{
  "dataset": "rcmax_50_20_6",
  "num_jobs": 50,
  "timestamp": "2025-09-21T14:24:29.681838",
  "frameworks": {
    "AutoGen": {
      "success": true,
      "makespan": 25,
      "structured_schedule": [
        {
          "job": "Job1",
          "step": 1,
          "machine": "Machine0",
          "start": 0,
          "end": 3,
          "duration": 3
        },
        {
          "job": "Job1",
          "step": 2,
          "machine": "Machine1",
          "start": 3,
          "end": 7,
          "duration": 4
        },
        {
          "job": "Job2",
          "step": 1,
          "machine": "Machine1",
          "start": 7,
          "end": 10,
          "duration": 3
        },
        {
          "job": "Job1",
          "step": 1,
          "machine": "Machine12",
          "start": 0,
          "end": 93,
          "duration": 93
        },
        {
          "job": "Job1",
          "step": 2,
          "machine": "Machine17",
          "start": 93,
          "end": 292,
          "duration": 199
        },
        {
          "job": "Job2",
          "step": 1,
          "machine": "Machine0",
          "start": 40,
          "end": 80,
          "duration": 40
        },
        {
          "job": "Job2",
          "step": 2,
          "machine": "Machine7",
          "start": 80,
          "end": 126,
          "duration": 46
        },
        {
          "job": "Job1",
          "step": 1,
          "machine": "Machine12",
          "start": 0,
          "end": 93,
          "duration": 93
        },
        {
          "job": "Job2",
          "step": 1,
          "machine": "Machine0",
          "start": 40,
          "end": 80,
          "duration": 40
        },
        {
          "job": "Job1",
          "step": 1,
          "machine": "Machine0",
          "start": 0,
          "end": 3,
          "duration": 3
        },
        {
          "job": "Job1",
          "step": 2,
          "machine": "Machine1",
          "start": 3,
          "end": 7,
          "duration": 4
        },
        {
          "job": "Job2",
          "step": 1,
          "machine": "Machine1",
          "start": 7,
          "end": 10,
          "duration": 3
        },
        {
          "job": "Job1",
          "step": 1,
          "machine": "Machine12",
          "start": 0,
          "end": 93,
          "duration": 93
        },
        {
          "job": "Job1",
          "step": 2,
          "machine": "Machine17",
          "start": 93,
          "end": 292,
          "duration": 199
        },
        {
          "job": "Job2",
          "step": 1,
          "machine": "Machine0",
          "start": 40,
          "end": 80,
          "duration": 40
        },
        {
          "job": "Job2",
          "step": 2,
          "machine": "Machine7",
          "start": 80,
          "end": 126,
          "duration": 46
        },
        {
          "job": "Job1",
          "step": 1,
          "machine": "Machine12",
          "start": 0,
          "end": 93,
          "duration": 93
        },
        {
          "job": "Job2",
          "step": 1,
          "machine": "Machine0",
          "start": 40,
          "end": 80,
          "duration": 40
        }
      ],
      "response": "Message: \n        Job Shop Scheduling Problem (JSSP) - Dataset: rcmax_50_20_6\n        \n        Problem Description:\n        - Number of jobs: 50\n        - Each job has multiple operations that must be performed in sequence\n        - Each operation requires a specific machine and has a duration\n        - Each machine can only process one operation at a time\n        - Goal: Find the minimum makespan (total completion time)\n        \n        Job Specifications:\n        \nJob1:\n  Step 1: Machine Machine12, Duration 93\n  Step 2: Machine Machine17, Duration 199\n  Step 3: Machine Machine13, Duration 26\n  Step 4: Machine Machine0, Duration 48\n  Step 5: Machine Machine9, Duration 172\n  Step 6: Machine Machine2, Duration 175\n  Step 7: Machine Machine14, Duration 39\n  Step 8: Machine Machine16, Duration 39\n  Step 9: Machine Machine11, Duration 11\n  Step 10: Machine Machine4, Duration 138\n  Step 11: Machine Machine6, Duration 197\n  Step 12: Machine Machine8, Duration 97\n  Step 13: Machine Machine15, Duration 92\n  Step 14: Machine Machine1, Duration 46\n  Step 15: Machine Machine18, Duration 182\n  Step 16: Machine Machine10, Duration 180\n  Step 17: Machine Machine3, Duration 109\n  Step 18: Machine Machine19, Duration 147\n  Step 19: Machine Machine7, Duration 167\n  Step 20: Machine Machine5, Duration 66\nJob2:\n  Step 1: Machine Machine0, Duration 40\n  Step 2: Machine Machine7, Duration 46\n  Step 3: Machine Machine18, Duration 52\n  Step 4: Machine Machine9, Duration 126\n  Step 5: Machine Machine12, Duration 136\n  Step 6: Machine Machine19, Duration 147\n  Step 7: Machine Machine15, Duration 152\n  Step 8: Machine Machine3, Duration 28\n  Step 9: Machine Machine11, Duration 101\n  Step 10: Machine Machine13, Duration 8\n  Step 11: Machine Machine14, Duration 110\n  Step 12: Machine Machine2, Duration 6\n  Step 13: Machine Machine6, Duration 103\n  Step 14: Machine Machine1, Duration 166\n  Step 15: Machine Machine16, Duration 51\n  Step 16: Machine Machine10, Duration 4\n  Step 17: Machine Machine17, Duration 119\n  Step 18: Machine Machine5, Duration 100\n  Step 19: Machine Machine4, Duration 197\n  Step 20: Machine Machine8, Duration 185\nJob3:\n  Step 1: Machine Machine7, Duration 109\n  Step 2: Machine Machine5, Duration 198\n  Step 3: Machine Machine15, Duration 133\n  Step 4: Machine Machine18, Duration 19\n  Step 5: Machine Machine2, Duration 112\n  Step 6: Machine Machine10, Duration 118\n  Step 7: Machine Machine6, Duration 9\n  Step 8: Machine Machine1, Duration 46\n  Step 9: Machine Machine17, Duration 21\n  Step 10: Machine Machine4, Duration 87\n  Step 11: Machine Machine14, Duration 32\n  Step 12: Machine Machine8, Duration 86\n  Step 13: Machine Machine9, Duration 46\n  Step 14: Machine Machine0, Duration 70\n  Step 15: Machine Machine11, Duration 52\n  Step 16: Machine Machine16, Duration 27\n  Step 17: Machine Machine12, Duration 120\n  Step 18: Machine Machine3, Duration 154\n  Step 19: Machine Machine19, Duration 28\n  Step 20: Machine Machine13, Duration 123\nJob4:\n  Step 1: Machine Machine7, Duration 136\n  Step 2: Machine Machine14, Duration 93\n  Step 3: Machine Machine12, Duration 123\n  Step 4: Machine Machine2, Duration 167\n  Step 5: Machine Machine10, Duration 158\n  Step 6: Machine Machine11, Duration 53\n  Step 7: Machine Machine19, Duration 99\n  Step 8: Machine Machine0, Duration 8\n  Step 9: Machine Machine17, Duration 191\n  Step 10: Machine Machine4, Duration 138\n  Step 11: Machine Machine9, Duration 149\n  Step 12: Machine Machine5, Duration 156\n  Step 13: Machine Machine13, Duration 30\n  Step 14: Machine Machine16, Duration 90\n  Step 15: Machine Machine3, Duration 124\n  Step 16: Machine Machine8, Duration 127\n  Step 17: Machine Machine18, Duration 67\n  Step 18: Machine Machine1, Duration 104\n  Step 19: Machine Machine15, Duration 116\n  Step 20: Machine Machine6, Duration 127\nJob5:\n  Step 1: Machine Machine7, Duration 42\n  Step 2: Machine Machine16, Duration 128\n  Step 3: Machine Machine2, Duration 170\n  Step 4: Machine Machine18, Duration 5\n  Step 5: Machine Machine13, Duration 80\n  Step 6: Machine Machine11, Duration 124\n  Step 7: Machine Machine5, Duration 137\n  Step 8: Machine Machine15, Duration 15\n  Step 9: Machine Machine10, Duration 180\n  Step 10: Machine Machine19, Duration 53\n  Step 11: Machine Machine0, Duration 190\n  Step 12: Machine Machine1, Duration 46\n  Step 13: Machine Machine8, Duration 149\n  Step 14: Machine Machine6, Duration 129\n  Step 15: Machine Machine12, Duration 178\n  Step 16: Machine Machine9, Duration 144\n  Step 17: Machine Machine14, Duration 124\n  Step 18: Machine Machine17, Duration 196\n  Step 19: Machine Machine3, Duration 18\n  Step 20: Machine Machine4, Duration 110\nJob6:\n  Step 1: Machine Machine9, Duration 59\n  Step 2: Machine Machine17, Duration 116\n  Step 3: Machine Machine16, Duration 68\n  Step 4: Machine Machine13, Duration 35\n  Step 5: Machine Machine0, Duration 169\n  Step 6: Machine Machine14, Duration 70\n  Step 7: Machine Machine1, Duration 129\n  Step 8: Machine Machine12, Duration 34\n  Step 9: Machine Machine10, Duration 73\n  Step 10: Machine Machine18, Duration 77\n  Step 11: Machine Machine11, Duration 177\n  Step 12: Machine Machine4, Duration 63\n  Step 13: Machine Machine3, Duration 13\n  Step 14: Machine Machine2, Duration 58\n  Step 15: Machine Machine15, Duration 137\n  Step 16: Machine Machine5, Duration 84\n  Step 17: Machine Machine8, Duration 67\n  Step 18: Machine Machine19, Duration 121\n  Step 19: Machine Machine7, Duration 187\n  Step 20: Machine Machine6, Duration 105\nJob7:\n  Step 1: Machine Machine16, Duration 57\n  Step 2: Machine Machine1, Duration 173\n  Step 3: Machine Machine7, Duration 6\n  Step 4: Machine Machine5, Duration 19\n  Step 5: Machine Machine12, Duration 91\n  Step 6: Machine Machine11, Duration 114\n  Step 7: Machine Machine14, Duration 94\n  Step 8: Machine Machine17, Duration 156\n  Step 9: Machine Machine9, Duration 72\n  Step 10: Machine Machine19, Duration 112\n  Step 11: Machine Machine18, Duration 1\n  Step 12: Machine Machine13, Duration 111\n  Step 13: Machine Machine2, Duration 168\n  Step 14: Machine Machine3, Duration 44\n  Step 15: Machine Machine6, Duration 15\n  Step 16: Machine Machine4, Duration 194\n  Step 17: Machine Machine0, Duration 119\n  Step 18: Machine Machine15, Duration 57\n  Step 19: Machine Machine10, Duration 101\n  Step 20: Machine Machine8, Duration 164\nJob8:\n  Step 1: Machine Machine9, Duration 126\n  Step 2: Machine Machine11, Duration 29\n  Step 3: Machine Machine15, Duration 17\n  Step 4: Machine Machine8, Duration 62\n  Step 5: Machine Machine0, Duration 171\n  Step 6: Machine Machine14, Duration 181\n  Step 7: Machine Machine13, Duration 184\n  Step 8: Machine Machine12, Duration 35\n  Step 9: Machine Machine5, Duration 30\n  Step 10: Machine Machine4, Duration 115\n  Step 11: Machine Machine6, Duration 2\n  Step 12: Machine Machine3, Duration 151\n  Step 13: Machine Machine16, Duration 65\n  Step 14: Machine Machine19, Duration 91\n  Step 15: Machine Machine1, Duration 77\n  Step 16: Machine Machine17, Duration 166\n  Step 17: Machine Machine2, Duration 74\n  Step 18: Machine Machine10, Duration 183\n  Step 19: Machine Machine18, Duration 177\n  Step 20: Machine Machine7, Duration 187\nJob9:\n  Step 1: Machine Machine8, Duration 99\n  Step 2: Machine Machine18, Duration 122\n  Step 3: Machine Machine11, Duration 49\n  Step 4: Machine Machine7, Duration 44\n  Step 5: Machine Machine10, Duration 126\n  Step 6: Machine Machine17, Duration 168\n  Step 7: Machine Machine3, Duration 20\n  Step 8: Machine Machine6, Duration 46\n  Step 9: Machine Machine14, Duration 190\n  Step 10: Machine Machine4, Duration 162\n  Step 11: Machine Machine1, Duration 184\n  Step 12: Machine Machine0, Duration 96\n  Step 13: Machine Machine5, Duration 170\n  Step 14: Machine Machine16, Duration 147\n  Step 15: Machine Machine19, Duration 10\n  Step 16: Machine Machine13, Duration 142\n  Step 17: Machine Machine9, Duration 111\n  Step 18: Machine Machine12, Duration 12\n  Step 19: Machine Machine2, Duration 86\n  Step 20: Machine Machine15, Duration 196\nJob10:\n  Step 1: Machine Machine12, Duration 114\n  Step 2: Machine Machine16, Duration 75\n  Step 3: Machine Machine15, Duration 66\n  Step 4: Machine Machine9, Duration 170\n  Step 5: Machine Machine6, Duration 70\n  Step 6: Machine Machine2, Duration 50\n  Step 7: Machine Machine10, Duration 131\n  Step 8: Machine Machine11, Duration 57\n  Step 9: Machine Machine5, Duration 61\n  Step 10: Machine Machine0, Duration 188\n  Step 11: Machine Machine8, Duration 74\n  Step 12: Machine Machine1, Duration 107\n  Step 13: Machine Machine13, Duration 152\n  Step 14: Machine Machine4, Duration 152\n  Step 15: Machine Machine18, Duration 60\n  Step 16: Machine Machine17, Duration 97\n  Step 17: Machine Machine19, Duration 19\n  Step 18: Machine Machine3, Duration 15\n  Step 19: Machine Machine7, Duration 147\n  Step 20: Machine Machine14, Duration 156\nJob11:\n  Step 1: Machine Machine0, Duration 29\n  Step 2: Machine Machine1, Duration 179\n  Step 3: Machine Machine7, Duration 109\n  Step 4: Machine Machine4, Duration 30\n  Step 5: Machine Machine18, Duration 92\n  Step 6: Machine Machine10, Duration 71\n  Step 7: Machine Machine9, Duration 111\n  Step 8: Machine Machine15, Duration 146\n  Step 9: Machine Machine5, Duration 77\n  Step 10: Machine Machine19, Duration 59\n  Step 11: Machine Machine2, Duration 146\n  Step 12: Machine Machine17, Duration 16\n  Step 13: Machine Machine16, Duration 49\n  Step 14: Machine Machine13, Duration 12\n  Step 15: Machine Machine12, Duration 144\n  Step 16: Machine Machine3, Duration 95\n  Step 17: Machine Machine14, Duration 163\n  Step 18: Machine Machine6, Duration 199\n  Step 19: Machine Machine11, Duration 157\n  Step 20: Machine Machine8, Duration 131\nJob12:\n  Step 1: Machine Machine17, Duration 174\n  Step 2: Machine Machine13, Duration 22\n  Step 3: Machine Machine11, Duration 142\n  Step 4: Machine Machine8, Duration 32\n  Step 5: Machine Machine14, Duration 49\n  Step 6: Machine Machine10, Duration 97\n  Step 7: Machine Machine5, Duration 47\n  Step 8: Machine Machine4, Duration 140\n  Step 9: Machine Machine12, Duration 49\n  Step 10: Machine Machine18, Duration 41\n  Step 11: Machine Machine9, Duration 157\n  Step 12: Machine Machine2, Duration 3\n  Step 13: Machine Machine7, Duration 198\n  Step 14: Machine Machine19, Duration 92\n  Step 15: Machine Machine0, Duration 2\n  Step 16: Machine Machine3, Duration 142\n  Step 17: Machine Machine1, Duration 114\n  Step 18: Machine Machine16, Duration 4\n  Step 19: Machine Machine6, Duration 98\n  Step 20: Machine Machine15, Duration 100\nJob13:\n  Step 1: Machine Machine17, Duration 47\n  Step 2: Machine Machine8, Duration 55\n  Step 3: Machine Machine7, Duration 136\n  Step 4: Machine Machine9, Duration 51\n  Step 5: Machine Machine1, Duration 79\n  Step 6: Machine Machine4, Duration 37\n  Step 7: Machine Machine15, Duration 100\n  Step 8: Machine Machine14, Duration 139\n  Step 9: Machine Machine0, Duration 45\n  Step 10: Machine Machine10, Duration 39\n  Step 11: Machine Machine16, Duration 160\n  Step 12: Machine Machine19, Duration 90\n  Step 13: Machine Machine5, Duration 114\n  Step 14: Machine Machine13, Duration 13\n  Step 15: Machine Machine2, Duration 66\n  Step 16: Machine Machine11, Duration 90\n  Step 17: Machine Machine12, Duration 187\n  Step 18: Machine Machine6, Duration 47\n  Step 19: Machine Machine18, Duration 75\n  Step 20: Machine Machine3, Duration 151\nJob14:\n  Step 1: Machine Machine18, Duration 139\n  Step 2: Machine Machine5, Duration 102\n  Step 3: Machine Machine4, Duration 181\n  Step 4: Machine Machine7, Duration 24\n  Step 5: Machine Machine13, Duration 142\n  Step 6: Machine Machine8, Duration 23\n  Step 7: Machine Machine16, Duration 100\n  Step 8: Machine Machine11, Duration 95\n  Step 9: Machine Machine3, Duration 89\n  Step 10: Machine Machine14, Duration 144\n  Step 11: Machine Machine15, Duration 159\n  Step 12: Machine Machine10, Duration 176\n  Step 13: Machine Machine9, Duration 153\n  Step 14: Machine Machine2, Duration 112\n  Step 15: Machine Machine12, Duration 136\n  Step 16: Machine Machine6, Duration 97\n  Step 17: Machine Machine19, Duration 176\n  Step 18: Machine Machine17, Duration 20\n  Step 19: Machine Machine1, Duration 154\n  Step 20: Machine Machine0, Duration 15\nJob15:\n  Step 1: Machine Machine16, Duration 183\n  Step 2: Machine Machine12, Duration 53\n  Step 3: Machine Machine2, Duration 2\n  Step 4: Machine Machine15, Duration 26\n  Step 5: Machine Machine1, Duration 196\n  Step 6: Machine Machine9, Duration 15\n  Step 7: Machine Machine18, Duration 5\n  Step 8: Machine Machine7, Duration 103\n  Step 9: Machine Machine3, Duration 40\n  Step 10: Machine Machine5, Duration 86\n  Step 11: Machine Machine4, Duration 130\n  Step 12: Machine Machine6, Duration 118\n  Step 13: Machine Machine0, Duration 111\n  Step 14: Machine Machine8, Duration 94\n  Step 15: Machine Machine13, Duration 118\n  Step 16: Machine Machine11, Duration 119\n  Step 17: Machine Machine19, Duration 188\n  Step 18: Machine Machine17, Duration 119\n  Step 19: Machine Machine14, Duration 55\n  Step 20: Machine Machine10, Duration 146\nJob16:\n  Step 1: Machine Machine0, Duration 97\n  Step 2: Machine Machine9, Duration 197\n  Step 3: Machine Machine1, Duration 127\n  Step 4: Machine Machine8, Duration 39\n  Step 5: Machine Machine11, Duration 80\n  Step 6: Machine Machine5, Duration 138\n  Step 7: Machine Machine13, Duration 77\n  Step 8: Machine Machine2, Duration 3\n  Step 9: Machine Machine17, Duration 116\n  Step 10: Machine Machine4, Duration 115\n  Step 11: Machine Machine6, Duration 127\n  Step 12: Machine Machine18, Duration 61\n  Step 13: Machine Machine7, Duration 124\n  Step 14: Machine Machine15, Duration 7\n  Step 15: Machine Machine12, Duration 111\n  Step 16: Machine Machine14, Duration 40\n  Step 17: Machine Machine16, Duration 96\n  Step 18: Machine Machine10, Duration 34\n  Step 19: Machine Machine19, Duration 159\n  Step 20: Machine Machine3, Duration 29\nJob17:\n  Step 1: Machine Machine18, Duration 123\n  Step 2: Machine Machine5, Duration 22\n  Step 3: Machine Machine1, Duration 135\n  Step 4: Machine Machine19, Duration 99\n  Step 5: Machine Machine8, Duration 105\n  Step 6: Machine Machine11, Duration 14\n  Step 7: Machine Machine13, Duration 159\n  Step 8: Machine Machine9, Duration 21\n  Step 9: Machine Machine14, Duration 86\n  Step 10: Machine Machine17, Duration 12\n  Step 11: Machine Machine7, Duration 49\n  Step 12: Machine Machine6, Duration 160\n  Step 13: Machine Machine4, Duration 66\n  Step 14: Machine Machine12, Duration 9\n  Step 15: Machine Machine3, Duration 31\n  Step 16: Machine Machine16, Duration 134\n  Step 17: Machine Machine15, Duration 12\n  Step 18: Machine Machine10, Duration 38\n  Step 19: Machine Machine2, Duration 131\n  Step 20: Machine Machine0, Duration 55\nJob18:\n  Step 1: Machine Machine12, Duration 18\n  Step 2: Machine Machine11, Duration 93\n  Step 3: Machine Machine7, Duration 128\n  Step 4: Machine Machine17, Duration 41\n  Step 5: Machine Machine8, Duration 174\n  Step 6: Machine Machine4, Duration 75\n  Step 7: Machine Machine15, Duration 44\n  Step 8: Machine Machine5, Duration 15\n  Step 9: Machine Machine9, Duration 100\n  Step 10: Machine Machine14, Duration 58\n  Step 11: Machine Machine10, Duration 166\n  Step 12: Machine Machine13, Duration 89\n  Step 13: Machine Machine16, Duration 174\n  Step 14: Machine Machine19, Duration 91\n  Step 15: Machine Machine3, Duration 33\n  Step 16: Machine Machine0, Duration 28\n  Step 17: Machine Machine6, Duration 195\n  Step 18: Machine Machine1, Duration 163\n  Step 19: Machine Machine18, Duration 95\n  Step 20: Machine Machine2, Duration 40\nJob19:\n  Step 1: Machine Machine18, Duration 185\n  Step 2: Machine Machine9, Duration 88\n  Step 3: Machine Machine13, Duration 135\n  Step 4: Machine Machine1, Duration 98\n  Step 5: Machine Machine15, Duration 196\n  Step 6: Machine Machine0, Duration 119\n  Step 7: Machine Machine8, Duration 52\n  Step 8: Machine Machine10, Duration 21\n  Step 9: Machine Machine6, Duration 130\n  Step 10: Machine Machine4, Duration 141\n  Step 11: Machine Machine17, Duration 52\n  Step 12: Machine Machine14, Duration 96\n  Step 13: Machine Machine2, Duration 34\n  Step 14: Machine Machine3, Duration 115\n  Step 15: Machine Machine12, Duration 5\n  Step 16: Machine Machine5, Duration 74\n  Step 17: Machine Machine11, Duration 104\n  Step 18: Machine Machine19, Duration 88\n  Step 19: Machine Machine7, Duration 162\n  Step 20: Machine Machine16, Duration 113\nJob20:\n  Step 1: Machine Machine6, Duration 63\n  Step 2: Machine Machine2, Duration 140\n  Step 3: Machine Machine4, Duration 8\n  Step 4: Machine Machine0, Duration 73\n  Step 5: Machine Machine15, Duration 115\n  Step 6: Machine Machine3, Duration 178\n  Step 7: Machine Machine1, Duration 101\n  Step 8: Machine Machine17, Duration 149\n  Step 9: Machine Machine19, Duration 137\n  Step 10: Machine Machine18, Duration 170\n  Step 11: Machine Machine16, Duration 92\n  Step 12: Machine Machine8, Duration 149\n  Step 13: Machine Machine9, Duration 180\n  Step 14: Machine Machine11, Duration 103\n  Step 15: Machine Machine7, Duration 179\n  Step 16: Machine Machine13, Duration 106\n  Step 17: Machine Machine5, Duration 57\n  Step 18: Machine Machine12, Duration 171\n  Step 19: Machine Machine14, Duration 112\n  Step 20: Machine Machine10, Duration 104\nJob21:\n  Step 1: Machine Machine8, Duration 125\n  Step 2: Machine Machine5, Duration 82\n  Step 3: Machine Machine2, Duration 151\n  Step 4: Machine Machine9, Duration 10\n  Step 5: Machine Machine4, Duration 162\n  Step 6: Machine Machine10, Duration 144\n  Step 7: Machine Machine1, Duration 9\n  Step 8: Machine Machine13, Duration 193\n  Step 9: Machine Machine0, Duration 165\n  Step 10: Machine Machine3, Duration 98\n  Step 11: Machine Machine14, Duration 134\n  Step 12: Machine Machine11, Duration 198\n  Step 13: Machine Machine15, Duration 129\n  Step 14: Machine Machine6, Duration 34\n  Step 15: Machine Machine16, Duration 139\n  Step 16: Machine Machine12, Duration 89\n  Step 17: Machine Machine7, Duration 108\n  Step 18: Machine Machine17, Duration 87\n  Step 19: Machine Machine19, Duration 86\n  Step 20: Machine Machine18, Duration 51\nJob22:\n  Step 1: Machine Machine0, Duration 107\n  Step 2: Machine Machine8, Duration 84\n  Step 3: Machine Machine2, Duration 70\n  Step 4: Machine Machine12, Duration 31\n  Step 5: Machine Machine19, Duration 163\n  Step 6: Machine Machine11, Duration 104\n  Step 7: Machine Machine1, Duration 54\n  Step 8: Machine Machine4, Duration 19\n  Step 9: Machine Machine6, Duration 85\n  Step 10: Machine Machine15, Duration 194\n  Step 11: Machine Machine10, Duration 157\n  Step 12: Machine Machine13, Duration 124\n  Step 13: Machine Machine5, Duration 193\n  Step 14: Machine Machine16, Duration 140\n  Step 15: Machine Machine9, Duration 187\n  Step 16: Machine Machine7, Duration 162\n  Step 17: Machine Machine14, Duration 23\n  Step 18: Machine Machine18, Duration 59\n  Step 19: Machine Machine17, Duration 26\n  Step 20: Machine Machine3, Duration 182\nJob23:\n  Step 1: Machine Machine3, Duration 86\n  Step 2: Machine Machine17, Duration 25\n  Step 3: Machine Machine19, Duration 109\n  Step 4: Machine Machine18, Duration 95\n  Step 5: Machine Machine12, Duration 85\n  Step 6: Machine Machine0, Duration 179\n  Step 7: Machine Machine9, Duration 76\n  Step 8: Machine Machine6, Duration 68\n  Step 9: Machine Machine15, Duration 104\n  Step 10: Machine Machine2, Duration 25\n  Step 11: Machine Machine4, Duration 24\n  Step 12: Machine Machine7, Duration 113\n  Step 13: Machine Machine5, Duration 37\n  Step 14: Machine Machine10, Duration 155\n  Step 15: Machine Machine8, Duration 113\n  Step 16: Machine Machine1, Duration 134\n  Step 17: Machine Machine13, Duration 190\n  Step 18: Machine Machine14, Duration 67\n  Step 19: Machine Machine11, Duration 192\n  Step 20: Machine Machine16, Duration 172\nJob24:\n  Step 1: Machine Machine19, Duration 28\n  Step 2: Machine Machine10, Duration 4\n  Step 3: Machine Machine16, Duration 91\n  Step 4: Machine Machine3, Duration 104\n  Step 5: Machine Machine13, Duration 37\n  Step 6: Machine Machine0, Duration 198\n  Step 7: Machine Machine15, Duration 53\n  Step 8: Machine Machine18, Duration 165\n  Step 9: Machine Machine1, Duration 72\n  Step 10: Machine Machine4, Duration 8\n  Step 11: Machine Machine2, Duration 93\n  Step 12: Machine Machine5, Duration 161\n  Step 13: Machine Machine6, Duration 148\n  Step 14: Machine Machine9, Duration 181\n  Step 15: Machine Machine11, Duration 109\n  Step 16: Machine Machine12, Duration 49\n  Step 17: Machine Machine14, Duration 110\n  Step 18: Machine Machine8, Duration 76\n  Step 19: Machine Machine7, Duration 130\n  Step 20: Machine Machine17, Duration 7\nJob25:\n  Step 1: Machine Machine5, Duration 36\n  Step 2: Machine Machine1, Duration 139\n  Step 3: Machine Machine17, Duration 66\n  Step 4: Machine Machine19, Duration 88\n  Step 5: Machine Machine8, Duration 41\n  Step 6: Machine Machine9, Duration 148\n  Step 7: Machine Machine7, Duration 162\n  Step 8: Machine Machine16, Duration 69\n  Step 9: Machine Machine12, Duration 189\n  Step 10: Machine Machine3, Duration 57\n  Step 11: Machine Machine0, Duration 157\n  Step 12: Machine Machine4, Duration 43\n  Step 13: Machine Machine10, Duration 198\n  Step 14: Machine Machine6, Duration 149\n  Step 15: Machine Machine2, Duration 192\n  Step 16: Machine Machine13, Duration 57\n  Step 17: Machine Machine14, Duration 95\n  Step 18: Machine Machine18, Duration 95\n  Step 19: Machine Machine11, Duration 11\n  Step 20: Machine Machine15, Duration 158\nJob26:\n  Step 1: Machine Machine5, Duration 8\n  Step 2: Machine Machine1, Duration 149\n  Step 3: Machine Machine8, Duration 168\n  Step 4: Machine Machine9, Duration 159\n  Step 5: Machine Machine12, Duration 65\n  Step 6: Machine Machine4, Duration 194\n  Step 7: Machine Machine17, Duration 48\n  Step 8: Machine Machine6, Duration 4\n  Step 9: Machine Machine2, Duration 197\n  Step 10: Machine Machine16, Duration 91\n  Step 11: Machine Machine18, Duration 122\n  Step 12: Machine Machine0, Duration 123\n  Step 13: Machine Machine15, Duration 27\n  Step 14: Machine Machine19, Duration 76\n  Step 15: Machine Machine7, Duration 147\n  Step 16: Machine Machine13, Duration 120\n  Step 17: Machine Machine14, Duration 20\n  Step 18: Machine Machine11, Duration 24\n  Step 19: Machine Machine3, Duration 133\n  Step 20: Machine Machine10, Duration 182\nJob27:\n  Step 1: Machine Machine11, Duration 29\n  Step 2: Machine Machine9, Duration 46\n  Step 3: Machine Machine7, Duration 164\n  Step 4: Machine Machine13, Duration 152\n  Step 5: Machine Machine1, Duration 4\n  Step 6: Machine Machine18, Duration 129\n  Step 7: Machine Machine14, Duration 148\n  Step 8: Machine Machine2, Duration 46\n  Step 9: Machine Machine19, Duration 98\n  Step 10: Machine Machine16, Duration 84\n  Step 11: Machine Machine10, Duration 133\n  Step 12: Machine Machine15, Duration 137\n  Step 13: Machine Machine4, Duration 192\n  Step 14: Machine Machine5, Duration 166\n  Step 15: Machine Machine3, Duration 14\n  Step 16: Machine Machine6, Duration 173\n  Step 17: Machine Machine17, Duration 44\n  Step 18: Machine Machine0, Duration 144\n  Step 19: Machine Machine8, Duration 99\n  Step 20: Machine Machine12, Duration 85\nJob28:\n  Step 1: Machine Machine9, Duration 64\n  Step 2: Machine Machine19, Duration 62\n  Step 3: Machine Machine1, Duration 3\n  Step 4: Machine Machine14, Duration 109\n  Step 5: Machine Machine12, Duration 133\n  Step 6: Machine Machine7, Duration 33\n  Step 7: Machine Machine11, Duration 19\n  Step 8: Machine Machine16, Duration 46\n  Step 9: Machine Machine0, Duration 89\n  Step 10: Machine Machine6, Duration 27\n  Step 11: Machine Machine2, Duration 108\n  Step 12: Machine Machine15, Duration 49\n  Step 13: Machine Machine10, Duration 137\n  Step 14: Machine Machine4, Duration 138\n  Step 15: Machine Machine5, Duration 27\n  Step 16: Machine Machine3, Duration 65\n  Step 17: Machine Machine17, Duration 1\n  Step 18: Machine Machine13, Duration 182\n  Step 19: Machine Machine18, Duration 35\n  Step 20: Machine Machine8, Duration 51\nJob29:\n  Step 1: Machine Machine17, Duration 165\n  Step 2: Machine Machine2, Duration 31\n  Step 3: Machine Machine7, Duration 16\n  Step 4: Machine Machine5, Duration 28\n  Step 5: Machine Machine3, Duration 81\n  Step 6: Machine Machine19, Duration 112\n  Step 7: Machine Machine11, Duration 17\n  Step 8: Machine Machine8, Duration 168\n  Step 9: Machine Machine1, Duration 139\n  Step 10: Machine Machine0, Duration 80\n  Step 11: Machine Machine9, Duration 141\n  Step 12: Machine Machine10, Duration 46\n  Step 13: Machine Machine14, Duration 26\n  Step 14: Machine Machine13, Duration 173\n  Step 15: Machine Machine4, Duration 173\n  Step 16: Machine Machine18, Duration 189\n  Step 17: Machine Machine15, Duration 193\n  Step 18: Machine Machine12, Duration 107\n  Step 19: Machine Machine16, Duration 177\n  Step 20: Machine Machine6, Duration 77\nJob30:\n  Step 1: Machine Machine3, Duration 19\n  Step 2: Machine Machine6, Duration 33\n  Step 3: Machine Machine13, Duration 161\n  Step 4: Machine Machine2, Duration 9\n  Step 5: Machine Machine9, Duration 112\n  Step 6: Machine Machine1, Duration 185\n  Step 7: Machine Machine4, Duration 134\n  Step 8: Machine Machine8, Duration 77\n  Step 9: Machine Machine5, Duration 190\n  Step 10: Machine Machine14, Duration 109\n  Step 11: Machine Machine16, Duration 149\n  Step 12: Machine Machine0, Duration 60\n  Step 13: Machine Machine19, Duration 82\n  Step 14: Machine Machine11, Duration 89\n  Step 15: Machine Machine10, Duration 193\n  Step 16: Machine Machine12, Duration 182\n  Step 17: Machine Machine17, Duration 73\n  Step 18: Machine Machine18, Duration 103\n  Step 19: Machine Machine7, Duration 153\n  Step 20: Machine Machine15, Duration 18\nJob31:\n  Step 1: Machine Machine14, Duration 34\n  Step 2: Machine Machine6, Duration 112\n  Step 3: Machine Machine7, Duration 154\n  Step 4: Machine Machine3, Duration 66\n  Step 5: Machine Machine0, Duration 147\n  Step 6: Machine Machine13, Duration 165\n  Step 7: Machine Machine19, Duration 177\n  Step 8: Machine Machine15, Duration 192\n  Step 9: Machine Machine5, Duration 160\n  Step 10: Machine Machine4, Duration 180\n  Step 11: Machine Machine18, Duration 177\n  Step 12: Machine Machine8, Duration 51\n  Step 13: Machine Machine10, Duration 82\n  Step 14: Machine Machine11, Duration 169\n  Step 15: Machine Machine9, Duration 6\n  Step 16: Machine Machine17, Duration 195\n  Step 17: Machine Machine16, Duration 149\n  Step 18: Machine Machine1, Duration 54\n  Step 19: Machine Machine2, Duration 10\n  Step 20: Machine Machine12, Duration 156\nJob32:\n  Step 1: Machine Machine1, Duration 17\n  Step 2: Machine Machine8, Duration 18\n  Step 3: Machine Machine3, Duration 165\n  Step 4: Machine Machine2, Duration 135\n  Step 5: Machine Machine15, Duration 183\n  Step 6: Machine Machine0, Duration 93\n  Step 7: Machine Machine4, Duration 87\n  Step 8: Machine Machine9, Duration 104\n  Step 9: Machine Machine14, Duration 121\n  Step 10: Machine Machine5, Duration 88\n  Step 11: Machine Machine19, Duration 87\n  Step 12: Machine Machine17, Duration 50\n  Step 13: Machine Machine18, Duration 1\n  Step 14: Machine Machine6, Duration 192\n  Step 15: Machine Machine12, Duration 65\n  Step 16: Machine Machine10, Duration 80\n  Step 17: Machine Machine7, Duration 6\n  Step 18: Machine Machine11, Duration 79\n  Step 19: Machine Machine13, Duration 8\n  Step 20: Machine Machine16, Duration 153\nJob33:\n  Step 1: Machine Machine10, Duration 197\n  Step 2: Machine Machine0, Duration 79\n  Step 3: Machine Machine17, Duration 164\n  Step 4: Machine Machine11, Duration 16\n  Step 5: Machine Machine16, Duration 65\n  Step 6: Machine Machine12, Duration 32\n  Step 7: Machine Machine15, Duration 76\n  Step 8: Machine Machine1, Duration 191\n  Step 9: Machine Machine2, Duration 101\n  Step 10: Machine Machine14, Duration 23\n  Step 11: Machine Machine6, Duration 200\n  Step 12: Machine Machine7, Duration 96\n  Step 13: Machine Machine18, Duration 151\n  Step 14: Machine Machine5, Duration 24\n  Step 15: Machine Machine3, Duration 96\n  Step 16: Machine Machine4, Duration 106\n  Step 17: Machine Machine13, Duration 2\n  Step 18: Machine Machine9, Duration 132\n  Step 19: Machine Machine8, Duration 106\n  Step 20: Machine Machine19, Duration 132\nJob34:\n  Step 1: Machine Machine16, Duration 75\n  Step 2: Machine Machine3, Duration 149\n  Step 3: Machine Machine8, Duration 40\n  Step 4: Machine Machine9, Duration 29\n  Step 5: Machine Machine13, Duration 115\n  Step 6: Machine Machine15, Duration 169\n  Step 7: Machine Machine1, Duration 139\n  Step 8: Machine Machine17, Duration 27\n  Step 9: Machine Machine14, Duration 54\n  Step 10: Machine Machine2, Duration 84\n  Step 11: Machine Machine5, Duration 30\n  Step 12: Machine Machine7, Duration 8\n  Step 13: Machine Machine11, Duration 8\n  Step 14: Machine Machine10, Duration 95\n  Step 15: Machine Machine12, Duration 113\n  Step 16: Machine Machine6, Duration 88\n  Step 17: Machine Machine0, Duration 154\n  Step 18: Machine Machine4, Duration 55\n  Step 19: Machine Machine18, Duration 158\n  Step 20: Machine Machine19, Duration 32\nJob35:\n  Step 1: Machine Machine14, Duration 133\n  Step 2: Machine Machine9, Duration 142\n  Step 3: Machine Machine4, Duration 115\n  Step 4: Machine Machine17, Duration 154\n  Step 5: Machine Machine2, Duration 178\n  Step 6: Machine Machine5, Duration 99\n  Step 7: Machine Machine15, Duration 173\n  Step 8: Machine Machine13, Duration 53\n  Step 9: Machine Machine10, Duration 77\n  Step 10: Machine Machine12, Duration 186\n  Step 11: Machine Machine19, Duration 144\n  Step 12: Machine Machine3, Duration 116\n  Step 13: Machine Machine7, Duration 113\n  Step 14: Machine Machine8, Duration 154\n  Step 15: Machine Machine18, Duration 22\n  Step 16: Machine Machine11, Duration 127\n  Step 17: Machine Machine0, Duration 28\n  Step 18: Machine Machine1, Duration 61\n  Step 19: Machine Machine16, Duration 90\n  Step 20: Machine Machine6, Duration 52\nJob36:\n  Step 1: Machine Machine7, Duration 130\n  Step 2: Machine Machine9, Duration 95\n  Step 3: Machine Machine3, Duration 38\n  Step 4: Machine Machine17, Duration 87\n  Step 5: Machine Machine11, Duration 96\n  Step 6: Machine Machine2, Duration 16\n  Step 7: Machine Machine15, Duration 79\n  Step 8: Machine Machine13, Duration 150\n  Step 9: Machine Machine4, Duration 36\n  Step 10: Machine Machine0, Duration 40\n  Step 11: Machine Machine5, Duration 5\n  Step 12: Machine Machine18, Duration 114\n  Step 13: Machine Machine10, Duration 109\n  Step 14: Machine Machine14, Duration 78\n  Step 15: Machine Machine12, Duration 14\n  Step 16: Machine Machine16, Duration 103\n  Step 17: Machine Machine6, Duration 54\n  Step 18: Machine Machine8, Duration 86\n  Step 19: Machine Machine1, Duration 154\n  Step 20: Machine Machine19, Duration 137\nJob37:\n  Step 1: Machine Machine1, Duration 30\n  Step 2: Machine Machine17, Duration 128\n  Step 3: Machine Machine12, Duration 192\n  Step 4: Machine Machine2, Duration 12\n  Step 5: Machine Machine7, Duration 48\n  Step 6: Machine Machine11, Duration 117\n  Step 7: Machine Machine15, Duration 96\n  Step 8: Machine Machine4, Duration 99\n  Step 9: Machine Machine18, Duration 30\n  Step 10: Machine Machine3, Duration 24\n  Step 11: Machine Machine14, Duration 96\n  Step 12: Machine Machine16, Duration 69\n  Step 13: Machine Machine5, Duration 49\n  Step 14: Machine Machine19, Duration 134\n  Step 15: Machine Machine10, Duration 124\n  Step 16: Machine Machine6, Duration 54\n  Step 17: Machine Machine13, Duration 16\n  Step 18: Machine Machine0, Duration 171\n  Step 19: Machine Machine9, Duration 127\n  Step 20: Machine Machine8, Duration 17\nJob38:\n  Step 1: Machine Machine10, Duration 139\n  Step 2: Machine Machine1, Duration 196\n  Step 3: Machine Machine6, Duration 135\n  Step 4: Machine Machine4, Duration 134\n  Step 5: Machine Machine12, Duration 98\n  Step 6: Machine Machine16, Duration 37\n  Step 7: Machine Machine0, Duration 12\n  Step 8: Machine Machine5, Duration 109\n  Step 9: Machine Machine18, Duration 88\n  Step 10: Machine Machine3, Duration 118\n  Step 11: Machine Machine7, Duration 48\n  Step 12: Machine Machine19, Duration 192\n  Step 13: Machine Machine14, Duration 84\n  Step 14: Machine Machine9, Duration 142\n  Step 15: Machine Machine13, Duration 147\n  Step 16: Machine Machine11, Duration 17\n  Step 17: Machine Machine2, Duration 107\n  Step 18: Machine Machine17, Duration 194\n  Step 19: Machine Machine8, Duration 122\n  Step 20: Machine Machine15, Duration 68\nJob39:\n  Step 1: Machine Machine9, Duration 106\n  Step 2: Machine Machine10, Duration 154\n  Step 3: Machine Machine1, Duration 111\n  Step 4: Machine Machine3, Duration 148\n  Step 5: Machine Machine11, Duration 128\n  Step 6: Machine Machine2, Duration 153\n  Step 7: Machine Machine15, Duration 88\n  Step 8: Machine Machine4, Duration 45\n  Step 9: Machine Machine16, Duration 191\n  Step 10: Machine Machine18, Duration 164\n  Step 11: Machine Machine17, Duration 116\n  Step 12: Machine Machine5, Duration 1\n  Step 13: Machine Machine0, Duration 31\n  Step 14: Machine Machine19, Duration 95\n  Step 15: Machine Machine7, Duration 51\n  Step 16: Machine Machine14, Duration 46\n  Step 17: Machine Machine6, Duration 123\n  Step 18: Machine Machine12, Duration 16\n  Step 19: Machine Machine8, Duration 187\n  Step 20: Machine Machine13, Duration 189\nJob40:\n  Step 1: Machine Machine12, Duration 101\n  Step 2: Machine Machine8, Duration 113\n  Step 3: Machine Machine9, Duration 38\n  Step 4: Machine Machine1, Duration 119\n  Step 5: Machine Machine2, Duration 184\n  Step 6: Machine Machine3, Duration 148\n  Step 7: Machine Machine16, Duration 148\n  Step 8: Machine Machine10, Duration 43\n  Step 9: Machine Machine15, Duration 20\n  Step 10: Machine Machine14, Duration 178\n  Step 11: Machine Machine11, Duration 83\n  Step 12: Machine Machine5, Duration 92\n  Step 13: Machine Machine0, Duration 35\n  Step 14: Machine Machine17, Duration 165\n  Step 15: Machine Machine13, Duration 38\n  Step 16: Machine Machine6, Duration 131\n  Step 17: Machine Machine19, Duration 144\n  Step 18: Machine Machine7, Duration 179\n  Step 19: Machine Machine4, Duration 30\n  Step 20: Machine Machine18, Duration 89\nJob41:\n  Step 1: Machine Machine9, Duration 164\n  Step 2: Machine Machine19, Duration 55\n  Step 3: Machine Machine8, Duration 176\n  Step 4: Machine Machine18, Duration 82\n  Step 5: Machine Machine14, Duration 61\n  Step 6: Machine Machine0, Duration 183\n  Step 7: Machine Machine15, Duration 14\n  Step 8: Machine Machine16, Duration 27\n  Step 9: Machine Machine11, Duration 66\n  Step 10: Machine Machine12, Duration 91\n  Step 11: Machine Machine13, Duration 22\n  Step 12: Machine Machine6, Duration 158\n  Step 13: Machine Machine4, Duration 165\n  Step 14: Machine Machine1, Duration 182\n  Step 15: Machine Machine17, Duration 86\n  Step 16: Machine Machine3, Duration 197\n  Step 17: Machine Machine10, Duration 139\n  Step 18: Machine Machine7, Duration 157\n  Step 19: Machine Machine5, Duration 119\n  Step 20: Machine Machine2, Duration 114\nJob42:\n  Step 1: Machine Machine15, Duration 33\n  Step 2: Machine Machine5, Duration 65\n  Step 3: Machine Machine19, Duration 109\n  Step 4: Machine Machine11, Duration 84\n  Step 5: Machine Machine2, Duration 164\n  Step 6: Machine Machine12, Duration 141\n  Step 7: Machine Machine17, Duration 132\n  Step 8: Machine Machine1, Duration 164\n  Step 9: Machine Machine4, Duration 97\n  Step 10: Machine Machine9, Duration 85\n  Step 11: Machine Machine14, Duration 125\n  Step 12: Machine Machine10, Duration 104\n  Step 13: Machine Machine8, Duration 22\n  Step 14: Machine Machine6, Duration 171\n  Step 15: Machine Machine7, Duration 115\n  Step 16: Machine Machine18, Duration 77\n  Step 17: Machine Machine0, Duration 69\n  Step 18: Machine Machine16, Duration 181\n  Step 19: Machine Machine13, Duration 121\n  Step 20: Machine Machine3, Duration 98\nJob43:\n  Step 1: Machine Machine4, Duration 44\n  Step 2: Machine Machine5, Duration 99\n  Step 3: Machine Machine19, Duration 20\n  Step 4: Machine Machine18, Duration 171\n  Step 5: Machine Machine17, Duration 174\n  Step 6: Machine Machine6, Duration 87\n  Step 7: Machine Machine13, Duration 33\n  Step 8: Machine Machine3, Duration 18\n  Step 9: Machine Machine11, Duration 153\n  Step 10: Machine Machine2, Duration 153\n  Step 11: Machine Machine16, Duration 113\n  Step 12: Machine Machine15, Duration 149\n  Step 13: Machine Machine7, Duration 103\n  Step 14: Machine Machine8, Duration 103\n  Step 15: Machine Machine10, Duration 138\n  Step 16: Machine Machine14, Duration 67\n  Step 17: Machine Machine9, Duration 56\n  Step 18: Machine Machine1, Duration 92\n  Step 19: Machine Machine0, Duration 137\n  Step 20: Machine Machine12, Duration 105\nJob44:\n  Step 1: Machine Machine13, Duration 69\n  Step 2: Machine Machine2, Duration 145\n  Step 3: Machine Machine4, Duration 4\n  Step 4: Machine Machine10, Duration 11\n  Step 5: Machine Machine16, Duration 54\n  Step 6: Machine Machine14, Duration 150\n  Step 7: Machine Machine17, Duration 31\n  Step 8: Machine Machine3, Duration 168\n  Step 9: Machine Machine18, Duration 142\n  Step 10: Machine Machine12, Duration 86\n  Step 11: Machine Machine5, Duration 19\n  Step 12: Machine Machine9, Duration 111\n  Step 13: Machine Machine11, Duration 89\n  Step 14: Machine Machine19, Duration 53\n  Step 15: Machine Machine15, Duration 96\n  Step 16: Machine Machine1, Duration 179\n  Step 17: Machine Machine8, Duration 148\n  Step 18: Machine Machine0, Duration 195\n  Step 19: Machine Machine7, Duration 23\n  Step 20: Machine Machine6, Duration 161\nJob45:\n  Step 1: Machine Machine15, Duration 95\n  Step 2: Machine Machine7, Duration 75\n  Step 3: Machine Machine13, Duration 65\n  Step 4: Machine Machine17, Duration 83\n  Step 5: Machine Machine18, Duration 169\n  Step 6: Machine Machine8, Duration 170\n  Step 7: Machine Machine16, Duration 195\n  Step 8: Machine Machine0, Duration 193\n  Step 9: Machine Machine11, Duration 144\n  Step 10: Machine Machine10, Duration 53\n  Step 11: Machine Machine12, Duration 102\n  Step 12: Machine Machine4, Duration 27\n  Step 13: Machine Machine3, Duration 122\n  Step 14: Machine Machine2, Duration 199\n  Step 15: Machine Machine19, Duration 198\n  Step 16: Machine Machine6, Duration 184\n  Step 17: Machine Machine9, Duration 6\n  Step 18: Machine Machine5, Duration 9\n  Step 19: Machine Machine14, Duration 124\n  Step 20: Machine Machine1, Duration 17\nJob46:\n  Step 1: Machine Machine2, Duration 175\n  Step 2: Machine Machine11, Duration 137\n  Step 3: Machine Machine3, Duration 74\n  Step 4: Machine Machine9, Duration 3\n  Step 5: Machine Machine4, Duration 94\n  Step 6: Machine Machine5, Duration 2\n  Step 7: Machine Machine13, Duration 175\n  Step 8: Machine Machine17, Duration 134\n  Step 9: Machine Machine7, Duration 46\n  Step 10: Machine Machine12, Duration 120\n  Step 11: Machine Machine18, Duration 184\n  Step 12: Machine Machine15, Duration 123\n  Step 13: Machine Machine10, Duration 118\n  Step 14: Machine Machine0, Duration 76\n  Step 15: Machine Machine14, Duration 195\n  Step 16: Machine Machine6, Duration 37\n  Step 17: Machine Machine16, Duration 38\n  Step 18: Machine Machine8, Duration 92\n  Step 19: Machine Machine19, Duration 146\n  Step 20: Machine Machine1, Duration 43\nJob47:\n  Step 1: Machine Machine17, Duration 105\n  Step 2: Machine Machine16, Duration 68\n  Step 3: Machine Machine2, Duration 195\n  Step 4: Machine Machine4, Duration 131\n  Step 5: Machine Machine15, Duration 9\n  Step 6: Machine Machine18, Duration 61\n  Step 7: Machine Machine12, Duration 170\n  Step 8: Machine Machine19, Duration 186\n  Step 9: Machine Machine13, Duration 152\n  Step 10: Machine Machine6, Duration 166\n  Step 11: Machine Machine9, Duration 69\n  Step 12: Machine Machine14, Duration 46\n  Step 13: Machine Machine10, Duration 164\n  Step 14: Machine Machine11, Duration 46\n  Step 15: Machine Machine5, Duration 84\n  Step 16: Machine Machine1, Duration 133\n  Step 17: Machine Machine0, Duration 19\n  Step 18: Machine Machine3, Duration 199\n  Step 19: Machine Machine7, Duration 175\n  Step 20: Machine Machine8, Duration 59\nJob48:\n  Step 1: Machine Machine10, Duration 127\n  Step 2: Machine Machine6, Duration 163\n  Step 3: Machine Machine19, Duration 152\n  Step 4: Machine Machine14, Duration 149\n  Step 5: Machine Machine17, Duration 12\n  Step 6: Machine Machine13, Duration 11\n  Step 7: Machine Machine3, Duration 89\n  Step 8: Machine Machine5, Duration 97\n  Step 9: Machine Machine16, Duration 87\n  Step 10: Machine Machine18, Duration 120\n  Step 11: Machine Machine2, Duration 135\n  Step 12: Machine Machine0, Duration 123\n  Step 13: Machine Machine12, Duration 161\n  Step 14: Machine Machine15, Duration 58\n  Step 15: Machine Machine8, Duration 139\n  Step 16: Machine Machine7, Duration 82\n  Step 17: Machine Machine4, Duration 1\n  Step 18: Machine Machine11, Duration 93\n  Step 19: Machine Machine9, Duration 185\n  Step 20: Machine Machine1, Duration 167\nJob49:\n  Step 1: Machine Machine19, Duration 154\n  Step 2: Machine Machine3, Duration 124\n  Step 3: Machine Machine5, Duration 198\n  Step 4: Machine Machine15, Duration 49\n  Step 5: Machine Machine0, Duration 100\n  Step 6: Machine Machine8, Duration 145\n  Step 7: Machine Machine4, Duration 17\n  Step 8: Machine Machine12, Duration 103\n  Step 9: Machine Machine13, Duration 130\n  Step 10: Machine Machine18, Duration 170\n  Step 11: Machine Machine1, Duration 130\n  Step 12: Machine Machine17, Duration 122\n  Step 13: Machine Machine11, Duration 137\n  Step 14: Machine Machine14, Duration 33\n  Step 15: Machine Machine6, Duration 109\n  Step 16: Machine Machine2, Duration 26\n  Step 17: Machine Machine9, Duration 120\n  Step 18: Machine Machine7, Duration 33\n  Step 19: Machine Machine10, Duration 140\n  Step 20: Machine Machine16, Duration 126\nJob50:\n  Step 1: Machine Machine18, Duration 57\n  Step 2: Machine Machine17, Duration 133\n  Step 3: Machine Machine10, Duration 124\n  Step 4: Machine Machine16, Duration 188\n  Step 5: Machine Machine4, Duration 53\n  Step 6: Machine Machine15, Duration 24\n  Step 7: Machine Machine11, Duration 81\n  Step 8: Machine Machine1, Duration 93\n  Step 9: Machine Machine7, Duration 89\n  Step 10: Machine Machine19, Duration 12\n  Step 11: Machine Machine6, Duration 110\n  Step 12: Machine Machine8, Duration 111\n  Step 13: Machine Machine0, Duration 72\n  Step 14: Machine Machine13, Duration 163\n  Step 15: Machine Machine12, Duration 155\n  Step 16: Machine Machine5, Duration 151\n  Step 17: Machine Machine3, Duration 121\n  Step 18: Machine Machine2, Duration 98\n  Step 19: Machine Machine9, Duration 95\n  Step 20: Machine Machine14, Duration 164\n        \n        REQUIRED OUTPUT FORMAT:\n        You must provide your solution in the following exact format:\n        \n        1. FINAL MAKESPAN: [integer value]\n        2. STRUCTURED SCHEDULE:\n           For each operation, provide:\n           - Job: [job_name]\n           - Step: [step_number]\n           - Machine: [machine_name]\n           - Start Time: [start_time]\n           - End Time: [end_time]\n           - Duration: [duration]\n        \n        Example format:\n        FINAL MAKESPAN: 25\n        STRUCTURED SCHEDULE:\n        - Job: Job1, Step: 1, Machine: Machine0, Start Time: 0, End Time: 3, Duration: 3\n        - Job: Job1, Step: 2, Machine: Machine1, Start Time: 3, End Time: 7, Duration: 4\n        - Job: Job2, Step: 1, Machine: Machine1, Start Time: 7, End Time: 10, Duration: 3\n        \n        Please solve this Job Shop Scheduling Problem and provide:\n        1. A valid schedule with start and end times for each operation\n        2. The minimum makespan (total completion time)\n        3. Ensure all constraints are satisfied:\n           - Job precedence: operations within a job must be sequential\n           - Machine constraints: no overlapping operations on the same machine\n        \nMessage: [FunctionCall(id='call_zEiUUZyhC9fHPpUo0kRK0s1z', arguments='{\"task\":\"Solve the job shop scheduling problem for the given dataset rcmax_50_20_6 considering all the constraints and provide a valid schedule with start and end times for each operation, as well as the minimum makespan.\"}', name='Job_Scheduler')]\nMessage: Solve the job shop scheduling problem for the given dataset rcmax_50_20_6 considering all the constraints and provide a valid schedule with start and end times for each operation, as well as the minimum makespan.\nMessage: To provide a concrete schedule for the job shop scheduling problem, we need to analyze the dataset rcmax_50_20_6. A typical job shop scheduling problem involves a set of jobs, each consisting of a sequence of operations that need to be processed on specific machines. Each machine can process only one operation at a time, and each operation requires a specific machine for a specified duration.\n\nSince I don't have access to the specific contents of the dataset rcmax_50_20_6, I\u2019ll guide you through the necessary steps to construct a schedule assuming you have the data:\n\n1. **Data Extraction**: Extract information about jobs, operations, machines, and processing times from the dataset.\n\n2. **Precedence Constraints**: Determine the sequence of operations for each job. Operations for a given job must be processed in the specified order.\n\n3. **Machine Constraints**: Identify which machine each operation requires and ensure that no two operations are processed on the same machine at the same time.\n\n4. **Objective**: Minimize the makespan, which is the total time required to complete all jobs.\n\nHere's a generic approach to formulating a schedule:\n\n- **Initialize**: Set the start time of the first operation of the first job to time zero.\n\n- **Iterative Scheduling**:\n  - For each job, schedule its operations sequentially respecting the precedence constraints\u2014i.e., an operation can only start after its preceding operation is complete.\n  - For each operation, check the availability of the required machine. An operation can only start if both the machine and all preceding operations are free.\n  - Record the start and end times for each operation.\n  - Use a priority rule or dispatching rule to decide the order of operations on each machine, such as Shortest Processing Time (SPT) or Earliest Due Date (EDD).\n\n- **Calculate Makespan**: Once all operations are scheduled, identify the maximum end time from all operations, which represents the makespan.\n\nHere is a sample format for a schedule (hypothetical data):\n\n| Job | Operation | Machine | Start Time | End Time |\n|-----|-----------|---------|------------|----------|\n| 1   | 1         | M1      | 0          | 3        |\n| 1   | 2         | M2      | 3          | 7        |\n| 2   | 1         | M1      | 3          | 8        |\n| 2   | 2         | M3      | 8          | 12       |\n| ... | ...       | ...     | ...        | ...      |\n| n   | m         | Mk      | x          | y        |\n\n- **Optimization Techniques**: You might use techniques like:\n  - **Heuristics**: Such as Genetic Algorithm, Simulated Annealing, or Tabu Search.\n  - **Exact Algorithms**: Using Mixed-Integer Linear Programming (MILP).\n  - **Simulation-Based Approaches**: For more complex and dynamic systems.\n\nThe actual solution will depend on solving these constraints and should involve specific calculations or software tools that handle scheduling problems. If specific software or algorithm procedures are needed, you may need to employ appropriate operations research algorithms and tools like IBM ILOG CPLEX, Gurobi, or specialized scheduling software, or implement heuristic solutions programmatically.\n\nWithout the detailed dataset information, this framework serves as a guide for constructing a feasible schedule. If you can provide specific job data and constraints, I could potentially help with more detailed scheduling instructions or suggest algorithms tailored to your dataset\u2019s characteristics.\nMessage: [FunctionExecutionResult(content=\"To provide a concrete schedule for the job shop scheduling problem, we need to analyze the dataset rcmax_50_20_6. A typical job shop scheduling problem involves a set of jobs, each consisting of a sequence of operations that need to be processed on specific machines. Each machine can process only one operation at a time, and each operation requires a specific machine for a specified duration.\\n\\nSince I don't have access to the specific contents of the dataset rcmax_50_20_6, I\u2019ll guide you through the necessary steps to construct a schedule assuming you have the data:\\n\\n1. **Data Extraction**: Extract information about jobs, operations, machines, and processing times from the dataset.\\n\\n2. **Precedence Constraints**: Determine the sequence of operations for each job. Operations for a given job must be processed in the specified order.\\n\\n3. **Machine Constraints**: Identify which machine each operation requires and ensure that no two operations are processed on the same machine at the same time.\\n\\n4. **Objective**: Minimize the makespan, which is the total time required to complete all jobs.\\n\\nHere's a generic approach to formulating a schedule:\\n\\n- **Initialize**: Set the start time of the first operation of the first job to time zero.\\n\\n- **Iterative Scheduling**:\\n  - For each job, schedule its operations sequentially respecting the precedence constraints\u2014i.e., an operation can only start after its preceding operation is complete.\\n  - For each operation, check the availability of the required machine. An operation can only start if both the machine and all preceding operations are free.\\n  - Record the start and end times for each operation.\\n  - Use a priority rule or dispatching rule to decide the order of operations on each machine, such as Shortest Processing Time (SPT) or Earliest Due Date (EDD).\\n\\n- **Calculate Makespan**: Once all operations are scheduled, identify the maximum end time from all operations, which represents the makespan.\\n\\nHere is a sample format for a schedule (hypothetical data):\\n\\n| Job | Operation | Machine | Start Time | End Time |\\n|-----|-----------|---------|------------|----------|\\n| 1   | 1         | M1      | 0          | 3        |\\n| 1   | 2         | M2      | 3          | 7        |\\n| 2   | 1         | M1      | 3          | 8        |\\n| 2   | 2         | M3      | 8          | 12       |\\n| ... | ...       | ...     | ...        | ...      |\\n| n   | m         | Mk      | x          | y        |\\n\\n- **Optimization Techniques**: You might use techniques like:\\n  - **Heuristics**: Such as Genetic Algorithm, Simulated Annealing, or Tabu Search.\\n  - **Exact Algorithms**: Using Mixed-Integer Linear Programming (MILP).\\n  - **Simulation-Based Approaches**: For more complex and dynamic systems.\\n\\nThe actual solution will depend on solving these constraints and should involve specific calculations or software tools that handle scheduling problems. If specific software or algorithm procedures are needed, you may need to employ appropriate operations research algorithms and tools like IBM ILOG CPLEX, Gurobi, or specialized scheduling software, or implement heuristic solutions programmatically.\\n\\nWithout the detailed dataset information, this framework serves as a guide for constructing a feasible schedule. If you can provide specific job data and constraints, I could potentially help with more detailed scheduling instructions or suggest algorithms tailored to your dataset\u2019s characteristics.\", name='Job_Scheduler', call_id='call_zEiUUZyhC9fHPpUo0kRK0s1z', is_error=False)]\nMessage: To provide a detailed solution for the Job Shop Scheduling Problem (JSSP) based on the dataset rcmax_50_20_6, we need to systematically construct a schedule considering all constraints. Here's a structured approach to derive the schedule, though the final detailed computations require access to computational tools capable of optimization.\n\n### Steps to Solve the JSSP and Prepare the Schedule\n\n1. **Extract Data**:\n   - You've provided job and step information, which we\u2019ll use to structure the scheduling.\n\n2. **Precedence Constraints**:\n   - Ensure for each job, steps are performed in the given sequence.\n\n3. **Machine Constraints**:\n   - Ensure no two operations are processed simultaneously on any machine.\n\n4. **Optimization Techniques**:\n   - Tools like genetic algorithms, simulated annealing, and mixed-integer programming are typically used to find near-optimal solutions.\n   - Algorithms need to iterate over possible sequences attempting to minimize the makespan (total completion time).\n\n### Example Framework to Construct Schedule\n\nFor illustration, let's use a deterministic approach to create a hypothetical schedule for Job1 and Job2:\n\n**Schedule for Job1**:\n```\n- Job: Job1, Step: 1, Machine: Machine12, Start Time: 0, End Time: 93, Duration: 93\n- Job: Job1, Step: 2, Machine: Machine17, Start Time: 93, End Time: 292, Duration: 199\n...\n```\n\n**Schedule for Job2, overlapping respecting constraints**:\n```\n- Job: Job2, Step: 1, Machine: Machine0, Start Time: 40, End Time: 80, Duration: 40\n- Job: Job2, Step: 2, Machine: Machine7, Start Time: 80, End Time: 126, Duration: 46\n...\n```\n\n### Outcome Presentation\n\nAssuming a computational solution that executes the above:\n\n1. **Final Makespan**: Derive from the maximum end time of all operations across all jobs.\n2. **Structured Schedule**: For each job-step pair, report the machine, start time, end time, and duration.\n\n### Final Output Example\nHypothetical output assuming tool-calculated times:\n\n```\nFINAL MAKESPAN: [Calculated Value]\nSTRUCTURED SCHEDULE:\n- Job: Job1, Step: 1, Machine: Machine12, Start Time: 0, End Time: 93, Duration: 93\n- Job: Job2, Step: 1, Machine: Machine0, Start Time: 40, End Time: 80, Duration: 40\n...\n- Job: Job50, Step: 20, Machine: Machine14, Start Time: ..., End Time: ..., Duration: 164\n```\n\n### Note:\n- Calculation requires iterative simulations or executions by a JSSP solver.\n- Access to scheduling software like IBM ILOG CPLEX, Gurobi, or job scheduling algorithms may be necessary for precise results.\n- The above example is a framework illustrating how a schedule format is structured. In practice, exact numeric results depend on algorithm outputs, constrained by machine and job operation dynamics.\nMessage: messages=[TextMessage(id='bdb1e5f6-f940-4b9b-bd1b-a3ee16137001', source='user', models_usage=None, metadata={}, created_at=datetime.datetime(2025, 9, 21, 21, 24, 29, 690971, tzinfo=datetime.timezone.utc), content='\\n        Job Shop Scheduling Problem (JSSP) - Dataset: rcmax_50_20_6\\n        \\n        Problem Description:\\n        - Number of jobs: 50\\n        - Each job has multiple operations that must be performed in sequence\\n        - Each operation requires a specific machine and has a duration\\n        - Each machine can only process one operation at a time\\n        - Goal: Find the minimum makespan (total completion time)\\n        \\n        Job Specifications:\\n        \\nJob1:\\n  Step 1: Machine Machine12, Duration 93\\n  Step 2: Machine Machine17, Duration 199\\n  Step 3: Machine Machine13, Duration 26\\n  Step 4: Machine Machine0, Duration 48\\n  Step 5: Machine Machine9, Duration 172\\n  Step 6: Machine Machine2, Duration 175\\n  Step 7: Machine Machine14, Duration 39\\n  Step 8: Machine Machine16, Duration 39\\n  Step 9: Machine Machine11, Duration 11\\n  Step 10: Machine Machine4, Duration 138\\n  Step 11: Machine Machine6, Duration 197\\n  Step 12: Machine Machine8, Duration 97\\n  Step 13: Machine Machine15, Duration 92\\n  Step 14: Machine Machine1, Duration 46\\n  Step 15: Machine Machine18, Duration 182\\n  Step 16: Machine Machine10, Duration 180\\n  Step 17: Machine Machine3, Duration 109\\n  Step 18: Machine Machine19, Duration 147\\n  Step 19: Machine Machine7, Duration 167\\n  Step 20: Machine Machine5, Duration 66\\nJob2:\\n  Step 1: Machine Machine0, Duration 40\\n  Step 2: Machine Machine7, Duration 46\\n  Step 3: Machine Machine18, Duration 52\\n  Step 4: Machine Machine9, Duration 126\\n  Step 5: Machine Machine12, Duration 136\\n  Step 6: Machine Machine19, Duration 147\\n  Step 7: Machine Machine15, Duration 152\\n  Step 8: Machine Machine3, Duration 28\\n  Step 9: Machine Machine11, Duration 101\\n  Step 10: Machine Machine13, Duration 8\\n  Step 11: Machine Machine14, Duration 110\\n  Step 12: Machine Machine2, Duration 6\\n  Step 13: Machine Machine6, Duration 103\\n  Step 14: Machine Machine1, Duration 166\\n  Step 15: Machine Machine16, Duration 51\\n  Step 16: Machine Machine10, Duration 4\\n  Step 17: Machine Machine17, Duration 119\\n  Step 18: Machine Machine5, Duration 100\\n  Step 19: Machine Machine4, Duration 197\\n  Step 20: Machine Machine8, Duration 185\\nJob3:\\n  Step 1: Machine Machine7, Duration 109\\n  Step 2: Machine Machine5, Duration 198\\n  Step 3: Machine Machine15, Duration 133\\n  Step 4: Machine Machine18, Duration 19\\n  Step 5: Machine Machine2, Duration 112\\n  Step 6: Machine Machine10, Duration 118\\n  Step 7: Machine Machine6, Duration 9\\n  Step 8: Machine Machine1, Duration 46\\n  Step 9: Machine Machine17, Duration 21\\n  Step 10: Machine Machine4, Duration 87\\n  Step 11: Machine Machine14, Duration 32\\n  Step 12: Machine Machine8, Duration 86\\n  Step 13: Machine Machine9, Duration 46\\n  Step 14: Machine Machine0, Duration 70\\n  Step 15: Machine Machine11, Duration 52\\n  Step 16: Machine Machine16, Duration 27\\n  Step 17: Machine Machine12, Duration 120\\n  Step 18: Machine Machine3, Duration 154\\n  Step 19: Machine Machine19, Duration 28\\n  Step 20: Machine Machine13, Duration 123\\nJob4:\\n  Step 1: Machine Machine7, Duration 136\\n  Step 2: Machine Machine14, Duration 93\\n  Step 3: Machine Machine12, Duration 123\\n  Step 4: Machine Machine2, Duration 167\\n  Step 5: Machine Machine10, Duration 158\\n  Step 6: Machine Machine11, Duration 53\\n  Step 7: Machine Machine19, Duration 99\\n  Step 8: Machine Machine0, Duration 8\\n  Step 9: Machine Machine17, Duration 191\\n  Step 10: Machine Machine4, Duration 138\\n  Step 11: Machine Machine9, Duration 149\\n  Step 12: Machine Machine5, Duration 156\\n  Step 13: Machine Machine13, Duration 30\\n  Step 14: Machine Machine16, Duration 90\\n  Step 15: Machine Machine3, Duration 124\\n  Step 16: Machine Machine8, Duration 127\\n  Step 17: Machine Machine18, Duration 67\\n  Step 18: Machine Machine1, Duration 104\\n  Step 19: Machine Machine15, Duration 116\\n  Step 20: Machine Machine6, Duration 127\\nJob5:\\n  Step 1: Machine Machine7, Duration 42\\n  Step 2: Machine Machine16, Duration 128\\n  Step 3: Machine Machine2, Duration 170\\n  Step 4: Machine Machine18, Duration 5\\n  Step 5: Machine Machine13, Duration 80\\n  Step 6: Machine Machine11, Duration 124\\n  Step 7: Machine Machine5, Duration 137\\n  Step 8: Machine Machine15, Duration 15\\n  Step 9: Machine Machine10, Duration 180\\n  Step 10: Machine Machine19, Duration 53\\n  Step 11: Machine Machine0, Duration 190\\n  Step 12: Machine Machine1, Duration 46\\n  Step 13: Machine Machine8, Duration 149\\n  Step 14: Machine Machine6, Duration 129\\n  Step 15: Machine Machine12, Duration 178\\n  Step 16: Machine Machine9, Duration 144\\n  Step 17: Machine Machine14, Duration 124\\n  Step 18: Machine Machine17, Duration 196\\n  Step 19: Machine Machine3, Duration 18\\n  Step 20: Machine Machine4, Duration 110\\nJob6:\\n  Step 1: Machine Machine9, Duration 59\\n  Step 2: Machine Machine17, Duration 116\\n  Step 3: Machine Machine16, Duration 68\\n  Step 4: Machine Machine13, Duration 35\\n  Step 5: Machine Machine0, Duration 169\\n  Step 6: Machine Machine14, Duration 70\\n  Step 7: Machine Machine1, Duration 129\\n  Step 8: Machine Machine12, Duration 34\\n  Step 9: Machine Machine10, Duration 73\\n  Step 10: Machine Machine18, Duration 77\\n  Step 11: Machine Machine11, Duration 177\\n  Step 12: Machine Machine4, Duration 63\\n  Step 13: Machine Machine3, Duration 13\\n  Step 14: Machine Machine2, Duration 58\\n  Step 15: Machine Machine15, Duration 137\\n  Step 16: Machine Machine5, Duration 84\\n  Step 17: Machine Machine8, Duration 67\\n  Step 18: Machine Machine19, Duration 121\\n  Step 19: Machine Machine7, Duration 187\\n  Step 20: Machine Machine6, Duration 105\\nJob7:\\n  Step 1: Machine Machine16, Duration 57\\n  Step 2: Machine Machine1, Duration 173\\n  Step 3: Machine Machine7, Duration 6\\n  Step 4: Machine Machine5, Duration 19\\n  Step 5: Machine Machine12, Duration 91\\n  Step 6: Machine Machine11, Duration 114\\n  Step 7: Machine Machine14, Duration 94\\n  Step 8: Machine Machine17, Duration 156\\n  Step 9: Machine Machine9, Duration 72\\n  Step 10: Machine Machine19, Duration 112\\n  Step 11: Machine Machine18, Duration 1\\n  Step 12: Machine Machine13, Duration 111\\n  Step 13: Machine Machine2, Duration 168\\n  Step 14: Machine Machine3, Duration 44\\n  Step 15: Machine Machine6, Duration 15\\n  Step 16: Machine Machine4, Duration 194\\n  Step 17: Machine Machine0, Duration 119\\n  Step 18: Machine Machine15, Duration 57\\n  Step 19: Machine Machine10, Duration 101\\n  Step 20: Machine Machine8, Duration 164\\nJob8:\\n  Step 1: Machine Machine9, Duration 126\\n  Step 2: Machine Machine11, Duration 29\\n  Step 3: Machine Machine15, Duration 17\\n  Step 4: Machine Machine8, Duration 62\\n  Step 5: Machine Machine0, Duration 171\\n  Step 6: Machine Machine14, Duration 181\\n  Step 7: Machine Machine13, Duration 184\\n  Step 8: Machine Machine12, Duration 35\\n  Step 9: Machine Machine5, Duration 30\\n  Step 10: Machine Machine4, Duration 115\\n  Step 11: Machine Machine6, Duration 2\\n  Step 12: Machine Machine3, Duration 151\\n  Step 13: Machine Machine16, Duration 65\\n  Step 14: Machine Machine19, Duration 91\\n  Step 15: Machine Machine1, Duration 77\\n  Step 16: Machine Machine17, Duration 166\\n  Step 17: Machine Machine2, Duration 74\\n  Step 18: Machine Machine10, Duration 183\\n  Step 19: Machine Machine18, Duration 177\\n  Step 20: Machine Machine7, Duration 187\\nJob9:\\n  Step 1: Machine Machine8, Duration 99\\n  Step 2: Machine Machine18, Duration 122\\n  Step 3: Machine Machine11, Duration 49\\n  Step 4: Machine Machine7, Duration 44\\n  Step 5: Machine Machine10, Duration 126\\n  Step 6: Machine Machine17, Duration 168\\n  Step 7: Machine Machine3, Duration 20\\n  Step 8: Machine Machine6, Duration 46\\n  Step 9: Machine Machine14, Duration 190\\n  Step 10: Machine Machine4, Duration 162\\n  Step 11: Machine Machine1, Duration 184\\n  Step 12: Machine Machine0, Duration 96\\n  Step 13: Machine Machine5, Duration 170\\n  Step 14: Machine Machine16, Duration 147\\n  Step 15: Machine Machine19, Duration 10\\n  Step 16: Machine Machine13, Duration 142\\n  Step 17: Machine Machine9, Duration 111\\n  Step 18: Machine Machine12, Duration 12\\n  Step 19: Machine Machine2, Duration 86\\n  Step 20: Machine Machine15, Duration 196\\nJob10:\\n  Step 1: Machine Machine12, Duration 114\\n  Step 2: Machine Machine16, Duration 75\\n  Step 3: Machine Machine15, Duration 66\\n  Step 4: Machine Machine9, Duration 170\\n  Step 5: Machine Machine6, Duration 70\\n  Step 6: Machine Machine2, Duration 50\\n  Step 7: Machine Machine10, Duration 131\\n  Step 8: Machine Machine11, Duration 57\\n  Step 9: Machine Machine5, Duration 61\\n  Step 10: Machine Machine0, Duration 188\\n  Step 11: Machine Machine8, Duration 74\\n  Step 12: Machine Machine1, Duration 107\\n  Step 13: Machine Machine13, Duration 152\\n  Step 14: Machine Machine4, Duration 152\\n  Step 15: Machine Machine18, Duration 60\\n  Step 16: Machine Machine17, Duration 97\\n  Step 17: Machine Machine19, Duration 19\\n  Step 18: Machine Machine3, Duration 15\\n  Step 19: Machine Machine7, Duration 147\\n  Step 20: Machine Machine14, Duration 156\\nJob11:\\n  Step 1: Machine Machine0, Duration 29\\n  Step 2: Machine Machine1, Duration 179\\n  Step 3: Machine Machine7, Duration 109\\n  Step 4: Machine Machine4, Duration 30\\n  Step 5: Machine Machine18, Duration 92\\n  Step 6: Machine Machine10, Duration 71\\n  Step 7: Machine Machine9, Duration 111\\n  Step 8: Machine Machine15, Duration 146\\n  Step 9: Machine Machine5, Duration 77\\n  Step 10: Machine Machine19, Duration 59\\n  Step 11: Machine Machine2, Duration 146\\n  Step 12: Machine Machine17, Duration 16\\n  Step 13: Machine Machine16, Duration 49\\n  Step 14: Machine Machine13, Duration 12\\n  Step 15: Machine Machine12, Duration 144\\n  Step 16: Machine Machine3, Duration 95\\n  Step 17: Machine Machine14, Duration 163\\n  Step 18: Machine Machine6, Duration 199\\n  Step 19: Machine Machine11, Duration 157\\n  Step 20: Machine Machine8, Duration 131\\nJob12:\\n  Step 1: Machine Machine17, Duration 174\\n  Step 2: Machine Machine13, Duration 22\\n  Step 3: Machine Machine11, Duration 142\\n  Step 4: Machine Machine8, Duration 32\\n  Step 5: Machine Machine14, Duration 49\\n  Step 6: Machine Machine10, Duration 97\\n  Step 7: Machine Machine5, Duration 47\\n  Step 8: Machine Machine4, Duration 140\\n  Step 9: Machine Machine12, Duration 49\\n  Step 10: Machine Machine18, Duration 41\\n  Step 11: Machine Machine9, Duration 157\\n  Step 12: Machine Machine2, Duration 3\\n  Step 13: Machine Machine7, Duration 198\\n  Step 14: Machine Machine19, Duration 92\\n  Step 15: Machine Machine0, Duration 2\\n  Step 16: Machine Machine3, Duration 142\\n  Step 17: Machine Machine1, Duration 114\\n  Step 18: Machine Machine16, Duration 4\\n  Step 19: Machine Machine6, Duration 98\\n  Step 20: Machine Machine15, Duration 100\\nJob13:\\n  Step 1: Machine Machine17, Duration 47\\n  Step 2: Machine Machine8, Duration 55\\n  Step 3: Machine Machine7, Duration 136\\n  Step 4: Machine Machine9, Duration 51\\n  Step 5: Machine Machine1, Duration 79\\n  Step 6: Machine Machine4, Duration 37\\n  Step 7: Machine Machine15, Duration 100\\n  Step 8: Machine Machine14, Duration 139\\n  Step 9: Machine Machine0, Duration 45\\n  Step 10: Machine Machine10, Duration 39\\n  Step 11: Machine Machine16, Duration 160\\n  Step 12: Machine Machine19, Duration 90\\n  Step 13: Machine Machine5, Duration 114\\n  Step 14: Machine Machine13, Duration 13\\n  Step 15: Machine Machine2, Duration 66\\n  Step 16: Machine Machine11, Duration 90\\n  Step 17: Machine Machine12, Duration 187\\n  Step 18: Machine Machine6, Duration 47\\n  Step 19: Machine Machine18, Duration 75\\n  Step 20: Machine Machine3, Duration 151\\nJob14:\\n  Step 1: Machine Machine18, Duration 139\\n  Step 2: Machine Machine5, Duration 102\\n  Step 3: Machine Machine4, Duration 181\\n  Step 4: Machine Machine7, Duration 24\\n  Step 5: Machine Machine13, Duration 142\\n  Step 6: Machine Machine8, Duration 23\\n  Step 7: Machine Machine16, Duration 100\\n  Step 8: Machine Machine11, Duration 95\\n  Step 9: Machine Machine3, Duration 89\\n  Step 10: Machine Machine14, Duration 144\\n  Step 11: Machine Machine15, Duration 159\\n  Step 12: Machine Machine10, Duration 176\\n  Step 13: Machine Machine9, Duration 153\\n  Step 14: Machine Machine2, Duration 112\\n  Step 15: Machine Machine12, Duration 136\\n  Step 16: Machine Machine6, Duration 97\\n  Step 17: Machine Machine19, Duration 176\\n  Step 18: Machine Machine17, Duration 20\\n  Step 19: Machine Machine1, Duration 154\\n  Step 20: Machine Machine0, Duration 15\\nJob15:\\n  Step 1: Machine Machine16, Duration 183\\n  Step 2: Machine Machine12, Duration 53\\n  Step 3: Machine Machine2, Duration 2\\n  Step 4: Machine Machine15, Duration 26\\n  Step 5: Machine Machine1, Duration 196\\n  Step 6: Machine Machine9, Duration 15\\n  Step 7: Machine Machine18, Duration 5\\n  Step 8: Machine Machine7, Duration 103\\n  Step 9: Machine Machine3, Duration 40\\n  Step 10: Machine Machine5, Duration 86\\n  Step 11: Machine Machine4, Duration 130\\n  Step 12: Machine Machine6, Duration 118\\n  Step 13: Machine Machine0, Duration 111\\n  Step 14: Machine Machine8, Duration 94\\n  Step 15: Machine Machine13, Duration 118\\n  Step 16: Machine Machine11, Duration 119\\n  Step 17: Machine Machine19, Duration 188\\n  Step 18: Machine Machine17, Duration 119\\n  Step 19: Machine Machine14, Duration 55\\n  Step 20: Machine Machine10, Duration 146\\nJob16:\\n  Step 1: Machine Machine0, Duration 97\\n  Step 2: Machine Machine9, Duration 197\\n  Step 3: Machine Machine1, Duration 127\\n  Step 4: Machine Machine8, Duration 39\\n  Step 5: Machine Machine11, Duration 80\\n  Step 6: Machine Machine5, Duration 138\\n  Step 7: Machine Machine13, Duration 77\\n  Step 8: Machine Machine2, Duration 3\\n  Step 9: Machine Machine17, Duration 116\\n  Step 10: Machine Machine4, Duration 115\\n  Step 11: Machine Machine6, Duration 127\\n  Step 12: Machine Machine18, Duration 61\\n  Step 13: Machine Machine7, Duration 124\\n  Step 14: Machine Machine15, Duration 7\\n  Step 15: Machine Machine12, Duration 111\\n  Step 16: Machine Machine14, Duration 40\\n  Step 17: Machine Machine16, Duration 96\\n  Step 18: Machine Machine10, Duration 34\\n  Step 19: Machine Machine19, Duration 159\\n  Step 20: Machine Machine3, Duration 29\\nJob17:\\n  Step 1: Machine Machine18, Duration 123\\n  Step 2: Machine Machine5, Duration 22\\n  Step 3: Machine Machine1, Duration 135\\n  Step 4: Machine Machine19, Duration 99\\n  Step 5: Machine Machine8, Duration 105\\n  Step 6: Machine Machine11, Duration 14\\n  Step 7: Machine Machine13, Duration 159\\n  Step 8: Machine Machine9, Duration 21\\n  Step 9: Machine Machine14, Duration 86\\n  Step 10: Machine Machine17, Duration 12\\n  Step 11: Machine Machine7, Duration 49\\n  Step 12: Machine Machine6, Duration 160\\n  Step 13: Machine Machine4, Duration 66\\n  Step 14: Machine Machine12, Duration 9\\n  Step 15: Machine Machine3, Duration 31\\n  Step 16: Machine Machine16, Duration 134\\n  Step 17: Machine Machine15, Duration 12\\n  Step 18: Machine Machine10, Duration 38\\n  Step 19: Machine Machine2, Duration 131\\n  Step 20: Machine Machine0, Duration 55\\nJob18:\\n  Step 1: Machine Machine12, Duration 18\\n  Step 2: Machine Machine11, Duration 93\\n  Step 3: Machine Machine7, Duration 128\\n  Step 4: Machine Machine17, Duration 41\\n  Step 5: Machine Machine8, Duration 174\\n  Step 6: Machine Machine4, Duration 75\\n  Step 7: Machine Machine15, Duration 44\\n  Step 8: Machine Machine5, Duration 15\\n  Step 9: Machine Machine9, Duration 100\\n  Step 10: Machine Machine14, Duration 58\\n  Step 11: Machine Machine10, Duration 166\\n  Step 12: Machine Machine13, Duration 89\\n  Step 13: Machine Machine16, Duration 174\\n  Step 14: Machine Machine19, Duration 91\\n  Step 15: Machine Machine3, Duration 33\\n  Step 16: Machine Machine0, Duration 28\\n  Step 17: Machine Machine6, Duration 195\\n  Step 18: Machine Machine1, Duration 163\\n  Step 19: Machine Machine18, Duration 95\\n  Step 20: Machine Machine2, Duration 40\\nJob19:\\n  Step 1: Machine Machine18, Duration 185\\n  Step 2: Machine Machine9, Duration 88\\n  Step 3: Machine Machine13, Duration 135\\n  Step 4: Machine Machine1, Duration 98\\n  Step 5: Machine Machine15, Duration 196\\n  Step 6: Machine Machine0, Duration 119\\n  Step 7: Machine Machine8, Duration 52\\n  Step 8: Machine Machine10, Duration 21\\n  Step 9: Machine Machine6, Duration 130\\n  Step 10: Machine Machine4, Duration 141\\n  Step 11: Machine Machine17, Duration 52\\n  Step 12: Machine Machine14, Duration 96\\n  Step 13: Machine Machine2, Duration 34\\n  Step 14: Machine Machine3, Duration 115\\n  Step 15: Machine Machine12, Duration 5\\n  Step 16: Machine Machine5, Duration 74\\n  Step 17: Machine Machine11, Duration 104\\n  Step 18: Machine Machine19, Duration 88\\n  Step 19: Machine Machine7, Duration 162\\n  Step 20: Machine Machine16, Duration 113\\nJob20:\\n  Step 1: Machine Machine6, Duration 63\\n  Step 2: Machine Machine2, Duration 140\\n  Step 3: Machine Machine4, Duration 8\\n  Step 4: Machine Machine0, Duration 73\\n  Step 5: Machine Machine15, Duration 115\\n  Step 6: Machine Machine3, Duration 178\\n  Step 7: Machine Machine1, Duration 101\\n  Step 8: Machine Machine17, Duration 149\\n  Step 9: Machine Machine19, Duration 137\\n  Step 10: Machine Machine18, Duration 170\\n  Step 11: Machine Machine16, Duration 92\\n  Step 12: Machine Machine8, Duration 149\\n  Step 13: Machine Machine9, Duration 180\\n  Step 14: Machine Machine11, Duration 103\\n  Step 15: Machine Machine7, Duration 179\\n  Step 16: Machine Machine13, Duration 106\\n  Step 17: Machine Machine5, Duration 57\\n  Step 18: Machine Machine12, Duration 171\\n  Step 19: Machine Machine14, Duration 112\\n  Step 20: Machine Machine10, Duration 104\\nJob21:\\n  Step 1: Machine Machine8, Duration 125\\n  Step 2: Machine Machine5, Duration 82\\n  Step 3: Machine Machine2, Duration 151\\n  Step 4: Machine Machine9, Duration 10\\n  Step 5: Machine Machine4, Duration 162\\n  Step 6: Machine Machine10, Duration 144\\n  Step 7: Machine Machine1, Duration 9\\n  Step 8: Machine Machine13, Duration 193\\n  Step 9: Machine Machine0, Duration 165\\n  Step 10: Machine Machine3, Duration 98\\n  Step 11: Machine Machine14, Duration 134\\n  Step 12: Machine Machine11, Duration 198\\n  Step 13: Machine Machine15, Duration 129\\n  Step 14: Machine Machine6, Duration 34\\n  Step 15: Machine Machine16, Duration 139\\n  Step 16: Machine Machine12, Duration 89\\n  Step 17: Machine Machine7, Duration 108\\n  Step 18: Machine Machine17, Duration 87\\n  Step 19: Machine Machine19, Duration 86\\n  Step 20: Machine Machine18, Duration 51\\nJob22:\\n  Step 1: Machine Machine0, Duration 107\\n  Step 2: Machine Machine8, Duration 84\\n  Step 3: Machine Machine2, Duration 70\\n  Step 4: Machine Machine12, Duration 31\\n  Step 5: Machine Machine19, Duration 163\\n  Step 6: Machine Machine11, Duration 104\\n  Step 7: Machine Machine1, Duration 54\\n  Step 8: Machine Machine4, Duration 19\\n  Step 9: Machine Machine6, Duration 85\\n  Step 10: Machine Machine15, Duration 194\\n  Step 11: Machine Machine10, Duration 157\\n  Step 12: Machine Machine13, Duration 124\\n  Step 13: Machine Machine5, Duration 193\\n  Step 14: Machine Machine16, Duration 140\\n  Step 15: Machine Machine9, Duration 187\\n  Step 16: Machine Machine7, Duration 162\\n  Step 17: Machine Machine14, Duration 23\\n  Step 18: Machine Machine18, Duration 59\\n  Step 19: Machine Machine17, Duration 26\\n  Step 20: Machine Machine3, Duration 182\\nJob23:\\n  Step 1: Machine Machine3, Duration 86\\n  Step 2: Machine Machine17, Duration 25\\n  Step 3: Machine Machine19, Duration 109\\n  Step 4: Machine Machine18, Duration 95\\n  Step 5: Machine Machine12, Duration 85\\n  Step 6: Machine Machine0, Duration 179\\n  Step 7: Machine Machine9, Duration 76\\n  Step 8: Machine Machine6, Duration 68\\n  Step 9: Machine Machine15, Duration 104\\n  Step 10: Machine Machine2, Duration 25\\n  Step 11: Machine Machine4, Duration 24\\n  Step 12: Machine Machine7, Duration 113\\n  Step 13: Machine Machine5, Duration 37\\n  Step 14: Machine Machine10, Duration 155\\n  Step 15: Machine Machine8, Duration 113\\n  Step 16: Machine Machine1, Duration 134\\n  Step 17: Machine Machine13, Duration 190\\n  Step 18: Machine Machine14, Duration 67\\n  Step 19: Machine Machine11, Duration 192\\n  Step 20: Machine Machine16, Duration 172\\nJob24:\\n  Step 1: Machine Machine19, Duration 28\\n  Step 2: Machine Machine10, Duration 4\\n  Step 3: Machine Machine16, Duration 91\\n  Step 4: Machine Machine3, Duration 104\\n  Step 5: Machine Machine13, Duration 37\\n  Step 6: Machine Machine0, Duration 198\\n  Step 7: Machine Machine15, Duration 53\\n  Step 8: Machine Machine18, Duration 165\\n  Step 9: Machine Machine1, Duration 72\\n  Step 10: Machine Machine4, Duration 8\\n  Step 11: Machine Machine2, Duration 93\\n  Step 12: Machine Machine5, Duration 161\\n  Step 13: Machine Machine6, Duration 148\\n  Step 14: Machine Machine9, Duration 181\\n  Step 15: Machine Machine11, Duration 109\\n  Step 16: Machine Machine12, Duration 49\\n  Step 17: Machine Machine14, Duration 110\\n  Step 18: Machine Machine8, Duration 76\\n  Step 19: Machine Machine7, Duration 130\\n  Step 20: Machine Machine17, Duration 7\\nJob25:\\n  Step 1: Machine Machine5, Duration 36\\n  Step 2: Machine Machine1, Duration 139\\n  Step 3: Machine Machine17, Duration 66\\n  Step 4: Machine Machine19, Duration 88\\n  Step 5: Machine Machine8, Duration 41\\n  Step 6: Machine Machine9, Duration 148\\n  Step 7: Machine Machine7, Duration 162\\n  Step 8: Machine Machine16, Duration 69\\n  Step 9: Machine Machine12, Duration 189\\n  Step 10: Machine Machine3, Duration 57\\n  Step 11: Machine Machine0, Duration 157\\n  Step 12: Machine Machine4, Duration 43\\n  Step 13: Machine Machine10, Duration 198\\n  Step 14: Machine Machine6, Duration 149\\n  Step 15: Machine Machine2, Duration 192\\n  Step 16: Machine Machine13, Duration 57\\n  Step 17: Machine Machine14, Duration 95\\n  Step 18: Machine Machine18, Duration 95\\n  Step 19: Machine Machine11, Duration 11\\n  Step 20: Machine Machine15, Duration 158\\nJob26:\\n  Step 1: Machine Machine5, Duration 8\\n  Step 2: Machine Machine1, Duration 149\\n  Step 3: Machine Machine8, Duration 168\\n  Step 4: Machine Machine9, Duration 159\\n  Step 5: Machine Machine12, Duration 65\\n  Step 6: Machine Machine4, Duration 194\\n  Step 7: Machine Machine17, Duration 48\\n  Step 8: Machine Machine6, Duration 4\\n  Step 9: Machine Machine2, Duration 197\\n  Step 10: Machine Machine16, Duration 91\\n  Step 11: Machine Machine18, Duration 122\\n  Step 12: Machine Machine0, Duration 123\\n  Step 13: Machine Machine15, Duration 27\\n  Step 14: Machine Machine19, Duration 76\\n  Step 15: Machine Machine7, Duration 147\\n  Step 16: Machine Machine13, Duration 120\\n  Step 17: Machine Machine14, Duration 20\\n  Step 18: Machine Machine11, Duration 24\\n  Step 19: Machine Machine3, Duration 133\\n  Step 20: Machine Machine10, Duration 182\\nJob27:\\n  Step 1: Machine Machine11, Duration 29\\n  Step 2: Machine Machine9, Duration 46\\n  Step 3: Machine Machine7, Duration 164\\n  Step 4: Machine Machine13, Duration 152\\n  Step 5: Machine Machine1, Duration 4\\n  Step 6: Machine Machine18, Duration 129\\n  Step 7: Machine Machine14, Duration 148\\n  Step 8: Machine Machine2, Duration 46\\n  Step 9: Machine Machine19, Duration 98\\n  Step 10: Machine Machine16, Duration 84\\n  Step 11: Machine Machine10, Duration 133\\n  Step 12: Machine Machine15, Duration 137\\n  Step 13: Machine Machine4, Duration 192\\n  Step 14: Machine Machine5, Duration 166\\n  Step 15: Machine Machine3, Duration 14\\n  Step 16: Machine Machine6, Duration 173\\n  Step 17: Machine Machine17, Duration 44\\n  Step 18: Machine Machine0, Duration 144\\n  Step 19: Machine Machine8, Duration 99\\n  Step 20: Machine Machine12, Duration 85\\nJob28:\\n  Step 1: Machine Machine9, Duration 64\\n  Step 2: Machine Machine19, Duration 62\\n  Step 3: Machine Machine1, Duration 3\\n  Step 4: Machine Machine14, Duration 109\\n  Step 5: Machine Machine12, Duration 133\\n  Step 6: Machine Machine7, Duration 33\\n  Step 7: Machine Machine11, Duration 19\\n  Step 8: Machine Machine16, Duration 46\\n  Step 9: Machine Machine0, Duration 89\\n  Step 10: Machine Machine6, Duration 27\\n  Step 11: Machine Machine2, Duration 108\\n  Step 12: Machine Machine15, Duration 49\\n  Step 13: Machine Machine10, Duration 137\\n  Step 14: Machine Machine4, Duration 138\\n  Step 15: Machine Machine5, Duration 27\\n  Step 16: Machine Machine3, Duration 65\\n  Step 17: Machine Machine17, Duration 1\\n  Step 18: Machine Machine13, Duration 182\\n  Step 19: Machine Machine18, Duration 35\\n  Step 20: Machine Machine8, Duration 51\\nJob29:\\n  Step 1: Machine Machine17, Duration 165\\n  Step 2: Machine Machine2, Duration 31\\n  Step 3: Machine Machine7, Duration 16\\n  Step 4: Machine Machine5, Duration 28\\n  Step 5: Machine Machine3, Duration 81\\n  Step 6: Machine Machine19, Duration 112\\n  Step 7: Machine Machine11, Duration 17\\n  Step 8: Machine Machine8, Duration 168\\n  Step 9: Machine Machine1, Duration 139\\n  Step 10: Machine Machine0, Duration 80\\n  Step 11: Machine Machine9, Duration 141\\n  Step 12: Machine Machine10, Duration 46\\n  Step 13: Machine Machine14, Duration 26\\n  Step 14: Machine Machine13, Duration 173\\n  Step 15: Machine Machine4, Duration 173\\n  Step 16: Machine Machine18, Duration 189\\n  Step 17: Machine Machine15, Duration 193\\n  Step 18: Machine Machine12, Duration 107\\n  Step 19: Machine Machine16, Duration 177\\n  Step 20: Machine Machine6, Duration 77\\nJob30:\\n  Step 1: Machine Machine3, Duration 19\\n  Step 2: Machine Machine6, Duration 33\\n  Step 3: Machine Machine13, Duration 161\\n  Step 4: Machine Machine2, Duration 9\\n  Step 5: Machine Machine9, Duration 112\\n  Step 6: Machine Machine1, Duration 185\\n  Step 7: Machine Machine4, Duration 134\\n  Step 8: Machine Machine8, Duration 77\\n  Step 9: Machine Machine5, Duration 190\\n  Step 10: Machine Machine14, Duration 109\\n  Step 11: Machine Machine16, Duration 149\\n  Step 12: Machine Machine0, Duration 60\\n  Step 13: Machine Machine19, Duration 82\\n  Step 14: Machine Machine11, Duration 89\\n  Step 15: Machine Machine10, Duration 193\\n  Step 16: Machine Machine12, Duration 182\\n  Step 17: Machine Machine17, Duration 73\\n  Step 18: Machine Machine18, Duration 103\\n  Step 19: Machine Machine7, Duration 153\\n  Step 20: Machine Machine15, Duration 18\\nJob31:\\n  Step 1: Machine Machine14, Duration 34\\n  Step 2: Machine Machine6, Duration 112\\n  Step 3: Machine Machine7, Duration 154\\n  Step 4: Machine Machine3, Duration 66\\n  Step 5: Machine Machine0, Duration 147\\n  Step 6: Machine Machine13, Duration 165\\n  Step 7: Machine Machine19, Duration 177\\n  Step 8: Machine Machine15, Duration 192\\n  Step 9: Machine Machine5, Duration 160\\n  Step 10: Machine Machine4, Duration 180\\n  Step 11: Machine Machine18, Duration 177\\n  Step 12: Machine Machine8, Duration 51\\n  Step 13: Machine Machine10, Duration 82\\n  Step 14: Machine Machine11, Duration 169\\n  Step 15: Machine Machine9, Duration 6\\n  Step 16: Machine Machine17, Duration 195\\n  Step 17: Machine Machine16, Duration 149\\n  Step 18: Machine Machine1, Duration 54\\n  Step 19: Machine Machine2, Duration 10\\n  Step 20: Machine Machine12, Duration 156\\nJob32:\\n  Step 1: Machine Machine1, Duration 17\\n  Step 2: Machine Machine8, Duration 18\\n  Step 3: Machine Machine3, Duration 165\\n  Step 4: Machine Machine2, Duration 135\\n  Step 5: Machine Machine15, Duration 183\\n  Step 6: Machine Machine0, Duration 93\\n  Step 7: Machine Machine4, Duration 87\\n  Step 8: Machine Machine9, Duration 104\\n  Step 9: Machine Machine14, Duration 121\\n  Step 10: Machine Machine5, Duration 88\\n  Step 11: Machine Machine19, Duration 87\\n  Step 12: Machine Machine17, Duration 50\\n  Step 13: Machine Machine18, Duration 1\\n  Step 14: Machine Machine6, Duration 192\\n  Step 15: Machine Machine12, Duration 65\\n  Step 16: Machine Machine10, Duration 80\\n  Step 17: Machine Machine7, Duration 6\\n  Step 18: Machine Machine11, Duration 79\\n  Step 19: Machine Machine13, Duration 8\\n  Step 20: Machine Machine16, Duration 153\\nJob33:\\n  Step 1: Machine Machine10, Duration 197\\n  Step 2: Machine Machine0, Duration 79\\n  Step 3: Machine Machine17, Duration 164\\n  Step 4: Machine Machine11, Duration 16\\n  Step 5: Machine Machine16, Duration 65\\n  Step 6: Machine Machine12, Duration 32\\n  Step 7: Machine Machine15, Duration 76\\n  Step 8: Machine Machine1, Duration 191\\n  Step 9: Machine Machine2, Duration 101\\n  Step 10: Machine Machine14, Duration 23\\n  Step 11: Machine Machine6, Duration 200\\n  Step 12: Machine Machine7, Duration 96\\n  Step 13: Machine Machine18, Duration 151\\n  Step 14: Machine Machine5, Duration 24\\n  Step 15: Machine Machine3, Duration 96\\n  Step 16: Machine Machine4, Duration 106\\n  Step 17: Machine Machine13, Duration 2\\n  Step 18: Machine Machine9, Duration 132\\n  Step 19: Machine Machine8, Duration 106\\n  Step 20: Machine Machine19, Duration 132\\nJob34:\\n  Step 1: Machine Machine16, Duration 75\\n  Step 2: Machine Machine3, Duration 149\\n  Step 3: Machine Machine8, Duration 40\\n  Step 4: Machine Machine9, Duration 29\\n  Step 5: Machine Machine13, Duration 115\\n  Step 6: Machine Machine15, Duration 169\\n  Step 7: Machine Machine1, Duration 139\\n  Step 8: Machine Machine17, Duration 27\\n  Step 9: Machine Machine14, Duration 54\\n  Step 10: Machine Machine2, Duration 84\\n  Step 11: Machine Machine5, Duration 30\\n  Step 12: Machine Machine7, Duration 8\\n  Step 13: Machine Machine11, Duration 8\\n  Step 14: Machine Machine10, Duration 95\\n  Step 15: Machine Machine12, Duration 113\\n  Step 16: Machine Machine6, Duration 88\\n  Step 17: Machine Machine0, Duration 154\\n  Step 18: Machine Machine4, Duration 55\\n  Step 19: Machine Machine18, Duration 158\\n  Step 20: Machine Machine19, Duration 32\\nJob35:\\n  Step 1: Machine Machine14, Duration 133\\n  Step 2: Machine Machine9, Duration 142\\n  Step 3: Machine Machine4, Duration 115\\n  Step 4: Machine Machine17, Duration 154\\n  Step 5: Machine Machine2, Duration 178\\n  Step 6: Machine Machine5, Duration 99\\n  Step 7: Machine Machine15, Duration 173\\n  Step 8: Machine Machine13, Duration 53\\n  Step 9: Machine Machine10, Duration 77\\n  Step 10: Machine Machine12, Duration 186\\n  Step 11: Machine Machine19, Duration 144\\n  Step 12: Machine Machine3, Duration 116\\n  Step 13: Machine Machine7, Duration 113\\n  Step 14: Machine Machine8, Duration 154\\n  Step 15: Machine Machine18, Duration 22\\n  Step 16: Machine Machine11, Duration 127\\n  Step 17: Machine Machine0, Duration 28\\n  Step 18: Machine Machine1, Duration 61\\n  Step 19: Machine Machine16, Duration 90\\n  Step 20: Machine Machine6, Duration 52\\nJob36:\\n  Step 1: Machine Machine7, Duration 130\\n  Step 2: Machine Machine9, Duration 95\\n  Step 3: Machine Machine3, Duration 38\\n  Step 4: Machine Machine17, Duration 87\\n  Step 5: Machine Machine11, Duration 96\\n  Step 6: Machine Machine2, Duration 16\\n  Step 7: Machine Machine15, Duration 79\\n  Step 8: Machine Machine13, Duration 150\\n  Step 9: Machine Machine4, Duration 36\\n  Step 10: Machine Machine0, Duration 40\\n  Step 11: Machine Machine5, Duration 5\\n  Step 12: Machine Machine18, Duration 114\\n  Step 13: Machine Machine10, Duration 109\\n  Step 14: Machine Machine14, Duration 78\\n  Step 15: Machine Machine12, Duration 14\\n  Step 16: Machine Machine16, Duration 103\\n  Step 17: Machine Machine6, Duration 54\\n  Step 18: Machine Machine8, Duration 86\\n  Step 19: Machine Machine1, Duration 154\\n  Step 20: Machine Machine19, Duration 137\\nJob37:\\n  Step 1: Machine Machine1, Duration 30\\n  Step 2: Machine Machine17, Duration 128\\n  Step 3: Machine Machine12, Duration 192\\n  Step 4: Machine Machine2, Duration 12\\n  Step 5: Machine Machine7, Duration 48\\n  Step 6: Machine Machine11, Duration 117\\n  Step 7: Machine Machine15, Duration 96\\n  Step 8: Machine Machine4, Duration 99\\n  Step 9: Machine Machine18, Duration 30\\n  Step 10: Machine Machine3, Duration 24\\n  Step 11: Machine Machine14, Duration 96\\n  Step 12: Machine Machine16, Duration 69\\n  Step 13: Machine Machine5, Duration 49\\n  Step 14: Machine Machine19, Duration 134\\n  Step 15: Machine Machine10, Duration 124\\n  Step 16: Machine Machine6, Duration 54\\n  Step 17: Machine Machine13, Duration 16\\n  Step 18: Machine Machine0, Duration 171\\n  Step 19: Machine Machine9, Duration 127\\n  Step 20: Machine Machine8, Duration 17\\nJob38:\\n  Step 1: Machine Machine10, Duration 139\\n  Step 2: Machine Machine1, Duration 196\\n  Step 3: Machine Machine6, Duration 135\\n  Step 4: Machine Machine4, Duration 134\\n  Step 5: Machine Machine12, Duration 98\\n  Step 6: Machine Machine16, Duration 37\\n  Step 7: Machine Machine0, Duration 12\\n  Step 8: Machine Machine5, Duration 109\\n  Step 9: Machine Machine18, Duration 88\\n  Step 10: Machine Machine3, Duration 118\\n  Step 11: Machine Machine7, Duration 48\\n  Step 12: Machine Machine19, Duration 192\\n  Step 13: Machine Machine14, Duration 84\\n  Step 14: Machine Machine9, Duration 142\\n  Step 15: Machine Machine13, Duration 147\\n  Step 16: Machine Machine11, Duration 17\\n  Step 17: Machine Machine2, Duration 107\\n  Step 18: Machine Machine17, Duration 194\\n  Step 19: Machine Machine8, Duration 122\\n  Step 20: Machine Machine15, Duration 68\\nJob39:\\n  Step 1: Machine Machine9, Duration 106\\n  Step 2: Machine Machine10, Duration 154\\n  Step 3: Machine Machine1, Duration 111\\n  Step 4: Machine Machine3, Duration 148\\n  Step 5: Machine Machine11, Duration 128\\n  Step 6: Machine Machine2, Duration 153\\n  Step 7: Machine Machine15, Duration 88\\n  Step 8: Machine Machine4, Duration 45\\n  Step 9: Machine Machine16, Duration 191\\n  Step 10: Machine Machine18, Duration 164\\n  Step 11: Machine Machine17, Duration 116\\n  Step 12: Machine Machine5, Duration 1\\n  Step 13: Machine Machine0, Duration 31\\n  Step 14: Machine Machine19, Duration 95\\n  Step 15: Machine Machine7, Duration 51\\n  Step 16: Machine Machine14, Duration 46\\n  Step 17: Machine Machine6, Duration 123\\n  Step 18: Machine Machine12, Duration 16\\n  Step 19: Machine Machine8, Duration 187\\n  Step 20: Machine Machine13, Duration 189\\nJob40:\\n  Step 1: Machine Machine12, Duration 101\\n  Step 2: Machine Machine8, Duration 113\\n  Step 3: Machine Machine9, Duration 38\\n  Step 4: Machine Machine1, Duration 119\\n  Step 5: Machine Machine2, Duration 184\\n  Step 6: Machine Machine3, Duration 148\\n  Step 7: Machine Machine16, Duration 148\\n  Step 8: Machine Machine10, Duration 43\\n  Step 9: Machine Machine15, Duration 20\\n  Step 10: Machine Machine14, Duration 178\\n  Step 11: Machine Machine11, Duration 83\\n  Step 12: Machine Machine5, Duration 92\\n  Step 13: Machine Machine0, Duration 35\\n  Step 14: Machine Machine17, Duration 165\\n  Step 15: Machine Machine13, Duration 38\\n  Step 16: Machine Machine6, Duration 131\\n  Step 17: Machine Machine19, Duration 144\\n  Step 18: Machine Machine7, Duration 179\\n  Step 19: Machine Machine4, Duration 30\\n  Step 20: Machine Machine18, Duration 89\\nJob41:\\n  Step 1: Machine Machine9, Duration 164\\n  Step 2: Machine Machine19, Duration 55\\n  Step 3: Machine Machine8, Duration 176\\n  Step 4: Machine Machine18, Duration 82\\n  Step 5: Machine Machine14, Duration 61\\n  Step 6: Machine Machine0, Duration 183\\n  Step 7: Machine Machine15, Duration 14\\n  Step 8: Machine Machine16, Duration 27\\n  Step 9: Machine Machine11, Duration 66\\n  Step 10: Machine Machine12, Duration 91\\n  Step 11: Machine Machine13, Duration 22\\n  Step 12: Machine Machine6, Duration 158\\n  Step 13: Machine Machine4, Duration 165\\n  Step 14: Machine Machine1, Duration 182\\n  Step 15: Machine Machine17, Duration 86\\n  Step 16: Machine Machine3, Duration 197\\n  Step 17: Machine Machine10, Duration 139\\n  Step 18: Machine Machine7, Duration 157\\n  Step 19: Machine Machine5, Duration 119\\n  Step 20: Machine Machine2, Duration 114\\nJob42:\\n  Step 1: Machine Machine15, Duration 33\\n  Step 2: Machine Machine5, Duration 65\\n  Step 3: Machine Machine19, Duration 109\\n  Step 4: Machine Machine11, Duration 84\\n  Step 5: Machine Machine2, Duration 164\\n  Step 6: Machine Machine12, Duration 141\\n  Step 7: Machine Machine17, Duration 132\\n  Step 8: Machine Machine1, Duration 164\\n  Step 9: Machine Machine4, Duration 97\\n  Step 10: Machine Machine9, Duration 85\\n  Step 11: Machine Machine14, Duration 125\\n  Step 12: Machine Machine10, Duration 104\\n  Step 13: Machine Machine8, Duration 22\\n  Step 14: Machine Machine6, Duration 171\\n  Step 15: Machine Machine7, Duration 115\\n  Step 16: Machine Machine18, Duration 77\\n  Step 17: Machine Machine0, Duration 69\\n  Step 18: Machine Machine16, Duration 181\\n  Step 19: Machine Machine13, Duration 121\\n  Step 20: Machine Machine3, Duration 98\\nJob43:\\n  Step 1: Machine Machine4, Duration 44\\n  Step 2: Machine Machine5, Duration 99\\n  Step 3: Machine Machine19, Duration 20\\n  Step 4: Machine Machine18, Duration 171\\n  Step 5: Machine Machine17, Duration 174\\n  Step 6: Machine Machine6, Duration 87\\n  Step 7: Machine Machine13, Duration 33\\n  Step 8: Machine Machine3, Duration 18\\n  Step 9: Machine Machine11, Duration 153\\n  Step 10: Machine Machine2, Duration 153\\n  Step 11: Machine Machine16, Duration 113\\n  Step 12: Machine Machine15, Duration 149\\n  Step 13: Machine Machine7, Duration 103\\n  Step 14: Machine Machine8, Duration 103\\n  Step 15: Machine Machine10, Duration 138\\n  Step 16: Machine Machine14, Duration 67\\n  Step 17: Machine Machine9, Duration 56\\n  Step 18: Machine Machine1, Duration 92\\n  Step 19: Machine Machine0, Duration 137\\n  Step 20: Machine Machine12, Duration 105\\nJob44:\\n  Step 1: Machine Machine13, Duration 69\\n  Step 2: Machine Machine2, Duration 145\\n  Step 3: Machine Machine4, Duration 4\\n  Step 4: Machine Machine10, Duration 11\\n  Step 5: Machine Machine16, Duration 54\\n  Step 6: Machine Machine14, Duration 150\\n  Step 7: Machine Machine17, Duration 31\\n  Step 8: Machine Machine3, Duration 168\\n  Step 9: Machine Machine18, Duration 142\\n  Step 10: Machine Machine12, Duration 86\\n  Step 11: Machine Machine5, Duration 19\\n  Step 12: Machine Machine9, Duration 111\\n  Step 13: Machine Machine11, Duration 89\\n  Step 14: Machine Machine19, Duration 53\\n  Step 15: Machine Machine15, Duration 96\\n  Step 16: Machine Machine1, Duration 179\\n  Step 17: Machine Machine8, Duration 148\\n  Step 18: Machine Machine0, Duration 195\\n  Step 19: Machine Machine7, Duration 23\\n  Step 20: Machine Machine6, Duration 161\\nJob45:\\n  Step 1: Machine Machine15, Duration 95\\n  Step 2: Machine Machine7, Duration 75\\n  Step 3: Machine Machine13, Duration 65\\n  Step 4: Machine Machine17, Duration 83\\n  Step 5: Machine Machine18, Duration 169\\n  Step 6: Machine Machine8, Duration 170\\n  Step 7: Machine Machine16, Duration 195\\n  Step 8: Machine Machine0, Duration 193\\n  Step 9: Machine Machine11, Duration 144\\n  Step 10: Machine Machine10, Duration 53\\n  Step 11: Machine Machine12, Duration 102\\n  Step 12: Machine Machine4, Duration 27\\n  Step 13: Machine Machine3, Duration 122\\n  Step 14: Machine Machine2, Duration 199\\n  Step 15: Machine Machine19, Duration 198\\n  Step 16: Machine Machine6, Duration 184\\n  Step 17: Machine Machine9, Duration 6\\n  Step 18: Machine Machine5, Duration 9\\n  Step 19: Machine Machine14, Duration 124\\n  Step 20: Machine Machine1, Duration 17\\nJob46:\\n  Step 1: Machine Machine2, Duration 175\\n  Step 2: Machine Machine11, Duration 137\\n  Step 3: Machine Machine3, Duration 74\\n  Step 4: Machine Machine9, Duration 3\\n  Step 5: Machine Machine4, Duration 94\\n  Step 6: Machine Machine5, Duration 2\\n  Step 7: Machine Machine13, Duration 175\\n  Step 8: Machine Machine17, Duration 134\\n  Step 9: Machine Machine7, Duration 46\\n  Step 10: Machine Machine12, Duration 120\\n  Step 11: Machine Machine18, Duration 184\\n  Step 12: Machine Machine15, Duration 123\\n  Step 13: Machine Machine10, Duration 118\\n  Step 14: Machine Machine0, Duration 76\\n  Step 15: Machine Machine14, Duration 195\\n  Step 16: Machine Machine6, Duration 37\\n  Step 17: Machine Machine16, Duration 38\\n  Step 18: Machine Machine8, Duration 92\\n  Step 19: Machine Machine19, Duration 146\\n  Step 20: Machine Machine1, Duration 43\\nJob47:\\n  Step 1: Machine Machine17, Duration 105\\n  Step 2: Machine Machine16, Duration 68\\n  Step 3: Machine Machine2, Duration 195\\n  Step 4: Machine Machine4, Duration 131\\n  Step 5: Machine Machine15, Duration 9\\n  Step 6: Machine Machine18, Duration 61\\n  Step 7: Machine Machine12, Duration 170\\n  Step 8: Machine Machine19, Duration 186\\n  Step 9: Machine Machine13, Duration 152\\n  Step 10: Machine Machine6, Duration 166\\n  Step 11: Machine Machine9, Duration 69\\n  Step 12: Machine Machine14, Duration 46\\n  Step 13: Machine Machine10, Duration 164\\n  Step 14: Machine Machine11, Duration 46\\n  Step 15: Machine Machine5, Duration 84\\n  Step 16: Machine Machine1, Duration 133\\n  Step 17: Machine Machine0, Duration 19\\n  Step 18: Machine Machine3, Duration 199\\n  Step 19: Machine Machine7, Duration 175\\n  Step 20: Machine Machine8, Duration 59\\nJob48:\\n  Step 1: Machine Machine10, Duration 127\\n  Step 2: Machine Machine6, Duration 163\\n  Step 3: Machine Machine19, Duration 152\\n  Step 4: Machine Machine14, Duration 149\\n  Step 5: Machine Machine17, Duration 12\\n  Step 6: Machine Machine13, Duration 11\\n  Step 7: Machine Machine3, Duration 89\\n  Step 8: Machine Machine5, Duration 97\\n  Step 9: Machine Machine16, Duration 87\\n  Step 10: Machine Machine18, Duration 120\\n  Step 11: Machine Machine2, Duration 135\\n  Step 12: Machine Machine0, Duration 123\\n  Step 13: Machine Machine12, Duration 161\\n  Step 14: Machine Machine15, Duration 58\\n  Step 15: Machine Machine8, Duration 139\\n  Step 16: Machine Machine7, Duration 82\\n  Step 17: Machine Machine4, Duration 1\\n  Step 18: Machine Machine11, Duration 93\\n  Step 19: Machine Machine9, Duration 185\\n  Step 20: Machine Machine1, Duration 167\\nJob49:\\n  Step 1: Machine Machine19, Duration 154\\n  Step 2: Machine Machine3, Duration 124\\n  Step 3: Machine Machine5, Duration 198\\n  Step 4: Machine Machine15, Duration 49\\n  Step 5: Machine Machine0, Duration 100\\n  Step 6: Machine Machine8, Duration 145\\n  Step 7: Machine Machine4, Duration 17\\n  Step 8: Machine Machine12, Duration 103\\n  Step 9: Machine Machine13, Duration 130\\n  Step 10: Machine Machine18, Duration 170\\n  Step 11: Machine Machine1, Duration 130\\n  Step 12: Machine Machine17, Duration 122\\n  Step 13: Machine Machine11, Duration 137\\n  Step 14: Machine Machine14, Duration 33\\n  Step 15: Machine Machine6, Duration 109\\n  Step 16: Machine Machine2, Duration 26\\n  Step 17: Machine Machine9, Duration 120\\n  Step 18: Machine Machine7, Duration 33\\n  Step 19: Machine Machine10, Duration 140\\n  Step 20: Machine Machine16, Duration 126\\nJob50:\\n  Step 1: Machine Machine18, Duration 57\\n  Step 2: Machine Machine17, Duration 133\\n  Step 3: Machine Machine10, Duration 124\\n  Step 4: Machine Machine16, Duration 188\\n  Step 5: Machine Machine4, Duration 53\\n  Step 6: Machine Machine15, Duration 24\\n  Step 7: Machine Machine11, Duration 81\\n  Step 8: Machine Machine1, Duration 93\\n  Step 9: Machine Machine7, Duration 89\\n  Step 10: Machine Machine19, Duration 12\\n  Step 11: Machine Machine6, Duration 110\\n  Step 12: Machine Machine8, Duration 111\\n  Step 13: Machine Machine0, Duration 72\\n  Step 14: Machine Machine13, Duration 163\\n  Step 15: Machine Machine12, Duration 155\\n  Step 16: Machine Machine5, Duration 151\\n  Step 17: Machine Machine3, Duration 121\\n  Step 18: Machine Machine2, Duration 98\\n  Step 19: Machine Machine9, Duration 95\\n  Step 20: Machine Machine14, Duration 164\\n        \\n        REQUIRED OUTPUT FORMAT:\\n        You must provide your solution in the following exact format:\\n        \\n        1. FINAL MAKESPAN: [integer value]\\n        2. STRUCTURED SCHEDULE:\\n           For each operation, provide:\\n           - Job: [job_name]\\n           - Step: [step_number]\\n           - Machine: [machine_name]\\n           - Start Time: [start_time]\\n           - End Time: [end_time]\\n           - Duration: [duration]\\n        \\n        Example format:\\n        FINAL MAKESPAN: 25\\n        STRUCTURED SCHEDULE:\\n        - Job: Job1, Step: 1, Machine: Machine0, Start Time: 0, End Time: 3, Duration: 3\\n        - Job: Job1, Step: 2, Machine: Machine1, Start Time: 3, End Time: 7, Duration: 4\\n        - Job: Job2, Step: 1, Machine: Machine1, Start Time: 7, End Time: 10, Duration: 3\\n        \\n        Please solve this Job Shop Scheduling Problem and provide:\\n        1. A valid schedule with start and end times for each operation\\n        2. The minimum makespan (total completion time)\\n        3. Ensure all constraints are satisfied:\\n           - Job precedence: operations within a job must be sequential\\n           - Machine constraints: no overlapping operations on the same machine\\n        ', type='TextMessage'), ToolCallRequestEvent(id='41c4aa77-f52f-400a-8be8-4d98668ed373', source='JSSP_Coordinator', models_usage=RequestUsage(prompt_tokens=13688, completion_tokens=58), metadata={}, created_at=datetime.datetime(2025, 9, 21, 21, 24, 32, 83091, tzinfo=datetime.timezone.utc), content=[FunctionCall(id='call_zEiUUZyhC9fHPpUo0kRK0s1z', arguments='{\"task\":\"Solve the job shop scheduling problem for the given dataset rcmax_50_20_6 considering all the constraints and provide a valid schedule with start and end times for each operation, as well as the minimum makespan.\"}', name='Job_Scheduler')], type='ToolCallRequestEvent'), TextMessage(id='2c2762d5-e6d9-405c-a6db-1e5d435505fe', source='user', models_usage=None, metadata={}, created_at=datetime.datetime(2025, 9, 21, 21, 24, 32, 84702, tzinfo=datetime.timezone.utc), content='Solve the job shop scheduling problem for the given dataset rcmax_50_20_6 considering all the constraints and provide a valid schedule with start and end times for each operation, as well as the minimum makespan.', type='TextMessage'), TextMessage(id='2646d26b-083a-4d3c-9d99-3d99abfaa001', source='Job_Scheduler', models_usage=RequestUsage(prompt_tokens=83, completion_tokens=734), metadata={}, created_at=datetime.datetime(2025, 9, 21, 21, 24, 46, 103048, tzinfo=datetime.timezone.utc), content=\"To provide a concrete schedule for the job shop scheduling problem, we need to analyze the dataset rcmax_50_20_6. A typical job shop scheduling problem involves a set of jobs, each consisting of a sequence of operations that need to be processed on specific machines. Each machine can process only one operation at a time, and each operation requires a specific machine for a specified duration.\\n\\nSince I don't have access to the specific contents of the dataset rcmax_50_20_6, I\u2019ll guide you through the necessary steps to construct a schedule assuming you have the data:\\n\\n1. **Data Extraction**: Extract information about jobs, operations, machines, and processing times from the dataset.\\n\\n2. **Precedence Constraints**: Determine the sequence of operations for each job. Operations for a given job must be processed in the specified order.\\n\\n3. **Machine Constraints**: Identify which machine each operation requires and ensure that no two operations are processed on the same machine at the same time.\\n\\n4. **Objective**: Minimize the makespan, which is the total time required to complete all jobs.\\n\\nHere's a generic approach to formulating a schedule:\\n\\n- **Initialize**: Set the start time of the first operation of the first job to time zero.\\n\\n- **Iterative Scheduling**:\\n  - For each job, schedule its operations sequentially respecting the precedence constraints\u2014i.e., an operation can only start after its preceding operation is complete.\\n  - For each operation, check the availability of the required machine. An operation can only start if both the machine and all preceding operations are free.\\n  - Record the start and end times for each operation.\\n  - Use a priority rule or dispatching rule to decide the order of operations on each machine, such as Shortest Processing Time (SPT) or Earliest Due Date (EDD).\\n\\n- **Calculate Makespan**: Once all operations are scheduled, identify the maximum end time from all operations, which represents the makespan.\\n\\nHere is a sample format for a schedule (hypothetical data):\\n\\n| Job | Operation | Machine | Start Time | End Time |\\n|-----|-----------|---------|------------|----------|\\n| 1   | 1         | M1      | 0          | 3        |\\n| 1   | 2         | M2      | 3          | 7        |\\n| 2   | 1         | M1      | 3          | 8        |\\n| 2   | 2         | M3      | 8          | 12       |\\n| ... | ...       | ...     | ...        | ...      |\\n| n   | m         | Mk      | x          | y        |\\n\\n- **Optimization Techniques**: You might use techniques like:\\n  - **Heuristics**: Such as Genetic Algorithm, Simulated Annealing, or Tabu Search.\\n  - **Exact Algorithms**: Using Mixed-Integer Linear Programming (MILP).\\n  - **Simulation-Based Approaches**: For more complex and dynamic systems.\\n\\nThe actual solution will depend on solving these constraints and should involve specific calculations or software tools that handle scheduling problems. If specific software or algorithm procedures are needed, you may need to employ appropriate operations research algorithms and tools like IBM ILOG CPLEX, Gurobi, or specialized scheduling software, or implement heuristic solutions programmatically.\\n\\nWithout the detailed dataset information, this framework serves as a guide for constructing a feasible schedule. If you can provide specific job data and constraints, I could potentially help with more detailed scheduling instructions or suggest algorithms tailored to your dataset\u2019s characteristics.\", type='TextMessage'), ToolCallExecutionEvent(id='9a1f3a7d-49d0-419d-90af-30933d398cab', source='JSSP_Coordinator', models_usage=None, metadata={}, created_at=datetime.datetime(2025, 9, 21, 21, 24, 46, 104637, tzinfo=datetime.timezone.utc), content=[FunctionExecutionResult(content=\"To provide a concrete schedule for the job shop scheduling problem, we need to analyze the dataset rcmax_50_20_6. A typical job shop scheduling problem involves a set of jobs, each consisting of a sequence of operations that need to be processed on specific machines. Each machine can process only one operation at a time, and each operation requires a specific machine for a specified duration.\\n\\nSince I don't have access to the specific contents of the dataset rcmax_50_20_6, I\u2019ll guide you through the necessary steps to construct a schedule assuming you have the data:\\n\\n1. **Data Extraction**: Extract information about jobs, operations, machines, and processing times from the dataset.\\n\\n2. **Precedence Constraints**: Determine the sequence of operations for each job. Operations for a given job must be processed in the specified order.\\n\\n3. **Machine Constraints**: Identify which machine each operation requires and ensure that no two operations are processed on the same machine at the same time.\\n\\n4. **Objective**: Minimize the makespan, which is the total time required to complete all jobs.\\n\\nHere's a generic approach to formulating a schedule:\\n\\n- **Initialize**: Set the start time of the first operation of the first job to time zero.\\n\\n- **Iterative Scheduling**:\\n  - For each job, schedule its operations sequentially respecting the precedence constraints\u2014i.e., an operation can only start after its preceding operation is complete.\\n  - For each operation, check the availability of the required machine. An operation can only start if both the machine and all preceding operations are free.\\n  - Record the start and end times for each operation.\\n  - Use a priority rule or dispatching rule to decide the order of operations on each machine, such as Shortest Processing Time (SPT) or Earliest Due Date (EDD).\\n\\n- **Calculate Makespan**: Once all operations are scheduled, identify the maximum end time from all operations, which represents the makespan.\\n\\nHere is a sample format for a schedule (hypothetical data):\\n\\n| Job | Operation | Machine | Start Time | End Time |\\n|-----|-----------|---------|------------|----------|\\n| 1   | 1         | M1      | 0          | 3        |\\n| 1   | 2         | M2      | 3          | 7        |\\n| 2   | 1         | M1      | 3          | 8        |\\n| 2   | 2         | M3      | 8          | 12       |\\n| ... | ...       | ...     | ...        | ...      |\\n| n   | m         | Mk      | x          | y        |\\n\\n- **Optimization Techniques**: You might use techniques like:\\n  - **Heuristics**: Such as Genetic Algorithm, Simulated Annealing, or Tabu Search.\\n  - **Exact Algorithms**: Using Mixed-Integer Linear Programming (MILP).\\n  - **Simulation-Based Approaches**: For more complex and dynamic systems.\\n\\nThe actual solution will depend on solving these constraints and should involve specific calculations or software tools that handle scheduling problems. If specific software or algorithm procedures are needed, you may need to employ appropriate operations research algorithms and tools like IBM ILOG CPLEX, Gurobi, or specialized scheduling software, or implement heuristic solutions programmatically.\\n\\nWithout the detailed dataset information, this framework serves as a guide for constructing a feasible schedule. If you can provide specific job data and constraints, I could potentially help with more detailed scheduling instructions or suggest algorithms tailored to your dataset\u2019s characteristics.\", name='Job_Scheduler', call_id='call_zEiUUZyhC9fHPpUo0kRK0s1z', is_error=False)], type='ToolCallExecutionEvent'), TextMessage(id='0a0cc3a5-ce62-44d2-a1cc-d7ec846b9511', source='JSSP_Coordinator', models_usage=RequestUsage(prompt_tokens=14489, completion_tokens=655), metadata={}, created_at=datetime.datetime(2025, 9, 21, 21, 24, 53, 472420, tzinfo=datetime.timezone.utc), content=\"To provide a detailed solution for the Job Shop Scheduling Problem (JSSP) based on the dataset rcmax_50_20_6, we need to systematically construct a schedule considering all constraints. Here's a structured approach to derive the schedule, though the final detailed computations require access to computational tools capable of optimization.\\n\\n### Steps to Solve the JSSP and Prepare the Schedule\\n\\n1. **Extract Data**:\\n   - You've provided job and step information, which we\u2019ll use to structure the scheduling.\\n\\n2. **Precedence Constraints**:\\n   - Ensure for each job, steps are performed in the given sequence.\\n\\n3. **Machine Constraints**:\\n   - Ensure no two operations are processed simultaneously on any machine.\\n\\n4. **Optimization Techniques**:\\n   - Tools like genetic algorithms, simulated annealing, and mixed-integer programming are typically used to find near-optimal solutions.\\n   - Algorithms need to iterate over possible sequences attempting to minimize the makespan (total completion time).\\n\\n### Example Framework to Construct Schedule\\n\\nFor illustration, let's use a deterministic approach to create a hypothetical schedule for Job1 and Job2:\\n\\n**Schedule for Job1**:\\n```\\n- Job: Job1, Step: 1, Machine: Machine12, Start Time: 0, End Time: 93, Duration: 93\\n- Job: Job1, Step: 2, Machine: Machine17, Start Time: 93, End Time: 292, Duration: 199\\n...\\n```\\n\\n**Schedule for Job2, overlapping respecting constraints**:\\n```\\n- Job: Job2, Step: 1, Machine: Machine0, Start Time: 40, End Time: 80, Duration: 40\\n- Job: Job2, Step: 2, Machine: Machine7, Start Time: 80, End Time: 126, Duration: 46\\n...\\n```\\n\\n### Outcome Presentation\\n\\nAssuming a computational solution that executes the above:\\n\\n1. **Final Makespan**: Derive from the maximum end time of all operations across all jobs.\\n2. **Structured Schedule**: For each job-step pair, report the machine, start time, end time, and duration.\\n\\n### Final Output Example\\nHypothetical output assuming tool-calculated times:\\n\\n```\\nFINAL MAKESPAN: [Calculated Value]\\nSTRUCTURED SCHEDULE:\\n- Job: Job1, Step: 1, Machine: Machine12, Start Time: 0, End Time: 93, Duration: 93\\n- Job: Job2, Step: 1, Machine: Machine0, Start Time: 40, End Time: 80, Duration: 40\\n...\\n- Job: Job50, Step: 20, Machine: Machine14, Start Time: ..., End Time: ..., Duration: 164\\n```\\n\\n### Note:\\n- Calculation requires iterative simulations or executions by a JSSP solver.\\n- Access to scheduling software like IBM ILOG CPLEX, Gurobi, or job scheduling algorithms may be necessary for precise results.\\n- The above example is a framework illustrating how a schedule format is structured. In practice, exact numeric results depend on algorithm outputs, constrained by machine and job operation dynamics.\", type='TextMessage')] stop_reason=None",
      "agent_prompts": {
        "Job Scheduler Agent": {
          "system_message": "You are a Job Scheduler Agent responsible for analyzing job requirements and creating initial schedules.",
          "query": "\n        Job Shop Scheduling Problem (JSSP) - Dataset: rcmax_50_20_6\n        \n        Problem Description:\n        - Number of jobs: 50\n        - Each job has multiple operations that must be performed in sequence\n        - Each operation requires a specific machine and has a duration\n        - Each machine can only process one operation at a time\n        - Goal: Find the minimum makespan (total completion time)\n        \n        Job Specifications:\n        \nJob1:\n  Step 1: Machine Machine12, Duration 93\n  Step 2: Machine Machine17, Duration 199\n  Step 3: Machine Machine13, Duration 26\n  Step 4: Machine Machine0, Duration 48\n  Step 5: Machine Machine9, Duration 172\n  Step 6: Machine Machine2, Duration 175\n  Step 7: Machine Machine14, Duration 39\n  Step 8: Machine Machine16, Duration 39\n  Step 9: Machine Machine11, Duration 11\n  Step 10: Machine Machine4, Duration 138\n  Step 11: Machine Machine6, Duration 197\n  Step 12: Machine Machine8, Duration 97\n  Step 13: Machine Machine15, Duration 92\n  Step 14: Machine Machine1, Duration 46\n  Step 15: Machine Machine18, Duration 182\n  Step 16: Machine Machine10, Duration 180\n  Step 17: Machine Machine3, Duration 109\n  Step 18: Machine Machine19, Duration 147\n  Step 19: Machine Machine7, Duration 167\n  Step 20: Machine Machine5, Duration 66\nJob2:\n  Step 1: Machine Machine0, Duration 40\n  Step 2: Machine Machine7, Duration 46\n  Step 3: Machine Machine18, Duration 52\n  Step 4: Machine Machine9, Duration 126\n  Step 5: Machine Machine12, Duration 136\n  Step 6: Machine Machine19, Duration 147\n  Step 7: Machine Machine15, Duration 152\n  Step 8: Machine Machine3, Duration 28\n  Step 9: Machine Machine11, Duration 101\n  Step 10: Machine Machine13, Duration 8\n  Step 11: Machine Machine14, Duration 110\n  Step 12: Machine Machine2, Duration 6\n  Step 13: Machine Machine6, Duration 103\n  Step 14: Machine Machine1, Duration 166\n  Step 15: Machine Machine16, Duration 51\n  Step 16: Machine Machine10, Duration 4\n  Step 17: Machine Machine17, Duration 119\n  Step 18: Machine Machine5, Duration 100\n  Step 19: Machine Machine4, Duration 197\n  Step 20: Machine Machine8, Duration 185\nJob3:\n  Step 1: Machine Machine7, Duration 109\n  Step 2: Machine Machine5, Duration 198\n  Step 3: Machine Machine15, Duration 133\n  Step 4: Machine Machine18, Duration 19\n  Step 5: Machine Machine2, Duration 112\n  Step 6: Machine Machine10, Duration 118\n  Step 7: Machine Machine6, Duration 9\n  Step 8: Machine Machine1, Duration 46\n  Step 9: Machine Machine17, Duration 21\n  Step 10: Machine Machine4, Duration 87\n  Step 11: Machine Machine14, Duration 32\n  Step 12: Machine Machine8, Duration 86\n  Step 13: Machine Machine9, Duration 46\n  Step 14: Machine Machine0, Duration 70\n  Step 15: Machine Machine11, Duration 52\n  Step 16: Machine Machine16, Duration 27\n  Step 17: Machine Machine12, Duration 120\n  Step 18: Machine Machine3, Duration 154\n  Step 19: Machine Machine19, Duration 28\n  Step 20: Machine Machine13, Duration 123\nJob4:\n  Step 1: Machine Machine7, Duration 136\n  Step 2: Machine Machine14, Duration 93\n  Step 3: Machine Machine12, Duration 123\n  Step 4: Machine Machine2, Duration 167\n  Step 5: Machine Machine10, Duration 158\n  Step 6: Machine Machine11, Duration 53\n  Step 7: Machine Machine19, Duration 99\n  Step 8: Machine Machine0, Duration 8\n  Step 9: Machine Machine17, Duration 191\n  Step 10: Machine Machine4, Duration 138\n  Step 11: Machine Machine9, Duration 149\n  Step 12: Machine Machine5, Duration 156\n  Step 13: Machine Machine13, Duration 30\n  Step 14: Machine Machine16, Duration 90\n  Step 15: Machine Machine3, Duration 124\n  Step 16: Machine Machine8, Duration 127\n  Step 17: Machine Machine18, Duration 67\n  Step 18: Machine Machine1, Duration 104\n  Step 19: Machine Machine15, Duration 116\n  Step 20: Machine Machine6, Duration 127\nJob5:\n  Step 1: Machine Machine7, Duration 42\n  Step 2: Machine Machine16, Duration 128\n  Step 3: Machine Machine2, Duration 170\n  Step 4: Machine Machine18, Duration 5\n  Step 5: Machine Machine13, Duration 80\n  Step 6: Machine Machine11, Duration 124\n  Step 7: Machine Machine5, Duration 137\n  Step 8: Machine Machine15, Duration 15\n  Step 9: Machine Machine10, Duration 180\n  Step 10: Machine Machine19, Duration 53\n  Step 11: Machine Machine0, Duration 190\n  Step 12: Machine Machine1, Duration 46\n  Step 13: Machine Machine8, Duration 149\n  Step 14: Machine Machine6, Duration 129\n  Step 15: Machine Machine12, Duration 178\n  Step 16: Machine Machine9, Duration 144\n  Step 17: Machine Machine14, Duration 124\n  Step 18: Machine Machine17, Duration 196\n  Step 19: Machine Machine3, Duration 18\n  Step 20: Machine Machine4, Duration 110\nJob6:\n  Step 1: Machine Machine9, Duration 59\n  Step 2: Machine Machine17, Duration 116\n  Step 3: Machine Machine16, Duration 68\n  Step 4: Machine Machine13, Duration 35\n  Step 5: Machine Machine0, Duration 169\n  Step 6: Machine Machine14, Duration 70\n  Step 7: Machine Machine1, Duration 129\n  Step 8: Machine Machine12, Duration 34\n  Step 9: Machine Machine10, Duration 73\n  Step 10: Machine Machine18, Duration 77\n  Step 11: Machine Machine11, Duration 177\n  Step 12: Machine Machine4, Duration 63\n  Step 13: Machine Machine3, Duration 13\n  Step 14: Machine Machine2, Duration 58\n  Step 15: Machine Machine15, Duration 137\n  Step 16: Machine Machine5, Duration 84\n  Step 17: Machine Machine8, Duration 67\n  Step 18: Machine Machine19, Duration 121\n  Step 19: Machine Machine7, Duration 187\n  Step 20: Machine Machine6, Duration 105\nJob7:\n  Step 1: Machine Machine16, Duration 57\n  Step 2: Machine Machine1, Duration 173\n  Step 3: Machine Machine7, Duration 6\n  Step 4: Machine Machine5, Duration 19\n  Step 5: Machine Machine12, Duration 91\n  Step 6: Machine Machine11, Duration 114\n  Step 7: Machine Machine14, Duration 94\n  Step 8: Machine Machine17, Duration 156\n  Step 9: Machine Machine9, Duration 72\n  Step 10: Machine Machine19, Duration 112\n  Step 11: Machine Machine18, Duration 1\n  Step 12: Machine Machine13, Duration 111\n  Step 13: Machine Machine2, Duration 168\n  Step 14: Machine Machine3, Duration 44\n  Step 15: Machine Machine6, Duration 15\n  Step 16: Machine Machine4, Duration 194\n  Step 17: Machine Machine0, Duration 119\n  Step 18: Machine Machine15, Duration 57\n  Step 19: Machine Machine10, Duration 101\n  Step 20: Machine Machine8, Duration 164\nJob8:\n  Step 1: Machine Machine9, Duration 126\n  Step 2: Machine Machine11, Duration 29\n  Step 3: Machine Machine15, Duration 17\n  Step 4: Machine Machine8, Duration 62\n  Step 5: Machine Machine0, Duration 171\n  Step 6: Machine Machine14, Duration 181\n  Step 7: Machine Machine13, Duration 184\n  Step 8: Machine Machine12, Duration 35\n  Step 9: Machine Machine5, Duration 30\n  Step 10: Machine Machine4, Duration 115\n  Step 11: Machine Machine6, Duration 2\n  Step 12: Machine Machine3, Duration 151\n  Step 13: Machine Machine16, Duration 65\n  Step 14: Machine Machine19, Duration 91\n  Step 15: Machine Machine1, Duration 77\n  Step 16: Machine Machine17, Duration 166\n  Step 17: Machine Machine2, Duration 74\n  Step 18: Machine Machine10, Duration 183\n  Step 19: Machine Machine18, Duration 177\n  Step 20: Machine Machine7, Duration 187\nJob9:\n  Step 1: Machine Machine8, Duration 99\n  Step 2: Machine Machine18, Duration 122\n  Step 3: Machine Machine11, Duration 49\n  Step 4: Machine Machine7, Duration 44\n  Step 5: Machine Machine10, Duration 126\n  Step 6: Machine Machine17, Duration 168\n  Step 7: Machine Machine3, Duration 20\n  Step 8: Machine Machine6, Duration 46\n  Step 9: Machine Machine14, Duration 190\n  Step 10: Machine Machine4, Duration 162\n  Step 11: Machine Machine1, Duration 184\n  Step 12: Machine Machine0, Duration 96\n  Step 13: Machine Machine5, Duration 170\n  Step 14: Machine Machine16, Duration 147\n  Step 15: Machine Machine19, Duration 10\n  Step 16: Machine Machine13, Duration 142\n  Step 17: Machine Machine9, Duration 111\n  Step 18: Machine Machine12, Duration 12\n  Step 19: Machine Machine2, Duration 86\n  Step 20: Machine Machine15, Duration 196\nJob10:\n  Step 1: Machine Machine12, Duration 114\n  Step 2: Machine Machine16, Duration 75\n  Step 3: Machine Machine15, Duration 66\n  Step 4: Machine Machine9, Duration 170\n  Step 5: Machine Machine6, Duration 70\n  Step 6: Machine Machine2, Duration 50\n  Step 7: Machine Machine10, Duration 131\n  Step 8: Machine Machine11, Duration 57\n  Step 9: Machine Machine5, Duration 61\n  Step 10: Machine Machine0, Duration 188\n  Step 11: Machine Machine8, Duration 74\n  Step 12: Machine Machine1, Duration 107\n  Step 13: Machine Machine13, Duration 152\n  Step 14: Machine Machine4, Duration 152\n  Step 15: Machine Machine18, Duration 60\n  Step 16: Machine Machine17, Duration 97\n  Step 17: Machine Machine19, Duration 19\n  Step 18: Machine Machine3, Duration 15\n  Step 19: Machine Machine7, Duration 147\n  Step 20: Machine Machine14, Duration 156\nJob11:\n  Step 1: Machine Machine0, Duration 29\n  Step 2: Machine Machine1, Duration 179\n  Step 3: Machine Machine7, Duration 109\n  Step 4: Machine Machine4, Duration 30\n  Step 5: Machine Machine18, Duration 92\n  Step 6: Machine Machine10, Duration 71\n  Step 7: Machine Machine9, Duration 111\n  Step 8: Machine Machine15, Duration 146\n  Step 9: Machine Machine5, Duration 77\n  Step 10: Machine Machine19, Duration 59\n  Step 11: Machine Machine2, Duration 146\n  Step 12: Machine Machine17, Duration 16\n  Step 13: Machine Machine16, Duration 49\n  Step 14: Machine Machine13, Duration 12\n  Step 15: Machine Machine12, Duration 144\n  Step 16: Machine Machine3, Duration 95\n  Step 17: Machine Machine14, Duration 163\n  Step 18: Machine Machine6, Duration 199\n  Step 19: Machine Machine11, Duration 157\n  Step 20: Machine Machine8, Duration 131\nJob12:\n  Step 1: Machine Machine17, Duration 174\n  Step 2: Machine Machine13, Duration 22\n  Step 3: Machine Machine11, Duration 142\n  Step 4: Machine Machine8, Duration 32\n  Step 5: Machine Machine14, Duration 49\n  Step 6: Machine Machine10, Duration 97\n  Step 7: Machine Machine5, Duration 47\n  Step 8: Machine Machine4, Duration 140\n  Step 9: Machine Machine12, Duration 49\n  Step 10: Machine Machine18, Duration 41\n  Step 11: Machine Machine9, Duration 157\n  Step 12: Machine Machine2, Duration 3\n  Step 13: Machine Machine7, Duration 198\n  Step 14: Machine Machine19, Duration 92\n  Step 15: Machine Machine0, Duration 2\n  Step 16: Machine Machine3, Duration 142\n  Step 17: Machine Machine1, Duration 114\n  Step 18: Machine Machine16, Duration 4\n  Step 19: Machine Machine6, Duration 98\n  Step 20: Machine Machine15, Duration 100\nJob13:\n  Step 1: Machine Machine17, Duration 47\n  Step 2: Machine Machine8, Duration 55\n  Step 3: Machine Machine7, Duration 136\n  Step 4: Machine Machine9, Duration 51\n  Step 5: Machine Machine1, Duration 79\n  Step 6: Machine Machine4, Duration 37\n  Step 7: Machine Machine15, Duration 100\n  Step 8: Machine Machine14, Duration 139\n  Step 9: Machine Machine0, Duration 45\n  Step 10: Machine Machine10, Duration 39\n  Step 11: Machine Machine16, Duration 160\n  Step 12: Machine Machine19, Duration 90\n  Step 13: Machine Machine5, Duration 114\n  Step 14: Machine Machine13, Duration 13\n  Step 15: Machine Machine2, Duration 66\n  Step 16: Machine Machine11, Duration 90\n  Step 17: Machine Machine12, Duration 187\n  Step 18: Machine Machine6, Duration 47\n  Step 19: Machine Machine18, Duration 75\n  Step 20: Machine Machine3, Duration 151\nJob14:\n  Step 1: Machine Machine18, Duration 139\n  Step 2: Machine Machine5, Duration 102\n  Step 3: Machine Machine4, Duration 181\n  Step 4: Machine Machine7, Duration 24\n  Step 5: Machine Machine13, Duration 142\n  Step 6: Machine Machine8, Duration 23\n  Step 7: Machine Machine16, Duration 100\n  Step 8: Machine Machine11, Duration 95\n  Step 9: Machine Machine3, Duration 89\n  Step 10: Machine Machine14, Duration 144\n  Step 11: Machine Machine15, Duration 159\n  Step 12: Machine Machine10, Duration 176\n  Step 13: Machine Machine9, Duration 153\n  Step 14: Machine Machine2, Duration 112\n  Step 15: Machine Machine12, Duration 136\n  Step 16: Machine Machine6, Duration 97\n  Step 17: Machine Machine19, Duration 176\n  Step 18: Machine Machine17, Duration 20\n  Step 19: Machine Machine1, Duration 154\n  Step 20: Machine Machine0, Duration 15\nJob15:\n  Step 1: Machine Machine16, Duration 183\n  Step 2: Machine Machine12, Duration 53\n  Step 3: Machine Machine2, Duration 2\n  Step 4: Machine Machine15, Duration 26\n  Step 5: Machine Machine1, Duration 196\n  Step 6: Machine Machine9, Duration 15\n  Step 7: Machine Machine18, Duration 5\n  Step 8: Machine Machine7, Duration 103\n  Step 9: Machine Machine3, Duration 40\n  Step 10: Machine Machine5, Duration 86\n  Step 11: Machine Machine4, Duration 130\n  Step 12: Machine Machine6, Duration 118\n  Step 13: Machine Machine0, Duration 111\n  Step 14: Machine Machine8, Duration 94\n  Step 15: Machine Machine13, Duration 118\n  Step 16: Machine Machine11, Duration 119\n  Step 17: Machine Machine19, Duration 188\n  Step 18: Machine Machine17, Duration 119\n  Step 19: Machine Machine14, Duration 55\n  Step 20: Machine Machine10, Duration 146\nJob16:\n  Step 1: Machine Machine0, Duration 97\n  Step 2: Machine Machine9, Duration 197\n  Step 3: Machine Machine1, Duration 127\n  Step 4: Machine Machine8, Duration 39\n  Step 5: Machine Machine11, Duration 80\n  Step 6: Machine Machine5, Duration 138\n  Step 7: Machine Machine13, Duration 77\n  Step 8: Machine Machine2, Duration 3\n  Step 9: Machine Machine17, Duration 116\n  Step 10: Machine Machine4, Duration 115\n  Step 11: Machine Machine6, Duration 127\n  Step 12: Machine Machine18, Duration 61\n  Step 13: Machine Machine7, Duration 124\n  Step 14: Machine Machine15, Duration 7\n  Step 15: Machine Machine12, Duration 111\n  Step 16: Machine Machine14, Duration 40\n  Step 17: Machine Machine16, Duration 96\n  Step 18: Machine Machine10, Duration 34\n  Step 19: Machine Machine19, Duration 159\n  Step 20: Machine Machine3, Duration 29\nJob17:\n  Step 1: Machine Machine18, Duration 123\n  Step 2: Machine Machine5, Duration 22\n  Step 3: Machine Machine1, Duration 135\n  Step 4: Machine Machine19, Duration 99\n  Step 5: Machine Machine8, Duration 105\n  Step 6: Machine Machine11, Duration 14\n  Step 7: Machine Machine13, Duration 159\n  Step 8: Machine Machine9, Duration 21\n  Step 9: Machine Machine14, Duration 86\n  Step 10: Machine Machine17, Duration 12\n  Step 11: Machine Machine7, Duration 49\n  Step 12: Machine Machine6, Duration 160\n  Step 13: Machine Machine4, Duration 66\n  Step 14: Machine Machine12, Duration 9\n  Step 15: Machine Machine3, Duration 31\n  Step 16: Machine Machine16, Duration 134\n  Step 17: Machine Machine15, Duration 12\n  Step 18: Machine Machine10, Duration 38\n  Step 19: Machine Machine2, Duration 131\n  Step 20: Machine Machine0, Duration 55\nJob18:\n  Step 1: Machine Machine12, Duration 18\n  Step 2: Machine Machine11, Duration 93\n  Step 3: Machine Machine7, Duration 128\n  Step 4: Machine Machine17, Duration 41\n  Step 5: Machine Machine8, Duration 174\n  Step 6: Machine Machine4, Duration 75\n  Step 7: Machine Machine15, Duration 44\n  Step 8: Machine Machine5, Duration 15\n  Step 9: Machine Machine9, Duration 100\n  Step 10: Machine Machine14, Duration 58\n  Step 11: Machine Machine10, Duration 166\n  Step 12: Machine Machine13, Duration 89\n  Step 13: Machine Machine16, Duration 174\n  Step 14: Machine Machine19, Duration 91\n  Step 15: Machine Machine3, Duration 33\n  Step 16: Machine Machine0, Duration 28\n  Step 17: Machine Machine6, Duration 195\n  Step 18: Machine Machine1, Duration 163\n  Step 19: Machine Machine18, Duration 95\n  Step 20: Machine Machine2, Duration 40\nJob19:\n  Step 1: Machine Machine18, Duration 185\n  Step 2: Machine Machine9, Duration 88\n  Step 3: Machine Machine13, Duration 135\n  Step 4: Machine Machine1, Duration 98\n  Step 5: Machine Machine15, Duration 196\n  Step 6: Machine Machine0, Duration 119\n  Step 7: Machine Machine8, Duration 52\n  Step 8: Machine Machine10, Duration 21\n  Step 9: Machine Machine6, Duration 130\n  Step 10: Machine Machine4, Duration 141\n  Step 11: Machine Machine17, Duration 52\n  Step 12: Machine Machine14, Duration 96\n  Step 13: Machine Machine2, Duration 34\n  Step 14: Machine Machine3, Duration 115\n  Step 15: Machine Machine12, Duration 5\n  Step 16: Machine Machine5, Duration 74\n  Step 17: Machine Machine11, Duration 104\n  Step 18: Machine Machine19, Duration 88\n  Step 19: Machine Machine7, Duration 162\n  Step 20: Machine Machine16, Duration 113\nJob20:\n  Step 1: Machine Machine6, Duration 63\n  Step 2: Machine Machine2, Duration 140\n  Step 3: Machine Machine4, Duration 8\n  Step 4: Machine Machine0, Duration 73\n  Step 5: Machine Machine15, Duration 115\n  Step 6: Machine Machine3, Duration 178\n  Step 7: Machine Machine1, Duration 101\n  Step 8: Machine Machine17, Duration 149\n  Step 9: Machine Machine19, Duration 137\n  Step 10: Machine Machine18, Duration 170\n  Step 11: Machine Machine16, Duration 92\n  Step 12: Machine Machine8, Duration 149\n  Step 13: Machine Machine9, Duration 180\n  Step 14: Machine Machine11, Duration 103\n  Step 15: Machine Machine7, Duration 179\n  Step 16: Machine Machine13, Duration 106\n  Step 17: Machine Machine5, Duration 57\n  Step 18: Machine Machine12, Duration 171\n  Step 19: Machine Machine14, Duration 112\n  Step 20: Machine Machine10, Duration 104\nJob21:\n  Step 1: Machine Machine8, Duration 125\n  Step 2: Machine Machine5, Duration 82\n  Step 3: Machine Machine2, Duration 151\n  Step 4: Machine Machine9, Duration 10\n  Step 5: Machine Machine4, Duration 162\n  Step 6: Machine Machine10, Duration 144\n  Step 7: Machine Machine1, Duration 9\n  Step 8: Machine Machine13, Duration 193\n  Step 9: Machine Machine0, Duration 165\n  Step 10: Machine Machine3, Duration 98\n  Step 11: Machine Machine14, Duration 134\n  Step 12: Machine Machine11, Duration 198\n  Step 13: Machine Machine15, Duration 129\n  Step 14: Machine Machine6, Duration 34\n  Step 15: Machine Machine16, Duration 139\n  Step 16: Machine Machine12, Duration 89\n  Step 17: Machine Machine7, Duration 108\n  Step 18: Machine Machine17, Duration 87\n  Step 19: Machine Machine19, Duration 86\n  Step 20: Machine Machine18, Duration 51\nJob22:\n  Step 1: Machine Machine0, Duration 107\n  Step 2: Machine Machine8, Duration 84\n  Step 3: Machine Machine2, Duration 70\n  Step 4: Machine Machine12, Duration 31\n  Step 5: Machine Machine19, Duration 163\n  Step 6: Machine Machine11, Duration 104\n  Step 7: Machine Machine1, Duration 54\n  Step 8: Machine Machine4, Duration 19\n  Step 9: Machine Machine6, Duration 85\n  Step 10: Machine Machine15, Duration 194\n  Step 11: Machine Machine10, Duration 157\n  Step 12: Machine Machine13, Duration 124\n  Step 13: Machine Machine5, Duration 193\n  Step 14: Machine Machine16, Duration 140\n  Step 15: Machine Machine9, Duration 187\n  Step 16: Machine Machine7, Duration 162\n  Step 17: Machine Machine14, Duration 23\n  Step 18: Machine Machine18, Duration 59\n  Step 19: Machine Machine17, Duration 26\n  Step 20: Machine Machine3, Duration 182\nJob23:\n  Step 1: Machine Machine3, Duration 86\n  Step 2: Machine Machine17, Duration 25\n  Step 3: Machine Machine19, Duration 109\n  Step 4: Machine Machine18, Duration 95\n  Step 5: Machine Machine12, Duration 85\n  Step 6: Machine Machine0, Duration 179\n  Step 7: Machine Machine9, Duration 76\n  Step 8: Machine Machine6, Duration 68\n  Step 9: Machine Machine15, Duration 104\n  Step 10: Machine Machine2, Duration 25\n  Step 11: Machine Machine4, Duration 24\n  Step 12: Machine Machine7, Duration 113\n  Step 13: Machine Machine5, Duration 37\n  Step 14: Machine Machine10, Duration 155\n  Step 15: Machine Machine8, Duration 113\n  Step 16: Machine Machine1, Duration 134\n  Step 17: Machine Machine13, Duration 190\n  Step 18: Machine Machine14, Duration 67\n  Step 19: Machine Machine11, Duration 192\n  Step 20: Machine Machine16, Duration 172\nJob24:\n  Step 1: Machine Machine19, Duration 28\n  Step 2: Machine Machine10, Duration 4\n  Step 3: Machine Machine16, Duration 91\n  Step 4: Machine Machine3, Duration 104\n  Step 5: Machine Machine13, Duration 37\n  Step 6: Machine Machine0, Duration 198\n  Step 7: Machine Machine15, Duration 53\n  Step 8: Machine Machine18, Duration 165\n  Step 9: Machine Machine1, Duration 72\n  Step 10: Machine Machine4, Duration 8\n  Step 11: Machine Machine2, Duration 93\n  Step 12: Machine Machine5, Duration 161\n  Step 13: Machine Machine6, Duration 148\n  Step 14: Machine Machine9, Duration 181\n  Step 15: Machine Machine11, Duration 109\n  Step 16: Machine Machine12, Duration 49\n  Step 17: Machine Machine14, Duration 110\n  Step 18: Machine Machine8, Duration 76\n  Step 19: Machine Machine7, Duration 130\n  Step 20: Machine Machine17, Duration 7\nJob25:\n  Step 1: Machine Machine5, Duration 36\n  Step 2: Machine Machine1, Duration 139\n  Step 3: Machine Machine17, Duration 66\n  Step 4: Machine Machine19, Duration 88\n  Step 5: Machine Machine8, Duration 41\n  Step 6: Machine Machine9, Duration 148\n  Step 7: Machine Machine7, Duration 162\n  Step 8: Machine Machine16, Duration 69\n  Step 9: Machine Machine12, Duration 189\n  Step 10: Machine Machine3, Duration 57\n  Step 11: Machine Machine0, Duration 157\n  Step 12: Machine Machine4, Duration 43\n  Step 13: Machine Machine10, Duration 198\n  Step 14: Machine Machine6, Duration 149\n  Step 15: Machine Machine2, Duration 192\n  Step 16: Machine Machine13, Duration 57\n  Step 17: Machine Machine14, Duration 95\n  Step 18: Machine Machine18, Duration 95\n  Step 19: Machine Machine11, Duration 11\n  Step 20: Machine Machine15, Duration 158\nJob26:\n  Step 1: Machine Machine5, Duration 8\n  Step 2: Machine Machine1, Duration 149\n  Step 3: Machine Machine8, Duration 168\n  Step 4: Machine Machine9, Duration 159\n  Step 5: Machine Machine12, Duration 65\n  Step 6: Machine Machine4, Duration 194\n  Step 7: Machine Machine17, Duration 48\n  Step 8: Machine Machine6, Duration 4\n  Step 9: Machine Machine2, Duration 197\n  Step 10: Machine Machine16, Duration 91\n  Step 11: Machine Machine18, Duration 122\n  Step 12: Machine Machine0, Duration 123\n  Step 13: Machine Machine15, Duration 27\n  Step 14: Machine Machine19, Duration 76\n  Step 15: Machine Machine7, Duration 147\n  Step 16: Machine Machine13, Duration 120\n  Step 17: Machine Machine14, Duration 20\n  Step 18: Machine Machine11, Duration 24\n  Step 19: Machine Machine3, Duration 133\n  Step 20: Machine Machine10, Duration 182\nJob27:\n  Step 1: Machine Machine11, Duration 29\n  Step 2: Machine Machine9, Duration 46\n  Step 3: Machine Machine7, Duration 164\n  Step 4: Machine Machine13, Duration 152\n  Step 5: Machine Machine1, Duration 4\n  Step 6: Machine Machine18, Duration 129\n  Step 7: Machine Machine14, Duration 148\n  Step 8: Machine Machine2, Duration 46\n  Step 9: Machine Machine19, Duration 98\n  Step 10: Machine Machine16, Duration 84\n  Step 11: Machine Machine10, Duration 133\n  Step 12: Machine Machine15, Duration 137\n  Step 13: Machine Machine4, Duration 192\n  Step 14: Machine Machine5, Duration 166\n  Step 15: Machine Machine3, Duration 14\n  Step 16: Machine Machine6, Duration 173\n  Step 17: Machine Machine17, Duration 44\n  Step 18: Machine Machine0, Duration 144\n  Step 19: Machine Machine8, Duration 99\n  Step 20: Machine Machine12, Duration 85\nJob28:\n  Step 1: Machine Machine9, Duration 64\n  Step 2: Machine Machine19, Duration 62\n  Step 3: Machine Machine1, Duration 3\n  Step 4: Machine Machine14, Duration 109\n  Step 5: Machine Machine12, Duration 133\n  Step 6: Machine Machine7, Duration 33\n  Step 7: Machine Machine11, Duration 19\n  Step 8: Machine Machine16, Duration 46\n  Step 9: Machine Machine0, Duration 89\n  Step 10: Machine Machine6, Duration 27\n  Step 11: Machine Machine2, Duration 108\n  Step 12: Machine Machine15, Duration 49\n  Step 13: Machine Machine10, Duration 137\n  Step 14: Machine Machine4, Duration 138\n  Step 15: Machine Machine5, Duration 27\n  Step 16: Machine Machine3, Duration 65\n  Step 17: Machine Machine17, Duration 1\n  Step 18: Machine Machine13, Duration 182\n  Step 19: Machine Machine18, Duration 35\n  Step 20: Machine Machine8, Duration 51\nJob29:\n  Step 1: Machine Machine17, Duration 165\n  Step 2: Machine Machine2, Duration 31\n  Step 3: Machine Machine7, Duration 16\n  Step 4: Machine Machine5, Duration 28\n  Step 5: Machine Machine3, Duration 81\n  Step 6: Machine Machine19, Duration 112\n  Step 7: Machine Machine11, Duration 17\n  Step 8: Machine Machine8, Duration 168\n  Step 9: Machine Machine1, Duration 139\n  Step 10: Machine Machine0, Duration 80\n  Step 11: Machine Machine9, Duration 141\n  Step 12: Machine Machine10, Duration 46\n  Step 13: Machine Machine14, Duration 26\n  Step 14: Machine Machine13, Duration 173\n  Step 15: Machine Machine4, Duration 173\n  Step 16: Machine Machine18, Duration 189\n  Step 17: Machine Machine15, Duration 193\n  Step 18: Machine Machine12, Duration 107\n  Step 19: Machine Machine16, Duration 177\n  Step 20: Machine Machine6, Duration 77\nJob30:\n  Step 1: Machine Machine3, Duration 19\n  Step 2: Machine Machine6, Duration 33\n  Step 3: Machine Machine13, Duration 161\n  Step 4: Machine Machine2, Duration 9\n  Step 5: Machine Machine9, Duration 112\n  Step 6: Machine Machine1, Duration 185\n  Step 7: Machine Machine4, Duration 134\n  Step 8: Machine Machine8, Duration 77\n  Step 9: Machine Machine5, Duration 190\n  Step 10: Machine Machine14, Duration 109\n  Step 11: Machine Machine16, Duration 149\n  Step 12: Machine Machine0, Duration 60\n  Step 13: Machine Machine19, Duration 82\n  Step 14: Machine Machine11, Duration 89\n  Step 15: Machine Machine10, Duration 193\n  Step 16: Machine Machine12, Duration 182\n  Step 17: Machine Machine17, Duration 73\n  Step 18: Machine Machine18, Duration 103\n  Step 19: Machine Machine7, Duration 153\n  Step 20: Machine Machine15, Duration 18\nJob31:\n  Step 1: Machine Machine14, Duration 34\n  Step 2: Machine Machine6, Duration 112\n  Step 3: Machine Machine7, Duration 154\n  Step 4: Machine Machine3, Duration 66\n  Step 5: Machine Machine0, Duration 147\n  Step 6: Machine Machine13, Duration 165\n  Step 7: Machine Machine19, Duration 177\n  Step 8: Machine Machine15, Duration 192\n  Step 9: Machine Machine5, Duration 160\n  Step 10: Machine Machine4, Duration 180\n  Step 11: Machine Machine18, Duration 177\n  Step 12: Machine Machine8, Duration 51\n  Step 13: Machine Machine10, Duration 82\n  Step 14: Machine Machine11, Duration 169\n  Step 15: Machine Machine9, Duration 6\n  Step 16: Machine Machine17, Duration 195\n  Step 17: Machine Machine16, Duration 149\n  Step 18: Machine Machine1, Duration 54\n  Step 19: Machine Machine2, Duration 10\n  Step 20: Machine Machine12, Duration 156\nJob32:\n  Step 1: Machine Machine1, Duration 17\n  Step 2: Machine Machine8, Duration 18\n  Step 3: Machine Machine3, Duration 165\n  Step 4: Machine Machine2, Duration 135\n  Step 5: Machine Machine15, Duration 183\n  Step 6: Machine Machine0, Duration 93\n  Step 7: Machine Machine4, Duration 87\n  Step 8: Machine Machine9, Duration 104\n  Step 9: Machine Machine14, Duration 121\n  Step 10: Machine Machine5, Duration 88\n  Step 11: Machine Machine19, Duration 87\n  Step 12: Machine Machine17, Duration 50\n  Step 13: Machine Machine18, Duration 1\n  Step 14: Machine Machine6, Duration 192\n  Step 15: Machine Machine12, Duration 65\n  Step 16: Machine Machine10, Duration 80\n  Step 17: Machine Machine7, Duration 6\n  Step 18: Machine Machine11, Duration 79\n  Step 19: Machine Machine13, Duration 8\n  Step 20: Machine Machine16, Duration 153\nJob33:\n  Step 1: Machine Machine10, Duration 197\n  Step 2: Machine Machine0, Duration 79\n  Step 3: Machine Machine17, Duration 164\n  Step 4: Machine Machine11, Duration 16\n  Step 5: Machine Machine16, Duration 65\n  Step 6: Machine Machine12, Duration 32\n  Step 7: Machine Machine15, Duration 76\n  Step 8: Machine Machine1, Duration 191\n  Step 9: Machine Machine2, Duration 101\n  Step 10: Machine Machine14, Duration 23\n  Step 11: Machine Machine6, Duration 200\n  Step 12: Machine Machine7, Duration 96\n  Step 13: Machine Machine18, Duration 151\n  Step 14: Machine Machine5, Duration 24\n  Step 15: Machine Machine3, Duration 96\n  Step 16: Machine Machine4, Duration 106\n  Step 17: Machine Machine13, Duration 2\n  Step 18: Machine Machine9, Duration 132\n  Step 19: Machine Machine8, Duration 106\n  Step 20: Machine Machine19, Duration 132\nJob34:\n  Step 1: Machine Machine16, Duration 75\n  Step 2: Machine Machine3, Duration 149\n  Step 3: Machine Machine8, Duration 40\n  Step 4: Machine Machine9, Duration 29\n  Step 5: Machine Machine13, Duration 115\n  Step 6: Machine Machine15, Duration 169\n  Step 7: Machine Machine1, Duration 139\n  Step 8: Machine Machine17, Duration 27\n  Step 9: Machine Machine14, Duration 54\n  Step 10: Machine Machine2, Duration 84\n  Step 11: Machine Machine5, Duration 30\n  Step 12: Machine Machine7, Duration 8\n  Step 13: Machine Machine11, Duration 8\n  Step 14: Machine Machine10, Duration 95\n  Step 15: Machine Machine12, Duration 113\n  Step 16: Machine Machine6, Duration 88\n  Step 17: Machine Machine0, Duration 154\n  Step 18: Machine Machine4, Duration 55\n  Step 19: Machine Machine18, Duration 158\n  Step 20: Machine Machine19, Duration 32\nJob35:\n  Step 1: Machine Machine14, Duration 133\n  Step 2: Machine Machine9, Duration 142\n  Step 3: Machine Machine4, Duration 115\n  Step 4: Machine Machine17, Duration 154\n  Step 5: Machine Machine2, Duration 178\n  Step 6: Machine Machine5, Duration 99\n  Step 7: Machine Machine15, Duration 173\n  Step 8: Machine Machine13, Duration 53\n  Step 9: Machine Machine10, Duration 77\n  Step 10: Machine Machine12, Duration 186\n  Step 11: Machine Machine19, Duration 144\n  Step 12: Machine Machine3, Duration 116\n  Step 13: Machine Machine7, Duration 113\n  Step 14: Machine Machine8, Duration 154\n  Step 15: Machine Machine18, Duration 22\n  Step 16: Machine Machine11, Duration 127\n  Step 17: Machine Machine0, Duration 28\n  Step 18: Machine Machine1, Duration 61\n  Step 19: Machine Machine16, Duration 90\n  Step 20: Machine Machine6, Duration 52\nJob36:\n  Step 1: Machine Machine7, Duration 130\n  Step 2: Machine Machine9, Duration 95\n  Step 3: Machine Machine3, Duration 38\n  Step 4: Machine Machine17, Duration 87\n  Step 5: Machine Machine11, Duration 96\n  Step 6: Machine Machine2, Duration 16\n  Step 7: Machine Machine15, Duration 79\n  Step 8: Machine Machine13, Duration 150\n  Step 9: Machine Machine4, Duration 36\n  Step 10: Machine Machine0, Duration 40\n  Step 11: Machine Machine5, Duration 5\n  Step 12: Machine Machine18, Duration 114\n  Step 13: Machine Machine10, Duration 109\n  Step 14: Machine Machine14, Duration 78\n  Step 15: Machine Machine12, Duration 14\n  Step 16: Machine Machine16, Duration 103\n  Step 17: Machine Machine6, Duration 54\n  Step 18: Machine Machine8, Duration 86\n  Step 19: Machine Machine1, Duration 154\n  Step 20: Machine Machine19, Duration 137\nJob37:\n  Step 1: Machine Machine1, Duration 30\n  Step 2: Machine Machine17, Duration 128\n  Step 3: Machine Machine12, Duration 192\n  Step 4: Machine Machine2, Duration 12\n  Step 5: Machine Machine7, Duration 48\n  Step 6: Machine Machine11, Duration 117\n  Step 7: Machine Machine15, Duration 96\n  Step 8: Machine Machine4, Duration 99\n  Step 9: Machine Machine18, Duration 30\n  Step 10: Machine Machine3, Duration 24\n  Step 11: Machine Machine14, Duration 96\n  Step 12: Machine Machine16, Duration 69\n  Step 13: Machine Machine5, Duration 49\n  Step 14: Machine Machine19, Duration 134\n  Step 15: Machine Machine10, Duration 124\n  Step 16: Machine Machine6, Duration 54\n  Step 17: Machine Machine13, Duration 16\n  Step 18: Machine Machine0, Duration 171\n  Step 19: Machine Machine9, Duration 127\n  Step 20: Machine Machine8, Duration 17\nJob38:\n  Step 1: Machine Machine10, Duration 139\n  Step 2: Machine Machine1, Duration 196\n  Step 3: Machine Machine6, Duration 135\n  Step 4: Machine Machine4, Duration 134\n  Step 5: Machine Machine12, Duration 98\n  Step 6: Machine Machine16, Duration 37\n  Step 7: Machine Machine0, Duration 12\n  Step 8: Machine Machine5, Duration 109\n  Step 9: Machine Machine18, Duration 88\n  Step 10: Machine Machine3, Duration 118\n  Step 11: Machine Machine7, Duration 48\n  Step 12: Machine Machine19, Duration 192\n  Step 13: Machine Machine14, Duration 84\n  Step 14: Machine Machine9, Duration 142\n  Step 15: Machine Machine13, Duration 147\n  Step 16: Machine Machine11, Duration 17\n  Step 17: Machine Machine2, Duration 107\n  Step 18: Machine Machine17, Duration 194\n  Step 19: Machine Machine8, Duration 122\n  Step 20: Machine Machine15, Duration 68\nJob39:\n  Step 1: Machine Machine9, Duration 106\n  Step 2: Machine Machine10, Duration 154\n  Step 3: Machine Machine1, Duration 111\n  Step 4: Machine Machine3, Duration 148\n  Step 5: Machine Machine11, Duration 128\n  Step 6: Machine Machine2, Duration 153\n  Step 7: Machine Machine15, Duration 88\n  Step 8: Machine Machine4, Duration 45\n  Step 9: Machine Machine16, Duration 191\n  Step 10: Machine Machine18, Duration 164\n  Step 11: Machine Machine17, Duration 116\n  Step 12: Machine Machine5, Duration 1\n  Step 13: Machine Machine0, Duration 31\n  Step 14: Machine Machine19, Duration 95\n  Step 15: Machine Machine7, Duration 51\n  Step 16: Machine Machine14, Duration 46\n  Step 17: Machine Machine6, Duration 123\n  Step 18: Machine Machine12, Duration 16\n  Step 19: Machine Machine8, Duration 187\n  Step 20: Machine Machine13, Duration 189\nJob40:\n  Step 1: Machine Machine12, Duration 101\n  Step 2: Machine Machine8, Duration 113\n  Step 3: Machine Machine9, Duration 38\n  Step 4: Machine Machine1, Duration 119\n  Step 5: Machine Machine2, Duration 184\n  Step 6: Machine Machine3, Duration 148\n  Step 7: Machine Machine16, Duration 148\n  Step 8: Machine Machine10, Duration 43\n  Step 9: Machine Machine15, Duration 20\n  Step 10: Machine Machine14, Duration 178\n  Step 11: Machine Machine11, Duration 83\n  Step 12: Machine Machine5, Duration 92\n  Step 13: Machine Machine0, Duration 35\n  Step 14: Machine Machine17, Duration 165\n  Step 15: Machine Machine13, Duration 38\n  Step 16: Machine Machine6, Duration 131\n  Step 17: Machine Machine19, Duration 144\n  Step 18: Machine Machine7, Duration 179\n  Step 19: Machine Machine4, Duration 30\n  Step 20: Machine Machine18, Duration 89\nJob41:\n  Step 1: Machine Machine9, Duration 164\n  Step 2: Machine Machine19, Duration 55\n  Step 3: Machine Machine8, Duration 176\n  Step 4: Machine Machine18, Duration 82\n  Step 5: Machine Machine14, Duration 61\n  Step 6: Machine Machine0, Duration 183\n  Step 7: Machine Machine15, Duration 14\n  Step 8: Machine Machine16, Duration 27\n  Step 9: Machine Machine11, Duration 66\n  Step 10: Machine Machine12, Duration 91\n  Step 11: Machine Machine13, Duration 22\n  Step 12: Machine Machine6, Duration 158\n  Step 13: Machine Machine4, Duration 165\n  Step 14: Machine Machine1, Duration 182\n  Step 15: Machine Machine17, Duration 86\n  Step 16: Machine Machine3, Duration 197\n  Step 17: Machine Machine10, Duration 139\n  Step 18: Machine Machine7, Duration 157\n  Step 19: Machine Machine5, Duration 119\n  Step 20: Machine Machine2, Duration 114\nJob42:\n  Step 1: Machine Machine15, Duration 33\n  Step 2: Machine Machine5, Duration 65\n  Step 3: Machine Machine19, Duration 109\n  Step 4: Machine Machine11, Duration 84\n  Step 5: Machine Machine2, Duration 164\n  Step 6: Machine Machine12, Duration 141\n  Step 7: Machine Machine17, Duration 132\n  Step 8: Machine Machine1, Duration 164\n  Step 9: Machine Machine4, Duration 97\n  Step 10: Machine Machine9, Duration 85\n  Step 11: Machine Machine14, Duration 125\n  Step 12: Machine Machine10, Duration 104\n  Step 13: Machine Machine8, Duration 22\n  Step 14: Machine Machine6, Duration 171\n  Step 15: Machine Machine7, Duration 115\n  Step 16: Machine Machine18, Duration 77\n  Step 17: Machine Machine0, Duration 69\n  Step 18: Machine Machine16, Duration 181\n  Step 19: Machine Machine13, Duration 121\n  Step 20: Machine Machine3, Duration 98\nJob43:\n  Step 1: Machine Machine4, Duration 44\n  Step 2: Machine Machine5, Duration 99\n  Step 3: Machine Machine19, Duration 20\n  Step 4: Machine Machine18, Duration 171\n  Step 5: Machine Machine17, Duration 174\n  Step 6: Machine Machine6, Duration 87\n  Step 7: Machine Machine13, Duration 33\n  Step 8: Machine Machine3, Duration 18\n  Step 9: Machine Machine11, Duration 153\n  Step 10: Machine Machine2, Duration 153\n  Step 11: Machine Machine16, Duration 113\n  Step 12: Machine Machine15, Duration 149\n  Step 13: Machine Machine7, Duration 103\n  Step 14: Machine Machine8, Duration 103\n  Step 15: Machine Machine10, Duration 138\n  Step 16: Machine Machine14, Duration 67\n  Step 17: Machine Machine9, Duration 56\n  Step 18: Machine Machine1, Duration 92\n  Step 19: Machine Machine0, Duration 137\n  Step 20: Machine Machine12, Duration 105\nJob44:\n  Step 1: Machine Machine13, Duration 69\n  Step 2: Machine Machine2, Duration 145\n  Step 3: Machine Machine4, Duration 4\n  Step 4: Machine Machine10, Duration 11\n  Step 5: Machine Machine16, Duration 54\n  Step 6: Machine Machine14, Duration 150\n  Step 7: Machine Machine17, Duration 31\n  Step 8: Machine Machine3, Duration 168\n  Step 9: Machine Machine18, Duration 142\n  Step 10: Machine Machine12, Duration 86\n  Step 11: Machine Machine5, Duration 19\n  Step 12: Machine Machine9, Duration 111\n  Step 13: Machine Machine11, Duration 89\n  Step 14: Machine Machine19, Duration 53\n  Step 15: Machine Machine15, Duration 96\n  Step 16: Machine Machine1, Duration 179\n  Step 17: Machine Machine8, Duration 148\n  Step 18: Machine Machine0, Duration 195\n  Step 19: Machine Machine7, Duration 23\n  Step 20: Machine Machine6, Duration 161\nJob45:\n  Step 1: Machine Machine15, Duration 95\n  Step 2: Machine Machine7, Duration 75\n  Step 3: Machine Machine13, Duration 65\n  Step 4: Machine Machine17, Duration 83\n  Step 5: Machine Machine18, Duration 169\n  Step 6: Machine Machine8, Duration 170\n  Step 7: Machine Machine16, Duration 195\n  Step 8: Machine Machine0, Duration 193\n  Step 9: Machine Machine11, Duration 144\n  Step 10: Machine Machine10, Duration 53\n  Step 11: Machine Machine12, Duration 102\n  Step 12: Machine Machine4, Duration 27\n  Step 13: Machine Machine3, Duration 122\n  Step 14: Machine Machine2, Duration 199\n  Step 15: Machine Machine19, Duration 198\n  Step 16: Machine Machine6, Duration 184\n  Step 17: Machine Machine9, Duration 6\n  Step 18: Machine Machine5, Duration 9\n  Step 19: Machine Machine14, Duration 124\n  Step 20: Machine Machine1, Duration 17\nJob46:\n  Step 1: Machine Machine2, Duration 175\n  Step 2: Machine Machine11, Duration 137\n  Step 3: Machine Machine3, Duration 74\n  Step 4: Machine Machine9, Duration 3\n  Step 5: Machine Machine4, Duration 94\n  Step 6: Machine Machine5, Duration 2\n  Step 7: Machine Machine13, Duration 175\n  Step 8: Machine Machine17, Duration 134\n  Step 9: Machine Machine7, Duration 46\n  Step 10: Machine Machine12, Duration 120\n  Step 11: Machine Machine18, Duration 184\n  Step 12: Machine Machine15, Duration 123\n  Step 13: Machine Machine10, Duration 118\n  Step 14: Machine Machine0, Duration 76\n  Step 15: Machine Machine14, Duration 195\n  Step 16: Machine Machine6, Duration 37\n  Step 17: Machine Machine16, Duration 38\n  Step 18: Machine Machine8, Duration 92\n  Step 19: Machine Machine19, Duration 146\n  Step 20: Machine Machine1, Duration 43\nJob47:\n  Step 1: Machine Machine17, Duration 105\n  Step 2: Machine Machine16, Duration 68\n  Step 3: Machine Machine2, Duration 195\n  Step 4: Machine Machine4, Duration 131\n  Step 5: Machine Machine15, Duration 9\n  Step 6: Machine Machine18, Duration 61\n  Step 7: Machine Machine12, Duration 170\n  Step 8: Machine Machine19, Duration 186\n  Step 9: Machine Machine13, Duration 152\n  Step 10: Machine Machine6, Duration 166\n  Step 11: Machine Machine9, Duration 69\n  Step 12: Machine Machine14, Duration 46\n  Step 13: Machine Machine10, Duration 164\n  Step 14: Machine Machine11, Duration 46\n  Step 15: Machine Machine5, Duration 84\n  Step 16: Machine Machine1, Duration 133\n  Step 17: Machine Machine0, Duration 19\n  Step 18: Machine Machine3, Duration 199\n  Step 19: Machine Machine7, Duration 175\n  Step 20: Machine Machine8, Duration 59\nJob48:\n  Step 1: Machine Machine10, Duration 127\n  Step 2: Machine Machine6, Duration 163\n  Step 3: Machine Machine19, Duration 152\n  Step 4: Machine Machine14, Duration 149\n  Step 5: Machine Machine17, Duration 12\n  Step 6: Machine Machine13, Duration 11\n  Step 7: Machine Machine3, Duration 89\n  Step 8: Machine Machine5, Duration 97\n  Step 9: Machine Machine16, Duration 87\n  Step 10: Machine Machine18, Duration 120\n  Step 11: Machine Machine2, Duration 135\n  Step 12: Machine Machine0, Duration 123\n  Step 13: Machine Machine12, Duration 161\n  Step 14: Machine Machine15, Duration 58\n  Step 15: Machine Machine8, Duration 139\n  Step 16: Machine Machine7, Duration 82\n  Step 17: Machine Machine4, Duration 1\n  Step 18: Machine Machine11, Duration 93\n  Step 19: Machine Machine9, Duration 185\n  Step 20: Machine Machine1, Duration 167\nJob49:\n  Step 1: Machine Machine19, Duration 154\n  Step 2: Machine Machine3, Duration 124\n  Step 3: Machine Machine5, Duration 198\n  Step 4: Machine Machine15, Duration 49\n  Step 5: Machine Machine0, Duration 100\n  Step 6: Machine Machine8, Duration 145\n  Step 7: Machine Machine4, Duration 17\n  Step 8: Machine Machine12, Duration 103\n  Step 9: Machine Machine13, Duration 130\n  Step 10: Machine Machine18, Duration 170\n  Step 11: Machine Machine1, Duration 130\n  Step 12: Machine Machine17, Duration 122\n  Step 13: Machine Machine11, Duration 137\n  Step 14: Machine Machine14, Duration 33\n  Step 15: Machine Machine6, Duration 109\n  Step 16: Machine Machine2, Duration 26\n  Step 17: Machine Machine9, Duration 120\n  Step 18: Machine Machine7, Duration 33\n  Step 19: Machine Machine10, Duration 140\n  Step 20: Machine Machine16, Duration 126\nJob50:\n  Step 1: Machine Machine18, Duration 57\n  Step 2: Machine Machine17, Duration 133\n  Step 3: Machine Machine10, Duration 124\n  Step 4: Machine Machine16, Duration 188\n  Step 5: Machine Machine4, Duration 53\n  Step 6: Machine Machine15, Duration 24\n  Step 7: Machine Machine11, Duration 81\n  Step 8: Machine Machine1, Duration 93\n  Step 9: Machine Machine7, Duration 89\n  Step 10: Machine Machine19, Duration 12\n  Step 11: Machine Machine6, Duration 110\n  Step 12: Machine Machine8, Duration 111\n  Step 13: Machine Machine0, Duration 72\n  Step 14: Machine Machine13, Duration 163\n  Step 15: Machine Machine12, Duration 155\n  Step 16: Machine Machine5, Duration 151\n  Step 17: Machine Machine3, Duration 121\n  Step 18: Machine Machine2, Duration 98\n  Step 19: Machine Machine9, Duration 95\n  Step 20: Machine Machine14, Duration 164\n        \n        REQUIRED OUTPUT FORMAT:\n        You must provide your solution in the following exact format:\n        \n        1. FINAL MAKESPAN: [integer value]\n        2. STRUCTURED SCHEDULE:\n           For each operation, provide:\n           - Job: [job_name]\n           - Step: [step_number]\n           - Machine: [machine_name]\n           - Start Time: [start_time]\n           - End Time: [end_time]\n           - Duration: [duration]\n        \n        Example format:\n        FINAL MAKESPAN: 25\n        STRUCTURED SCHEDULE:\n        - Job: Job1, Step: 1, Machine: Machine0, Start Time: 0, End Time: 3, Duration: 3\n        - Job: Job1, Step: 2, Machine: Machine1, Start Time: 3, End Time: 7, Duration: 4\n        - Job: Job2, Step: 1, Machine: Machine1, Start Time: 7, End Time: 10, Duration: 3\n        \n        Please solve this Job Shop Scheduling Problem and provide:\n        1. A valid schedule with start and end times for each operation\n        2. The minimum makespan (total completion time)\n        3. Ensure all constraints are satisfied:\n           - Job precedence: operations within a job must be sequential\n           - Machine constraints: no overlapping operations on the same machine\n        "
        },
        "Machine Coordinator Agent": {
          "system_message": "You are a Machine Coordinator Agent responsible for coordinating machine usage and resolving conflicts.",
          "query": "\n        Job Shop Scheduling Problem (JSSP) - Dataset: rcmax_50_20_6\n        \n        Problem Description:\n        - Number of jobs: 50\n        - Each job has multiple operations that must be performed in sequence\n        - Each operation requires a specific machine and has a duration\n        - Each machine can only process one operation at a time\n        - Goal: Find the minimum makespan (total completion time)\n        \n        Job Specifications:\n        \nJob1:\n  Step 1: Machine Machine12, Duration 93\n  Step 2: Machine Machine17, Duration 199\n  Step 3: Machine Machine13, Duration 26\n  Step 4: Machine Machine0, Duration 48\n  Step 5: Machine Machine9, Duration 172\n  Step 6: Machine Machine2, Duration 175\n  Step 7: Machine Machine14, Duration 39\n  Step 8: Machine Machine16, Duration 39\n  Step 9: Machine Machine11, Duration 11\n  Step 10: Machine Machine4, Duration 138\n  Step 11: Machine Machine6, Duration 197\n  Step 12: Machine Machine8, Duration 97\n  Step 13: Machine Machine15, Duration 92\n  Step 14: Machine Machine1, Duration 46\n  Step 15: Machine Machine18, Duration 182\n  Step 16: Machine Machine10, Duration 180\n  Step 17: Machine Machine3, Duration 109\n  Step 18: Machine Machine19, Duration 147\n  Step 19: Machine Machine7, Duration 167\n  Step 20: Machine Machine5, Duration 66\nJob2:\n  Step 1: Machine Machine0, Duration 40\n  Step 2: Machine Machine7, Duration 46\n  Step 3: Machine Machine18, Duration 52\n  Step 4: Machine Machine9, Duration 126\n  Step 5: Machine Machine12, Duration 136\n  Step 6: Machine Machine19, Duration 147\n  Step 7: Machine Machine15, Duration 152\n  Step 8: Machine Machine3, Duration 28\n  Step 9: Machine Machine11, Duration 101\n  Step 10: Machine Machine13, Duration 8\n  Step 11: Machine Machine14, Duration 110\n  Step 12: Machine Machine2, Duration 6\n  Step 13: Machine Machine6, Duration 103\n  Step 14: Machine Machine1, Duration 166\n  Step 15: Machine Machine16, Duration 51\n  Step 16: Machine Machine10, Duration 4\n  Step 17: Machine Machine17, Duration 119\n  Step 18: Machine Machine5, Duration 100\n  Step 19: Machine Machine4, Duration 197\n  Step 20: Machine Machine8, Duration 185\nJob3:\n  Step 1: Machine Machine7, Duration 109\n  Step 2: Machine Machine5, Duration 198\n  Step 3: Machine Machine15, Duration 133\n  Step 4: Machine Machine18, Duration 19\n  Step 5: Machine Machine2, Duration 112\n  Step 6: Machine Machine10, Duration 118\n  Step 7: Machine Machine6, Duration 9\n  Step 8: Machine Machine1, Duration 46\n  Step 9: Machine Machine17, Duration 21\n  Step 10: Machine Machine4, Duration 87\n  Step 11: Machine Machine14, Duration 32\n  Step 12: Machine Machine8, Duration 86\n  Step 13: Machine Machine9, Duration 46\n  Step 14: Machine Machine0, Duration 70\n  Step 15: Machine Machine11, Duration 52\n  Step 16: Machine Machine16, Duration 27\n  Step 17: Machine Machine12, Duration 120\n  Step 18: Machine Machine3, Duration 154\n  Step 19: Machine Machine19, Duration 28\n  Step 20: Machine Machine13, Duration 123\nJob4:\n  Step 1: Machine Machine7, Duration 136\n  Step 2: Machine Machine14, Duration 93\n  Step 3: Machine Machine12, Duration 123\n  Step 4: Machine Machine2, Duration 167\n  Step 5: Machine Machine10, Duration 158\n  Step 6: Machine Machine11, Duration 53\n  Step 7: Machine Machine19, Duration 99\n  Step 8: Machine Machine0, Duration 8\n  Step 9: Machine Machine17, Duration 191\n  Step 10: Machine Machine4, Duration 138\n  Step 11: Machine Machine9, Duration 149\n  Step 12: Machine Machine5, Duration 156\n  Step 13: Machine Machine13, Duration 30\n  Step 14: Machine Machine16, Duration 90\n  Step 15: Machine Machine3, Duration 124\n  Step 16: Machine Machine8, Duration 127\n  Step 17: Machine Machine18, Duration 67\n  Step 18: Machine Machine1, Duration 104\n  Step 19: Machine Machine15, Duration 116\n  Step 20: Machine Machine6, Duration 127\nJob5:\n  Step 1: Machine Machine7, Duration 42\n  Step 2: Machine Machine16, Duration 128\n  Step 3: Machine Machine2, Duration 170\n  Step 4: Machine Machine18, Duration 5\n  Step 5: Machine Machine13, Duration 80\n  Step 6: Machine Machine11, Duration 124\n  Step 7: Machine Machine5, Duration 137\n  Step 8: Machine Machine15, Duration 15\n  Step 9: Machine Machine10, Duration 180\n  Step 10: Machine Machine19, Duration 53\n  Step 11: Machine Machine0, Duration 190\n  Step 12: Machine Machine1, Duration 46\n  Step 13: Machine Machine8, Duration 149\n  Step 14: Machine Machine6, Duration 129\n  Step 15: Machine Machine12, Duration 178\n  Step 16: Machine Machine9, Duration 144\n  Step 17: Machine Machine14, Duration 124\n  Step 18: Machine Machine17, Duration 196\n  Step 19: Machine Machine3, Duration 18\n  Step 20: Machine Machine4, Duration 110\nJob6:\n  Step 1: Machine Machine9, Duration 59\n  Step 2: Machine Machine17, Duration 116\n  Step 3: Machine Machine16, Duration 68\n  Step 4: Machine Machine13, Duration 35\n  Step 5: Machine Machine0, Duration 169\n  Step 6: Machine Machine14, Duration 70\n  Step 7: Machine Machine1, Duration 129\n  Step 8: Machine Machine12, Duration 34\n  Step 9: Machine Machine10, Duration 73\n  Step 10: Machine Machine18, Duration 77\n  Step 11: Machine Machine11, Duration 177\n  Step 12: Machine Machine4, Duration 63\n  Step 13: Machine Machine3, Duration 13\n  Step 14: Machine Machine2, Duration 58\n  Step 15: Machine Machine15, Duration 137\n  Step 16: Machine Machine5, Duration 84\n  Step 17: Machine Machine8, Duration 67\n  Step 18: Machine Machine19, Duration 121\n  Step 19: Machine Machine7, Duration 187\n  Step 20: Machine Machine6, Duration 105\nJob7:\n  Step 1: Machine Machine16, Duration 57\n  Step 2: Machine Machine1, Duration 173\n  Step 3: Machine Machine7, Duration 6\n  Step 4: Machine Machine5, Duration 19\n  Step 5: Machine Machine12, Duration 91\n  Step 6: Machine Machine11, Duration 114\n  Step 7: Machine Machine14, Duration 94\n  Step 8: Machine Machine17, Duration 156\n  Step 9: Machine Machine9, Duration 72\n  Step 10: Machine Machine19, Duration 112\n  Step 11: Machine Machine18, Duration 1\n  Step 12: Machine Machine13, Duration 111\n  Step 13: Machine Machine2, Duration 168\n  Step 14: Machine Machine3, Duration 44\n  Step 15: Machine Machine6, Duration 15\n  Step 16: Machine Machine4, Duration 194\n  Step 17: Machine Machine0, Duration 119\n  Step 18: Machine Machine15, Duration 57\n  Step 19: Machine Machine10, Duration 101\n  Step 20: Machine Machine8, Duration 164\nJob8:\n  Step 1: Machine Machine9, Duration 126\n  Step 2: Machine Machine11, Duration 29\n  Step 3: Machine Machine15, Duration 17\n  Step 4: Machine Machine8, Duration 62\n  Step 5: Machine Machine0, Duration 171\n  Step 6: Machine Machine14, Duration 181\n  Step 7: Machine Machine13, Duration 184\n  Step 8: Machine Machine12, Duration 35\n  Step 9: Machine Machine5, Duration 30\n  Step 10: Machine Machine4, Duration 115\n  Step 11: Machine Machine6, Duration 2\n  Step 12: Machine Machine3, Duration 151\n  Step 13: Machine Machine16, Duration 65\n  Step 14: Machine Machine19, Duration 91\n  Step 15: Machine Machine1, Duration 77\n  Step 16: Machine Machine17, Duration 166\n  Step 17: Machine Machine2, Duration 74\n  Step 18: Machine Machine10, Duration 183\n  Step 19: Machine Machine18, Duration 177\n  Step 20: Machine Machine7, Duration 187\nJob9:\n  Step 1: Machine Machine8, Duration 99\n  Step 2: Machine Machine18, Duration 122\n  Step 3: Machine Machine11, Duration 49\n  Step 4: Machine Machine7, Duration 44\n  Step 5: Machine Machine10, Duration 126\n  Step 6: Machine Machine17, Duration 168\n  Step 7: Machine Machine3, Duration 20\n  Step 8: Machine Machine6, Duration 46\n  Step 9: Machine Machine14, Duration 190\n  Step 10: Machine Machine4, Duration 162\n  Step 11: Machine Machine1, Duration 184\n  Step 12: Machine Machine0, Duration 96\n  Step 13: Machine Machine5, Duration 170\n  Step 14: Machine Machine16, Duration 147\n  Step 15: Machine Machine19, Duration 10\n  Step 16: Machine Machine13, Duration 142\n  Step 17: Machine Machine9, Duration 111\n  Step 18: Machine Machine12, Duration 12\n  Step 19: Machine Machine2, Duration 86\n  Step 20: Machine Machine15, Duration 196\nJob10:\n  Step 1: Machine Machine12, Duration 114\n  Step 2: Machine Machine16, Duration 75\n  Step 3: Machine Machine15, Duration 66\n  Step 4: Machine Machine9, Duration 170\n  Step 5: Machine Machine6, Duration 70\n  Step 6: Machine Machine2, Duration 50\n  Step 7: Machine Machine10, Duration 131\n  Step 8: Machine Machine11, Duration 57\n  Step 9: Machine Machine5, Duration 61\n  Step 10: Machine Machine0, Duration 188\n  Step 11: Machine Machine8, Duration 74\n  Step 12: Machine Machine1, Duration 107\n  Step 13: Machine Machine13, Duration 152\n  Step 14: Machine Machine4, Duration 152\n  Step 15: Machine Machine18, Duration 60\n  Step 16: Machine Machine17, Duration 97\n  Step 17: Machine Machine19, Duration 19\n  Step 18: Machine Machine3, Duration 15\n  Step 19: Machine Machine7, Duration 147\n  Step 20: Machine Machine14, Duration 156\nJob11:\n  Step 1: Machine Machine0, Duration 29\n  Step 2: Machine Machine1, Duration 179\n  Step 3: Machine Machine7, Duration 109\n  Step 4: Machine Machine4, Duration 30\n  Step 5: Machine Machine18, Duration 92\n  Step 6: Machine Machine10, Duration 71\n  Step 7: Machine Machine9, Duration 111\n  Step 8: Machine Machine15, Duration 146\n  Step 9: Machine Machine5, Duration 77\n  Step 10: Machine Machine19, Duration 59\n  Step 11: Machine Machine2, Duration 146\n  Step 12: Machine Machine17, Duration 16\n  Step 13: Machine Machine16, Duration 49\n  Step 14: Machine Machine13, Duration 12\n  Step 15: Machine Machine12, Duration 144\n  Step 16: Machine Machine3, Duration 95\n  Step 17: Machine Machine14, Duration 163\n  Step 18: Machine Machine6, Duration 199\n  Step 19: Machine Machine11, Duration 157\n  Step 20: Machine Machine8, Duration 131\nJob12:\n  Step 1: Machine Machine17, Duration 174\n  Step 2: Machine Machine13, Duration 22\n  Step 3: Machine Machine11, Duration 142\n  Step 4: Machine Machine8, Duration 32\n  Step 5: Machine Machine14, Duration 49\n  Step 6: Machine Machine10, Duration 97\n  Step 7: Machine Machine5, Duration 47\n  Step 8: Machine Machine4, Duration 140\n  Step 9: Machine Machine12, Duration 49\n  Step 10: Machine Machine18, Duration 41\n  Step 11: Machine Machine9, Duration 157\n  Step 12: Machine Machine2, Duration 3\n  Step 13: Machine Machine7, Duration 198\n  Step 14: Machine Machine19, Duration 92\n  Step 15: Machine Machine0, Duration 2\n  Step 16: Machine Machine3, Duration 142\n  Step 17: Machine Machine1, Duration 114\n  Step 18: Machine Machine16, Duration 4\n  Step 19: Machine Machine6, Duration 98\n  Step 20: Machine Machine15, Duration 100\nJob13:\n  Step 1: Machine Machine17, Duration 47\n  Step 2: Machine Machine8, Duration 55\n  Step 3: Machine Machine7, Duration 136\n  Step 4: Machine Machine9, Duration 51\n  Step 5: Machine Machine1, Duration 79\n  Step 6: Machine Machine4, Duration 37\n  Step 7: Machine Machine15, Duration 100\n  Step 8: Machine Machine14, Duration 139\n  Step 9: Machine Machine0, Duration 45\n  Step 10: Machine Machine10, Duration 39\n  Step 11: Machine Machine16, Duration 160\n  Step 12: Machine Machine19, Duration 90\n  Step 13: Machine Machine5, Duration 114\n  Step 14: Machine Machine13, Duration 13\n  Step 15: Machine Machine2, Duration 66\n  Step 16: Machine Machine11, Duration 90\n  Step 17: Machine Machine12, Duration 187\n  Step 18: Machine Machine6, Duration 47\n  Step 19: Machine Machine18, Duration 75\n  Step 20: Machine Machine3, Duration 151\nJob14:\n  Step 1: Machine Machine18, Duration 139\n  Step 2: Machine Machine5, Duration 102\n  Step 3: Machine Machine4, Duration 181\n  Step 4: Machine Machine7, Duration 24\n  Step 5: Machine Machine13, Duration 142\n  Step 6: Machine Machine8, Duration 23\n  Step 7: Machine Machine16, Duration 100\n  Step 8: Machine Machine11, Duration 95\n  Step 9: Machine Machine3, Duration 89\n  Step 10: Machine Machine14, Duration 144\n  Step 11: Machine Machine15, Duration 159\n  Step 12: Machine Machine10, Duration 176\n  Step 13: Machine Machine9, Duration 153\n  Step 14: Machine Machine2, Duration 112\n  Step 15: Machine Machine12, Duration 136\n  Step 16: Machine Machine6, Duration 97\n  Step 17: Machine Machine19, Duration 176\n  Step 18: Machine Machine17, Duration 20\n  Step 19: Machine Machine1, Duration 154\n  Step 20: Machine Machine0, Duration 15\nJob15:\n  Step 1: Machine Machine16, Duration 183\n  Step 2: Machine Machine12, Duration 53\n  Step 3: Machine Machine2, Duration 2\n  Step 4: Machine Machine15, Duration 26\n  Step 5: Machine Machine1, Duration 196\n  Step 6: Machine Machine9, Duration 15\n  Step 7: Machine Machine18, Duration 5\n  Step 8: Machine Machine7, Duration 103\n  Step 9: Machine Machine3, Duration 40\n  Step 10: Machine Machine5, Duration 86\n  Step 11: Machine Machine4, Duration 130\n  Step 12: Machine Machine6, Duration 118\n  Step 13: Machine Machine0, Duration 111\n  Step 14: Machine Machine8, Duration 94\n  Step 15: Machine Machine13, Duration 118\n  Step 16: Machine Machine11, Duration 119\n  Step 17: Machine Machine19, Duration 188\n  Step 18: Machine Machine17, Duration 119\n  Step 19: Machine Machine14, Duration 55\n  Step 20: Machine Machine10, Duration 146\nJob16:\n  Step 1: Machine Machine0, Duration 97\n  Step 2: Machine Machine9, Duration 197\n  Step 3: Machine Machine1, Duration 127\n  Step 4: Machine Machine8, Duration 39\n  Step 5: Machine Machine11, Duration 80\n  Step 6: Machine Machine5, Duration 138\n  Step 7: Machine Machine13, Duration 77\n  Step 8: Machine Machine2, Duration 3\n  Step 9: Machine Machine17, Duration 116\n  Step 10: Machine Machine4, Duration 115\n  Step 11: Machine Machine6, Duration 127\n  Step 12: Machine Machine18, Duration 61\n  Step 13: Machine Machine7, Duration 124\n  Step 14: Machine Machine15, Duration 7\n  Step 15: Machine Machine12, Duration 111\n  Step 16: Machine Machine14, Duration 40\n  Step 17: Machine Machine16, Duration 96\n  Step 18: Machine Machine10, Duration 34\n  Step 19: Machine Machine19, Duration 159\n  Step 20: Machine Machine3, Duration 29\nJob17:\n  Step 1: Machine Machine18, Duration 123\n  Step 2: Machine Machine5, Duration 22\n  Step 3: Machine Machine1, Duration 135\n  Step 4: Machine Machine19, Duration 99\n  Step 5: Machine Machine8, Duration 105\n  Step 6: Machine Machine11, Duration 14\n  Step 7: Machine Machine13, Duration 159\n  Step 8: Machine Machine9, Duration 21\n  Step 9: Machine Machine14, Duration 86\n  Step 10: Machine Machine17, Duration 12\n  Step 11: Machine Machine7, Duration 49\n  Step 12: Machine Machine6, Duration 160\n  Step 13: Machine Machine4, Duration 66\n  Step 14: Machine Machine12, Duration 9\n  Step 15: Machine Machine3, Duration 31\n  Step 16: Machine Machine16, Duration 134\n  Step 17: Machine Machine15, Duration 12\n  Step 18: Machine Machine10, Duration 38\n  Step 19: Machine Machine2, Duration 131\n  Step 20: Machine Machine0, Duration 55\nJob18:\n  Step 1: Machine Machine12, Duration 18\n  Step 2: Machine Machine11, Duration 93\n  Step 3: Machine Machine7, Duration 128\n  Step 4: Machine Machine17, Duration 41\n  Step 5: Machine Machine8, Duration 174\n  Step 6: Machine Machine4, Duration 75\n  Step 7: Machine Machine15, Duration 44\n  Step 8: Machine Machine5, Duration 15\n  Step 9: Machine Machine9, Duration 100\n  Step 10: Machine Machine14, Duration 58\n  Step 11: Machine Machine10, Duration 166\n  Step 12: Machine Machine13, Duration 89\n  Step 13: Machine Machine16, Duration 174\n  Step 14: Machine Machine19, Duration 91\n  Step 15: Machine Machine3, Duration 33\n  Step 16: Machine Machine0, Duration 28\n  Step 17: Machine Machine6, Duration 195\n  Step 18: Machine Machine1, Duration 163\n  Step 19: Machine Machine18, Duration 95\n  Step 20: Machine Machine2, Duration 40\nJob19:\n  Step 1: Machine Machine18, Duration 185\n  Step 2: Machine Machine9, Duration 88\n  Step 3: Machine Machine13, Duration 135\n  Step 4: Machine Machine1, Duration 98\n  Step 5: Machine Machine15, Duration 196\n  Step 6: Machine Machine0, Duration 119\n  Step 7: Machine Machine8, Duration 52\n  Step 8: Machine Machine10, Duration 21\n  Step 9: Machine Machine6, Duration 130\n  Step 10: Machine Machine4, Duration 141\n  Step 11: Machine Machine17, Duration 52\n  Step 12: Machine Machine14, Duration 96\n  Step 13: Machine Machine2, Duration 34\n  Step 14: Machine Machine3, Duration 115\n  Step 15: Machine Machine12, Duration 5\n  Step 16: Machine Machine5, Duration 74\n  Step 17: Machine Machine11, Duration 104\n  Step 18: Machine Machine19, Duration 88\n  Step 19: Machine Machine7, Duration 162\n  Step 20: Machine Machine16, Duration 113\nJob20:\n  Step 1: Machine Machine6, Duration 63\n  Step 2: Machine Machine2, Duration 140\n  Step 3: Machine Machine4, Duration 8\n  Step 4: Machine Machine0, Duration 73\n  Step 5: Machine Machine15, Duration 115\n  Step 6: Machine Machine3, Duration 178\n  Step 7: Machine Machine1, Duration 101\n  Step 8: Machine Machine17, Duration 149\n  Step 9: Machine Machine19, Duration 137\n  Step 10: Machine Machine18, Duration 170\n  Step 11: Machine Machine16, Duration 92\n  Step 12: Machine Machine8, Duration 149\n  Step 13: Machine Machine9, Duration 180\n  Step 14: Machine Machine11, Duration 103\n  Step 15: Machine Machine7, Duration 179\n  Step 16: Machine Machine13, Duration 106\n  Step 17: Machine Machine5, Duration 57\n  Step 18: Machine Machine12, Duration 171\n  Step 19: Machine Machine14, Duration 112\n  Step 20: Machine Machine10, Duration 104\nJob21:\n  Step 1: Machine Machine8, Duration 125\n  Step 2: Machine Machine5, Duration 82\n  Step 3: Machine Machine2, Duration 151\n  Step 4: Machine Machine9, Duration 10\n  Step 5: Machine Machine4, Duration 162\n  Step 6: Machine Machine10, Duration 144\n  Step 7: Machine Machine1, Duration 9\n  Step 8: Machine Machine13, Duration 193\n  Step 9: Machine Machine0, Duration 165\n  Step 10: Machine Machine3, Duration 98\n  Step 11: Machine Machine14, Duration 134\n  Step 12: Machine Machine11, Duration 198\n  Step 13: Machine Machine15, Duration 129\n  Step 14: Machine Machine6, Duration 34\n  Step 15: Machine Machine16, Duration 139\n  Step 16: Machine Machine12, Duration 89\n  Step 17: Machine Machine7, Duration 108\n  Step 18: Machine Machine17, Duration 87\n  Step 19: Machine Machine19, Duration 86\n  Step 20: Machine Machine18, Duration 51\nJob22:\n  Step 1: Machine Machine0, Duration 107\n  Step 2: Machine Machine8, Duration 84\n  Step 3: Machine Machine2, Duration 70\n  Step 4: Machine Machine12, Duration 31\n  Step 5: Machine Machine19, Duration 163\n  Step 6: Machine Machine11, Duration 104\n  Step 7: Machine Machine1, Duration 54\n  Step 8: Machine Machine4, Duration 19\n  Step 9: Machine Machine6, Duration 85\n  Step 10: Machine Machine15, Duration 194\n  Step 11: Machine Machine10, Duration 157\n  Step 12: Machine Machine13, Duration 124\n  Step 13: Machine Machine5, Duration 193\n  Step 14: Machine Machine16, Duration 140\n  Step 15: Machine Machine9, Duration 187\n  Step 16: Machine Machine7, Duration 162\n  Step 17: Machine Machine14, Duration 23\n  Step 18: Machine Machine18, Duration 59\n  Step 19: Machine Machine17, Duration 26\n  Step 20: Machine Machine3, Duration 182\nJob23:\n  Step 1: Machine Machine3, Duration 86\n  Step 2: Machine Machine17, Duration 25\n  Step 3: Machine Machine19, Duration 109\n  Step 4: Machine Machine18, Duration 95\n  Step 5: Machine Machine12, Duration 85\n  Step 6: Machine Machine0, Duration 179\n  Step 7: Machine Machine9, Duration 76\n  Step 8: Machine Machine6, Duration 68\n  Step 9: Machine Machine15, Duration 104\n  Step 10: Machine Machine2, Duration 25\n  Step 11: Machine Machine4, Duration 24\n  Step 12: Machine Machine7, Duration 113\n  Step 13: Machine Machine5, Duration 37\n  Step 14: Machine Machine10, Duration 155\n  Step 15: Machine Machine8, Duration 113\n  Step 16: Machine Machine1, Duration 134\n  Step 17: Machine Machine13, Duration 190\n  Step 18: Machine Machine14, Duration 67\n  Step 19: Machine Machine11, Duration 192\n  Step 20: Machine Machine16, Duration 172\nJob24:\n  Step 1: Machine Machine19, Duration 28\n  Step 2: Machine Machine10, Duration 4\n  Step 3: Machine Machine16, Duration 91\n  Step 4: Machine Machine3, Duration 104\n  Step 5: Machine Machine13, Duration 37\n  Step 6: Machine Machine0, Duration 198\n  Step 7: Machine Machine15, Duration 53\n  Step 8: Machine Machine18, Duration 165\n  Step 9: Machine Machine1, Duration 72\n  Step 10: Machine Machine4, Duration 8\n  Step 11: Machine Machine2, Duration 93\n  Step 12: Machine Machine5, Duration 161\n  Step 13: Machine Machine6, Duration 148\n  Step 14: Machine Machine9, Duration 181\n  Step 15: Machine Machine11, Duration 109\n  Step 16: Machine Machine12, Duration 49\n  Step 17: Machine Machine14, Duration 110\n  Step 18: Machine Machine8, Duration 76\n  Step 19: Machine Machine7, Duration 130\n  Step 20: Machine Machine17, Duration 7\nJob25:\n  Step 1: Machine Machine5, Duration 36\n  Step 2: Machine Machine1, Duration 139\n  Step 3: Machine Machine17, Duration 66\n  Step 4: Machine Machine19, Duration 88\n  Step 5: Machine Machine8, Duration 41\n  Step 6: Machine Machine9, Duration 148\n  Step 7: Machine Machine7, Duration 162\n  Step 8: Machine Machine16, Duration 69\n  Step 9: Machine Machine12, Duration 189\n  Step 10: Machine Machine3, Duration 57\n  Step 11: Machine Machine0, Duration 157\n  Step 12: Machine Machine4, Duration 43\n  Step 13: Machine Machine10, Duration 198\n  Step 14: Machine Machine6, Duration 149\n  Step 15: Machine Machine2, Duration 192\n  Step 16: Machine Machine13, Duration 57\n  Step 17: Machine Machine14, Duration 95\n  Step 18: Machine Machine18, Duration 95\n  Step 19: Machine Machine11, Duration 11\n  Step 20: Machine Machine15, Duration 158\nJob26:\n  Step 1: Machine Machine5, Duration 8\n  Step 2: Machine Machine1, Duration 149\n  Step 3: Machine Machine8, Duration 168\n  Step 4: Machine Machine9, Duration 159\n  Step 5: Machine Machine12, Duration 65\n  Step 6: Machine Machine4, Duration 194\n  Step 7: Machine Machine17, Duration 48\n  Step 8: Machine Machine6, Duration 4\n  Step 9: Machine Machine2, Duration 197\n  Step 10: Machine Machine16, Duration 91\n  Step 11: Machine Machine18, Duration 122\n  Step 12: Machine Machine0, Duration 123\n  Step 13: Machine Machine15, Duration 27\n  Step 14: Machine Machine19, Duration 76\n  Step 15: Machine Machine7, Duration 147\n  Step 16: Machine Machine13, Duration 120\n  Step 17: Machine Machine14, Duration 20\n  Step 18: Machine Machine11, Duration 24\n  Step 19: Machine Machine3, Duration 133\n  Step 20: Machine Machine10, Duration 182\nJob27:\n  Step 1: Machine Machine11, Duration 29\n  Step 2: Machine Machine9, Duration 46\n  Step 3: Machine Machine7, Duration 164\n  Step 4: Machine Machine13, Duration 152\n  Step 5: Machine Machine1, Duration 4\n  Step 6: Machine Machine18, Duration 129\n  Step 7: Machine Machine14, Duration 148\n  Step 8: Machine Machine2, Duration 46\n  Step 9: Machine Machine19, Duration 98\n  Step 10: Machine Machine16, Duration 84\n  Step 11: Machine Machine10, Duration 133\n  Step 12: Machine Machine15, Duration 137\n  Step 13: Machine Machine4, Duration 192\n  Step 14: Machine Machine5, Duration 166\n  Step 15: Machine Machine3, Duration 14\n  Step 16: Machine Machine6, Duration 173\n  Step 17: Machine Machine17, Duration 44\n  Step 18: Machine Machine0, Duration 144\n  Step 19: Machine Machine8, Duration 99\n  Step 20: Machine Machine12, Duration 85\nJob28:\n  Step 1: Machine Machine9, Duration 64\n  Step 2: Machine Machine19, Duration 62\n  Step 3: Machine Machine1, Duration 3\n  Step 4: Machine Machine14, Duration 109\n  Step 5: Machine Machine12, Duration 133\n  Step 6: Machine Machine7, Duration 33\n  Step 7: Machine Machine11, Duration 19\n  Step 8: Machine Machine16, Duration 46\n  Step 9: Machine Machine0, Duration 89\n  Step 10: Machine Machine6, Duration 27\n  Step 11: Machine Machine2, Duration 108\n  Step 12: Machine Machine15, Duration 49\n  Step 13: Machine Machine10, Duration 137\n  Step 14: Machine Machine4, Duration 138\n  Step 15: Machine Machine5, Duration 27\n  Step 16: Machine Machine3, Duration 65\n  Step 17: Machine Machine17, Duration 1\n  Step 18: Machine Machine13, Duration 182\n  Step 19: Machine Machine18, Duration 35\n  Step 20: Machine Machine8, Duration 51\nJob29:\n  Step 1: Machine Machine17, Duration 165\n  Step 2: Machine Machine2, Duration 31\n  Step 3: Machine Machine7, Duration 16\n  Step 4: Machine Machine5, Duration 28\n  Step 5: Machine Machine3, Duration 81\n  Step 6: Machine Machine19, Duration 112\n  Step 7: Machine Machine11, Duration 17\n  Step 8: Machine Machine8, Duration 168\n  Step 9: Machine Machine1, Duration 139\n  Step 10: Machine Machine0, Duration 80\n  Step 11: Machine Machine9, Duration 141\n  Step 12: Machine Machine10, Duration 46\n  Step 13: Machine Machine14, Duration 26\n  Step 14: Machine Machine13, Duration 173\n  Step 15: Machine Machine4, Duration 173\n  Step 16: Machine Machine18, Duration 189\n  Step 17: Machine Machine15, Duration 193\n  Step 18: Machine Machine12, Duration 107\n  Step 19: Machine Machine16, Duration 177\n  Step 20: Machine Machine6, Duration 77\nJob30:\n  Step 1: Machine Machine3, Duration 19\n  Step 2: Machine Machine6, Duration 33\n  Step 3: Machine Machine13, Duration 161\n  Step 4: Machine Machine2, Duration 9\n  Step 5: Machine Machine9, Duration 112\n  Step 6: Machine Machine1, Duration 185\n  Step 7: Machine Machine4, Duration 134\n  Step 8: Machine Machine8, Duration 77\n  Step 9: Machine Machine5, Duration 190\n  Step 10: Machine Machine14, Duration 109\n  Step 11: Machine Machine16, Duration 149\n  Step 12: Machine Machine0, Duration 60\n  Step 13: Machine Machine19, Duration 82\n  Step 14: Machine Machine11, Duration 89\n  Step 15: Machine Machine10, Duration 193\n  Step 16: Machine Machine12, Duration 182\n  Step 17: Machine Machine17, Duration 73\n  Step 18: Machine Machine18, Duration 103\n  Step 19: Machine Machine7, Duration 153\n  Step 20: Machine Machine15, Duration 18\nJob31:\n  Step 1: Machine Machine14, Duration 34\n  Step 2: Machine Machine6, Duration 112\n  Step 3: Machine Machine7, Duration 154\n  Step 4: Machine Machine3, Duration 66\n  Step 5: Machine Machine0, Duration 147\n  Step 6: Machine Machine13, Duration 165\n  Step 7: Machine Machine19, Duration 177\n  Step 8: Machine Machine15, Duration 192\n  Step 9: Machine Machine5, Duration 160\n  Step 10: Machine Machine4, Duration 180\n  Step 11: Machine Machine18, Duration 177\n  Step 12: Machine Machine8, Duration 51\n  Step 13: Machine Machine10, Duration 82\n  Step 14: Machine Machine11, Duration 169\n  Step 15: Machine Machine9, Duration 6\n  Step 16: Machine Machine17, Duration 195\n  Step 17: Machine Machine16, Duration 149\n  Step 18: Machine Machine1, Duration 54\n  Step 19: Machine Machine2, Duration 10\n  Step 20: Machine Machine12, Duration 156\nJob32:\n  Step 1: Machine Machine1, Duration 17\n  Step 2: Machine Machine8, Duration 18\n  Step 3: Machine Machine3, Duration 165\n  Step 4: Machine Machine2, Duration 135\n  Step 5: Machine Machine15, Duration 183\n  Step 6: Machine Machine0, Duration 93\n  Step 7: Machine Machine4, Duration 87\n  Step 8: Machine Machine9, Duration 104\n  Step 9: Machine Machine14, Duration 121\n  Step 10: Machine Machine5, Duration 88\n  Step 11: Machine Machine19, Duration 87\n  Step 12: Machine Machine17, Duration 50\n  Step 13: Machine Machine18, Duration 1\n  Step 14: Machine Machine6, Duration 192\n  Step 15: Machine Machine12, Duration 65\n  Step 16: Machine Machine10, Duration 80\n  Step 17: Machine Machine7, Duration 6\n  Step 18: Machine Machine11, Duration 79\n  Step 19: Machine Machine13, Duration 8\n  Step 20: Machine Machine16, Duration 153\nJob33:\n  Step 1: Machine Machine10, Duration 197\n  Step 2: Machine Machine0, Duration 79\n  Step 3: Machine Machine17, Duration 164\n  Step 4: Machine Machine11, Duration 16\n  Step 5: Machine Machine16, Duration 65\n  Step 6: Machine Machine12, Duration 32\n  Step 7: Machine Machine15, Duration 76\n  Step 8: Machine Machine1, Duration 191\n  Step 9: Machine Machine2, Duration 101\n  Step 10: Machine Machine14, Duration 23\n  Step 11: Machine Machine6, Duration 200\n  Step 12: Machine Machine7, Duration 96\n  Step 13: Machine Machine18, Duration 151\n  Step 14: Machine Machine5, Duration 24\n  Step 15: Machine Machine3, Duration 96\n  Step 16: Machine Machine4, Duration 106\n  Step 17: Machine Machine13, Duration 2\n  Step 18: Machine Machine9, Duration 132\n  Step 19: Machine Machine8, Duration 106\n  Step 20: Machine Machine19, Duration 132\nJob34:\n  Step 1: Machine Machine16, Duration 75\n  Step 2: Machine Machine3, Duration 149\n  Step 3: Machine Machine8, Duration 40\n  Step 4: Machine Machine9, Duration 29\n  Step 5: Machine Machine13, Duration 115\n  Step 6: Machine Machine15, Duration 169\n  Step 7: Machine Machine1, Duration 139\n  Step 8: Machine Machine17, Duration 27\n  Step 9: Machine Machine14, Duration 54\n  Step 10: Machine Machine2, Duration 84\n  Step 11: Machine Machine5, Duration 30\n  Step 12: Machine Machine7, Duration 8\n  Step 13: Machine Machine11, Duration 8\n  Step 14: Machine Machine10, Duration 95\n  Step 15: Machine Machine12, Duration 113\n  Step 16: Machine Machine6, Duration 88\n  Step 17: Machine Machine0, Duration 154\n  Step 18: Machine Machine4, Duration 55\n  Step 19: Machine Machine18, Duration 158\n  Step 20: Machine Machine19, Duration 32\nJob35:\n  Step 1: Machine Machine14, Duration 133\n  Step 2: Machine Machine9, Duration 142\n  Step 3: Machine Machine4, Duration 115\n  Step 4: Machine Machine17, Duration 154\n  Step 5: Machine Machine2, Duration 178\n  Step 6: Machine Machine5, Duration 99\n  Step 7: Machine Machine15, Duration 173\n  Step 8: Machine Machine13, Duration 53\n  Step 9: Machine Machine10, Duration 77\n  Step 10: Machine Machine12, Duration 186\n  Step 11: Machine Machine19, Duration 144\n  Step 12: Machine Machine3, Duration 116\n  Step 13: Machine Machine7, Duration 113\n  Step 14: Machine Machine8, Duration 154\n  Step 15: Machine Machine18, Duration 22\n  Step 16: Machine Machine11, Duration 127\n  Step 17: Machine Machine0, Duration 28\n  Step 18: Machine Machine1, Duration 61\n  Step 19: Machine Machine16, Duration 90\n  Step 20: Machine Machine6, Duration 52\nJob36:\n  Step 1: Machine Machine7, Duration 130\n  Step 2: Machine Machine9, Duration 95\n  Step 3: Machine Machine3, Duration 38\n  Step 4: Machine Machine17, Duration 87\n  Step 5: Machine Machine11, Duration 96\n  Step 6: Machine Machine2, Duration 16\n  Step 7: Machine Machine15, Duration 79\n  Step 8: Machine Machine13, Duration 150\n  Step 9: Machine Machine4, Duration 36\n  Step 10: Machine Machine0, Duration 40\n  Step 11: Machine Machine5, Duration 5\n  Step 12: Machine Machine18, Duration 114\n  Step 13: Machine Machine10, Duration 109\n  Step 14: Machine Machine14, Duration 78\n  Step 15: Machine Machine12, Duration 14\n  Step 16: Machine Machine16, Duration 103\n  Step 17: Machine Machine6, Duration 54\n  Step 18: Machine Machine8, Duration 86\n  Step 19: Machine Machine1, Duration 154\n  Step 20: Machine Machine19, Duration 137\nJob37:\n  Step 1: Machine Machine1, Duration 30\n  Step 2: Machine Machine17, Duration 128\n  Step 3: Machine Machine12, Duration 192\n  Step 4: Machine Machine2, Duration 12\n  Step 5: Machine Machine7, Duration 48\n  Step 6: Machine Machine11, Duration 117\n  Step 7: Machine Machine15, Duration 96\n  Step 8: Machine Machine4, Duration 99\n  Step 9: Machine Machine18, Duration 30\n  Step 10: Machine Machine3, Duration 24\n  Step 11: Machine Machine14, Duration 96\n  Step 12: Machine Machine16, Duration 69\n  Step 13: Machine Machine5, Duration 49\n  Step 14: Machine Machine19, Duration 134\n  Step 15: Machine Machine10, Duration 124\n  Step 16: Machine Machine6, Duration 54\n  Step 17: Machine Machine13, Duration 16\n  Step 18: Machine Machine0, Duration 171\n  Step 19: Machine Machine9, Duration 127\n  Step 20: Machine Machine8, Duration 17\nJob38:\n  Step 1: Machine Machine10, Duration 139\n  Step 2: Machine Machine1, Duration 196\n  Step 3: Machine Machine6, Duration 135\n  Step 4: Machine Machine4, Duration 134\n  Step 5: Machine Machine12, Duration 98\n  Step 6: Machine Machine16, Duration 37\n  Step 7: Machine Machine0, Duration 12\n  Step 8: Machine Machine5, Duration 109\n  Step 9: Machine Machine18, Duration 88\n  Step 10: Machine Machine3, Duration 118\n  Step 11: Machine Machine7, Duration 48\n  Step 12: Machine Machine19, Duration 192\n  Step 13: Machine Machine14, Duration 84\n  Step 14: Machine Machine9, Duration 142\n  Step 15: Machine Machine13, Duration 147\n  Step 16: Machine Machine11, Duration 17\n  Step 17: Machine Machine2, Duration 107\n  Step 18: Machine Machine17, Duration 194\n  Step 19: Machine Machine8, Duration 122\n  Step 20: Machine Machine15, Duration 68\nJob39:\n  Step 1: Machine Machine9, Duration 106\n  Step 2: Machine Machine10, Duration 154\n  Step 3: Machine Machine1, Duration 111\n  Step 4: Machine Machine3, Duration 148\n  Step 5: Machine Machine11, Duration 128\n  Step 6: Machine Machine2, Duration 153\n  Step 7: Machine Machine15, Duration 88\n  Step 8: Machine Machine4, Duration 45\n  Step 9: Machine Machine16, Duration 191\n  Step 10: Machine Machine18, Duration 164\n  Step 11: Machine Machine17, Duration 116\n  Step 12: Machine Machine5, Duration 1\n  Step 13: Machine Machine0, Duration 31\n  Step 14: Machine Machine19, Duration 95\n  Step 15: Machine Machine7, Duration 51\n  Step 16: Machine Machine14, Duration 46\n  Step 17: Machine Machine6, Duration 123\n  Step 18: Machine Machine12, Duration 16\n  Step 19: Machine Machine8, Duration 187\n  Step 20: Machine Machine13, Duration 189\nJob40:\n  Step 1: Machine Machine12, Duration 101\n  Step 2: Machine Machine8, Duration 113\n  Step 3: Machine Machine9, Duration 38\n  Step 4: Machine Machine1, Duration 119\n  Step 5: Machine Machine2, Duration 184\n  Step 6: Machine Machine3, Duration 148\n  Step 7: Machine Machine16, Duration 148\n  Step 8: Machine Machine10, Duration 43\n  Step 9: Machine Machine15, Duration 20\n  Step 10: Machine Machine14, Duration 178\n  Step 11: Machine Machine11, Duration 83\n  Step 12: Machine Machine5, Duration 92\n  Step 13: Machine Machine0, Duration 35\n  Step 14: Machine Machine17, Duration 165\n  Step 15: Machine Machine13, Duration 38\n  Step 16: Machine Machine6, Duration 131\n  Step 17: Machine Machine19, Duration 144\n  Step 18: Machine Machine7, Duration 179\n  Step 19: Machine Machine4, Duration 30\n  Step 20: Machine Machine18, Duration 89\nJob41:\n  Step 1: Machine Machine9, Duration 164\n  Step 2: Machine Machine19, Duration 55\n  Step 3: Machine Machine8, Duration 176\n  Step 4: Machine Machine18, Duration 82\n  Step 5: Machine Machine14, Duration 61\n  Step 6: Machine Machine0, Duration 183\n  Step 7: Machine Machine15, Duration 14\n  Step 8: Machine Machine16, Duration 27\n  Step 9: Machine Machine11, Duration 66\n  Step 10: Machine Machine12, Duration 91\n  Step 11: Machine Machine13, Duration 22\n  Step 12: Machine Machine6, Duration 158\n  Step 13: Machine Machine4, Duration 165\n  Step 14: Machine Machine1, Duration 182\n  Step 15: Machine Machine17, Duration 86\n  Step 16: Machine Machine3, Duration 197\n  Step 17: Machine Machine10, Duration 139\n  Step 18: Machine Machine7, Duration 157\n  Step 19: Machine Machine5, Duration 119\n  Step 20: Machine Machine2, Duration 114\nJob42:\n  Step 1: Machine Machine15, Duration 33\n  Step 2: Machine Machine5, Duration 65\n  Step 3: Machine Machine19, Duration 109\n  Step 4: Machine Machine11, Duration 84\n  Step 5: Machine Machine2, Duration 164\n  Step 6: Machine Machine12, Duration 141\n  Step 7: Machine Machine17, Duration 132\n  Step 8: Machine Machine1, Duration 164\n  Step 9: Machine Machine4, Duration 97\n  Step 10: Machine Machine9, Duration 85\n  Step 11: Machine Machine14, Duration 125\n  Step 12: Machine Machine10, Duration 104\n  Step 13: Machine Machine8, Duration 22\n  Step 14: Machine Machine6, Duration 171\n  Step 15: Machine Machine7, Duration 115\n  Step 16: Machine Machine18, Duration 77\n  Step 17: Machine Machine0, Duration 69\n  Step 18: Machine Machine16, Duration 181\n  Step 19: Machine Machine13, Duration 121\n  Step 20: Machine Machine3, Duration 98\nJob43:\n  Step 1: Machine Machine4, Duration 44\n  Step 2: Machine Machine5, Duration 99\n  Step 3: Machine Machine19, Duration 20\n  Step 4: Machine Machine18, Duration 171\n  Step 5: Machine Machine17, Duration 174\n  Step 6: Machine Machine6, Duration 87\n  Step 7: Machine Machine13, Duration 33\n  Step 8: Machine Machine3, Duration 18\n  Step 9: Machine Machine11, Duration 153\n  Step 10: Machine Machine2, Duration 153\n  Step 11: Machine Machine16, Duration 113\n  Step 12: Machine Machine15, Duration 149\n  Step 13: Machine Machine7, Duration 103\n  Step 14: Machine Machine8, Duration 103\n  Step 15: Machine Machine10, Duration 138\n  Step 16: Machine Machine14, Duration 67\n  Step 17: Machine Machine9, Duration 56\n  Step 18: Machine Machine1, Duration 92\n  Step 19: Machine Machine0, Duration 137\n  Step 20: Machine Machine12, Duration 105\nJob44:\n  Step 1: Machine Machine13, Duration 69\n  Step 2: Machine Machine2, Duration 145\n  Step 3: Machine Machine4, Duration 4\n  Step 4: Machine Machine10, Duration 11\n  Step 5: Machine Machine16, Duration 54\n  Step 6: Machine Machine14, Duration 150\n  Step 7: Machine Machine17, Duration 31\n  Step 8: Machine Machine3, Duration 168\n  Step 9: Machine Machine18, Duration 142\n  Step 10: Machine Machine12, Duration 86\n  Step 11: Machine Machine5, Duration 19\n  Step 12: Machine Machine9, Duration 111\n  Step 13: Machine Machine11, Duration 89\n  Step 14: Machine Machine19, Duration 53\n  Step 15: Machine Machine15, Duration 96\n  Step 16: Machine Machine1, Duration 179\n  Step 17: Machine Machine8, Duration 148\n  Step 18: Machine Machine0, Duration 195\n  Step 19: Machine Machine7, Duration 23\n  Step 20: Machine Machine6, Duration 161\nJob45:\n  Step 1: Machine Machine15, Duration 95\n  Step 2: Machine Machine7, Duration 75\n  Step 3: Machine Machine13, Duration 65\n  Step 4: Machine Machine17, Duration 83\n  Step 5: Machine Machine18, Duration 169\n  Step 6: Machine Machine8, Duration 170\n  Step 7: Machine Machine16, Duration 195\n  Step 8: Machine Machine0, Duration 193\n  Step 9: Machine Machine11, Duration 144\n  Step 10: Machine Machine10, Duration 53\n  Step 11: Machine Machine12, Duration 102\n  Step 12: Machine Machine4, Duration 27\n  Step 13: Machine Machine3, Duration 122\n  Step 14: Machine Machine2, Duration 199\n  Step 15: Machine Machine19, Duration 198\n  Step 16: Machine Machine6, Duration 184\n  Step 17: Machine Machine9, Duration 6\n  Step 18: Machine Machine5, Duration 9\n  Step 19: Machine Machine14, Duration 124\n  Step 20: Machine Machine1, Duration 17\nJob46:\n  Step 1: Machine Machine2, Duration 175\n  Step 2: Machine Machine11, Duration 137\n  Step 3: Machine Machine3, Duration 74\n  Step 4: Machine Machine9, Duration 3\n  Step 5: Machine Machine4, Duration 94\n  Step 6: Machine Machine5, Duration 2\n  Step 7: Machine Machine13, Duration 175\n  Step 8: Machine Machine17, Duration 134\n  Step 9: Machine Machine7, Duration 46\n  Step 10: Machine Machine12, Duration 120\n  Step 11: Machine Machine18, Duration 184\n  Step 12: Machine Machine15, Duration 123\n  Step 13: Machine Machine10, Duration 118\n  Step 14: Machine Machine0, Duration 76\n  Step 15: Machine Machine14, Duration 195\n  Step 16: Machine Machine6, Duration 37\n  Step 17: Machine Machine16, Duration 38\n  Step 18: Machine Machine8, Duration 92\n  Step 19: Machine Machine19, Duration 146\n  Step 20: Machine Machine1, Duration 43\nJob47:\n  Step 1: Machine Machine17, Duration 105\n  Step 2: Machine Machine16, Duration 68\n  Step 3: Machine Machine2, Duration 195\n  Step 4: Machine Machine4, Duration 131\n  Step 5: Machine Machine15, Duration 9\n  Step 6: Machine Machine18, Duration 61\n  Step 7: Machine Machine12, Duration 170\n  Step 8: Machine Machine19, Duration 186\n  Step 9: Machine Machine13, Duration 152\n  Step 10: Machine Machine6, Duration 166\n  Step 11: Machine Machine9, Duration 69\n  Step 12: Machine Machine14, Duration 46\n  Step 13: Machine Machine10, Duration 164\n  Step 14: Machine Machine11, Duration 46\n  Step 15: Machine Machine5, Duration 84\n  Step 16: Machine Machine1, Duration 133\n  Step 17: Machine Machine0, Duration 19\n  Step 18: Machine Machine3, Duration 199\n  Step 19: Machine Machine7, Duration 175\n  Step 20: Machine Machine8, Duration 59\nJob48:\n  Step 1: Machine Machine10, Duration 127\n  Step 2: Machine Machine6, Duration 163\n  Step 3: Machine Machine19, Duration 152\n  Step 4: Machine Machine14, Duration 149\n  Step 5: Machine Machine17, Duration 12\n  Step 6: Machine Machine13, Duration 11\n  Step 7: Machine Machine3, Duration 89\n  Step 8: Machine Machine5, Duration 97\n  Step 9: Machine Machine16, Duration 87\n  Step 10: Machine Machine18, Duration 120\n  Step 11: Machine Machine2, Duration 135\n  Step 12: Machine Machine0, Duration 123\n  Step 13: Machine Machine12, Duration 161\n  Step 14: Machine Machine15, Duration 58\n  Step 15: Machine Machine8, Duration 139\n  Step 16: Machine Machine7, Duration 82\n  Step 17: Machine Machine4, Duration 1\n  Step 18: Machine Machine11, Duration 93\n  Step 19: Machine Machine9, Duration 185\n  Step 20: Machine Machine1, Duration 167\nJob49:\n  Step 1: Machine Machine19, Duration 154\n  Step 2: Machine Machine3, Duration 124\n  Step 3: Machine Machine5, Duration 198\n  Step 4: Machine Machine15, Duration 49\n  Step 5: Machine Machine0, Duration 100\n  Step 6: Machine Machine8, Duration 145\n  Step 7: Machine Machine4, Duration 17\n  Step 8: Machine Machine12, Duration 103\n  Step 9: Machine Machine13, Duration 130\n  Step 10: Machine Machine18, Duration 170\n  Step 11: Machine Machine1, Duration 130\n  Step 12: Machine Machine17, Duration 122\n  Step 13: Machine Machine11, Duration 137\n  Step 14: Machine Machine14, Duration 33\n  Step 15: Machine Machine6, Duration 109\n  Step 16: Machine Machine2, Duration 26\n  Step 17: Machine Machine9, Duration 120\n  Step 18: Machine Machine7, Duration 33\n  Step 19: Machine Machine10, Duration 140\n  Step 20: Machine Machine16, Duration 126\nJob50:\n  Step 1: Machine Machine18, Duration 57\n  Step 2: Machine Machine17, Duration 133\n  Step 3: Machine Machine10, Duration 124\n  Step 4: Machine Machine16, Duration 188\n  Step 5: Machine Machine4, Duration 53\n  Step 6: Machine Machine15, Duration 24\n  Step 7: Machine Machine11, Duration 81\n  Step 8: Machine Machine1, Duration 93\n  Step 9: Machine Machine7, Duration 89\n  Step 10: Machine Machine19, Duration 12\n  Step 11: Machine Machine6, Duration 110\n  Step 12: Machine Machine8, Duration 111\n  Step 13: Machine Machine0, Duration 72\n  Step 14: Machine Machine13, Duration 163\n  Step 15: Machine Machine12, Duration 155\n  Step 16: Machine Machine5, Duration 151\n  Step 17: Machine Machine3, Duration 121\n  Step 18: Machine Machine2, Duration 98\n  Step 19: Machine Machine9, Duration 95\n  Step 20: Machine Machine14, Duration 164\n        \n        REQUIRED OUTPUT FORMAT:\n        You must provide your solution in the following exact format:\n        \n        1. FINAL MAKESPAN: [integer value]\n        2. STRUCTURED SCHEDULE:\n           For each operation, provide:\n           - Job: [job_name]\n           - Step: [step_number]\n           - Machine: [machine_name]\n           - Start Time: [start_time]\n           - End Time: [end_time]\n           - Duration: [duration]\n        \n        Example format:\n        FINAL MAKESPAN: 25\n        STRUCTURED SCHEDULE:\n        - Job: Job1, Step: 1, Machine: Machine0, Start Time: 0, End Time: 3, Duration: 3\n        - Job: Job1, Step: 2, Machine: Machine1, Start Time: 3, End Time: 7, Duration: 4\n        - Job: Job2, Step: 1, Machine: Machine1, Start Time: 7, End Time: 10, Duration: 3\n        \n        Please solve this Job Shop Scheduling Problem and provide:\n        1. A valid schedule with start and end times for each operation\n        2. The minimum makespan (total completion time)\n        3. Ensure all constraints are satisfied:\n           - Job precedence: operations within a job must be sequential\n           - Machine constraints: no overlapping operations on the same machine\n        "
        },
        "Supervisor Agent": {
          "system_message": "You are a Supervisor Agent responsible for final coordination and optimization.",
          "query": "\n        Job Shop Scheduling Problem (JSSP) - Dataset: rcmax_50_20_6\n        \n        Problem Description:\n        - Number of jobs: 50\n        - Each job has multiple operations that must be performed in sequence\n        - Each operation requires a specific machine and has a duration\n        - Each machine can only process one operation at a time\n        - Goal: Find the minimum makespan (total completion time)\n        \n        Job Specifications:\n        \nJob1:\n  Step 1: Machine Machine12, Duration 93\n  Step 2: Machine Machine17, Duration 199\n  Step 3: Machine Machine13, Duration 26\n  Step 4: Machine Machine0, Duration 48\n  Step 5: Machine Machine9, Duration 172\n  Step 6: Machine Machine2, Duration 175\n  Step 7: Machine Machine14, Duration 39\n  Step 8: Machine Machine16, Duration 39\n  Step 9: Machine Machine11, Duration 11\n  Step 10: Machine Machine4, Duration 138\n  Step 11: Machine Machine6, Duration 197\n  Step 12: Machine Machine8, Duration 97\n  Step 13: Machine Machine15, Duration 92\n  Step 14: Machine Machine1, Duration 46\n  Step 15: Machine Machine18, Duration 182\n  Step 16: Machine Machine10, Duration 180\n  Step 17: Machine Machine3, Duration 109\n  Step 18: Machine Machine19, Duration 147\n  Step 19: Machine Machine7, Duration 167\n  Step 20: Machine Machine5, Duration 66\nJob2:\n  Step 1: Machine Machine0, Duration 40\n  Step 2: Machine Machine7, Duration 46\n  Step 3: Machine Machine18, Duration 52\n  Step 4: Machine Machine9, Duration 126\n  Step 5: Machine Machine12, Duration 136\n  Step 6: Machine Machine19, Duration 147\n  Step 7: Machine Machine15, Duration 152\n  Step 8: Machine Machine3, Duration 28\n  Step 9: Machine Machine11, Duration 101\n  Step 10: Machine Machine13, Duration 8\n  Step 11: Machine Machine14, Duration 110\n  Step 12: Machine Machine2, Duration 6\n  Step 13: Machine Machine6, Duration 103\n  Step 14: Machine Machine1, Duration 166\n  Step 15: Machine Machine16, Duration 51\n  Step 16: Machine Machine10, Duration 4\n  Step 17: Machine Machine17, Duration 119\n  Step 18: Machine Machine5, Duration 100\n  Step 19: Machine Machine4, Duration 197\n  Step 20: Machine Machine8, Duration 185\nJob3:\n  Step 1: Machine Machine7, Duration 109\n  Step 2: Machine Machine5, Duration 198\n  Step 3: Machine Machine15, Duration 133\n  Step 4: Machine Machine18, Duration 19\n  Step 5: Machine Machine2, Duration 112\n  Step 6: Machine Machine10, Duration 118\n  Step 7: Machine Machine6, Duration 9\n  Step 8: Machine Machine1, Duration 46\n  Step 9: Machine Machine17, Duration 21\n  Step 10: Machine Machine4, Duration 87\n  Step 11: Machine Machine14, Duration 32\n  Step 12: Machine Machine8, Duration 86\n  Step 13: Machine Machine9, Duration 46\n  Step 14: Machine Machine0, Duration 70\n  Step 15: Machine Machine11, Duration 52\n  Step 16: Machine Machine16, Duration 27\n  Step 17: Machine Machine12, Duration 120\n  Step 18: Machine Machine3, Duration 154\n  Step 19: Machine Machine19, Duration 28\n  Step 20: Machine Machine13, Duration 123\nJob4:\n  Step 1: Machine Machine7, Duration 136\n  Step 2: Machine Machine14, Duration 93\n  Step 3: Machine Machine12, Duration 123\n  Step 4: Machine Machine2, Duration 167\n  Step 5: Machine Machine10, Duration 158\n  Step 6: Machine Machine11, Duration 53\n  Step 7: Machine Machine19, Duration 99\n  Step 8: Machine Machine0, Duration 8\n  Step 9: Machine Machine17, Duration 191\n  Step 10: Machine Machine4, Duration 138\n  Step 11: Machine Machine9, Duration 149\n  Step 12: Machine Machine5, Duration 156\n  Step 13: Machine Machine13, Duration 30\n  Step 14: Machine Machine16, Duration 90\n  Step 15: Machine Machine3, Duration 124\n  Step 16: Machine Machine8, Duration 127\n  Step 17: Machine Machine18, Duration 67\n  Step 18: Machine Machine1, Duration 104\n  Step 19: Machine Machine15, Duration 116\n  Step 20: Machine Machine6, Duration 127\nJob5:\n  Step 1: Machine Machine7, Duration 42\n  Step 2: Machine Machine16, Duration 128\n  Step 3: Machine Machine2, Duration 170\n  Step 4: Machine Machine18, Duration 5\n  Step 5: Machine Machine13, Duration 80\n  Step 6: Machine Machine11, Duration 124\n  Step 7: Machine Machine5, Duration 137\n  Step 8: Machine Machine15, Duration 15\n  Step 9: Machine Machine10, Duration 180\n  Step 10: Machine Machine19, Duration 53\n  Step 11: Machine Machine0, Duration 190\n  Step 12: Machine Machine1, Duration 46\n  Step 13: Machine Machine8, Duration 149\n  Step 14: Machine Machine6, Duration 129\n  Step 15: Machine Machine12, Duration 178\n  Step 16: Machine Machine9, Duration 144\n  Step 17: Machine Machine14, Duration 124\n  Step 18: Machine Machine17, Duration 196\n  Step 19: Machine Machine3, Duration 18\n  Step 20: Machine Machine4, Duration 110\nJob6:\n  Step 1: Machine Machine9, Duration 59\n  Step 2: Machine Machine17, Duration 116\n  Step 3: Machine Machine16, Duration 68\n  Step 4: Machine Machine13, Duration 35\n  Step 5: Machine Machine0, Duration 169\n  Step 6: Machine Machine14, Duration 70\n  Step 7: Machine Machine1, Duration 129\n  Step 8: Machine Machine12, Duration 34\n  Step 9: Machine Machine10, Duration 73\n  Step 10: Machine Machine18, Duration 77\n  Step 11: Machine Machine11, Duration 177\n  Step 12: Machine Machine4, Duration 63\n  Step 13: Machine Machine3, Duration 13\n  Step 14: Machine Machine2, Duration 58\n  Step 15: Machine Machine15, Duration 137\n  Step 16: Machine Machine5, Duration 84\n  Step 17: Machine Machine8, Duration 67\n  Step 18: Machine Machine19, Duration 121\n  Step 19: Machine Machine7, Duration 187\n  Step 20: Machine Machine6, Duration 105\nJob7:\n  Step 1: Machine Machine16, Duration 57\n  Step 2: Machine Machine1, Duration 173\n  Step 3: Machine Machine7, Duration 6\n  Step 4: Machine Machine5, Duration 19\n  Step 5: Machine Machine12, Duration 91\n  Step 6: Machine Machine11, Duration 114\n  Step 7: Machine Machine14, Duration 94\n  Step 8: Machine Machine17, Duration 156\n  Step 9: Machine Machine9, Duration 72\n  Step 10: Machine Machine19, Duration 112\n  Step 11: Machine Machine18, Duration 1\n  Step 12: Machine Machine13, Duration 111\n  Step 13: Machine Machine2, Duration 168\n  Step 14: Machine Machine3, Duration 44\n  Step 15: Machine Machine6, Duration 15\n  Step 16: Machine Machine4, Duration 194\n  Step 17: Machine Machine0, Duration 119\n  Step 18: Machine Machine15, Duration 57\n  Step 19: Machine Machine10, Duration 101\n  Step 20: Machine Machine8, Duration 164\nJob8:\n  Step 1: Machine Machine9, Duration 126\n  Step 2: Machine Machine11, Duration 29\n  Step 3: Machine Machine15, Duration 17\n  Step 4: Machine Machine8, Duration 62\n  Step 5: Machine Machine0, Duration 171\n  Step 6: Machine Machine14, Duration 181\n  Step 7: Machine Machine13, Duration 184\n  Step 8: Machine Machine12, Duration 35\n  Step 9: Machine Machine5, Duration 30\n  Step 10: Machine Machine4, Duration 115\n  Step 11: Machine Machine6, Duration 2\n  Step 12: Machine Machine3, Duration 151\n  Step 13: Machine Machine16, Duration 65\n  Step 14: Machine Machine19, Duration 91\n  Step 15: Machine Machine1, Duration 77\n  Step 16: Machine Machine17, Duration 166\n  Step 17: Machine Machine2, Duration 74\n  Step 18: Machine Machine10, Duration 183\n  Step 19: Machine Machine18, Duration 177\n  Step 20: Machine Machine7, Duration 187\nJob9:\n  Step 1: Machine Machine8, Duration 99\n  Step 2: Machine Machine18, Duration 122\n  Step 3: Machine Machine11, Duration 49\n  Step 4: Machine Machine7, Duration 44\n  Step 5: Machine Machine10, Duration 126\n  Step 6: Machine Machine17, Duration 168\n  Step 7: Machine Machine3, Duration 20\n  Step 8: Machine Machine6, Duration 46\n  Step 9: Machine Machine14, Duration 190\n  Step 10: Machine Machine4, Duration 162\n  Step 11: Machine Machine1, Duration 184\n  Step 12: Machine Machine0, Duration 96\n  Step 13: Machine Machine5, Duration 170\n  Step 14: Machine Machine16, Duration 147\n  Step 15: Machine Machine19, Duration 10\n  Step 16: Machine Machine13, Duration 142\n  Step 17: Machine Machine9, Duration 111\n  Step 18: Machine Machine12, Duration 12\n  Step 19: Machine Machine2, Duration 86\n  Step 20: Machine Machine15, Duration 196\nJob10:\n  Step 1: Machine Machine12, Duration 114\n  Step 2: Machine Machine16, Duration 75\n  Step 3: Machine Machine15, Duration 66\n  Step 4: Machine Machine9, Duration 170\n  Step 5: Machine Machine6, Duration 70\n  Step 6: Machine Machine2, Duration 50\n  Step 7: Machine Machine10, Duration 131\n  Step 8: Machine Machine11, Duration 57\n  Step 9: Machine Machine5, Duration 61\n  Step 10: Machine Machine0, Duration 188\n  Step 11: Machine Machine8, Duration 74\n  Step 12: Machine Machine1, Duration 107\n  Step 13: Machine Machine13, Duration 152\n  Step 14: Machine Machine4, Duration 152\n  Step 15: Machine Machine18, Duration 60\n  Step 16: Machine Machine17, Duration 97\n  Step 17: Machine Machine19, Duration 19\n  Step 18: Machine Machine3, Duration 15\n  Step 19: Machine Machine7, Duration 147\n  Step 20: Machine Machine14, Duration 156\nJob11:\n  Step 1: Machine Machine0, Duration 29\n  Step 2: Machine Machine1, Duration 179\n  Step 3: Machine Machine7, Duration 109\n  Step 4: Machine Machine4, Duration 30\n  Step 5: Machine Machine18, Duration 92\n  Step 6: Machine Machine10, Duration 71\n  Step 7: Machine Machine9, Duration 111\n  Step 8: Machine Machine15, Duration 146\n  Step 9: Machine Machine5, Duration 77\n  Step 10: Machine Machine19, Duration 59\n  Step 11: Machine Machine2, Duration 146\n  Step 12: Machine Machine17, Duration 16\n  Step 13: Machine Machine16, Duration 49\n  Step 14: Machine Machine13, Duration 12\n  Step 15: Machine Machine12, Duration 144\n  Step 16: Machine Machine3, Duration 95\n  Step 17: Machine Machine14, Duration 163\n  Step 18: Machine Machine6, Duration 199\n  Step 19: Machine Machine11, Duration 157\n  Step 20: Machine Machine8, Duration 131\nJob12:\n  Step 1: Machine Machine17, Duration 174\n  Step 2: Machine Machine13, Duration 22\n  Step 3: Machine Machine11, Duration 142\n  Step 4: Machine Machine8, Duration 32\n  Step 5: Machine Machine14, Duration 49\n  Step 6: Machine Machine10, Duration 97\n  Step 7: Machine Machine5, Duration 47\n  Step 8: Machine Machine4, Duration 140\n  Step 9: Machine Machine12, Duration 49\n  Step 10: Machine Machine18, Duration 41\n  Step 11: Machine Machine9, Duration 157\n  Step 12: Machine Machine2, Duration 3\n  Step 13: Machine Machine7, Duration 198\n  Step 14: Machine Machine19, Duration 92\n  Step 15: Machine Machine0, Duration 2\n  Step 16: Machine Machine3, Duration 142\n  Step 17: Machine Machine1, Duration 114\n  Step 18: Machine Machine16, Duration 4\n  Step 19: Machine Machine6, Duration 98\n  Step 20: Machine Machine15, Duration 100\nJob13:\n  Step 1: Machine Machine17, Duration 47\n  Step 2: Machine Machine8, Duration 55\n  Step 3: Machine Machine7, Duration 136\n  Step 4: Machine Machine9, Duration 51\n  Step 5: Machine Machine1, Duration 79\n  Step 6: Machine Machine4, Duration 37\n  Step 7: Machine Machine15, Duration 100\n  Step 8: Machine Machine14, Duration 139\n  Step 9: Machine Machine0, Duration 45\n  Step 10: Machine Machine10, Duration 39\n  Step 11: Machine Machine16, Duration 160\n  Step 12: Machine Machine19, Duration 90\n  Step 13: Machine Machine5, Duration 114\n  Step 14: Machine Machine13, Duration 13\n  Step 15: Machine Machine2, Duration 66\n  Step 16: Machine Machine11, Duration 90\n  Step 17: Machine Machine12, Duration 187\n  Step 18: Machine Machine6, Duration 47\n  Step 19: Machine Machine18, Duration 75\n  Step 20: Machine Machine3, Duration 151\nJob14:\n  Step 1: Machine Machine18, Duration 139\n  Step 2: Machine Machine5, Duration 102\n  Step 3: Machine Machine4, Duration 181\n  Step 4: Machine Machine7, Duration 24\n  Step 5: Machine Machine13, Duration 142\n  Step 6: Machine Machine8, Duration 23\n  Step 7: Machine Machine16, Duration 100\n  Step 8: Machine Machine11, Duration 95\n  Step 9: Machine Machine3, Duration 89\n  Step 10: Machine Machine14, Duration 144\n  Step 11: Machine Machine15, Duration 159\n  Step 12: Machine Machine10, Duration 176\n  Step 13: Machine Machine9, Duration 153\n  Step 14: Machine Machine2, Duration 112\n  Step 15: Machine Machine12, Duration 136\n  Step 16: Machine Machine6, Duration 97\n  Step 17: Machine Machine19, Duration 176\n  Step 18: Machine Machine17, Duration 20\n  Step 19: Machine Machine1, Duration 154\n  Step 20: Machine Machine0, Duration 15\nJob15:\n  Step 1: Machine Machine16, Duration 183\n  Step 2: Machine Machine12, Duration 53\n  Step 3: Machine Machine2, Duration 2\n  Step 4: Machine Machine15, Duration 26\n  Step 5: Machine Machine1, Duration 196\n  Step 6: Machine Machine9, Duration 15\n  Step 7: Machine Machine18, Duration 5\n  Step 8: Machine Machine7, Duration 103\n  Step 9: Machine Machine3, Duration 40\n  Step 10: Machine Machine5, Duration 86\n  Step 11: Machine Machine4, Duration 130\n  Step 12: Machine Machine6, Duration 118\n  Step 13: Machine Machine0, Duration 111\n  Step 14: Machine Machine8, Duration 94\n  Step 15: Machine Machine13, Duration 118\n  Step 16: Machine Machine11, Duration 119\n  Step 17: Machine Machine19, Duration 188\n  Step 18: Machine Machine17, Duration 119\n  Step 19: Machine Machine14, Duration 55\n  Step 20: Machine Machine10, Duration 146\nJob16:\n  Step 1: Machine Machine0, Duration 97\n  Step 2: Machine Machine9, Duration 197\n  Step 3: Machine Machine1, Duration 127\n  Step 4: Machine Machine8, Duration 39\n  Step 5: Machine Machine11, Duration 80\n  Step 6: Machine Machine5, Duration 138\n  Step 7: Machine Machine13, Duration 77\n  Step 8: Machine Machine2, Duration 3\n  Step 9: Machine Machine17, Duration 116\n  Step 10: Machine Machine4, Duration 115\n  Step 11: Machine Machine6, Duration 127\n  Step 12: Machine Machine18, Duration 61\n  Step 13: Machine Machine7, Duration 124\n  Step 14: Machine Machine15, Duration 7\n  Step 15: Machine Machine12, Duration 111\n  Step 16: Machine Machine14, Duration 40\n  Step 17: Machine Machine16, Duration 96\n  Step 18: Machine Machine10, Duration 34\n  Step 19: Machine Machine19, Duration 159\n  Step 20: Machine Machine3, Duration 29\nJob17:\n  Step 1: Machine Machine18, Duration 123\n  Step 2: Machine Machine5, Duration 22\n  Step 3: Machine Machine1, Duration 135\n  Step 4: Machine Machine19, Duration 99\n  Step 5: Machine Machine8, Duration 105\n  Step 6: Machine Machine11, Duration 14\n  Step 7: Machine Machine13, Duration 159\n  Step 8: Machine Machine9, Duration 21\n  Step 9: Machine Machine14, Duration 86\n  Step 10: Machine Machine17, Duration 12\n  Step 11: Machine Machine7, Duration 49\n  Step 12: Machine Machine6, Duration 160\n  Step 13: Machine Machine4, Duration 66\n  Step 14: Machine Machine12, Duration 9\n  Step 15: Machine Machine3, Duration 31\n  Step 16: Machine Machine16, Duration 134\n  Step 17: Machine Machine15, Duration 12\n  Step 18: Machine Machine10, Duration 38\n  Step 19: Machine Machine2, Duration 131\n  Step 20: Machine Machine0, Duration 55\nJob18:\n  Step 1: Machine Machine12, Duration 18\n  Step 2: Machine Machine11, Duration 93\n  Step 3: Machine Machine7, Duration 128\n  Step 4: Machine Machine17, Duration 41\n  Step 5: Machine Machine8, Duration 174\n  Step 6: Machine Machine4, Duration 75\n  Step 7: Machine Machine15, Duration 44\n  Step 8: Machine Machine5, Duration 15\n  Step 9: Machine Machine9, Duration 100\n  Step 10: Machine Machine14, Duration 58\n  Step 11: Machine Machine10, Duration 166\n  Step 12: Machine Machine13, Duration 89\n  Step 13: Machine Machine16, Duration 174\n  Step 14: Machine Machine19, Duration 91\n  Step 15: Machine Machine3, Duration 33\n  Step 16: Machine Machine0, Duration 28\n  Step 17: Machine Machine6, Duration 195\n  Step 18: Machine Machine1, Duration 163\n  Step 19: Machine Machine18, Duration 95\n  Step 20: Machine Machine2, Duration 40\nJob19:\n  Step 1: Machine Machine18, Duration 185\n  Step 2: Machine Machine9, Duration 88\n  Step 3: Machine Machine13, Duration 135\n  Step 4: Machine Machine1, Duration 98\n  Step 5: Machine Machine15, Duration 196\n  Step 6: Machine Machine0, Duration 119\n  Step 7: Machine Machine8, Duration 52\n  Step 8: Machine Machine10, Duration 21\n  Step 9: Machine Machine6, Duration 130\n  Step 10: Machine Machine4, Duration 141\n  Step 11: Machine Machine17, Duration 52\n  Step 12: Machine Machine14, Duration 96\n  Step 13: Machine Machine2, Duration 34\n  Step 14: Machine Machine3, Duration 115\n  Step 15: Machine Machine12, Duration 5\n  Step 16: Machine Machine5, Duration 74\n  Step 17: Machine Machine11, Duration 104\n  Step 18: Machine Machine19, Duration 88\n  Step 19: Machine Machine7, Duration 162\n  Step 20: Machine Machine16, Duration 113\nJob20:\n  Step 1: Machine Machine6, Duration 63\n  Step 2: Machine Machine2, Duration 140\n  Step 3: Machine Machine4, Duration 8\n  Step 4: Machine Machine0, Duration 73\n  Step 5: Machine Machine15, Duration 115\n  Step 6: Machine Machine3, Duration 178\n  Step 7: Machine Machine1, Duration 101\n  Step 8: Machine Machine17, Duration 149\n  Step 9: Machine Machine19, Duration 137\n  Step 10: Machine Machine18, Duration 170\n  Step 11: Machine Machine16, Duration 92\n  Step 12: Machine Machine8, Duration 149\n  Step 13: Machine Machine9, Duration 180\n  Step 14: Machine Machine11, Duration 103\n  Step 15: Machine Machine7, Duration 179\n  Step 16: Machine Machine13, Duration 106\n  Step 17: Machine Machine5, Duration 57\n  Step 18: Machine Machine12, Duration 171\n  Step 19: Machine Machine14, Duration 112\n  Step 20: Machine Machine10, Duration 104\nJob21:\n  Step 1: Machine Machine8, Duration 125\n  Step 2: Machine Machine5, Duration 82\n  Step 3: Machine Machine2, Duration 151\n  Step 4: Machine Machine9, Duration 10\n  Step 5: Machine Machine4, Duration 162\n  Step 6: Machine Machine10, Duration 144\n  Step 7: Machine Machine1, Duration 9\n  Step 8: Machine Machine13, Duration 193\n  Step 9: Machine Machine0, Duration 165\n  Step 10: Machine Machine3, Duration 98\n  Step 11: Machine Machine14, Duration 134\n  Step 12: Machine Machine11, Duration 198\n  Step 13: Machine Machine15, Duration 129\n  Step 14: Machine Machine6, Duration 34\n  Step 15: Machine Machine16, Duration 139\n  Step 16: Machine Machine12, Duration 89\n  Step 17: Machine Machine7, Duration 108\n  Step 18: Machine Machine17, Duration 87\n  Step 19: Machine Machine19, Duration 86\n  Step 20: Machine Machine18, Duration 51\nJob22:\n  Step 1: Machine Machine0, Duration 107\n  Step 2: Machine Machine8, Duration 84\n  Step 3: Machine Machine2, Duration 70\n  Step 4: Machine Machine12, Duration 31\n  Step 5: Machine Machine19, Duration 163\n  Step 6: Machine Machine11, Duration 104\n  Step 7: Machine Machine1, Duration 54\n  Step 8: Machine Machine4, Duration 19\n  Step 9: Machine Machine6, Duration 85\n  Step 10: Machine Machine15, Duration 194\n  Step 11: Machine Machine10, Duration 157\n  Step 12: Machine Machine13, Duration 124\n  Step 13: Machine Machine5, Duration 193\n  Step 14: Machine Machine16, Duration 140\n  Step 15: Machine Machine9, Duration 187\n  Step 16: Machine Machine7, Duration 162\n  Step 17: Machine Machine14, Duration 23\n  Step 18: Machine Machine18, Duration 59\n  Step 19: Machine Machine17, Duration 26\n  Step 20: Machine Machine3, Duration 182\nJob23:\n  Step 1: Machine Machine3, Duration 86\n  Step 2: Machine Machine17, Duration 25\n  Step 3: Machine Machine19, Duration 109\n  Step 4: Machine Machine18, Duration 95\n  Step 5: Machine Machine12, Duration 85\n  Step 6: Machine Machine0, Duration 179\n  Step 7: Machine Machine9, Duration 76\n  Step 8: Machine Machine6, Duration 68\n  Step 9: Machine Machine15, Duration 104\n  Step 10: Machine Machine2, Duration 25\n  Step 11: Machine Machine4, Duration 24\n  Step 12: Machine Machine7, Duration 113\n  Step 13: Machine Machine5, Duration 37\n  Step 14: Machine Machine10, Duration 155\n  Step 15: Machine Machine8, Duration 113\n  Step 16: Machine Machine1, Duration 134\n  Step 17: Machine Machine13, Duration 190\n  Step 18: Machine Machine14, Duration 67\n  Step 19: Machine Machine11, Duration 192\n  Step 20: Machine Machine16, Duration 172\nJob24:\n  Step 1: Machine Machine19, Duration 28\n  Step 2: Machine Machine10, Duration 4\n  Step 3: Machine Machine16, Duration 91\n  Step 4: Machine Machine3, Duration 104\n  Step 5: Machine Machine13, Duration 37\n  Step 6: Machine Machine0, Duration 198\n  Step 7: Machine Machine15, Duration 53\n  Step 8: Machine Machine18, Duration 165\n  Step 9: Machine Machine1, Duration 72\n  Step 10: Machine Machine4, Duration 8\n  Step 11: Machine Machine2, Duration 93\n  Step 12: Machine Machine5, Duration 161\n  Step 13: Machine Machine6, Duration 148\n  Step 14: Machine Machine9, Duration 181\n  Step 15: Machine Machine11, Duration 109\n  Step 16: Machine Machine12, Duration 49\n  Step 17: Machine Machine14, Duration 110\n  Step 18: Machine Machine8, Duration 76\n  Step 19: Machine Machine7, Duration 130\n  Step 20: Machine Machine17, Duration 7\nJob25:\n  Step 1: Machine Machine5, Duration 36\n  Step 2: Machine Machine1, Duration 139\n  Step 3: Machine Machine17, Duration 66\n  Step 4: Machine Machine19, Duration 88\n  Step 5: Machine Machine8, Duration 41\n  Step 6: Machine Machine9, Duration 148\n  Step 7: Machine Machine7, Duration 162\n  Step 8: Machine Machine16, Duration 69\n  Step 9: Machine Machine12, Duration 189\n  Step 10: Machine Machine3, Duration 57\n  Step 11: Machine Machine0, Duration 157\n  Step 12: Machine Machine4, Duration 43\n  Step 13: Machine Machine10, Duration 198\n  Step 14: Machine Machine6, Duration 149\n  Step 15: Machine Machine2, Duration 192\n  Step 16: Machine Machine13, Duration 57\n  Step 17: Machine Machine14, Duration 95\n  Step 18: Machine Machine18, Duration 95\n  Step 19: Machine Machine11, Duration 11\n  Step 20: Machine Machine15, Duration 158\nJob26:\n  Step 1: Machine Machine5, Duration 8\n  Step 2: Machine Machine1, Duration 149\n  Step 3: Machine Machine8, Duration 168\n  Step 4: Machine Machine9, Duration 159\n  Step 5: Machine Machine12, Duration 65\n  Step 6: Machine Machine4, Duration 194\n  Step 7: Machine Machine17, Duration 48\n  Step 8: Machine Machine6, Duration 4\n  Step 9: Machine Machine2, Duration 197\n  Step 10: Machine Machine16, Duration 91\n  Step 11: Machine Machine18, Duration 122\n  Step 12: Machine Machine0, Duration 123\n  Step 13: Machine Machine15, Duration 27\n  Step 14: Machine Machine19, Duration 76\n  Step 15: Machine Machine7, Duration 147\n  Step 16: Machine Machine13, Duration 120\n  Step 17: Machine Machine14, Duration 20\n  Step 18: Machine Machine11, Duration 24\n  Step 19: Machine Machine3, Duration 133\n  Step 20: Machine Machine10, Duration 182\nJob27:\n  Step 1: Machine Machine11, Duration 29\n  Step 2: Machine Machine9, Duration 46\n  Step 3: Machine Machine7, Duration 164\n  Step 4: Machine Machine13, Duration 152\n  Step 5: Machine Machine1, Duration 4\n  Step 6: Machine Machine18, Duration 129\n  Step 7: Machine Machine14, Duration 148\n  Step 8: Machine Machine2, Duration 46\n  Step 9: Machine Machine19, Duration 98\n  Step 10: Machine Machine16, Duration 84\n  Step 11: Machine Machine10, Duration 133\n  Step 12: Machine Machine15, Duration 137\n  Step 13: Machine Machine4, Duration 192\n  Step 14: Machine Machine5, Duration 166\n  Step 15: Machine Machine3, Duration 14\n  Step 16: Machine Machine6, Duration 173\n  Step 17: Machine Machine17, Duration 44\n  Step 18: Machine Machine0, Duration 144\n  Step 19: Machine Machine8, Duration 99\n  Step 20: Machine Machine12, Duration 85\nJob28:\n  Step 1: Machine Machine9, Duration 64\n  Step 2: Machine Machine19, Duration 62\n  Step 3: Machine Machine1, Duration 3\n  Step 4: Machine Machine14, Duration 109\n  Step 5: Machine Machine12, Duration 133\n  Step 6: Machine Machine7, Duration 33\n  Step 7: Machine Machine11, Duration 19\n  Step 8: Machine Machine16, Duration 46\n  Step 9: Machine Machine0, Duration 89\n  Step 10: Machine Machine6, Duration 27\n  Step 11: Machine Machine2, Duration 108\n  Step 12: Machine Machine15, Duration 49\n  Step 13: Machine Machine10, Duration 137\n  Step 14: Machine Machine4, Duration 138\n  Step 15: Machine Machine5, Duration 27\n  Step 16: Machine Machine3, Duration 65\n  Step 17: Machine Machine17, Duration 1\n  Step 18: Machine Machine13, Duration 182\n  Step 19: Machine Machine18, Duration 35\n  Step 20: Machine Machine8, Duration 51\nJob29:\n  Step 1: Machine Machine17, Duration 165\n  Step 2: Machine Machine2, Duration 31\n  Step 3: Machine Machine7, Duration 16\n  Step 4: Machine Machine5, Duration 28\n  Step 5: Machine Machine3, Duration 81\n  Step 6: Machine Machine19, Duration 112\n  Step 7: Machine Machine11, Duration 17\n  Step 8: Machine Machine8, Duration 168\n  Step 9: Machine Machine1, Duration 139\n  Step 10: Machine Machine0, Duration 80\n  Step 11: Machine Machine9, Duration 141\n  Step 12: Machine Machine10, Duration 46\n  Step 13: Machine Machine14, Duration 26\n  Step 14: Machine Machine13, Duration 173\n  Step 15: Machine Machine4, Duration 173\n  Step 16: Machine Machine18, Duration 189\n  Step 17: Machine Machine15, Duration 193\n  Step 18: Machine Machine12, Duration 107\n  Step 19: Machine Machine16, Duration 177\n  Step 20: Machine Machine6, Duration 77\nJob30:\n  Step 1: Machine Machine3, Duration 19\n  Step 2: Machine Machine6, Duration 33\n  Step 3: Machine Machine13, Duration 161\n  Step 4: Machine Machine2, Duration 9\n  Step 5: Machine Machine9, Duration 112\n  Step 6: Machine Machine1, Duration 185\n  Step 7: Machine Machine4, Duration 134\n  Step 8: Machine Machine8, Duration 77\n  Step 9: Machine Machine5, Duration 190\n  Step 10: Machine Machine14, Duration 109\n  Step 11: Machine Machine16, Duration 149\n  Step 12: Machine Machine0, Duration 60\n  Step 13: Machine Machine19, Duration 82\n  Step 14: Machine Machine11, Duration 89\n  Step 15: Machine Machine10, Duration 193\n  Step 16: Machine Machine12, Duration 182\n  Step 17: Machine Machine17, Duration 73\n  Step 18: Machine Machine18, Duration 103\n  Step 19: Machine Machine7, Duration 153\n  Step 20: Machine Machine15, Duration 18\nJob31:\n  Step 1: Machine Machine14, Duration 34\n  Step 2: Machine Machine6, Duration 112\n  Step 3: Machine Machine7, Duration 154\n  Step 4: Machine Machine3, Duration 66\n  Step 5: Machine Machine0, Duration 147\n  Step 6: Machine Machine13, Duration 165\n  Step 7: Machine Machine19, Duration 177\n  Step 8: Machine Machine15, Duration 192\n  Step 9: Machine Machine5, Duration 160\n  Step 10: Machine Machine4, Duration 180\n  Step 11: Machine Machine18, Duration 177\n  Step 12: Machine Machine8, Duration 51\n  Step 13: Machine Machine10, Duration 82\n  Step 14: Machine Machine11, Duration 169\n  Step 15: Machine Machine9, Duration 6\n  Step 16: Machine Machine17, Duration 195\n  Step 17: Machine Machine16, Duration 149\n  Step 18: Machine Machine1, Duration 54\n  Step 19: Machine Machine2, Duration 10\n  Step 20: Machine Machine12, Duration 156\nJob32:\n  Step 1: Machine Machine1, Duration 17\n  Step 2: Machine Machine8, Duration 18\n  Step 3: Machine Machine3, Duration 165\n  Step 4: Machine Machine2, Duration 135\n  Step 5: Machine Machine15, Duration 183\n  Step 6: Machine Machine0, Duration 93\n  Step 7: Machine Machine4, Duration 87\n  Step 8: Machine Machine9, Duration 104\n  Step 9: Machine Machine14, Duration 121\n  Step 10: Machine Machine5, Duration 88\n  Step 11: Machine Machine19, Duration 87\n  Step 12: Machine Machine17, Duration 50\n  Step 13: Machine Machine18, Duration 1\n  Step 14: Machine Machine6, Duration 192\n  Step 15: Machine Machine12, Duration 65\n  Step 16: Machine Machine10, Duration 80\n  Step 17: Machine Machine7, Duration 6\n  Step 18: Machine Machine11, Duration 79\n  Step 19: Machine Machine13, Duration 8\n  Step 20: Machine Machine16, Duration 153\nJob33:\n  Step 1: Machine Machine10, Duration 197\n  Step 2: Machine Machine0, Duration 79\n  Step 3: Machine Machine17, Duration 164\n  Step 4: Machine Machine11, Duration 16\n  Step 5: Machine Machine16, Duration 65\n  Step 6: Machine Machine12, Duration 32\n  Step 7: Machine Machine15, Duration 76\n  Step 8: Machine Machine1, Duration 191\n  Step 9: Machine Machine2, Duration 101\n  Step 10: Machine Machine14, Duration 23\n  Step 11: Machine Machine6, Duration 200\n  Step 12: Machine Machine7, Duration 96\n  Step 13: Machine Machine18, Duration 151\n  Step 14: Machine Machine5, Duration 24\n  Step 15: Machine Machine3, Duration 96\n  Step 16: Machine Machine4, Duration 106\n  Step 17: Machine Machine13, Duration 2\n  Step 18: Machine Machine9, Duration 132\n  Step 19: Machine Machine8, Duration 106\n  Step 20: Machine Machine19, Duration 132\nJob34:\n  Step 1: Machine Machine16, Duration 75\n  Step 2: Machine Machine3, Duration 149\n  Step 3: Machine Machine8, Duration 40\n  Step 4: Machine Machine9, Duration 29\n  Step 5: Machine Machine13, Duration 115\n  Step 6: Machine Machine15, Duration 169\n  Step 7: Machine Machine1, Duration 139\n  Step 8: Machine Machine17, Duration 27\n  Step 9: Machine Machine14, Duration 54\n  Step 10: Machine Machine2, Duration 84\n  Step 11: Machine Machine5, Duration 30\n  Step 12: Machine Machine7, Duration 8\n  Step 13: Machine Machine11, Duration 8\n  Step 14: Machine Machine10, Duration 95\n  Step 15: Machine Machine12, Duration 113\n  Step 16: Machine Machine6, Duration 88\n  Step 17: Machine Machine0, Duration 154\n  Step 18: Machine Machine4, Duration 55\n  Step 19: Machine Machine18, Duration 158\n  Step 20: Machine Machine19, Duration 32\nJob35:\n  Step 1: Machine Machine14, Duration 133\n  Step 2: Machine Machine9, Duration 142\n  Step 3: Machine Machine4, Duration 115\n  Step 4: Machine Machine17, Duration 154\n  Step 5: Machine Machine2, Duration 178\n  Step 6: Machine Machine5, Duration 99\n  Step 7: Machine Machine15, Duration 173\n  Step 8: Machine Machine13, Duration 53\n  Step 9: Machine Machine10, Duration 77\n  Step 10: Machine Machine12, Duration 186\n  Step 11: Machine Machine19, Duration 144\n  Step 12: Machine Machine3, Duration 116\n  Step 13: Machine Machine7, Duration 113\n  Step 14: Machine Machine8, Duration 154\n  Step 15: Machine Machine18, Duration 22\n  Step 16: Machine Machine11, Duration 127\n  Step 17: Machine Machine0, Duration 28\n  Step 18: Machine Machine1, Duration 61\n  Step 19: Machine Machine16, Duration 90\n  Step 20: Machine Machine6, Duration 52\nJob36:\n  Step 1: Machine Machine7, Duration 130\n  Step 2: Machine Machine9, Duration 95\n  Step 3: Machine Machine3, Duration 38\n  Step 4: Machine Machine17, Duration 87\n  Step 5: Machine Machine11, Duration 96\n  Step 6: Machine Machine2, Duration 16\n  Step 7: Machine Machine15, Duration 79\n  Step 8: Machine Machine13, Duration 150\n  Step 9: Machine Machine4, Duration 36\n  Step 10: Machine Machine0, Duration 40\n  Step 11: Machine Machine5, Duration 5\n  Step 12: Machine Machine18, Duration 114\n  Step 13: Machine Machine10, Duration 109\n  Step 14: Machine Machine14, Duration 78\n  Step 15: Machine Machine12, Duration 14\n  Step 16: Machine Machine16, Duration 103\n  Step 17: Machine Machine6, Duration 54\n  Step 18: Machine Machine8, Duration 86\n  Step 19: Machine Machine1, Duration 154\n  Step 20: Machine Machine19, Duration 137\nJob37:\n  Step 1: Machine Machine1, Duration 30\n  Step 2: Machine Machine17, Duration 128\n  Step 3: Machine Machine12, Duration 192\n  Step 4: Machine Machine2, Duration 12\n  Step 5: Machine Machine7, Duration 48\n  Step 6: Machine Machine11, Duration 117\n  Step 7: Machine Machine15, Duration 96\n  Step 8: Machine Machine4, Duration 99\n  Step 9: Machine Machine18, Duration 30\n  Step 10: Machine Machine3, Duration 24\n  Step 11: Machine Machine14, Duration 96\n  Step 12: Machine Machine16, Duration 69\n  Step 13: Machine Machine5, Duration 49\n  Step 14: Machine Machine19, Duration 134\n  Step 15: Machine Machine10, Duration 124\n  Step 16: Machine Machine6, Duration 54\n  Step 17: Machine Machine13, Duration 16\n  Step 18: Machine Machine0, Duration 171\n  Step 19: Machine Machine9, Duration 127\n  Step 20: Machine Machine8, Duration 17\nJob38:\n  Step 1: Machine Machine10, Duration 139\n  Step 2: Machine Machine1, Duration 196\n  Step 3: Machine Machine6, Duration 135\n  Step 4: Machine Machine4, Duration 134\n  Step 5: Machine Machine12, Duration 98\n  Step 6: Machine Machine16, Duration 37\n  Step 7: Machine Machine0, Duration 12\n  Step 8: Machine Machine5, Duration 109\n  Step 9: Machine Machine18, Duration 88\n  Step 10: Machine Machine3, Duration 118\n  Step 11: Machine Machine7, Duration 48\n  Step 12: Machine Machine19, Duration 192\n  Step 13: Machine Machine14, Duration 84\n  Step 14: Machine Machine9, Duration 142\n  Step 15: Machine Machine13, Duration 147\n  Step 16: Machine Machine11, Duration 17\n  Step 17: Machine Machine2, Duration 107\n  Step 18: Machine Machine17, Duration 194\n  Step 19: Machine Machine8, Duration 122\n  Step 20: Machine Machine15, Duration 68\nJob39:\n  Step 1: Machine Machine9, Duration 106\n  Step 2: Machine Machine10, Duration 154\n  Step 3: Machine Machine1, Duration 111\n  Step 4: Machine Machine3, Duration 148\n  Step 5: Machine Machine11, Duration 128\n  Step 6: Machine Machine2, Duration 153\n  Step 7: Machine Machine15, Duration 88\n  Step 8: Machine Machine4, Duration 45\n  Step 9: Machine Machine16, Duration 191\n  Step 10: Machine Machine18, Duration 164\n  Step 11: Machine Machine17, Duration 116\n  Step 12: Machine Machine5, Duration 1\n  Step 13: Machine Machine0, Duration 31\n  Step 14: Machine Machine19, Duration 95\n  Step 15: Machine Machine7, Duration 51\n  Step 16: Machine Machine14, Duration 46\n  Step 17: Machine Machine6, Duration 123\n  Step 18: Machine Machine12, Duration 16\n  Step 19: Machine Machine8, Duration 187\n  Step 20: Machine Machine13, Duration 189\nJob40:\n  Step 1: Machine Machine12, Duration 101\n  Step 2: Machine Machine8, Duration 113\n  Step 3: Machine Machine9, Duration 38\n  Step 4: Machine Machine1, Duration 119\n  Step 5: Machine Machine2, Duration 184\n  Step 6: Machine Machine3, Duration 148\n  Step 7: Machine Machine16, Duration 148\n  Step 8: Machine Machine10, Duration 43\n  Step 9: Machine Machine15, Duration 20\n  Step 10: Machine Machine14, Duration 178\n  Step 11: Machine Machine11, Duration 83\n  Step 12: Machine Machine5, Duration 92\n  Step 13: Machine Machine0, Duration 35\n  Step 14: Machine Machine17, Duration 165\n  Step 15: Machine Machine13, Duration 38\n  Step 16: Machine Machine6, Duration 131\n  Step 17: Machine Machine19, Duration 144\n  Step 18: Machine Machine7, Duration 179\n  Step 19: Machine Machine4, Duration 30\n  Step 20: Machine Machine18, Duration 89\nJob41:\n  Step 1: Machine Machine9, Duration 164\n  Step 2: Machine Machine19, Duration 55\n  Step 3: Machine Machine8, Duration 176\n  Step 4: Machine Machine18, Duration 82\n  Step 5: Machine Machine14, Duration 61\n  Step 6: Machine Machine0, Duration 183\n  Step 7: Machine Machine15, Duration 14\n  Step 8: Machine Machine16, Duration 27\n  Step 9: Machine Machine11, Duration 66\n  Step 10: Machine Machine12, Duration 91\n  Step 11: Machine Machine13, Duration 22\n  Step 12: Machine Machine6, Duration 158\n  Step 13: Machine Machine4, Duration 165\n  Step 14: Machine Machine1, Duration 182\n  Step 15: Machine Machine17, Duration 86\n  Step 16: Machine Machine3, Duration 197\n  Step 17: Machine Machine10, Duration 139\n  Step 18: Machine Machine7, Duration 157\n  Step 19: Machine Machine5, Duration 119\n  Step 20: Machine Machine2, Duration 114\nJob42:\n  Step 1: Machine Machine15, Duration 33\n  Step 2: Machine Machine5, Duration 65\n  Step 3: Machine Machine19, Duration 109\n  Step 4: Machine Machine11, Duration 84\n  Step 5: Machine Machine2, Duration 164\n  Step 6: Machine Machine12, Duration 141\n  Step 7: Machine Machine17, Duration 132\n  Step 8: Machine Machine1, Duration 164\n  Step 9: Machine Machine4, Duration 97\n  Step 10: Machine Machine9, Duration 85\n  Step 11: Machine Machine14, Duration 125\n  Step 12: Machine Machine10, Duration 104\n  Step 13: Machine Machine8, Duration 22\n  Step 14: Machine Machine6, Duration 171\n  Step 15: Machine Machine7, Duration 115\n  Step 16: Machine Machine18, Duration 77\n  Step 17: Machine Machine0, Duration 69\n  Step 18: Machine Machine16, Duration 181\n  Step 19: Machine Machine13, Duration 121\n  Step 20: Machine Machine3, Duration 98\nJob43:\n  Step 1: Machine Machine4, Duration 44\n  Step 2: Machine Machine5, Duration 99\n  Step 3: Machine Machine19, Duration 20\n  Step 4: Machine Machine18, Duration 171\n  Step 5: Machine Machine17, Duration 174\n  Step 6: Machine Machine6, Duration 87\n  Step 7: Machine Machine13, Duration 33\n  Step 8: Machine Machine3, Duration 18\n  Step 9: Machine Machine11, Duration 153\n  Step 10: Machine Machine2, Duration 153\n  Step 11: Machine Machine16, Duration 113\n  Step 12: Machine Machine15, Duration 149\n  Step 13: Machine Machine7, Duration 103\n  Step 14: Machine Machine8, Duration 103\n  Step 15: Machine Machine10, Duration 138\n  Step 16: Machine Machine14, Duration 67\n  Step 17: Machine Machine9, Duration 56\n  Step 18: Machine Machine1, Duration 92\n  Step 19: Machine Machine0, Duration 137\n  Step 20: Machine Machine12, Duration 105\nJob44:\n  Step 1: Machine Machine13, Duration 69\n  Step 2: Machine Machine2, Duration 145\n  Step 3: Machine Machine4, Duration 4\n  Step 4: Machine Machine10, Duration 11\n  Step 5: Machine Machine16, Duration 54\n  Step 6: Machine Machine14, Duration 150\n  Step 7: Machine Machine17, Duration 31\n  Step 8: Machine Machine3, Duration 168\n  Step 9: Machine Machine18, Duration 142\n  Step 10: Machine Machine12, Duration 86\n  Step 11: Machine Machine5, Duration 19\n  Step 12: Machine Machine9, Duration 111\n  Step 13: Machine Machine11, Duration 89\n  Step 14: Machine Machine19, Duration 53\n  Step 15: Machine Machine15, Duration 96\n  Step 16: Machine Machine1, Duration 179\n  Step 17: Machine Machine8, Duration 148\n  Step 18: Machine Machine0, Duration 195\n  Step 19: Machine Machine7, Duration 23\n  Step 20: Machine Machine6, Duration 161\nJob45:\n  Step 1: Machine Machine15, Duration 95\n  Step 2: Machine Machine7, Duration 75\n  Step 3: Machine Machine13, Duration 65\n  Step 4: Machine Machine17, Duration 83\n  Step 5: Machine Machine18, Duration 169\n  Step 6: Machine Machine8, Duration 170\n  Step 7: Machine Machine16, Duration 195\n  Step 8: Machine Machine0, Duration 193\n  Step 9: Machine Machine11, Duration 144\n  Step 10: Machine Machine10, Duration 53\n  Step 11: Machine Machine12, Duration 102\n  Step 12: Machine Machine4, Duration 27\n  Step 13: Machine Machine3, Duration 122\n  Step 14: Machine Machine2, Duration 199\n  Step 15: Machine Machine19, Duration 198\n  Step 16: Machine Machine6, Duration 184\n  Step 17: Machine Machine9, Duration 6\n  Step 18: Machine Machine5, Duration 9\n  Step 19: Machine Machine14, Duration 124\n  Step 20: Machine Machine1, Duration 17\nJob46:\n  Step 1: Machine Machine2, Duration 175\n  Step 2: Machine Machine11, Duration 137\n  Step 3: Machine Machine3, Duration 74\n  Step 4: Machine Machine9, Duration 3\n  Step 5: Machine Machine4, Duration 94\n  Step 6: Machine Machine5, Duration 2\n  Step 7: Machine Machine13, Duration 175\n  Step 8: Machine Machine17, Duration 134\n  Step 9: Machine Machine7, Duration 46\n  Step 10: Machine Machine12, Duration 120\n  Step 11: Machine Machine18, Duration 184\n  Step 12: Machine Machine15, Duration 123\n  Step 13: Machine Machine10, Duration 118\n  Step 14: Machine Machine0, Duration 76\n  Step 15: Machine Machine14, Duration 195\n  Step 16: Machine Machine6, Duration 37\n  Step 17: Machine Machine16, Duration 38\n  Step 18: Machine Machine8, Duration 92\n  Step 19: Machine Machine19, Duration 146\n  Step 20: Machine Machine1, Duration 43\nJob47:\n  Step 1: Machine Machine17, Duration 105\n  Step 2: Machine Machine16, Duration 68\n  Step 3: Machine Machine2, Duration 195\n  Step 4: Machine Machine4, Duration 131\n  Step 5: Machine Machine15, Duration 9\n  Step 6: Machine Machine18, Duration 61\n  Step 7: Machine Machine12, Duration 170\n  Step 8: Machine Machine19, Duration 186\n  Step 9: Machine Machine13, Duration 152\n  Step 10: Machine Machine6, Duration 166\n  Step 11: Machine Machine9, Duration 69\n  Step 12: Machine Machine14, Duration 46\n  Step 13: Machine Machine10, Duration 164\n  Step 14: Machine Machine11, Duration 46\n  Step 15: Machine Machine5, Duration 84\n  Step 16: Machine Machine1, Duration 133\n  Step 17: Machine Machine0, Duration 19\n  Step 18: Machine Machine3, Duration 199\n  Step 19: Machine Machine7, Duration 175\n  Step 20: Machine Machine8, Duration 59\nJob48:\n  Step 1: Machine Machine10, Duration 127\n  Step 2: Machine Machine6, Duration 163\n  Step 3: Machine Machine19, Duration 152\n  Step 4: Machine Machine14, Duration 149\n  Step 5: Machine Machine17, Duration 12\n  Step 6: Machine Machine13, Duration 11\n  Step 7: Machine Machine3, Duration 89\n  Step 8: Machine Machine5, Duration 97\n  Step 9: Machine Machine16, Duration 87\n  Step 10: Machine Machine18, Duration 120\n  Step 11: Machine Machine2, Duration 135\n  Step 12: Machine Machine0, Duration 123\n  Step 13: Machine Machine12, Duration 161\n  Step 14: Machine Machine15, Duration 58\n  Step 15: Machine Machine8, Duration 139\n  Step 16: Machine Machine7, Duration 82\n  Step 17: Machine Machine4, Duration 1\n  Step 18: Machine Machine11, Duration 93\n  Step 19: Machine Machine9, Duration 185\n  Step 20: Machine Machine1, Duration 167\nJob49:\n  Step 1: Machine Machine19, Duration 154\n  Step 2: Machine Machine3, Duration 124\n  Step 3: Machine Machine5, Duration 198\n  Step 4: Machine Machine15, Duration 49\n  Step 5: Machine Machine0, Duration 100\n  Step 6: Machine Machine8, Duration 145\n  Step 7: Machine Machine4, Duration 17\n  Step 8: Machine Machine12, Duration 103\n  Step 9: Machine Machine13, Duration 130\n  Step 10: Machine Machine18, Duration 170\n  Step 11: Machine Machine1, Duration 130\n  Step 12: Machine Machine17, Duration 122\n  Step 13: Machine Machine11, Duration 137\n  Step 14: Machine Machine14, Duration 33\n  Step 15: Machine Machine6, Duration 109\n  Step 16: Machine Machine2, Duration 26\n  Step 17: Machine Machine9, Duration 120\n  Step 18: Machine Machine7, Duration 33\n  Step 19: Machine Machine10, Duration 140\n  Step 20: Machine Machine16, Duration 126\nJob50:\n  Step 1: Machine Machine18, Duration 57\n  Step 2: Machine Machine17, Duration 133\n  Step 3: Machine Machine10, Duration 124\n  Step 4: Machine Machine16, Duration 188\n  Step 5: Machine Machine4, Duration 53\n  Step 6: Machine Machine15, Duration 24\n  Step 7: Machine Machine11, Duration 81\n  Step 8: Machine Machine1, Duration 93\n  Step 9: Machine Machine7, Duration 89\n  Step 10: Machine Machine19, Duration 12\n  Step 11: Machine Machine6, Duration 110\n  Step 12: Machine Machine8, Duration 111\n  Step 13: Machine Machine0, Duration 72\n  Step 14: Machine Machine13, Duration 163\n  Step 15: Machine Machine12, Duration 155\n  Step 16: Machine Machine5, Duration 151\n  Step 17: Machine Machine3, Duration 121\n  Step 18: Machine Machine2, Duration 98\n  Step 19: Machine Machine9, Duration 95\n  Step 20: Machine Machine14, Duration 164\n        \n        REQUIRED OUTPUT FORMAT:\n        You must provide your solution in the following exact format:\n        \n        1. FINAL MAKESPAN: [integer value]\n        2. STRUCTURED SCHEDULE:\n           For each operation, provide:\n           - Job: [job_name]\n           - Step: [step_number]\n           - Machine: [machine_name]\n           - Start Time: [start_time]\n           - End Time: [end_time]\n           - Duration: [duration]\n        \n        Example format:\n        FINAL MAKESPAN: 25\n        STRUCTURED SCHEDULE:\n        - Job: Job1, Step: 1, Machine: Machine0, Start Time: 0, End Time: 3, Duration: 3\n        - Job: Job1, Step: 2, Machine: Machine1, Start Time: 3, End Time: 7, Duration: 4\n        - Job: Job2, Step: 1, Machine: Machine1, Start Time: 7, End Time: 10, Duration: 3\n        \n        Please solve this Job Shop Scheduling Problem and provide:\n        1. A valid schedule with start and end times for each operation\n        2. The minimum makespan (total completion time)\n        3. Ensure all constraints are satisfied:\n           - Job precedence: operations within a job must be sequential\n           - Machine constraints: no overlapping operations on the same machine\n        "
        }
      },
      "agent_outputs": {
        "Job Scheduler Agent": "\\n        Job Shop Scheduling Problem (JSSP) - Dataset: rcmax_50_20_6\\n        \\n        Problem Description:\\n        - Number of jobs: 50\\n        - Each job has multiple operations that must be performed in sequence\\n        - Each operation requires a specific machine and has a duration\\n        - Each machine can only process one operation at a time\\n        - Goal: Find the minimum makespan (total completion time)\\n        \\n        Job Specifications:\\n        \\nJob1:\\n  Step 1: Machine Machine12, Duration 93\\n  Step 2: Machine Machine17, Duration 199\\n  Step 3: Machine Machine13, Duration 26\\n  Step 4: Machine Machine0, Duration 48\\n  Step 5: Machine Machine9, Duration 172\\n  Step 6: Machine Machine2, Duration 175\\n  Step 7: Machine Machine14, Duration 39\\n  Step 8: Machine Machine16, Duration 39\\n  Step 9: Machine Machine11, Duration 11\\n  Step 10: Machine Machine4, Duration 138\\n  Step 11: Machine Machine6, Duration 197\\n  Step 12: Machine Machine8, Duration 97\\n  Step 13: Machine Machine15, Duration 92\\n  Step 14: Machine Machine1, Duration 46\\n  Step 15: Machine Machine18, Duration 182\\n  Step 16: Machine Machine10, Duration 180\\n  Step 17: Machine Machine3, Duration 109\\n  Step 18: Machine Machine19, Duration 147\\n  Step 19: Machine Machine7, Duration 167\\n  Step 20: Machine Machine5, Duration 66\\nJob2:\\n  Step 1: Machine Machine0, Duration 40\\n  Step 2: Machine Machine7, Duration 46\\n  Step 3: Machine Machine18, Duration 52\\n  Step 4: Machine Machine9, Duration 126\\n  Step 5: Machine Machine12, Duration 136\\n  Step 6: Machine Machine19, Duration 147\\n  Step 7: Machine Machine15, Duration 152\\n  Step 8: Machine Machine3, Duration 28\\n  Step 9: Machine Machine11, Duration 101\\n  Step 10: Machine Machine13, Duration 8\\n  Step 11: Machine Machine14, Duration 110\\n  Step 12: Machine Machine2, Duration 6\\n  Step 13: Machine Machine6, Duration 103\\n  Step 14: Machine Machine1, Duration 166\\n  Step 15: Machine Machine16, Duration 51\\n  Step 16: Machine Machine10, Duration 4\\n  Step 17: Machine Machine17, Duration 119\\n  Step 18: Machine Machine5, Duration 100\\n  Step 19: Machine Machine4, Duration 197\\n  Step 20: Machine Machine8, Duration 185\\nJob3:\\n  Step 1: Machine Machine7, Duration 109\\n  Step 2: Machine Machine5, Duration 198\\n  Step 3: Machine Machine15, Duration 133\\n  Step 4: Machine Machine18, Duration 19\\n  Step 5: Machine Machine2, Duration 112\\n  Step 6: Machine Machine10, Duration 118\\n  Step 7: Machine Machine6, Duration 9\\n  Step 8: Machine Machine1, Duration 46\\n  Step 9: Machine Machine17, Duration 21\\n  Step 10: Machine Machine4, Duration 87\\n  Step 11: Machine Machine14, Duration 32\\n  Step 12: Machine Machine8, Duration 86\\n  Step 13: Machine Machine9, Duration 46\\n  Step 14: Machine Machine0, Duration 70\\n  Step 15: Machine Machine11, Duration 52\\n  Step 16: Machine Machine16, Duration 27\\n  Step 17: Machine Machine12, Duration 120\\n  Step 18: Machine Machine3, Duration 154\\n  Step 19: Machine Machine19, Duration 28\\n  Step 20: Machine Machine13, Duration 123\\nJob4:\\n  Step 1: Machine Machine7, Duration 136\\n  Step 2: Machine Machine14, Duration 93\\n  Step 3: Machine Machine12, Duration 123\\n  Step 4: Machine Machine2, Duration 167\\n  Step 5: Machine Machine10, Duration 158\\n  Step 6: Machine Machine11, Duration 53\\n  Step 7: Machine Machine19, Duration 99\\n  Step 8: Machine Machine0, Duration 8\\n  Step 9: Machine Machine17, Duration 191\\n  Step 10: Machine Machine4, Duration 138\\n  Step 11: Machine Machine9, Duration 149\\n  Step 12: Machine Machine5, Duration 156\\n  Step 13: Machine Machine13, Duration 30\\n  Step 14: Machine Machine16, Duration 90\\n  Step 15: Machine Machine3, Duration 124\\n  Step 16: Machine Machine8, Duration 127\\n  Step 17: Machine Machine18, Duration 67\\n  Step 18: Machine Machine1, Duration 104\\n  Step 19: Machine Machine15, Duration 116\\n  Step 20: Machine Machine6, Duration 127\\nJob5:\\n  Step 1: Machine Machine7, Duration 42\\n  Step 2: Machine Machine16, Duration 128\\n  Step 3: Machine Machine2, Duration 170\\n  Step 4: Machine Machine18, Duration 5\\n  Step 5: Machine Machine13, Duration 80\\n  Step 6: Machine Machine11, Duration 124\\n  Step 7: Machine Machine5, Duration 137\\n  Step 8: Machine Machine15, Duration 15\\n  Step 9: Machine Machine10, Duration 180\\n  Step 10: Machine Machine19, Duration 53\\n  Step 11: Machine Machine0, Duration 190\\n  Step 12: Machine Machine1, Duration 46\\n  Step 13: Machine Machine8, Duration 149\\n  Step 14: Machine Machine6, Duration 129\\n  Step 15: Machine Machine12, Duration 178\\n  Step 16: Machine Machine9, Duration 144\\n  Step 17: Machine Machine14, Duration 124\\n  Step 18: Machine Machine17, Duration 196\\n  Step 19: Machine Machine3, Duration 18\\n  Step 20: Machine Machine4, Duration 110\\nJob6:\\n  Step 1: Machine Machine9, Duration 59\\n  Step 2: Machine Machine17, Duration 116\\n  Step 3: Machine Machine16, Duration 68\\n  Step 4: Machine Machine13, Duration 35\\n  Step 5: Machine Machine0, Duration 169\\n  Step 6: Machine Machine14, Duration 70\\n  Step 7: Machine Machine1, Duration 129\\n  Step 8: Machine Machine12, Duration 34\\n  Step 9: Machine Machine10, Duration 73\\n  Step 10: Machine Machine18, Duration 77\\n  Step 11: Machine Machine11, Duration 177\\n  Step 12: Machine Machine4, Duration 63\\n  Step 13: Machine Machine3, Duration 13\\n  Step 14: Machine Machine2, Duration 58\\n  Step 15: Machine Machine15, Duration 137\\n  Step 16: Machine Machine5, Duration 84\\n  Step 17: Machine Machine8, Duration 67\\n  Step 18: Machine Machine19, Duration 121\\n  Step 19: Machine Machine7, Duration 187\\n  Step 20: Machine Machine6, Duration 105\\nJob7:\\n  Step 1: Machine Machine16, Duration 57\\n  Step 2: Machine Machine1, Duration 173\\n  Step 3: Machine Machine7, Duration 6\\n  Step 4: Machine Machine5, Duration 19\\n  Step 5: Machine Machine12, Duration 91\\n  Step 6: Machine Machine11, Duration 114\\n  Step 7: Machine Machine14, Duration 94\\n  Step 8: Machine Machine17, Duration 156\\n  Step 9: Machine Machine9, Duration 72\\n  Step 10: Machine Machine19, Duration 112\\n  Step 11: Machine Machine18, Duration 1\\n  Step 12: Machine Machine13, Duration 111\\n  Step 13: Machine Machine2, Duration 168\\n  Step 14: Machine Machine3, Duration 44\\n  Step 15: Machine Machine6, Duration 15\\n  Step 16: Machine Machine4, Duration 194\\n  Step 17: Machine Machine0, Duration 119\\n  Step 18: Machine Machine15, Duration 57\\n  Step 19: Machine Machine10, Duration 101\\n  Step 20: Machine Machine8, Duration 164\\nJob8:\\n  Step 1: Machine Machine9, Duration 126\\n  Step 2: Machine Machine11, Duration 29\\n  Step 3: Machine Machine15, Duration 17\\n  Step 4: Machine Machine8, Duration 62\\n  Step 5: Machine Machine0, Duration 171\\n  Step 6: Machine Machine14, Duration 181\\n  Step 7: Machine Machine13, Duration 184\\n  Step 8: Machine Machine12, Duration 35\\n  Step 9: Machine Machine5, Duration 30\\n  Step 10: Machine Machine4, Duration 115\\n  Step 11: Machine Machine6, Duration 2\\n  Step 12: Machine Machine3, Duration 151\\n  Step 13: Machine Machine16, Duration 65\\n  Step 14: Machine Machine19, Duration 91\\n  Step 15: Machine Machine1, Duration 77\\n  Step 16: Machine Machine17, Duration 166\\n  Step 17: Machine Machine2, Duration 74\\n  Step 18: Machine Machine10, Duration 183\\n  Step 19: Machine Machine18, Duration 177\\n  Step 20: Machine Machine7, Duration 187\\nJob9:\\n  Step 1: Machine Machine8, Duration 99\\n  Step 2: Machine Machine18, Duration 122\\n  Step 3: Machine Machine11, Duration 49\\n  Step 4: Machine Machine7, Duration 44\\n  Step 5: Machine Machine10, Duration 126\\n  Step 6: Machine Machine17, Duration 168\\n  Step 7: Machine Machine3, Duration 20\\n  Step 8: Machine Machine6, Duration 46\\n  Step 9: Machine Machine14, Duration 190\\n  Step 10: Machine Machine4, Duration 162\\n  Step 11: Machine Machine1, Duration 184\\n  Step 12: Machine Machine0, Duration 96\\n  Step 13: Machine Machine5, Duration 170\\n  Step 14: Machine Machine16, Duration 147\\n  Step 15: Machine Machine19, Duration 10\\n  Step 16: Machine Machine13, Duration 142\\n  Step 17: Machine Machine9, Duration 111\\n  Step 18: Machine Machine12, Duration 12\\n  Step 19: Machine Machine2, Duration 86\\n  Step 20: Machine Machine15, Duration 196\\nJob10:\\n  Step 1: Machine Machine12, Duration 114\\n  Step 2: Machine Machine16, Duration 75\\n  Step 3: Machine Machine15, Duration 66\\n  Step 4: Machine Machine9, Duration 170\\n  Step 5: Machine Machine6, Duration 70\\n  Step 6: Machine Machine2, Duration 50\\n  Step 7: Machine Machine10, Duration 131\\n  Step 8: Machine Machine11, Duration 57\\n  Step 9: Machine Machine5, Duration 61\\n  Step 10: Machine Machine0, Duration 188\\n  Step 11: Machine Machine8, Duration 74\\n  Step 12: Machine Machine1, Duration 107\\n  Step 13: Machine Machine13, Duration 152\\n  Step 14: Machine Machine4, Duration 152\\n  Step 15: Machine Machine18, Duration 60\\n  Step 16: Machine Machine17, Duration 97\\n  Step 17: Machine Machine19, Duration 19\\n  Step 18: Machine Machine3, Duration 15\\n  Step 19: Machine Machine7, Duration 147\\n  Step 20: Machine Machine14, Duration 156\\nJob11:\\n  Step 1: Machine Machine0, Duration 29\\n  Step 2: Machine Machine1, Duration 179\\n  Step 3: Machine Machine7, Duration 109\\n  Step 4: Machine Machine4, Duration 30\\n  Step 5: Machine Machine18, Duration 92\\n  Step 6: Machine Machine10, Duration 71\\n  Step 7: Machine Machine9, Duration 111\\n  Step 8: Machine Machine15, Duration 146\\n  Step 9: Machine Machine5, Duration 77\\n  Step 10: Machine Machine19, Duration 59\\n  Step 11: Machine Machine2, Duration 146\\n  Step 12: Machine Machine17, Duration 16\\n  Step 13: Machine Machine16, Duration 49\\n  Step 14: Machine Machine13, Duration 12\\n  Step 15: Machine Machine12, Duration 144\\n  Step 16: Machine Machine3, Duration 95\\n  Step 17: Machine Machine14, Duration 163\\n  Step 18: Machine Machine6, Duration 199\\n  Step 19: Machine Machine11, Duration 157\\n  Step 20: Machine Machine8, Duration 131\\nJob12:\\n  Step 1: Machine Machine17, Duration 174\\n  Step 2: Machine Machine13, Duration 22\\n  Step 3: Machine Machine11, Duration 142\\n  Step 4: Machine Machine8, Duration 32\\n  Step 5: Machine Machine14, Duration 49\\n  Step 6: Machine Machine10, Duration 97\\n  Step 7: Machine Machine5, Duration 47\\n  Step 8: Machine Machine4, Duration 140\\n  Step 9: Machine Machine12, Duration 49\\n  Step 10: Machine Machine18, Duration 41\\n  Step 11: Machine Machine9, Duration 157\\n  Step 12: Machine Machine2, Duration 3\\n  Step 13: Machine Machine7, Duration 198\\n  Step 14: Machine Machine19, Duration 92\\n  Step 15: Machine Machine0, Duration 2\\n  Step 16: Machine Machine3, Duration 142\\n  Step 17: Machine Machine1, Duration 114\\n  Step 18: Machine Machine16, Duration 4\\n  Step 19: Machine Machine6, Duration 98\\n  Step 20: Machine Machine15, Duration 100\\nJob13:\\n  Step 1: Machine Machine17, Duration 47\\n  Step 2: Machine Machine8, Duration 55\\n  Step 3: Machine Machine7, Duration 136\\n  Step 4: Machine Machine9, Duration 51\\n  Step 5: Machine Machine1, Duration 79\\n  Step 6: Machine Machine4, Duration 37\\n  Step 7: Machine Machine15, Duration 100\\n  Step 8: Machine Machine14, Duration 139\\n  Step 9: Machine Machine0, Duration 45\\n  Step 10: Machine Machine10, Duration 39\\n  Step 11: Machine Machine16, Duration 160\\n  Step 12: Machine Machine19, Duration 90\\n  Step 13: Machine Machine5, Duration 114\\n  Step 14: Machine Machine13, Duration 13\\n  Step 15: Machine Machine2, Duration 66\\n  Step 16: Machine Machine11, Duration 90\\n  Step 17: Machine Machine12, Duration 187\\n  Step 18: Machine Machine6, Duration 47\\n  Step 19: Machine Machine18, Duration 75\\n  Step 20: Machine Machine3, Duration 151\\nJob14:\\n  Step 1: Machine Machine18, Duration 139\\n  Step 2: Machine Machine5, Duration 102\\n  Step 3: Machine Machine4, Duration 181\\n  Step 4: Machine Machine7, Duration 24\\n  Step 5: Machine Machine13, Duration 142\\n  Step 6: Machine Machine8, Duration 23\\n  Step 7: Machine Machine16, Duration 100\\n  Step 8: Machine Machine11, Duration 95\\n  Step 9: Machine Machine3, Duration 89\\n  Step 10: Machine Machine14, Duration 144\\n  Step 11: Machine Machine15, Duration 159\\n  Step 12: Machine Machine10, Duration 176\\n  Step 13: Machine Machine9, Duration 153\\n  Step 14: Machine Machine2, Duration 112\\n  Step 15: Machine Machine12, Duration 136\\n  Step 16: Machine Machine6, Duration 97\\n  Step 17: Machine Machine19, Duration 176\\n  Step 18: Machine Machine17, Duration 20\\n  Step 19: Machine Machine1, Duration 154\\n  Step 20: Machine Machine0, Duration 15\\nJob15:\\n  Step 1: Machine Machine16, Duration 183\\n  Step 2: Machine Machine12, Duration 53\\n  Step 3: Machine Machine2, Duration 2\\n  Step 4: Machine Machine15, Duration 26\\n  Step 5: Machine Machine1, Duration 196\\n  Step 6: Machine Machine9, Duration 15\\n  Step 7: Machine Machine18, Duration 5\\n  Step 8: Machine Machine7, Duration 103\\n  Step 9: Machine Machine3, Duration 40\\n  Step 10: Machine Machine5, Duration 86\\n  Step 11: Machine Machine4, Duration 130\\n  Step 12: Machine Machine6, Duration 118\\n  Step 13: Machine Machine0, Duration 111\\n  Step 14: Machine Machine8, Duration 94\\n  Step 15: Machine Machine13, Duration 118\\n  Step 16: Machine Machine11, Duration 119\\n  Step 17: Machine Machine19, Duration 188\\n  Step 18: Machine Machine17, Duration 119\\n  Step 19: Machine Machine14, Duration 55\\n  Step 20: Machine Machine10, Duration 146\\nJob16:\\n  Step 1: Machine Machine0, Duration 97\\n  Step 2: Machine Machine9, Duration 197\\n  Step 3: Machine Machine1, Duration 127\\n  Step 4: Machine Machine8, Duration 39\\n  Step 5: Machine Machine11, Duration 80\\n  Step 6: Machine Machine5, Duration 138\\n  Step 7: Machine Machine13, Duration 77\\n  Step 8: Machine Machine2, Duration 3\\n  Step 9: Machine Machine17, Duration 116\\n  Step 10: Machine Machine4, Duration 115\\n  Step 11: Machine Machine6, Duration 127\\n  Step 12: Machine Machine18, Duration 61\\n  Step 13: Machine Machine7, Duration 124\\n  Step 14: Machine Machine15, Duration 7\\n  Step 15: Machine Machine12, Duration 111\\n  Step 16: Machine Machine14, Duration 40\\n  Step 17: Machine Machine16, Duration 96\\n  Step 18: Machine Machine10, Duration 34\\n  Step 19: Machine Machine19, Duration 159\\n  Step 20: Machine Machine3, Duration 29\\nJob17:\\n  Step 1: Machine Machine18, Duration 123\\n  Step 2: Machine Machine5, Duration 22\\n  Step 3: Machine Machine1, Duration 135\\n  Step 4: Machine Machine19, Duration 99\\n  Step 5: Machine Machine8, Duration 105\\n  Step 6: Machine Machine11, Duration 14\\n  Step 7: Machine Machine13, Duration 159\\n  Step 8: Machine Machine9, Duration 21\\n  Step 9: Machine Machine14, Duration 86\\n  Step 10: Machine Machine17, Duration 12\\n  Step 11: Machine Machine7, Duration 49\\n  Step 12: Machine Machine6, Duration 160\\n  Step 13: Machine Machine4, Duration 66\\n  Step 14: Machine Machine12, Duration 9\\n  Step 15: Machine Machine3, Duration 31\\n  Step 16: Machine Machine16, Duration 134\\n  Step 17: Machine Machine15, Duration 12\\n  Step 18: Machine Machine10, Duration 38\\n  Step 19: Machine Machine2, Duration 131\\n  Step 20: Machine Machine0, Duration 55\\nJob18:\\n  Step 1: Machine Machine12, Duration 18\\n  Step 2: Machine Machine11, Duration 93\\n  Step 3: Machine Machine7, Duration 128\\n  Step 4: Machine Machine17, Duration 41\\n  Step 5: Machine Machine8, Duration 174\\n  Step 6: Machine Machine4, Duration 75\\n  Step 7: Machine Machine15, Duration 44\\n  Step 8: Machine Machine5, Duration 15\\n  Step 9: Machine Machine9, Duration 100\\n  Step 10: Machine Machine14, Duration 58\\n  Step 11: Machine Machine10, Duration 166\\n  Step 12: Machine Machine13, Duration 89\\n  Step 13: Machine Machine16, Duration 174\\n  Step 14: Machine Machine19, Duration 91\\n  Step 15: Machine Machine3, Duration 33\\n  Step 16: Machine Machine0, Duration 28\\n  Step 17: Machine Machine6, Duration 195\\n  Step 18: Machine Machine1, Duration 163\\n  Step 19: Machine Machine18, Duration 95\\n  Step 20: Machine Machine2, Duration 40\\nJob19:\\n  Step 1: Machine Machine18, Duration 185\\n  Step 2: Machine Machine9, Duration 88\\n  Step 3: Machine Machine13, Duration 135\\n  Step 4: Machine Machine1, Duration 98\\n  Step 5: Machine Machine15, Duration 196\\n  Step 6: Machine Machine0, Duration 119\\n  Step 7: Machine Machine8, Duration 52\\n  Step 8: Machine Machine10, Duration 21\\n  Step 9: Machine Machine6, Duration 130\\n  Step 10: Machine Machine4, Duration 141\\n  Step 11: Machine Machine17, Duration 52\\n  Step 12: Machine Machine14, Duration 96\\n  Step 13: Machine Machine2, Duration 34\\n  Step 14: Machine Machine3, Duration 115\\n  Step 15: Machine Machine12, Duration 5\\n  Step 16: Machine Machine5, Duration 74\\n  Step 17: Machine Machine11, Duration 104\\n  Step 18: Machine Machine19, Duration 88\\n  Step 19: Machine Machine7, Duration 162\\n  Step 20: Machine Machine16, Duration 113\\nJob20:\\n  Step 1: Machine Machine6, Duration 63\\n  Step 2: Machine Machine2, Duration 140\\n  Step 3: Machine Machine4, Duration 8\\n  Step 4: Machine Machine0, Duration 73\\n  Step 5: Machine Machine15, Duration 115\\n  Step 6: Machine Machine3, Duration 178\\n  Step 7: Machine Machine1, Duration 101\\n  Step 8: Machine Machine17, Duration 149\\n  Step 9: Machine Machine19, Duration 137\\n  Step 10: Machine Machine18, Duration 170\\n  Step 11: Machine Machine16, Duration 92\\n  Step 12: Machine Machine8, Duration 149\\n  Step 13: Machine Machine9, Duration 180\\n  Step 14: Machine Machine11, Duration 103\\n  Step 15: Machine Machine7, Duration 179\\n  Step 16: Machine Machine13, Duration 106\\n  Step 17: Machine Machine5, Duration 57\\n  Step 18: Machine Machine12, Duration 171\\n  Step 19: Machine Machine14, Duration 112\\n  Step 20: Machine Machine10, Duration 104\\nJob21:\\n  Step 1: Machine Machine8, Duration 125\\n  Step 2: Machine Machine5, Duration 82\\n  Step 3: Machine Machine2, Duration 151\\n  Step 4: Machine Machine9, Duration 10\\n  Step 5: Machine Machine4, Duration 162\\n  Step 6: Machine Machine10, Duration 144\\n  Step 7: Machine Machine1, Duration 9\\n  Step 8: Machine Machine13, Duration 193\\n  Step 9: Machine Machine0, Duration 165\\n  Step 10: Machine Machine3, Duration 98\\n  Step 11: Machine Machine14, Duration 134\\n  Step 12: Machine Machine11, Duration 198\\n  Step 13: Machine Machine15, Duration 129\\n  Step 14: Machine Machine6, Duration 34\\n  Step 15: Machine Machine16, Duration 139\\n  Step 16: Machine Machine12, Duration 89\\n  Step 17: Machine Machine7, Duration 108\\n  Step 18: Machine Machine17, Duration 87\\n  Step 19: Machine Machine19, Duration 86\\n  Step 20: Machine Machine18, Duration 51\\nJob22:\\n  Step 1: Machine Machine0, Duration 107\\n  Step 2: Machine Machine8, Duration 84\\n  Step 3: Machine Machine2, Duration 70\\n  Step 4: Machine Machine12, Duration 31\\n  Step 5: Machine Machine19, Duration 163\\n  Step 6: Machine Machine11, Duration 104\\n  Step 7: Machine Machine1, Duration 54\\n  Step 8: Machine Machine4, Duration 19\\n  Step 9: Machine Machine6, Duration 85\\n  Step 10: Machine Machine15, Duration 194\\n  Step 11: Machine Machine10, Duration 157\\n  Step 12: Machine Machine13, Duration 124\\n  Step 13: Machine Machine5, Duration 193\\n  Step 14: Machine Machine16, Duration 140\\n  Step 15: Machine Machine9, Duration 187\\n  Step 16: Machine Machine7, Duration 162\\n  Step 17: Machine Machine14, Duration 23\\n  Step 18: Machine Machine18, Duration 59\\n  Step 19: Machine Machine17, Duration 26\\n  Step 20: Machine Machine3, Duration 182\\nJob23:\\n  Step 1: Machine Machine3, Duration 86\\n  Step 2: Machine Machine17, Duration 25\\n  Step 3: Machine Machine19, Duration 109\\n  Step 4: Machine Machine18, Duration 95\\n  Step 5: Machine Machine12, Duration 85\\n  Step 6: Machine Machine0, Duration 179\\n  Step 7: Machine Machine9, Duration 76\\n  Step 8: Machine Machine6, Duration 68\\n  Step 9: Machine Machine15, Duration 104\\n  Step 10: Machine Machine2, Duration 25\\n  Step 11: Machine Machine4, Duration 24\\n  Step 12: Machine Machine7, Duration 113\\n  Step 13: Machine Machine5, Duration 37\\n  Step 14: Machine Machine10, Duration 155\\n  Step 15: Machine Machine8, Duration 113\\n  Step 16: Machine Machine1, Duration 134\\n  Step 17: Machine Machine13, Duration 190\\n  Step 18: Machine Machine14, Duration 67\\n  Step 19: Machine Machine11, Duration 192\\n  Step 20: Machine Machine16, Duration 172\\nJob24:\\n  Step 1: Machine Machine19, Duration 28\\n  Step 2: Machine Machine10, Duration 4\\n  Step 3: Machine Machine16, Duration 91\\n  Step 4: Machine Machine3, Duration 104\\n  Step 5: Machine Machine13, Duration 37\\n  Step 6: Machine Machine0, Duration 198\\n  Step 7: Machine Machine15, Duration 53\\n  Step 8: Machine Machine18, Duration 165\\n  Step 9: Machine Machine1, Duration 72\\n  Step 10: Machine Machine4, Duration 8\\n  Step 11: Machine Machine2, Duration 93\\n  Step 12: Machine Machine5, Duration 161\\n  Step 13: Machine Machine6, Duration 148\\n  Step 14: Machine Machine9, Duration 181\\n  Step 15: Machine Machine11, Duration 109\\n  Step 16: Machine Machine12, Duration 49\\n  Step 17: Machine Machine14, Duration 110\\n  Step 18: Machine Machine8, Duration 76\\n  Step 19: Machine Machine7, Duration 130\\n  Step 20: Machine Machine17, Duration 7\\nJob25:\\n  Step 1: Machine Machine5, Duration 36\\n  Step 2: Machine Machine1, Duration 139\\n  Step 3: Machine Machine17, Duration 66\\n  Step 4: Machine Machine19, Duration 88\\n  Step 5: Machine Machine8, Duration 41\\n  Step 6: Machine Machine9, Duration 148\\n  Step 7: Machine Machine7, Duration 162\\n  Step 8: Machine Machine16, Duration 69\\n  Step 9: Machine Machine12, Duration 189\\n  Step 10: Machine Machine3, Duration 57\\n  Step 11: Machine Machine0, Duration 157\\n  Step 12: Machine Machine4, Duration 43\\n  Step 13: Machine Machine10, Duration 198\\n  Step 14: Machine Machine6, Duration 149\\n  Step 15: Machine Machine2, Duration 192\\n  Step 16: Machine Machine13, Duration 57\\n  Step 17: Machine Machine14, Duration 95\\n  Step 18: Machine Machine18, Duration 95\\n  Step 19: Machine Machine11, Duration 11\\n  Step 20: Machine Machine15, Duration 158\\nJob26:\\n  Step 1: Machine Machine5, Duration 8\\n  Step 2: Machine Machine1, Duration 149\\n  Step 3: Machine Machine8, Duration 168\\n  Step 4: Machine Machine9, Duration 159\\n  Step 5: Machine Machine12, Duration 65\\n  Step 6: Machine Machine4, Duration 194\\n  Step 7: Machine Machine17, Duration 48\\n  Step 8: Machine Machine6, Duration 4\\n  Step 9: Machine Machine2, Duration 197\\n  Step 10: Machine Machine16, Duration 91\\n  Step 11: Machine Machine18, Duration 122\\n  Step 12: Machine Machine0, Duration 123\\n  Step 13: Machine Machine15, Duration 27\\n  Step 14: Machine Machine19, Duration 76\\n  Step 15: Machine Machine7, Duration 147\\n  Step 16: Machine Machine13, Duration 120\\n  Step 17: Machine Machine14, Duration 20\\n  Step 18: Machine Machine11, Duration 24\\n  Step 19: Machine Machine3, Duration 133\\n  Step 20: Machine Machine10, Duration 182\\nJob27:\\n  Step 1: Machine Machine11, Duration 29\\n  Step 2: Machine Machine9, Duration 46\\n  Step 3: Machine Machine7, Duration 164\\n  Step 4: Machine Machine13, Duration 152\\n  Step 5: Machine Machine1, Duration 4\\n  Step 6: Machine Machine18, Duration 129\\n  Step 7: Machine Machine14, Duration 148\\n  Step 8: Machine Machine2, Duration 46\\n  Step 9: Machine Machine19, Duration 98\\n  Step 10: Machine Machine16, Duration 84\\n  Step 11: Machine Machine10, Duration 133\\n  Step 12: Machine Machine15, Duration 137\\n  Step 13: Machine Machine4, Duration 192\\n  Step 14: Machine Machine5, Duration 166\\n  Step 15: Machine Machine3, Duration 14\\n  Step 16: Machine Machine6, Duration 173\\n  Step 17: Machine Machine17, Duration 44\\n  Step 18: Machine Machine0, Duration 144\\n  Step 19: Machine Machine8, Duration 99\\n  Step 20: Machine Machine12, Duration 85\\nJob28:\\n  Step 1: Machine Machine9, Duration 64\\n  Step 2: Machine Machine19, Duration 62\\n  Step 3: Machine Machine1, Duration 3\\n  Step 4: Machine Machine14, Duration 109\\n  Step 5: Machine Machine12, Duration 133\\n  Step 6: Machine Machine7, Duration 33\\n  Step 7: Machine Machine11, Duration 19\\n  Step 8: Machine Machine16, Duration 46\\n  Step 9: Machine Machine0, Duration 89\\n  Step 10: Machine Machine6, Duration 27\\n  Step 11: Machine Machine2, Duration 108\\n  Step 12: Machine Machine15, Duration 49\\n  Step 13: Machine Machine10, Duration 137\\n  Step 14: Machine Machine4, Duration 138\\n  Step 15: Machine Machine5, Duration 27\\n  Step 16: Machine Machine3, Duration 65\\n  Step 17: Machine Machine17, Duration 1\\n  Step 18: Machine Machine13, Duration 182\\n  Step 19: Machine Machine18, Duration 35\\n  Step 20: Machine Machine8, Duration 51\\nJob29:\\n  Step 1: Machine Machine17, Duration 165\\n  Step 2: Machine Machine2, Duration 31\\n  Step 3: Machine Machine7, Duration 16\\n  Step 4: Machine Machine5, Duration 28\\n  Step 5: Machine Machine3, Duration 81\\n  Step 6: Machine Machine19, Duration 112\\n  Step 7: Machine Machine11, Duration 17\\n  Step 8: Machine Machine8, Duration 168\\n  Step 9: Machine Machine1, Duration 139\\n  Step 10: Machine Machine0, Duration 80\\n  Step 11: Machine Machine9, Duration 141\\n  Step 12: Machine Machine10, Duration 46\\n  Step 13: Machine Machine14, Duration 26\\n  Step 14: Machine Machine13, Duration 173\\n  Step 15: Machine Machine4, Duration 173\\n  Step 16: Machine Machine18, Duration 189\\n  Step 17: Machine Machine15, Duration 193\\n  Step 18: Machine Machine12, Duration 107\\n  Step 19: Machine Machine16, Duration 177\\n  Step 20: Machine Machine6, Duration 77\\nJob30:\\n  Step 1: Machine Machine3, Duration 19\\n  Step 2: Machine Machine6, Duration 33\\n  Step 3: Machine Machine13, Duration 161\\n  Step 4: Machine Machine2, Duration 9\\n  Step 5: Machine Machine9, Duration 112\\n  Step 6: Machine Machine1, Duration 185\\n  Step 7: Machine Machine4, Duration 134\\n  Step 8: Machine Machine8, Duration 77\\n  Step 9: Machine Machine5, Duration 190\\n  Step 10: Machine Machine14, Duration 109\\n  Step 11: Machine Machine16, Duration 149\\n  Step 12: Machine Machine0, Duration 60\\n  Step 13: Machine Machine19, Duration 82\\n  Step 14: Machine Machine11, Duration 89\\n  Step 15: Machine Machine10, Duration 193\\n  Step 16: Machine Machine12, Duration 182\\n  Step 17: Machine Machine17, Duration 73\\n  Step 18: Machine Machine18, Duration 103\\n  Step 19: Machine Machine7, Duration 153\\n  Step 20: Machine Machine15, Duration 18\\nJob31:\\n  Step 1: Machine Machine14, Duration 34\\n  Step 2: Machine Machine6, Duration 112\\n  Step 3: Machine Machine7, Duration 154\\n  Step 4: Machine Machine3, Duration 66\\n  Step 5: Machine Machine0, Duration 147\\n  Step 6: Machine Machine13, Duration 165\\n  Step 7: Machine Machine19, Duration 177\\n  Step 8: Machine Machine15, Duration 192\\n  Step 9: Machine Machine5, Duration 160\\n  Step 10: Machine Machine4, Duration 180\\n  Step 11: Machine Machine18, Duration 177\\n  Step 12: Machine Machine8, Duration 51\\n  Step 13: Machine Machine10, Duration 82\\n  Step 14: Machine Machine11, Duration 169\\n  Step 15: Machine Machine9, Duration 6\\n  Step 16: Machine Machine17, Duration 195\\n  Step 17: Machine Machine16, Duration 149\\n  Step 18: Machine Machine1, Duration 54\\n  Step 19: Machine Machine2, Duration 10\\n  Step 20: Machine Machine12, Duration 156\\nJob32:\\n  Step 1: Machine Machine1, Duration 17\\n  Step 2: Machine Machine8, Duration 18\\n  Step 3: Machine Machine3, Duration 165\\n  Step 4: Machine Machine2, Duration 135\\n  Step 5: Machine Machine15, Duration 183\\n  Step 6: Machine Machine0, Duration 93\\n  Step 7: Machine Machine4, Duration 87\\n  Step 8: Machine Machine9, Duration 104\\n  Step 9: Machine Machine14, Duration 121\\n  Step 10: Machine Machine5, Duration 88\\n  Step 11: Machine Machine19, Duration 87\\n  Step 12: Machine Machine17, Duration 50\\n  Step 13: Machine Machine18, Duration 1\\n  Step 14: Machine Machine6, Duration 192\\n  Step 15: Machine Machine12, Duration 65\\n  Step 16: Machine Machine10, Duration 80\\n  Step 17: Machine Machine7, Duration 6\\n  Step 18: Machine Machine11, Duration 79\\n  Step 19: Machine Machine13, Duration 8\\n  Step 20: Machine Machine16, Duration 153\\nJob33:\\n  Step 1: Machine Machine10, Duration 197\\n  Step 2: Machine Machine0, Duration 79\\n  Step 3: Machine Machine17, Duration 164\\n  Step 4: Machine Machine11, Duration 16\\n  Step 5: Machine Machine16, Duration 65\\n  Step 6: Machine Machine12, Duration 32\\n  Step 7: Machine Machine15, Duration 76\\n  Step 8: Machine Machine1, Duration 191\\n  Step 9: Machine Machine2, Duration 101\\n  Step 10: Machine Machine14, Duration 23\\n  Step 11: Machine Machine6, Duration 200\\n  Step 12: Machine Machine7, Duration 96\\n  Step 13: Machine Machine18, Duration 151\\n  Step 14: Machine Machine5, Duration 24\\n  Step 15: Machine Machine3, Duration 96\\n  Step 16: Machine Machine4, Duration 106\\n  Step 17: Machine Machine13, Duration 2\\n  Step 18: Machine Machine9, Duration 132\\n  Step 19: Machine Machine8, Duration 106\\n  Step 20: Machine Machine19, Duration 132\\nJob34:\\n  Step 1: Machine Machine16, Duration 75\\n  Step 2: Machine Machine3, Duration 149\\n  Step 3: Machine Machine8, Duration 40\\n  Step 4: Machine Machine9, Duration 29\\n  Step 5: Machine Machine13, Duration 115\\n  Step 6: Machine Machine15, Duration 169\\n  Step 7: Machine Machine1, Duration 139\\n  Step 8: Machine Machine17, Duration 27\\n  Step 9: Machine Machine14, Duration 54\\n  Step 10: Machine Machine2, Duration 84\\n  Step 11: Machine Machine5, Duration 30\\n  Step 12: Machine Machine7, Duration 8\\n  Step 13: Machine Machine11, Duration 8\\n  Step 14: Machine Machine10, Duration 95\\n  Step 15: Machine Machine12, Duration 113\\n  Step 16: Machine Machine6, Duration 88\\n  Step 17: Machine Machine0, Duration 154\\n  Step 18: Machine Machine4, Duration 55\\n  Step 19: Machine Machine18, Duration 158\\n  Step 20: Machine Machine19, Duration 32\\nJob35:\\n  Step 1: Machine Machine14, Duration 133\\n  Step 2: Machine Machine9, Duration 142\\n  Step 3: Machine Machine4, Duration 115\\n  Step 4: Machine Machine17, Duration 154\\n  Step 5: Machine Machine2, Duration 178\\n  Step 6: Machine Machine5, Duration 99\\n  Step 7: Machine Machine15, Duration 173\\n  Step 8: Machine Machine13, Duration 53\\n  Step 9: Machine Machine10, Duration 77\\n  Step 10: Machine Machine12, Duration 186\\n  Step 11: Machine Machine19, Duration 144\\n  Step 12: Machine Machine3, Duration 116\\n  Step 13: Machine Machine7, Duration 113\\n  Step 14: Machine Machine8, Duration 154\\n  Step 15: Machine Machine18, Duration 22\\n  Step 16: Machine Machine11, Duration 127\\n  Step 17: Machine Machine0, Duration 28\\n  Step 18: Machine Machine1, Duration 61\\n  Step 19: Machine Machine16, Duration 90\\n  Step 20: Machine Machine6, Duration 52\\nJob36:\\n  Step 1: Machine Machine7, Duration 130\\n  Step 2: Machine Machine9, Duration 95\\n  Step 3: Machine Machine3, Duration 38\\n  Step 4: Machine Machine17, Duration 87\\n  Step 5: Machine Machine11, Duration 96\\n  Step 6: Machine Machine2, Duration 16\\n  Step 7: Machine Machine15, Duration 79\\n  Step 8: Machine Machine13, Duration 150\\n  Step 9: Machine Machine4, Duration 36\\n  Step 10: Machine Machine0, Duration 40\\n  Step 11: Machine Machine5, Duration 5\\n  Step 12: Machine Machine18, Duration 114\\n  Step 13: Machine Machine10, Duration 109\\n  Step 14: Machine Machine14, Duration 78\\n  Step 15: Machine Machine12, Duration 14\\n  Step 16: Machine Machine16, Duration 103\\n  Step 17: Machine Machine6, Duration 54\\n  Step 18: Machine Machine8, Duration 86\\n  Step 19: Machine Machine1, Duration 154\\n  Step 20: Machine Machine19, Duration 137\\nJob37:\\n  Step 1: Machine Machine1, Duration 30\\n  Step 2: Machine Machine17, Duration 128\\n  Step 3: Machine Machine12, Duration 192\\n  Step 4: Machine Machine2, Duration 12\\n  Step 5: Machine Machine7, Duration 48\\n  Step 6: Machine Machine11, Duration 117\\n  Step 7: Machine Machine15, Duration 96\\n  Step 8: Machine Machine4, Duration 99\\n  Step 9: Machine Machine18, Duration 30\\n  Step 10: Machine Machine3, Duration 24\\n  Step 11: Machine Machine14, Duration 96\\n  Step 12: Machine Machine16, Duration 69\\n  Step 13: Machine Machine5, Duration 49\\n  Step 14: Machine Machine19, Duration 134\\n  Step 15: Machine Machine10, Duration 124\\n  Step 16: Machine Machine6, Duration 54\\n  Step 17: Machine Machine13, Duration 16\\n  Step 18: Machine Machine0, Duration 171\\n  Step 19: Machine Machine9, Duration 127\\n  Step 20: Machine Machine8, Duration 17\\nJob38:\\n  Step 1: Machine Machine10, Duration 139\\n  Step 2: Machine Machine1, Duration 196\\n  Step 3: Machine Machine6, Duration 135\\n  Step 4: Machine Machine4, Duration 134\\n  Step 5: Machine Machine12, Duration 98\\n  Step 6: Machine Machine16, Duration 37\\n  Step 7: Machine Machine0, Duration 12\\n  Step 8: Machine Machine5, Duration 109\\n  Step 9: Machine Machine18, Duration 88\\n  Step 10: Machine Machine3, Duration 118\\n  Step 11: Machine Machine7, Duration 48\\n  Step 12: Machine Machine19, Duration 192\\n  Step 13: Machine Machine14, Duration 84\\n  Step 14: Machine Machine9, Duration 142\\n  Step 15: Machine Machine13, Duration 147\\n  Step 16: Machine Machine11, Duration 17\\n  Step 17: Machine Machine2, Duration 107\\n  Step 18: Machine Machine17, Duration 194\\n  Step 19: Machine Machine8, Duration 122\\n  Step 20: Machine Machine15, Duration 68\\nJob39:\\n  Step 1: Machine Machine9, Duration 106\\n  Step 2: Machine Machine10, Duration 154\\n  Step 3: Machine Machine1, Duration 111\\n  Step 4: Machine Machine3, Duration 148\\n  Step 5: Machine Machine11, Duration 128\\n  Step 6: Machine Machine2, Duration 153\\n  Step 7: Machine Machine15, Duration 88\\n  Step 8: Machine Machine4, Duration 45\\n  Step 9: Machine Machine16, Duration 191\\n  Step 10: Machine Machine18, Duration 164\\n  Step 11: Machine Machine17, Duration 116\\n  Step 12: Machine Machine5, Duration 1\\n  Step 13: Machine Machine0, Duration 31\\n  Step 14: Machine Machine19, Duration 95\\n  Step 15: Machine Machine7, Duration 51\\n  Step 16: Machine Machine14, Duration 46\\n  Step 17: Machine Machine6, Duration 123\\n  Step 18: Machine Machine12, Duration 16\\n  Step 19: Machine Machine8, Duration 187\\n  Step 20: Machine Machine13, Duration 189\\nJob40:\\n  Step 1: Machine Machine12, Duration 101\\n  Step 2: Machine Machine8, Duration 113\\n  Step 3: Machine Machine9, Duration 38\\n  Step 4: Machine Machine1, Duration 119\\n  Step 5: Machine Machine2, Duration 184\\n  Step 6: Machine Machine3, Duration 148\\n  Step 7: Machine Machine16, Duration 148\\n  Step 8: Machine Machine10, Duration 43\\n  Step 9: Machine Machine15, Duration 20\\n  Step 10: Machine Machine14, Duration 178\\n  Step 11: Machine Machine11, Duration 83\\n  Step 12: Machine Machine5, Duration 92\\n  Step 13: Machine Machine0, Duration 35\\n  Step 14: Machine Machine17, Duration 165\\n  Step 15: Machine Machine13, Duration 38\\n  Step 16: Machine Machine6, Duration 131\\n  Step 17: Machine Machine19, Duration 144\\n  Step 18: Machine Machine7, Duration 179\\n  Step 19: Machine Machine4, Duration 30\\n  Step 20: Machine Machine18, Duration 89\\nJob41:\\n  Step 1: Machine Machine9, Duration 164\\n  Step 2: Machine Machine19, Duration 55\\n  Step 3: Machine Machine8, Duration 176\\n  Step 4: Machine Machine18, Duration 82\\n  Step 5: Machine Machine14, Duration 61\\n  Step 6: Machine Machine0, Duration 183\\n  Step 7: Machine Machine15, Duration 14\\n  Step 8: Machine Machine16, Duration 27\\n  Step 9: Machine Machine11, Duration 66\\n  Step 10: Machine Machine12, Duration 91\\n  Step 11: Machine Machine13, Duration 22\\n  Step 12: Machine Machine6, Duration 158\\n  Step 13: Machine Machine4, Duration 165\\n  Step 14: Machine Machine1, Duration 182\\n  Step 15: Machine Machine17, Duration 86\\n  Step 16: Machine Machine3, Duration 197\\n  Step 17: Machine Machine10, Duration 139\\n  Step 18: Machine Machine7, Duration 157\\n  Step 19: Machine Machine5, Duration 119\\n  Step 20: Machine Machine2, Duration 114\\nJob42:\\n  Step 1: Machine Machine15, Duration 33\\n  Step 2: Machine Machine5, Duration 65\\n  Step 3: Machine Machine19, Duration 109\\n  Step 4: Machine Machine11, Duration 84\\n  Step 5: Machine Machine2, Duration 164\\n  Step 6: Machine Machine12, Duration 141\\n  Step 7: Machine Machine17, Duration 132\\n  Step 8: Machine Machine1, Duration 164\\n  Step 9: Machine Machine4, Duration 97\\n  Step 10: Machine Machine9, Duration 85\\n  Step 11: Machine Machine14, Duration 125\\n  Step 12: Machine Machine10, Duration 104\\n  Step 13: Machine Machine8, Duration 22\\n  Step 14: Machine Machine6, Duration 171\\n  Step 15: Machine Machine7, Duration 115\\n  Step 16: Machine Machine18, Duration 77\\n  Step 17: Machine Machine0, Duration 69\\n  Step 18: Machine Machine16, Duration 181\\n  Step 19: Machine Machine13, Duration 121\\n  Step 20: Machine Machine3, Duration 98\\nJob43:\\n  Step 1: Machine Machine4, Duration 44\\n  Step 2: Machine Machine5, Duration 99\\n  Step 3: Machine Machine19, Duration 20\\n  Step 4: Machine Machine18, Duration 171\\n  Step 5: Machine Machine17, Duration 174\\n  Step 6: Machine Machine6, Duration 87\\n  Step 7: Machine Machine13, Duration 33\\n  Step 8: Machine Machine3, Duration 18\\n  Step 9: Machine Machine11, Duration 153\\n  Step 10: Machine Machine2, Duration 153\\n  Step 11: Machine Machine16, Duration 113\\n  Step 12: Machine Machine15, Duration 149\\n  Step 13: Machine Machine7, Duration 103\\n  Step 14: Machine Machine8, Duration 103\\n  Step 15: Machine Machine10, Duration 138\\n  Step 16: Machine Machine14, Duration 67\\n  Step 17: Machine Machine9, Duration 56\\n  Step 18: Machine Machine1, Duration 92\\n  Step 19: Machine Machine0, Duration 137\\n  Step 20: Machine Machine12, Duration 105\\nJob44:\\n  Step 1: Machine Machine13, Duration 69\\n  Step 2: Machine Machine2, Duration 145\\n  Step 3: Machine Machine4, Duration 4\\n  Step 4: Machine Machine10, Duration 11\\n  Step 5: Machine Machine16, Duration 54\\n  Step 6: Machine Machine14, Duration 150\\n  Step 7: Machine Machine17, Duration 31\\n  Step 8: Machine Machine3, Duration 168\\n  Step 9: Machine Machine18, Duration 142\\n  Step 10: Machine Machine12, Duration 86\\n  Step 11: Machine Machine5, Duration 19\\n  Step 12: Machine Machine9, Duration 111\\n  Step 13: Machine Machine11, Duration 89\\n  Step 14: Machine Machine19, Duration 53\\n  Step 15: Machine Machine15, Duration 96\\n  Step 16: Machine Machine1, Duration 179\\n  Step 17: Machine Machine8, Duration 148\\n  Step 18: Machine Machine0, Duration 195\\n  Step 19: Machine Machine7, Duration 23\\n  Step 20: Machine Machine6, Duration 161\\nJob45:\\n  Step 1: Machine Machine15, Duration 95\\n  Step 2: Machine Machine7, Duration 75\\n  Step 3: Machine Machine13, Duration 65\\n  Step 4: Machine Machine17, Duration 83\\n  Step 5: Machine Machine18, Duration 169\\n  Step 6: Machine Machine8, Duration 170\\n  Step 7: Machine Machine16, Duration 195\\n  Step 8: Machine Machine0, Duration 193\\n  Step 9: Machine Machine11, Duration 144\\n  Step 10: Machine Machine10, Duration 53\\n  Step 11: Machine Machine12, Duration 102\\n  Step 12: Machine Machine4, Duration 27\\n  Step 13: Machine Machine3, Duration 122\\n  Step 14: Machine Machine2, Duration 199\\n  Step 15: Machine Machine19, Duration 198\\n  Step 16: Machine Machine6, Duration 184\\n  Step 17: Machine Machine9, Duration 6\\n  Step 18: Machine Machine5, Duration 9\\n  Step 19: Machine Machine14, Duration 124\\n  Step 20: Machine Machine1, Duration 17\\nJob46:\\n  Step 1: Machine Machine2, Duration 175\\n  Step 2: Machine Machine11, Duration 137\\n  Step 3: Machine Machine3, Duration 74\\n  Step 4: Machine Machine9, Duration 3\\n  Step 5: Machine Machine4, Duration 94\\n  Step 6: Machine Machine5, Duration 2\\n  Step 7: Machine Machine13, Duration 175\\n  Step 8: Machine Machine17, Duration 134\\n  Step 9: Machine Machine7, Duration 46\\n  Step 10: Machine Machine12, Duration 120\\n  Step 11: Machine Machine18, Duration 184\\n  Step 12: Machine Machine15, Duration 123\\n  Step 13: Machine Machine10, Duration 118\\n  Step 14: Machine Machine0, Duration 76\\n  Step 15: Machine Machine14, Duration 195\\n  Step 16: Machine Machine6, Duration 37\\n  Step 17: Machine Machine16, Duration 38\\n  Step 18: Machine Machine8, Duration 92\\n  Step 19: Machine Machine19, Duration 146\\n  Step 20: Machine Machine1, Duration 43\\nJob47:\\n  Step 1: Machine Machine17, Duration 105\\n  Step 2: Machine Machine16, Duration 68\\n  Step 3: Machine Machine2, Duration 195\\n  Step 4: Machine Machine4, Duration 131\\n  Step 5: Machine Machine15, Duration 9\\n  Step 6: Machine Machine18, Duration 61\\n  Step 7: Machine Machine12, Duration 170\\n  Step 8: Machine Machine19, Duration 186\\n  Step 9: Machine Machine13, Duration 152\\n  Step 10: Machine Machine6, Duration 166\\n  Step 11: Machine Machine9, Duration 69\\n  Step 12: Machine Machine14, Duration 46\\n  Step 13: Machine Machine10, Duration 164\\n  Step 14: Machine Machine11, Duration 46\\n  Step 15: Machine Machine5, Duration 84\\n  Step 16: Machine Machine1, Duration 133\\n  Step 17: Machine Machine0, Duration 19\\n  Step 18: Machine Machine3, Duration 199\\n  Step 19: Machine Machine7, Duration 175\\n  Step 20: Machine Machine8, Duration 59\\nJob48:\\n  Step 1: Machine Machine10, Duration 127\\n  Step 2: Machine Machine6, Duration 163\\n  Step 3: Machine Machine19, Duration 152\\n  Step 4: Machine Machine14, Duration 149\\n  Step 5: Machine Machine17, Duration 12\\n  Step 6: Machine Machine13, Duration 11\\n  Step 7: Machine Machine3, Duration 89\\n  Step 8: Machine Machine5, Duration 97\\n  Step 9: Machine Machine16, Duration 87\\n  Step 10: Machine Machine18, Duration 120\\n  Step 11: Machine Machine2, Duration 135\\n  Step 12: Machine Machine0, Duration 123\\n  Step 13: Machine Machine12, Duration 161\\n  Step 14: Machine Machine15, Duration 58\\n  Step 15: Machine Machine8, Duration 139\\n  Step 16: Machine Machine7, Duration 82\\n  Step 17: Machine Machine4, Duration 1\\n  Step 18: Machine Machine11, Duration 93\\n  Step 19: Machine Machine9, Duration 185\\n  Step 20: Machine Machine1, Duration 167\\nJob49:\\n  Step 1: Machine Machine19, Duration 154\\n  Step 2: Machine Machine3, Duration 124\\n  Step 3: Machine Machine5, Duration 198\\n  Step 4: Machine Machine15, Duration 49\\n  Step 5: Machine Machine0, Duration 100\\n  Step 6: Machine Machine8, Duration 145\\n  Step 7: Machine Machine4, Duration 17\\n  Step 8: Machine Machine12, Duration 103\\n  Step 9: Machine Machine13, Duration 130\\n  Step 10: Machine Machine18, Duration 170\\n  Step 11: Machine Machine1, Duration 130\\n  Step 12: Machine Machine17, Duration 122\\n  Step 13: Machine Machine11, Duration 137\\n  Step 14: Machine Machine14, Duration 33\\n  Step 15: Machine Machine6, Duration 109\\n  Step 16: Machine Machine2, Duration 26\\n  Step 17: Machine Machine9, Duration 120\\n  Step 18: Machine Machine7, Duration 33\\n  Step 19: Machine Machine10, Duration 140\\n  Step 20: Machine Machine16, Duration 126\\nJob50:\\n  Step 1: Machine Machine18, Duration 57\\n  Step 2: Machine Machine17, Duration 133\\n  Step 3: Machine Machine10, Duration 124\\n  Step 4: Machine Machine16, Duration 188\\n  Step 5: Machine Machine4, Duration 53\\n  Step 6: Machine Machine15, Duration 24\\n  Step 7: Machine Machine11, Duration 81\\n  Step 8: Machine Machine1, Duration 93\\n  Step 9: Machine Machine7, Duration 89\\n  Step 10: Machine Machine19, Duration 12\\n  Step 11: Machine Machine6, Duration 110\\n  Step 12: Machine Machine8, Duration 111\\n  Step 13: Machine Machine0, Duration 72\\n  Step 14: Machine Machine13, Duration 163\\n  Step 15: Machine Machine12, Duration 155\\n  Step 16: Machine Machine5, Duration 151\\n  Step 17: Machine Machine3, Duration 121\\n  Step 18: Machine Machine2, Duration 98\\n  Step 19: Machine Machine9, Duration 95\\n  Step 20: Machine Machine14, Duration 164\\n        \\n        REQUIRED OUTPUT FORMAT:\\n        You must provide your solution in the following exact format:\\n        \\n        1. FINAL MAKESPAN: [integer value]\\n        2. STRUCTURED SCHEDULE:\\n           For each operation, provide:\\n           - Job: [job_name]\\n           - Step: [step_number]\\n           - Machine: [machine_name]\\n           - Start Time: [start_time]\\n           - End Time: [end_time]\\n           - Duration: [duration]\\n        \\n        Example format:\\n        FINAL MAKESPAN: 25\\n        STRUCTURED SCHEDULE:\\n        - Job: Job1, Step: 1, Machine: Machine0, Start Time: 0, End Time: 3, Duration: 3\\n        - Job: Job1, Step: 2, Machine: Machine1, Start Time: 3, End Time: 7, Duration: 4\\n        - Job: Job2, Step: 1, Machine: Machine1, Start Time: 7, End Time: 10, Duration: 3\\n        \\n        Please solve this Job Shop Scheduling Problem and provide:\\n        1. A valid schedule with start and end times for each operation\\n        2. The minimum makespan (total completion time)\\n        3. Ensure all constraints are satisfied:\\n           - Job precedence: operations within a job must be sequential\\n           - Machine constraints: no overlapping operations on the same machine\\n        ",
        "Machine Coordinator Agent": "\\n        Job Shop Scheduling Problem (JSSP) - Dataset: rcmax_50_20_6\\n        \\n        Problem Description:\\n        - Number of jobs: 50\\n        - Each job has multiple operations that must be performed in sequence\\n        - Each operation requires a specific machine and has a duration\\n        - Each machine can only process one operation at a time\\n        - Goal: Find the minimum makespan (total completion time)\\n        \\n        Job Specifications:\\n        \\nJob1:\\n  Step 1: Machine Machine12, Duration 93\\n  Step 2: Machine Machine17, Duration 199\\n  Step 3: Machine Machine13, Duration 26\\n  Step 4: Machine Machine0, Duration 48\\n  Step 5: Machine Machine9, Duration 172\\n  Step 6: Machine Machine2, Duration 175\\n  Step 7: Machine Machine14, Duration 39\\n  Step 8: Machine Machine16, Duration 39\\n  Step 9: Machine Machine11, Duration 11\\n  Step 10: Machine Machine4, Duration 138\\n  Step 11: Machine Machine6, Duration 197\\n  Step 12: Machine Machine8, Duration 97\\n  Step 13: Machine Machine15, Duration 92\\n  Step 14: Machine Machine1, Duration 46\\n  Step 15: Machine Machine18, Duration 182\\n  Step 16: Machine Machine10, Duration 180\\n  Step 17: Machine Machine3, Duration 109\\n  Step 18: Machine Machine19, Duration 147\\n  Step 19: Machine Machine7, Duration 167\\n  Step 20: Machine Machine5, Duration 66\\nJob2:\\n  Step 1: Machine Machine0, Duration 40\\n  Step 2: Machine Machine7, Duration 46\\n  Step 3: Machine Machine18, Duration 52\\n  Step 4: Machine Machine9, Duration 126\\n  Step 5: Machine Machine12, Duration 136\\n  Step 6: Machine Machine19, Duration 147\\n  Step 7: Machine Machine15, Duration 152\\n  Step 8: Machine Machine3, Duration 28\\n  Step 9: Machine Machine11, Duration 101\\n  Step 10: Machine Machine13, Duration 8\\n  Step 11: Machine Machine14, Duration 110\\n  Step 12: Machine Machine2, Duration 6\\n  Step 13: Machine Machine6, Duration 103\\n  Step 14: Machine Machine1, Duration 166\\n  Step 15: Machine Machine16, Duration 51\\n  Step 16: Machine Machine10, Duration 4\\n  Step 17: Machine Machine17, Duration 119\\n  Step 18: Machine Machine5, Duration 100\\n  Step 19: Machine Machine4, Duration 197\\n  Step 20: Machine Machine8, Duration 185\\nJob3:\\n  Step 1: Machine Machine7, Duration 109\\n  Step 2: Machine Machine5, Duration 198\\n  Step 3: Machine Machine15, Duration 133\\n  Step 4: Machine Machine18, Duration 19\\n  Step 5: Machine Machine2, Duration 112\\n  Step 6: Machine Machine10, Duration 118\\n  Step 7: Machine Machine6, Duration 9\\n  Step 8: Machine Machine1, Duration 46\\n  Step 9: Machine Machine17, Duration 21\\n  Step 10: Machine Machine4, Duration 87\\n  Step 11: Machine Machine14, Duration 32\\n  Step 12: Machine Machine8, Duration 86\\n  Step 13: Machine Machine9, Duration 46\\n  Step 14: Machine Machine0, Duration 70\\n  Step 15: Machine Machine11, Duration 52\\n  Step 16: Machine Machine16, Duration 27\\n  Step 17: Machine Machine12, Duration 120\\n  Step 18: Machine Machine3, Duration 154\\n  Step 19: Machine Machine19, Duration 28\\n  Step 20: Machine Machine13, Duration 123\\nJob4:\\n  Step 1: Machine Machine7, Duration 136\\n  Step 2: Machine Machine14, Duration 93\\n  Step 3: Machine Machine12, Duration 123\\n  Step 4: Machine Machine2, Duration 167\\n  Step 5: Machine Machine10, Duration 158\\n  Step 6: Machine Machine11, Duration 53\\n  Step 7: Machine Machine19, Duration 99\\n  Step 8: Machine Machine0, Duration 8\\n  Step 9: Machine Machine17, Duration 191\\n  Step 10: Machine Machine4, Duration 138\\n  Step 11: Machine Machine9, Duration 149\\n  Step 12: Machine Machine5, Duration 156\\n  Step 13: Machine Machine13, Duration 30\\n  Step 14: Machine Machine16, Duration 90\\n  Step 15: Machine Machine3, Duration 124\\n  Step 16: Machine Machine8, Duration 127\\n  Step 17: Machine Machine18, Duration 67\\n  Step 18: Machine Machine1, Duration 104\\n  Step 19: Machine Machine15, Duration 116\\n  Step 20: Machine Machine6, Duration 127\\nJob5:\\n  Step 1: Machine Machine7, Duration 42\\n  Step 2: Machine Machine16, Duration 128\\n  Step 3: Machine Machine2, Duration 170\\n  Step 4: Machine Machine18, Duration 5\\n  Step 5: Machine Machine13, Duration 80\\n  Step 6: Machine Machine11, Duration 124\\n  Step 7: Machine Machine5, Duration 137\\n  Step 8: Machine Machine15, Duration 15\\n  Step 9: Machine Machine10, Duration 180\\n  Step 10: Machine Machine19, Duration 53\\n  Step 11: Machine Machine0, Duration 190\\n  Step 12: Machine Machine1, Duration 46\\n  Step 13: Machine Machine8, Duration 149\\n  Step 14: Machine Machine6, Duration 129\\n  Step 15: Machine Machine12, Duration 178\\n  Step 16: Machine Machine9, Duration 144\\n  Step 17: Machine Machine14, Duration 124\\n  Step 18: Machine Machine17, Duration 196\\n  Step 19: Machine Machine3, Duration 18\\n  Step 20: Machine Machine4, Duration 110\\nJob6:\\n  Step 1: Machine Machine9, Duration 59\\n  Step 2: Machine Machine17, Duration 116\\n  Step 3: Machine Machine16, Duration 68\\n  Step 4: Machine Machine13, Duration 35\\n  Step 5: Machine Machine0, Duration 169\\n  Step 6: Machine Machine14, Duration 70\\n  Step 7: Machine Machine1, Duration 129\\n  Step 8: Machine Machine12, Duration 34\\n  Step 9: Machine Machine10, Duration 73\\n  Step 10: Machine Machine18, Duration 77\\n  Step 11: Machine Machine11, Duration 177\\n  Step 12: Machine Machine4, Duration 63\\n  Step 13: Machine Machine3, Duration 13\\n  Step 14: Machine Machine2, Duration 58\\n  Step 15: Machine Machine15, Duration 137\\n  Step 16: Machine Machine5, Duration 84\\n  Step 17: Machine Machine8, Duration 67\\n  Step 18: Machine Machine19, Duration 121\\n  Step 19: Machine Machine7, Duration 187\\n  Step 20: Machine Machine6, Duration 105\\nJob7:\\n  Step 1: Machine Machine16, Duration 57\\n  Step 2: Machine Machine1, Duration 173\\n  Step 3: Machine Machine7, Duration 6\\n  Step 4: Machine Machine5, Duration 19\\n  Step 5: Machine Machine12, Duration 91\\n  Step 6: Machine Machine11, Duration 114\\n  Step 7: Machine Machine14, Duration 94\\n  Step 8: Machine Machine17, Duration 156\\n  Step 9: Machine Machine9, Duration 72\\n  Step 10: Machine Machine19, Duration 112\\n  Step 11: Machine Machine18, Duration 1\\n  Step 12: Machine Machine13, Duration 111\\n  Step 13: Machine Machine2, Duration 168\\n  Step 14: Machine Machine3, Duration 44\\n  Step 15: Machine Machine6, Duration 15\\n  Step 16: Machine Machine4, Duration 194\\n  Step 17: Machine Machine0, Duration 119\\n  Step 18: Machine Machine15, Duration 57\\n  Step 19: Machine Machine10, Duration 101\\n  Step 20: Machine Machine8, Duration 164\\nJob8:\\n  Step 1: Machine Machine9, Duration 126\\n  Step 2: Machine Machine11, Duration 29\\n  Step 3: Machine Machine15, Duration 17\\n  Step 4: Machine Machine8, Duration 62\\n  Step 5: Machine Machine0, Duration 171\\n  Step 6: Machine Machine14, Duration 181\\n  Step 7: Machine Machine13, Duration 184\\n  Step 8: Machine Machine12, Duration 35\\n  Step 9: Machine Machine5, Duration 30\\n  Step 10: Machine Machine4, Duration 115\\n  Step 11: Machine Machine6, Duration 2\\n  Step 12: Machine Machine3, Duration 151\\n  Step 13: Machine Machine16, Duration 65\\n  Step 14: Machine Machine19, Duration 91\\n  Step 15: Machine Machine1, Duration 77\\n  Step 16: Machine Machine17, Duration 166\\n  Step 17: Machine Machine2, Duration 74\\n  Step 18: Machine Machine10, Duration 183\\n  Step 19: Machine Machine18, Duration 177\\n  Step 20: Machine Machine7, Duration 187\\nJob9:\\n  Step 1: Machine Machine8, Duration 99\\n  Step 2: Machine Machine18, Duration 122\\n  Step 3: Machine Machine11, Duration 49\\n  Step 4: Machine Machine7, Duration 44\\n  Step 5: Machine Machine10, Duration 126\\n  Step 6: Machine Machine17, Duration 168\\n  Step 7: Machine Machine3, Duration 20\\n  Step 8: Machine Machine6, Duration 46\\n  Step 9: Machine Machine14, Duration 190\\n  Step 10: Machine Machine4, Duration 162\\n  Step 11: Machine Machine1, Duration 184\\n  Step 12: Machine Machine0, Duration 96\\n  Step 13: Machine Machine5, Duration 170\\n  Step 14: Machine Machine16, Duration 147\\n  Step 15: Machine Machine19, Duration 10\\n  Step 16: Machine Machine13, Duration 142\\n  Step 17: Machine Machine9, Duration 111\\n  Step 18: Machine Machine12, Duration 12\\n  Step 19: Machine Machine2, Duration 86\\n  Step 20: Machine Machine15, Duration 196\\nJob10:\\n  Step 1: Machine Machine12, Duration 114\\n  Step 2: Machine Machine16, Duration 75\\n  Step 3: Machine Machine15, Duration 66\\n  Step 4: Machine Machine9, Duration 170\\n  Step 5: Machine Machine6, Duration 70\\n  Step 6: Machine Machine2, Duration 50\\n  Step 7: Machine Machine10, Duration 131\\n  Step 8: Machine Machine11, Duration 57\\n  Step 9: Machine Machine5, Duration 61\\n  Step 10: Machine Machine0, Duration 188\\n  Step 11: Machine Machine8, Duration 74\\n  Step 12: Machine Machine1, Duration 107\\n  Step 13: Machine Machine13, Duration 152\\n  Step 14: Machine Machine4, Duration 152\\n  Step 15: Machine Machine18, Duration 60\\n  Step 16: Machine Machine17, Duration 97\\n  Step 17: Machine Machine19, Duration 19\\n  Step 18: Machine Machine3, Duration 15\\n  Step 19: Machine Machine7, Duration 147\\n  Step 20: Machine Machine14, Duration 156\\nJob11:\\n  Step 1: Machine Machine0, Duration 29\\n  Step 2: Machine Machine1, Duration 179\\n  Step 3: Machine Machine7, Duration 109\\n  Step 4: Machine Machine4, Duration 30\\n  Step 5: Machine Machine18, Duration 92\\n  Step 6: Machine Machine10, Duration 71\\n  Step 7: Machine Machine9, Duration 111\\n  Step 8: Machine Machine15, Duration 146\\n  Step 9: Machine Machine5, Duration 77\\n  Step 10: Machine Machine19, Duration 59\\n  Step 11: Machine Machine2, Duration 146\\n  Step 12: Machine Machine17, Duration 16\\n  Step 13: Machine Machine16, Duration 49\\n  Step 14: Machine Machine13, Duration 12\\n  Step 15: Machine Machine12, Duration 144\\n  Step 16: Machine Machine3, Duration 95\\n  Step 17: Machine Machine14, Duration 163\\n  Step 18: Machine Machine6, Duration 199\\n  Step 19: Machine Machine11, Duration 157\\n  Step 20: Machine Machine8, Duration 131\\nJob12:\\n  Step 1: Machine Machine17, Duration 174\\n  Step 2: Machine Machine13, Duration 22\\n  Step 3: Machine Machine11, Duration 142\\n  Step 4: Machine Machine8, Duration 32\\n  Step 5: Machine Machine14, Duration 49\\n  Step 6: Machine Machine10, Duration 97\\n  Step 7: Machine Machine5, Duration 47\\n  Step 8: Machine Machine4, Duration 140\\n  Step 9: Machine Machine12, Duration 49\\n  Step 10: Machine Machine18, Duration 41\\n  Step 11: Machine Machine9, Duration 157\\n  Step 12: Machine Machine2, Duration 3\\n  Step 13: Machine Machine7, Duration 198\\n  Step 14: Machine Machine19, Duration 92\\n  Step 15: Machine Machine0, Duration 2\\n  Step 16: Machine Machine3, Duration 142\\n  Step 17: Machine Machine1, Duration 114\\n  Step 18: Machine Machine16, Duration 4\\n  Step 19: Machine Machine6, Duration 98\\n  Step 20: Machine Machine15, Duration 100\\nJob13:\\n  Step 1: Machine Machine17, Duration 47\\n  Step 2: Machine Machine8, Duration 55\\n  Step 3: Machine Machine7, Duration 136\\n  Step 4: Machine Machine9, Duration 51\\n  Step 5: Machine Machine1, Duration 79\\n  Step 6: Machine Machine4, Duration 37\\n  Step 7: Machine Machine15, Duration 100\\n  Step 8: Machine Machine14, Duration 139\\n  Step 9: Machine Machine0, Duration 45\\n  Step 10: Machine Machine10, Duration 39\\n  Step 11: Machine Machine16, Duration 160\\n  Step 12: Machine Machine19, Duration 90\\n  Step 13: Machine Machine5, Duration 114\\n  Step 14: Machine Machine13, Duration 13\\n  Step 15: Machine Machine2, Duration 66\\n  Step 16: Machine Machine11, Duration 90\\n  Step 17: Machine Machine12, Duration 187\\n  Step 18: Machine Machine6, Duration 47\\n  Step 19: Machine Machine18, Duration 75\\n  Step 20: Machine Machine3, Duration 151\\nJob14:\\n  Step 1: Machine Machine18, Duration 139\\n  Step 2: Machine Machine5, Duration 102\\n  Step 3: Machine Machine4, Duration 181\\n  Step 4: Machine Machine7, Duration 24\\n  Step 5: Machine Machine13, Duration 142\\n  Step 6: Machine Machine8, Duration 23\\n  Step 7: Machine Machine16, Duration 100\\n  Step 8: Machine Machine11, Duration 95\\n  Step 9: Machine Machine3, Duration 89\\n  Step 10: Machine Machine14, Duration 144\\n  Step 11: Machine Machine15, Duration 159\\n  Step 12: Machine Machine10, Duration 176\\n  Step 13: Machine Machine9, Duration 153\\n  Step 14: Machine Machine2, Duration 112\\n  Step 15: Machine Machine12, Duration 136\\n  Step 16: Machine Machine6, Duration 97\\n  Step 17: Machine Machine19, Duration 176\\n  Step 18: Machine Machine17, Duration 20\\n  Step 19: Machine Machine1, Duration 154\\n  Step 20: Machine Machine0, Duration 15\\nJob15:\\n  Step 1: Machine Machine16, Duration 183\\n  Step 2: Machine Machine12, Duration 53\\n  Step 3: Machine Machine2, Duration 2\\n  Step 4: Machine Machine15, Duration 26\\n  Step 5: Machine Machine1, Duration 196\\n  Step 6: Machine Machine9, Duration 15\\n  Step 7: Machine Machine18, Duration 5\\n  Step 8: Machine Machine7, Duration 103\\n  Step 9: Machine Machine3, Duration 40\\n  Step 10: Machine Machine5, Duration 86\\n  Step 11: Machine Machine4, Duration 130\\n  Step 12: Machine Machine6, Duration 118\\n  Step 13: Machine Machine0, Duration 111\\n  Step 14: Machine Machine8, Duration 94\\n  Step 15: Machine Machine13, Duration 118\\n  Step 16: Machine Machine11, Duration 119\\n  Step 17: Machine Machine19, Duration 188\\n  Step 18: Machine Machine17, Duration 119\\n  Step 19: Machine Machine14, Duration 55\\n  Step 20: Machine Machine10, Duration 146\\nJob16:\\n  Step 1: Machine Machine0, Duration 97\\n  Step 2: Machine Machine9, Duration 197\\n  Step 3: Machine Machine1, Duration 127\\n  Step 4: Machine Machine8, Duration 39\\n  Step 5: Machine Machine11, Duration 80\\n  Step 6: Machine Machine5, Duration 138\\n  Step 7: Machine Machine13, Duration 77\\n  Step 8: Machine Machine2, Duration 3\\n  Step 9: Machine Machine17, Duration 116\\n  Step 10: Machine Machine4, Duration 115\\n  Step 11: Machine Machine6, Duration 127\\n  Step 12: Machine Machine18, Duration 61\\n  Step 13: Machine Machine7, Duration 124\\n  Step 14: Machine Machine15, Duration 7\\n  Step 15: Machine Machine12, Duration 111\\n  Step 16: Machine Machine14, Duration 40\\n  Step 17: Machine Machine16, Duration 96\\n  Step 18: Machine Machine10, Duration 34\\n  Step 19: Machine Machine19, Duration 159\\n  Step 20: Machine Machine3, Duration 29\\nJob17:\\n  Step 1: Machine Machine18, Duration 123\\n  Step 2: Machine Machine5, Duration 22\\n  Step 3: Machine Machine1, Duration 135\\n  Step 4: Machine Machine19, Duration 99\\n  Step 5: Machine Machine8, Duration 105\\n  Step 6: Machine Machine11, Duration 14\\n  Step 7: Machine Machine13, Duration 159\\n  Step 8: Machine Machine9, Duration 21\\n  Step 9: Machine Machine14, Duration 86\\n  Step 10: Machine Machine17, Duration 12\\n  Step 11: Machine Machine7, Duration 49\\n  Step 12: Machine Machine6, Duration 160\\n  Step 13: Machine Machine4, Duration 66\\n  Step 14: Machine Machine12, Duration 9\\n  Step 15: Machine Machine3, Duration 31\\n  Step 16: Machine Machine16, Duration 134\\n  Step 17: Machine Machine15, Duration 12\\n  Step 18: Machine Machine10, Duration 38\\n  Step 19: Machine Machine2, Duration 131\\n  Step 20: Machine Machine0, Duration 55\\nJob18:\\n  Step 1: Machine Machine12, Duration 18\\n  Step 2: Machine Machine11, Duration 93\\n  Step 3: Machine Machine7, Duration 128\\n  Step 4: Machine Machine17, Duration 41\\n  Step 5: Machine Machine8, Duration 174\\n  Step 6: Machine Machine4, Duration 75\\n  Step 7: Machine Machine15, Duration 44\\n  Step 8: Machine Machine5, Duration 15\\n  Step 9: Machine Machine9, Duration 100\\n  Step 10: Machine Machine14, Duration 58\\n  Step 11: Machine Machine10, Duration 166\\n  Step 12: Machine Machine13, Duration 89\\n  Step 13: Machine Machine16, Duration 174\\n  Step 14: Machine Machine19, Duration 91\\n  Step 15: Machine Machine3, Duration 33\\n  Step 16: Machine Machine0, Duration 28\\n  Step 17: Machine Machine6, Duration 195\\n  Step 18: Machine Machine1, Duration 163\\n  Step 19: Machine Machine18, Duration 95\\n  Step 20: Machine Machine2, Duration 40\\nJob19:\\n  Step 1: Machine Machine18, Duration 185\\n  Step 2: Machine Machine9, Duration 88\\n  Step 3: Machine Machine13, Duration 135\\n  Step 4: Machine Machine1, Duration 98\\n  Step 5: Machine Machine15, Duration 196\\n  Step 6: Machine Machine0, Duration 119\\n  Step 7: Machine Machine8, Duration 52\\n  Step 8: Machine Machine10, Duration 21\\n  Step 9: Machine Machine6, Duration 130\\n  Step 10: Machine Machine4, Duration 141\\n  Step 11: Machine Machine17, Duration 52\\n  Step 12: Machine Machine14, Duration 96\\n  Step 13: Machine Machine2, Duration 34\\n  Step 14: Machine Machine3, Duration 115\\n  Step 15: Machine Machine12, Duration 5\\n  Step 16: Machine Machine5, Duration 74\\n  Step 17: Machine Machine11, Duration 104\\n  Step 18: Machine Machine19, Duration 88\\n  Step 19: Machine Machine7, Duration 162\\n  Step 20: Machine Machine16, Duration 113\\nJob20:\\n  Step 1: Machine Machine6, Duration 63\\n  Step 2: Machine Machine2, Duration 140\\n  Step 3: Machine Machine4, Duration 8\\n  Step 4: Machine Machine0, Duration 73\\n  Step 5: Machine Machine15, Duration 115\\n  Step 6: Machine Machine3, Duration 178\\n  Step 7: Machine Machine1, Duration 101\\n  Step 8: Machine Machine17, Duration 149\\n  Step 9: Machine Machine19, Duration 137\\n  Step 10: Machine Machine18, Duration 170\\n  Step 11: Machine Machine16, Duration 92\\n  Step 12: Machine Machine8, Duration 149\\n  Step 13: Machine Machine9, Duration 180\\n  Step 14: Machine Machine11, Duration 103\\n  Step 15: Machine Machine7, Duration 179\\n  Step 16: Machine Machine13, Duration 106\\n  Step 17: Machine Machine5, Duration 57\\n  Step 18: Machine Machine12, Duration 171\\n  Step 19: Machine Machine14, Duration 112\\n  Step 20: Machine Machine10, Duration 104\\nJob21:\\n  Step 1: Machine Machine8, Duration 125\\n  Step 2: Machine Machine5, Duration 82\\n  Step 3: Machine Machine2, Duration 151\\n  Step 4: Machine Machine9, Duration 10\\n  Step 5: Machine Machine4, Duration 162\\n  Step 6: Machine Machine10, Duration 144\\n  Step 7: Machine Machine1, Duration 9\\n  Step 8: Machine Machine13, Duration 193\\n  Step 9: Machine Machine0, Duration 165\\n  Step 10: Machine Machine3, Duration 98\\n  Step 11: Machine Machine14, Duration 134\\n  Step 12: Machine Machine11, Duration 198\\n  Step 13: Machine Machine15, Duration 129\\n  Step 14: Machine Machine6, Duration 34\\n  Step 15: Machine Machine16, Duration 139\\n  Step 16: Machine Machine12, Duration 89\\n  Step 17: Machine Machine7, Duration 108\\n  Step 18: Machine Machine17, Duration 87\\n  Step 19: Machine Machine19, Duration 86\\n  Step 20: Machine Machine18, Duration 51\\nJob22:\\n  Step 1: Machine Machine0, Duration 107\\n  Step 2: Machine Machine8, Duration 84\\n  Step 3: Machine Machine2, Duration 70\\n  Step 4: Machine Machine12, Duration 31\\n  Step 5: Machine Machine19, Duration 163\\n  Step 6: Machine Machine11, Duration 104\\n  Step 7: Machine Machine1, Duration 54\\n  Step 8: Machine Machine4, Duration 19\\n  Step 9: Machine Machine6, Duration 85\\n  Step 10: Machine Machine15, Duration 194\\n  Step 11: Machine Machine10, Duration 157\\n  Step 12: Machine Machine13, Duration 124\\n  Step 13: Machine Machine5, Duration 193\\n  Step 14: Machine Machine16, Duration 140\\n  Step 15: Machine Machine9, Duration 187\\n  Step 16: Machine Machine7, Duration 162\\n  Step 17: Machine Machine14, Duration 23\\n  Step 18: Machine Machine18, Duration 59\\n  Step 19: Machine Machine17, Duration 26\\n  Step 20: Machine Machine3, Duration 182\\nJob23:\\n  Step 1: Machine Machine3, Duration 86\\n  Step 2: Machine Machine17, Duration 25\\n  Step 3: Machine Machine19, Duration 109\\n  Step 4: Machine Machine18, Duration 95\\n  Step 5: Machine Machine12, Duration 85\\n  Step 6: Machine Machine0, Duration 179\\n  Step 7: Machine Machine9, Duration 76\\n  Step 8: Machine Machine6, Duration 68\\n  Step 9: Machine Machine15, Duration 104\\n  Step 10: Machine Machine2, Duration 25\\n  Step 11: Machine Machine4, Duration 24\\n  Step 12: Machine Machine7, Duration 113\\n  Step 13: Machine Machine5, Duration 37\\n  Step 14: Machine Machine10, Duration 155\\n  Step 15: Machine Machine8, Duration 113\\n  Step 16: Machine Machine1, Duration 134\\n  Step 17: Machine Machine13, Duration 190\\n  Step 18: Machine Machine14, Duration 67\\n  Step 19: Machine Machine11, Duration 192\\n  Step 20: Machine Machine16, Duration 172\\nJob24:\\n  Step 1: Machine Machine19, Duration 28\\n  Step 2: Machine Machine10, Duration 4\\n  Step 3: Machine Machine16, Duration 91\\n  Step 4: Machine Machine3, Duration 104\\n  Step 5: Machine Machine13, Duration 37\\n  Step 6: Machine Machine0, Duration 198\\n  Step 7: Machine Machine15, Duration 53\\n  Step 8: Machine Machine18, Duration 165\\n  Step 9: Machine Machine1, Duration 72\\n  Step 10: Machine Machine4, Duration 8\\n  Step 11: Machine Machine2, Duration 93\\n  Step 12: Machine Machine5, Duration 161\\n  Step 13: Machine Machine6, Duration 148\\n  Step 14: Machine Machine9, Duration 181\\n  Step 15: Machine Machine11, Duration 109\\n  Step 16: Machine Machine12, Duration 49\\n  Step 17: Machine Machine14, Duration 110\\n  Step 18: Machine Machine8, Duration 76\\n  Step 19: Machine Machine7, Duration 130\\n  Step 20: Machine Machine17, Duration 7\\nJob25:\\n  Step 1: Machine Machine5, Duration 36\\n  Step 2: Machine Machine1, Duration 139\\n  Step 3: Machine Machine17, Duration 66\\n  Step 4: Machine Machine19, Duration 88\\n  Step 5: Machine Machine8, Duration 41\\n  Step 6: Machine Machine9, Duration 148\\n  Step 7: Machine Machine7, Duration 162\\n  Step 8: Machine Machine16, Duration 69\\n  Step 9: Machine Machine12, Duration 189\\n  Step 10: Machine Machine3, Duration 57\\n  Step 11: Machine Machine0, Duration 157\\n  Step 12: Machine Machine4, Duration 43\\n  Step 13: Machine Machine10, Duration 198\\n  Step 14: Machine Machine6, Duration 149\\n  Step 15: Machine Machine2, Duration 192\\n  Step 16: Machine Machine13, Duration 57\\n  Step 17: Machine Machine14, Duration 95\\n  Step 18: Machine Machine18, Duration 95\\n  Step 19: Machine Machine11, Duration 11\\n  Step 20: Machine Machine15, Duration 158\\nJob26:\\n  Step 1: Machine Machine5, Duration 8\\n  Step 2: Machine Machine1, Duration 149\\n  Step 3: Machine Machine8, Duration 168\\n  Step 4: Machine Machine9, Duration 159\\n  Step 5: Machine Machine12, Duration 65\\n  Step 6: Machine Machine4, Duration 194\\n  Step 7: Machine Machine17, Duration 48\\n  Step 8: Machine Machine6, Duration 4\\n  Step 9: Machine Machine2, Duration 197\\n  Step 10: Machine Machine16, Duration 91\\n  Step 11: Machine Machine18, Duration 122\\n  Step 12: Machine Machine0, Duration 123\\n  Step 13: Machine Machine15, Duration 27\\n  Step 14: Machine Machine19, Duration 76\\n  Step 15: Machine Machine7, Duration 147\\n  Step 16: Machine Machine13, Duration 120\\n  Step 17: Machine Machine14, Duration 20\\n  Step 18: Machine Machine11, Duration 24\\n  Step 19: Machine Machine3, Duration 133\\n  Step 20: Machine Machine10, Duration 182\\nJob27:\\n  Step 1: Machine Machine11, Duration 29\\n  Step 2: Machine Machine9, Duration 46\\n  Step 3: Machine Machine7, Duration 164\\n  Step 4: Machine Machine13, Duration 152\\n  Step 5: Machine Machine1, Duration 4\\n  Step 6: Machine Machine18, Duration 129\\n  Step 7: Machine Machine14, Duration 148\\n  Step 8: Machine Machine2, Duration 46\\n  Step 9: Machine Machine19, Duration 98\\n  Step 10: Machine Machine16, Duration 84\\n  Step 11: Machine Machine10, Duration 133\\n  Step 12: Machine Machine15, Duration 137\\n  Step 13: Machine Machine4, Duration 192\\n  Step 14: Machine Machine5, Duration 166\\n  Step 15: Machine Machine3, Duration 14\\n  Step 16: Machine Machine6, Duration 173\\n  Step 17: Machine Machine17, Duration 44\\n  Step 18: Machine Machine0, Duration 144\\n  Step 19: Machine Machine8, Duration 99\\n  Step 20: Machine Machine12, Duration 85\\nJob28:\\n  Step 1: Machine Machine9, Duration 64\\n  Step 2: Machine Machine19, Duration 62\\n  Step 3: Machine Machine1, Duration 3\\n  Step 4: Machine Machine14, Duration 109\\n  Step 5: Machine Machine12, Duration 133\\n  Step 6: Machine Machine7, Duration 33\\n  Step 7: Machine Machine11, Duration 19\\n  Step 8: Machine Machine16, Duration 46\\n  Step 9: Machine Machine0, Duration 89\\n  Step 10: Machine Machine6, Duration 27\\n  Step 11: Machine Machine2, Duration 108\\n  Step 12: Machine Machine15, Duration 49\\n  Step 13: Machine Machine10, Duration 137\\n  Step 14: Machine Machine4, Duration 138\\n  Step 15: Machine Machine5, Duration 27\\n  Step 16: Machine Machine3, Duration 65\\n  Step 17: Machine Machine17, Duration 1\\n  Step 18: Machine Machine13, Duration 182\\n  Step 19: Machine Machine18, Duration 35\\n  Step 20: Machine Machine8, Duration 51\\nJob29:\\n  Step 1: Machine Machine17, Duration 165\\n  Step 2: Machine Machine2, Duration 31\\n  Step 3: Machine Machine7, Duration 16\\n  Step 4: Machine Machine5, Duration 28\\n  Step 5: Machine Machine3, Duration 81\\n  Step 6: Machine Machine19, Duration 112\\n  Step 7: Machine Machine11, Duration 17\\n  Step 8: Machine Machine8, Duration 168\\n  Step 9: Machine Machine1, Duration 139\\n  Step 10: Machine Machine0, Duration 80\\n  Step 11: Machine Machine9, Duration 141\\n  Step 12: Machine Machine10, Duration 46\\n  Step 13: Machine Machine14, Duration 26\\n  Step 14: Machine Machine13, Duration 173\\n  Step 15: Machine Machine4, Duration 173\\n  Step 16: Machine Machine18, Duration 189\\n  Step 17: Machine Machine15, Duration 193\\n  Step 18: Machine Machine12, Duration 107\\n  Step 19: Machine Machine16, Duration 177\\n  Step 20: Machine Machine6, Duration 77\\nJob30:\\n  Step 1: Machine Machine3, Duration 19\\n  Step 2: Machine Machine6, Duration 33\\n  Step 3: Machine Machine13, Duration 161\\n  Step 4: Machine Machine2, Duration 9\\n  Step 5: Machine Machine9, Duration 112\\n  Step 6: Machine Machine1, Duration 185\\n  Step 7: Machine Machine4, Duration 134\\n  Step 8: Machine Machine8, Duration 77\\n  Step 9: Machine Machine5, Duration 190\\n  Step 10: Machine Machine14, Duration 109\\n  Step 11: Machine Machine16, Duration 149\\n  Step 12: Machine Machine0, Duration 60\\n  Step 13: Machine Machine19, Duration 82\\n  Step 14: Machine Machine11, Duration 89\\n  Step 15: Machine Machine10, Duration 193\\n  Step 16: Machine Machine12, Duration 182\\n  Step 17: Machine Machine17, Duration 73\\n  Step 18: Machine Machine18, Duration 103\\n  Step 19: Machine Machine7, Duration 153\\n  Step 20: Machine Machine15, Duration 18\\nJob31:\\n  Step 1: Machine Machine14, Duration 34\\n  Step 2: Machine Machine6, Duration 112\\n  Step 3: Machine Machine7, Duration 154\\n  Step 4: Machine Machine3, Duration 66\\n  Step 5: Machine Machine0, Duration 147\\n  Step 6: Machine Machine13, Duration 165\\n  Step 7: Machine Machine19, Duration 177\\n  Step 8: Machine Machine15, Duration 192\\n  Step 9: Machine Machine5, Duration 160\\n  Step 10: Machine Machine4, Duration 180\\n  Step 11: Machine Machine18, Duration 177\\n  Step 12: Machine Machine8, Duration 51\\n  Step 13: Machine Machine10, Duration 82\\n  Step 14: Machine Machine11, Duration 169\\n  Step 15: Machine Machine9, Duration 6\\n  Step 16: Machine Machine17, Duration 195\\n  Step 17: Machine Machine16, Duration 149\\n  Step 18: Machine Machine1, Duration 54\\n  Step 19: Machine Machine2, Duration 10\\n  Step 20: Machine Machine12, Duration 156\\nJob32:\\n  Step 1: Machine Machine1, Duration 17\\n  Step 2: Machine Machine8, Duration 18\\n  Step 3: Machine Machine3, Duration 165\\n  Step 4: Machine Machine2, Duration 135\\n  Step 5: Machine Machine15, Duration 183\\n  Step 6: Machine Machine0, Duration 93\\n  Step 7: Machine Machine4, Duration 87\\n  Step 8: Machine Machine9, Duration 104\\n  Step 9: Machine Machine14, Duration 121\\n  Step 10: Machine Machine5, Duration 88\\n  Step 11: Machine Machine19, Duration 87\\n  Step 12: Machine Machine17, Duration 50\\n  Step 13: Machine Machine18, Duration 1\\n  Step 14: Machine Machine6, Duration 192\\n  Step 15: Machine Machine12, Duration 65\\n  Step 16: Machine Machine10, Duration 80\\n  Step 17: Machine Machine7, Duration 6\\n  Step 18: Machine Machine11, Duration 79\\n  Step 19: Machine Machine13, Duration 8\\n  Step 20: Machine Machine16, Duration 153\\nJob33:\\n  Step 1: Machine Machine10, Duration 197\\n  Step 2: Machine Machine0, Duration 79\\n  Step 3: Machine Machine17, Duration 164\\n  Step 4: Machine Machine11, Duration 16\\n  Step 5: Machine Machine16, Duration 65\\n  Step 6: Machine Machine12, Duration 32\\n  Step 7: Machine Machine15, Duration 76\\n  Step 8: Machine Machine1, Duration 191\\n  Step 9: Machine Machine2, Duration 101\\n  Step 10: Machine Machine14, Duration 23\\n  Step 11: Machine Machine6, Duration 200\\n  Step 12: Machine Machine7, Duration 96\\n  Step 13: Machine Machine18, Duration 151\\n  Step 14: Machine Machine5, Duration 24\\n  Step 15: Machine Machine3, Duration 96\\n  Step 16: Machine Machine4, Duration 106\\n  Step 17: Machine Machine13, Duration 2\\n  Step 18: Machine Machine9, Duration 132\\n  Step 19: Machine Machine8, Duration 106\\n  Step 20: Machine Machine19, Duration 132\\nJob34:\\n  Step 1: Machine Machine16, Duration 75\\n  Step 2: Machine Machine3, Duration 149\\n  Step 3: Machine Machine8, Duration 40\\n  Step 4: Machine Machine9, Duration 29\\n  Step 5: Machine Machine13, Duration 115\\n  Step 6: Machine Machine15, Duration 169\\n  Step 7: Machine Machine1, Duration 139\\n  Step 8: Machine Machine17, Duration 27\\n  Step 9: Machine Machine14, Duration 54\\n  Step 10: Machine Machine2, Duration 84\\n  Step 11: Machine Machine5, Duration 30\\n  Step 12: Machine Machine7, Duration 8\\n  Step 13: Machine Machine11, Duration 8\\n  Step 14: Machine Machine10, Duration 95\\n  Step 15: Machine Machine12, Duration 113\\n  Step 16: Machine Machine6, Duration 88\\n  Step 17: Machine Machine0, Duration 154\\n  Step 18: Machine Machine4, Duration 55\\n  Step 19: Machine Machine18, Duration 158\\n  Step 20: Machine Machine19, Duration 32\\nJob35:\\n  Step 1: Machine Machine14, Duration 133\\n  Step 2: Machine Machine9, Duration 142\\n  Step 3: Machine Machine4, Duration 115\\n  Step 4: Machine Machine17, Duration 154\\n  Step 5: Machine Machine2, Duration 178\\n  Step 6: Machine Machine5, Duration 99\\n  Step 7: Machine Machine15, Duration 173\\n  Step 8: Machine Machine13, Duration 53\\n  Step 9: Machine Machine10, Duration 77\\n  Step 10: Machine Machine12, Duration 186\\n  Step 11: Machine Machine19, Duration 144\\n  Step 12: Machine Machine3, Duration 116\\n  Step 13: Machine Machine7, Duration 113\\n  Step 14: Machine Machine8, Duration 154\\n  Step 15: Machine Machine18, Duration 22\\n  Step 16: Machine Machine11, Duration 127\\n  Step 17: Machine Machine0, Duration 28\\n  Step 18: Machine Machine1, Duration 61\\n  Step 19: Machine Machine16, Duration 90\\n  Step 20: Machine Machine6, Duration 52\\nJob36:\\n  Step 1: Machine Machine7, Duration 130\\n  Step 2: Machine Machine9, Duration 95\\n  Step 3: Machine Machine3, Duration 38\\n  Step 4: Machine Machine17, Duration 87\\n  Step 5: Machine Machine11, Duration 96\\n  Step 6: Machine Machine2, Duration 16\\n  Step 7: Machine Machine15, Duration 79\\n  Step 8: Machine Machine13, Duration 150\\n  Step 9: Machine Machine4, Duration 36\\n  Step 10: Machine Machine0, Duration 40\\n  Step 11: Machine Machine5, Duration 5\\n  Step 12: Machine Machine18, Duration 114\\n  Step 13: Machine Machine10, Duration 109\\n  Step 14: Machine Machine14, Duration 78\\n  Step 15: Machine Machine12, Duration 14\\n  Step 16: Machine Machine16, Duration 103\\n  Step 17: Machine Machine6, Duration 54\\n  Step 18: Machine Machine8, Duration 86\\n  Step 19: Machine Machine1, Duration 154\\n  Step 20: Machine Machine19, Duration 137\\nJob37:\\n  Step 1: Machine Machine1, Duration 30\\n  Step 2: Machine Machine17, Duration 128\\n  Step 3: Machine Machine12, Duration 192\\n  Step 4: Machine Machine2, Duration 12\\n  Step 5: Machine Machine7, Duration 48\\n  Step 6: Machine Machine11, Duration 117\\n  Step 7: Machine Machine15, Duration 96\\n  Step 8: Machine Machine4, Duration 99\\n  Step 9: Machine Machine18, Duration 30\\n  Step 10: Machine Machine3, Duration 24\\n  Step 11: Machine Machine14, Duration 96\\n  Step 12: Machine Machine16, Duration 69\\n  Step 13: Machine Machine5, Duration 49\\n  Step 14: Machine Machine19, Duration 134\\n  Step 15: Machine Machine10, Duration 124\\n  Step 16: Machine Machine6, Duration 54\\n  Step 17: Machine Machine13, Duration 16\\n  Step 18: Machine Machine0, Duration 171\\n  Step 19: Machine Machine9, Duration 127\\n  Step 20: Machine Machine8, Duration 17\\nJob38:\\n  Step 1: Machine Machine10, Duration 139\\n  Step 2: Machine Machine1, Duration 196\\n  Step 3: Machine Machine6, Duration 135\\n  Step 4: Machine Machine4, Duration 134\\n  Step 5: Machine Machine12, Duration 98\\n  Step 6: Machine Machine16, Duration 37\\n  Step 7: Machine Machine0, Duration 12\\n  Step 8: Machine Machine5, Duration 109\\n  Step 9: Machine Machine18, Duration 88\\n  Step 10: Machine Machine3, Duration 118\\n  Step 11: Machine Machine7, Duration 48\\n  Step 12: Machine Machine19, Duration 192\\n  Step 13: Machine Machine14, Duration 84\\n  Step 14: Machine Machine9, Duration 142\\n  Step 15: Machine Machine13, Duration 147\\n  Step 16: Machine Machine11, Duration 17\\n  Step 17: Machine Machine2, Duration 107\\n  Step 18: Machine Machine17, Duration 194\\n  Step 19: Machine Machine8, Duration 122\\n  Step 20: Machine Machine15, Duration 68\\nJob39:\\n  Step 1: Machine Machine9, Duration 106\\n  Step 2: Machine Machine10, Duration 154\\n  Step 3: Machine Machine1, Duration 111\\n  Step 4: Machine Machine3, Duration 148\\n  Step 5: Machine Machine11, Duration 128\\n  Step 6: Machine Machine2, Duration 153\\n  Step 7: Machine Machine15, Duration 88\\n  Step 8: Machine Machine4, Duration 45\\n  Step 9: Machine Machine16, Duration 191\\n  Step 10: Machine Machine18, Duration 164\\n  Step 11: Machine Machine17, Duration 116\\n  Step 12: Machine Machine5, Duration 1\\n  Step 13: Machine Machine0, Duration 31\\n  Step 14: Machine Machine19, Duration 95\\n  Step 15: Machine Machine7, Duration 51\\n  Step 16: Machine Machine14, Duration 46\\n  Step 17: Machine Machine6, Duration 123\\n  Step 18: Machine Machine12, Duration 16\\n  Step 19: Machine Machine8, Duration 187\\n  Step 20: Machine Machine13, Duration 189\\nJob40:\\n  Step 1: Machine Machine12, Duration 101\\n  Step 2: Machine Machine8, Duration 113\\n  Step 3: Machine Machine9, Duration 38\\n  Step 4: Machine Machine1, Duration 119\\n  Step 5: Machine Machine2, Duration 184\\n  Step 6: Machine Machine3, Duration 148\\n  Step 7: Machine Machine16, Duration 148\\n  Step 8: Machine Machine10, Duration 43\\n  Step 9: Machine Machine15, Duration 20\\n  Step 10: Machine Machine14, Duration 178\\n  Step 11: Machine Machine11, Duration 83\\n  Step 12: Machine Machine5, Duration 92\\n  Step 13: Machine Machine0, Duration 35\\n  Step 14: Machine Machine17, Duration 165\\n  Step 15: Machine Machine13, Duration 38\\n  Step 16: Machine Machine6, Duration 131\\n  Step 17: Machine Machine19, Duration 144\\n  Step 18: Machine Machine7, Duration 179\\n  Step 19: Machine Machine4, Duration 30\\n  Step 20: Machine Machine18, Duration 89\\nJob41:\\n  Step 1: Machine Machine9, Duration 164\\n  Step 2: Machine Machine19, Duration 55\\n  Step 3: Machine Machine8, Duration 176\\n  Step 4: Machine Machine18, Duration 82\\n  Step 5: Machine Machine14, Duration 61\\n  Step 6: Machine Machine0, Duration 183\\n  Step 7: Machine Machine15, Duration 14\\n  Step 8: Machine Machine16, Duration 27\\n  Step 9: Machine Machine11, Duration 66\\n  Step 10: Machine Machine12, Duration 91\\n  Step 11: Machine Machine13, Duration 22\\n  Step 12: Machine Machine6, Duration 158\\n  Step 13: Machine Machine4, Duration 165\\n  Step 14: Machine Machine1, Duration 182\\n  Step 15: Machine Machine17, Duration 86\\n  Step 16: Machine Machine3, Duration 197\\n  Step 17: Machine Machine10, Duration 139\\n  Step 18: Machine Machine7, Duration 157\\n  Step 19: Machine Machine5, Duration 119\\n  Step 20: Machine Machine2, Duration 114\\nJob42:\\n  Step 1: Machine Machine15, Duration 33\\n  Step 2: Machine Machine5, Duration 65\\n  Step 3: Machine Machine19, Duration 109\\n  Step 4: Machine Machine11, Duration 84\\n  Step 5: Machine Machine2, Duration 164\\n  Step 6: Machine Machine12, Duration 141\\n  Step 7: Machine Machine17, Duration 132\\n  Step 8: Machine Machine1, Duration 164\\n  Step 9: Machine Machine4, Duration 97\\n  Step 10: Machine Machine9, Duration 85\\n  Step 11: Machine Machine14, Duration 125\\n  Step 12: Machine Machine10, Duration 104\\n  Step 13: Machine Machine8, Duration 22\\n  Step 14: Machine Machine6, Duration 171\\n  Step 15: Machine Machine7, Duration 115\\n  Step 16: Machine Machine18, Duration 77\\n  Step 17: Machine Machine0, Duration 69\\n  Step 18: Machine Machine16, Duration 181\\n  Step 19: Machine Machine13, Duration 121\\n  Step 20: Machine Machine3, Duration 98\\nJob43:\\n  Step 1: Machine Machine4, Duration 44\\n  Step 2: Machine Machine5, Duration 99\\n  Step 3: Machine Machine19, Duration 20\\n  Step 4: Machine Machine18, Duration 171\\n  Step 5: Machine Machine17, Duration 174\\n  Step 6: Machine Machine6, Duration 87\\n  Step 7: Machine Machine13, Duration 33\\n  Step 8: Machine Machine3, Duration 18\\n  Step 9: Machine Machine11, Duration 153\\n  Step 10: Machine Machine2, Duration 153\\n  Step 11: Machine Machine16, Duration 113\\n  Step 12: Machine Machine15, Duration 149\\n  Step 13: Machine Machine7, Duration 103\\n  Step 14: Machine Machine8, Duration 103\\n  Step 15: Machine Machine10, Duration 138\\n  Step 16: Machine Machine14, Duration 67\\n  Step 17: Machine Machine9, Duration 56\\n  Step 18: Machine Machine1, Duration 92\\n  Step 19: Machine Machine0, Duration 137\\n  Step 20: Machine Machine12, Duration 105\\nJob44:\\n  Step 1: Machine Machine13, Duration 69\\n  Step 2: Machine Machine2, Duration 145\\n  Step 3: Machine Machine4, Duration 4\\n  Step 4: Machine Machine10, Duration 11\\n  Step 5: Machine Machine16, Duration 54\\n  Step 6: Machine Machine14, Duration 150\\n  Step 7: Machine Machine17, Duration 31\\n  Step 8: Machine Machine3, Duration 168\\n  Step 9: Machine Machine18, Duration 142\\n  Step 10: Machine Machine12, Duration 86\\n  Step 11: Machine Machine5, Duration 19\\n  Step 12: Machine Machine9, Duration 111\\n  Step 13: Machine Machine11, Duration 89\\n  Step 14: Machine Machine19, Duration 53\\n  Step 15: Machine Machine15, Duration 96\\n  Step 16: Machine Machine1, Duration 179\\n  Step 17: Machine Machine8, Duration 148\\n  Step 18: Machine Machine0, Duration 195\\n  Step 19: Machine Machine7, Duration 23\\n  Step 20: Machine Machine6, Duration 161\\nJob45:\\n  Step 1: Machine Machine15, Duration 95\\n  Step 2: Machine Machine7, Duration 75\\n  Step 3: Machine Machine13, Duration 65\\n  Step 4: Machine Machine17, Duration 83\\n  Step 5: Machine Machine18, Duration 169\\n  Step 6: Machine Machine8, Duration 170\\n  Step 7: Machine Machine16, Duration 195\\n  Step 8: Machine Machine0, Duration 193\\n  Step 9: Machine Machine11, Duration 144\\n  Step 10: Machine Machine10, Duration 53\\n  Step 11: Machine Machine12, Duration 102\\n  Step 12: Machine Machine4, Duration 27\\n  Step 13: Machine Machine3, Duration 122\\n  Step 14: Machine Machine2, Duration 199\\n  Step 15: Machine Machine19, Duration 198\\n  Step 16: Machine Machine6, Duration 184\\n  Step 17: Machine Machine9, Duration 6\\n  Step 18: Machine Machine5, Duration 9\\n  Step 19: Machine Machine14, Duration 124\\n  Step 20: Machine Machine1, Duration 17\\nJob46:\\n  Step 1: Machine Machine2, Duration 175\\n  Step 2: Machine Machine11, Duration 137\\n  Step 3: Machine Machine3, Duration 74\\n  Step 4: Machine Machine9, Duration 3\\n  Step 5: Machine Machine4, Duration 94\\n  Step 6: Machine Machine5, Duration 2\\n  Step 7: Machine Machine13, Duration 175\\n  Step 8: Machine Machine17, Duration 134\\n  Step 9: Machine Machine7, Duration 46\\n  Step 10: Machine Machine12, Duration 120\\n  Step 11: Machine Machine18, Duration 184\\n  Step 12: Machine Machine15, Duration 123\\n  Step 13: Machine Machine10, Duration 118\\n  Step 14: Machine Machine0, Duration 76\\n  Step 15: Machine Machine14, Duration 195\\n  Step 16: Machine Machine6, Duration 37\\n  Step 17: Machine Machine16, Duration 38\\n  Step 18: Machine Machine8, Duration 92\\n  Step 19: Machine Machine19, Duration 146\\n  Step 20: Machine Machine1, Duration 43\\nJob47:\\n  Step 1: Machine Machine17, Duration 105\\n  Step 2: Machine Machine16, Duration 68\\n  Step 3: Machine Machine2, Duration 195\\n  Step 4: Machine Machine4, Duration 131\\n  Step 5: Machine Machine15, Duration 9\\n  Step 6: Machine Machine18, Duration 61\\n  Step 7: Machine Machine12, Duration 170\\n  Step 8: Machine Machine19, Duration 186\\n  Step 9: Machine Machine13, Duration 152\\n  Step 10: Machine Machine6, Duration 166\\n  Step 11: Machine Machine9, Duration 69\\n  Step 12: Machine Machine14, Duration 46\\n  Step 13: Machine Machine10, Duration 164\\n  Step 14: Machine Machine11, Duration 46\\n  Step 15: Machine Machine5, Duration 84\\n  Step 16: Machine Machine1, Duration 133\\n  Step 17: Machine Machine0, Duration 19\\n  Step 18: Machine Machine3, Duration 199\\n  Step 19: Machine Machine7, Duration 175\\n  Step 20: Machine Machine8, Duration 59\\nJob48:\\n  Step 1: Machine Machine10, Duration 127\\n  Step 2: Machine Machine6, Duration 163\\n  Step 3: Machine Machine19, Duration 152\\n  Step 4: Machine Machine14, Duration 149\\n  Step 5: Machine Machine17, Duration 12\\n  Step 6: Machine Machine13, Duration 11\\n  Step 7: Machine Machine3, Duration 89\\n  Step 8: Machine Machine5, Duration 97\\n  Step 9: Machine Machine16, Duration 87\\n  Step 10: Machine Machine18, Duration 120\\n  Step 11: Machine Machine2, Duration 135\\n  Step 12: Machine Machine0, Duration 123\\n  Step 13: Machine Machine12, Duration 161\\n  Step 14: Machine Machine15, Duration 58\\n  Step 15: Machine Machine8, Duration 139\\n  Step 16: Machine Machine7, Duration 82\\n  Step 17: Machine Machine4, Duration 1\\n  Step 18: Machine Machine11, Duration 93\\n  Step 19: Machine Machine9, Duration 185\\n  Step 20: Machine Machine1, Duration 167\\nJob49:\\n  Step 1: Machine Machine19, Duration 154\\n  Step 2: Machine Machine3, Duration 124\\n  Step 3: Machine Machine5, Duration 198\\n  Step 4: Machine Machine15, Duration 49\\n  Step 5: Machine Machine0, Duration 100\\n  Step 6: Machine Machine8, Duration 145\\n  Step 7: Machine Machine4, Duration 17\\n  Step 8: Machine Machine12, Duration 103\\n  Step 9: Machine Machine13, Duration 130\\n  Step 10: Machine Machine18, Duration 170\\n  Step 11: Machine Machine1, Duration 130\\n  Step 12: Machine Machine17, Duration 122\\n  Step 13: Machine Machine11, Duration 137\\n  Step 14: Machine Machine14, Duration 33\\n  Step 15: Machine Machine6, Duration 109\\n  Step 16: Machine Machine2, Duration 26\\n  Step 17: Machine Machine9, Duration 120\\n  Step 18: Machine Machine7, Duration 33\\n  Step 19: Machine Machine10, Duration 140\\n  Step 20: Machine Machine16, Duration 126\\nJob50:\\n  Step 1: Machine Machine18, Duration 57\\n  Step 2: Machine Machine17, Duration 133\\n  Step 3: Machine Machine10, Duration 124\\n  Step 4: Machine Machine16, Duration 188\\n  Step 5: Machine Machine4, Duration 53\\n  Step 6: Machine Machine15, Duration 24\\n  Step 7: Machine Machine11, Duration 81\\n  Step 8: Machine Machine1, Duration 93\\n  Step 9: Machine Machine7, Duration 89\\n  Step 10: Machine Machine19, Duration 12\\n  Step 11: Machine Machine6, Duration 110\\n  Step 12: Machine Machine8, Duration 111\\n  Step 13: Machine Machine0, Duration 72\\n  Step 14: Machine Machine13, Duration 163\\n  Step 15: Machine Machine12, Duration 155\\n  Step 16: Machine Machine5, Duration 151\\n  Step 17: Machine Machine3, Duration 121\\n  Step 18: Machine Machine2, Duration 98\\n  Step 19: Machine Machine9, Duration 95\\n  Step 20: Machine Machine14, Duration 164\\n        \\n        REQUIRED OUTPUT FORMAT:\\n        You must provide your solution in the following exact format:\\n        \\n        1. FINAL MAKESPAN: [integer value]\\n        2. STRUCTURED SCHEDULE:\\n           For each operation, provide:\\n           - Job: [job_name]\\n           - Step: [step_number]\\n           - Machine: [machine_name]\\n           - Start Time: [start_time]\\n           - End Time: [end_time]\\n           - Duration: [duration]\\n        \\n        Example format:\\n        FINAL MAKESPAN: 25\\n        STRUCTURED SCHEDULE:\\n        - Job: Job1, Step: 1, Machine: Machine0, Start Time: 0, End Time: 3, Duration: 3\\n        - Job: Job1, Step: 2, Machine: Machine1, Start Time: 3, End Time: 7, Duration: 4\\n        - Job: Job2, Step: 1, Machine: Machine1, Start Time: 7, End Time: 10, Duration: 3\\n        \\n        Please solve this Job Shop Scheduling Problem and provide:\\n        1. A valid schedule with start and end times for each operation\\n        2. The minimum makespan (total completion time)\\n        3. Ensure all constraints are satisfied:\\n           - Job precedence: operations within a job must be sequential\\n           - Machine constraints: no overlapping operations on the same machine\\n        ",
        "Supervisor Agent": "\\n        Job Shop Scheduling Problem (JSSP) - Dataset: rcmax_50_20_6\\n        \\n        Problem Description:\\n        - Number of jobs: 50\\n        - Each job has multiple operations that must be performed in sequence\\n        - Each operation requires a specific machine and has a duration\\n        - Each machine can only process one operation at a time\\n        - Goal: Find the minimum makespan (total completion time)\\n        \\n        Job Specifications:\\n        \\nJob1:\\n  Step 1: Machine Machine12, Duration 93\\n  Step 2: Machine Machine17, Duration 199\\n  Step 3: Machine Machine13, Duration 26\\n  Step 4: Machine Machine0, Duration 48\\n  Step 5: Machine Machine9, Duration 172\\n  Step 6: Machine Machine2, Duration 175\\n  Step 7: Machine Machine14, Duration 39\\n  Step 8: Machine Machine16, Duration 39\\n  Step 9: Machine Machine11, Duration 11\\n  Step 10: Machine Machine4, Duration 138\\n  Step 11: Machine Machine6, Duration 197\\n  Step 12: Machine Machine8, Duration 97\\n  Step 13: Machine Machine15, Duration 92\\n  Step 14: Machine Machine1, Duration 46\\n  Step 15: Machine Machine18, Duration 182\\n  Step 16: Machine Machine10, Duration 180\\n  Step 17: Machine Machine3, Duration 109\\n  Step 18: Machine Machine19, Duration 147\\n  Step 19: Machine Machine7, Duration 167\\n  Step 20: Machine Machine5, Duration 66\\nJob2:\\n  Step 1: Machine Machine0, Duration 40\\n  Step 2: Machine Machine7, Duration 46\\n  Step 3: Machine Machine18, Duration 52\\n  Step 4: Machine Machine9, Duration 126\\n  Step 5: Machine Machine12, Duration 136\\n  Step 6: Machine Machine19, Duration 147\\n  Step 7: Machine Machine15, Duration 152\\n  Step 8: Machine Machine3, Duration 28\\n  Step 9: Machine Machine11, Duration 101\\n  Step 10: Machine Machine13, Duration 8\\n  Step 11: Machine Machine14, Duration 110\\n  Step 12: Machine Machine2, Duration 6\\n  Step 13: Machine Machine6, Duration 103\\n  Step 14: Machine Machine1, Duration 166\\n  Step 15: Machine Machine16, Duration 51\\n  Step 16: Machine Machine10, Duration 4\\n  Step 17: Machine Machine17, Duration 119\\n  Step 18: Machine Machine5, Duration 100\\n  Step 19: Machine Machine4, Duration 197\\n  Step 20: Machine Machine8, Duration 185\\nJob3:\\n  Step 1: Machine Machine7, Duration 109\\n  Step 2: Machine Machine5, Duration 198\\n  Step 3: Machine Machine15, Duration 133\\n  Step 4: Machine Machine18, Duration 19\\n  Step 5: Machine Machine2, Duration 112\\n  Step 6: Machine Machine10, Duration 118\\n  Step 7: Machine Machine6, Duration 9\\n  Step 8: Machine Machine1, Duration 46\\n  Step 9: Machine Machine17, Duration 21\\n  Step 10: Machine Machine4, Duration 87\\n  Step 11: Machine Machine14, Duration 32\\n  Step 12: Machine Machine8, Duration 86\\n  Step 13: Machine Machine9, Duration 46\\n  Step 14: Machine Machine0, Duration 70\\n  Step 15: Machine Machine11, Duration 52\\n  Step 16: Machine Machine16, Duration 27\\n  Step 17: Machine Machine12, Duration 120\\n  Step 18: Machine Machine3, Duration 154\\n  Step 19: Machine Machine19, Duration 28\\n  Step 20: Machine Machine13, Duration 123\\nJob4:\\n  Step 1: Machine Machine7, Duration 136\\n  Step 2: Machine Machine14, Duration 93\\n  Step 3: Machine Machine12, Duration 123\\n  Step 4: Machine Machine2, Duration 167\\n  Step 5: Machine Machine10, Duration 158\\n  Step 6: Machine Machine11, Duration 53\\n  Step 7: Machine Machine19, Duration 99\\n  Step 8: Machine Machine0, Duration 8\\n  Step 9: Machine Machine17, Duration 191\\n  Step 10: Machine Machine4, Duration 138\\n  Step 11: Machine Machine9, Duration 149\\n  Step 12: Machine Machine5, Duration 156\\n  Step 13: Machine Machine13, Duration 30\\n  Step 14: Machine Machine16, Duration 90\\n  Step 15: Machine Machine3, Duration 124\\n  Step 16: Machine Machine8, Duration 127\\n  Step 17: Machine Machine18, Duration 67\\n  Step 18: Machine Machine1, Duration 104\\n  Step 19: Machine Machine15, Duration 116\\n  Step 20: Machine Machine6, Duration 127\\nJob5:\\n  Step 1: Machine Machine7, Duration 42\\n  Step 2: Machine Machine16, Duration 128\\n  Step 3: Machine Machine2, Duration 170\\n  Step 4: Machine Machine18, Duration 5\\n  Step 5: Machine Machine13, Duration 80\\n  Step 6: Machine Machine11, Duration 124\\n  Step 7: Machine Machine5, Duration 137\\n  Step 8: Machine Machine15, Duration 15\\n  Step 9: Machine Machine10, Duration 180\\n  Step 10: Machine Machine19, Duration 53\\n  Step 11: Machine Machine0, Duration 190\\n  Step 12: Machine Machine1, Duration 46\\n  Step 13: Machine Machine8, Duration 149\\n  Step 14: Machine Machine6, Duration 129\\n  Step 15: Machine Machine12, Duration 178\\n  Step 16: Machine Machine9, Duration 144\\n  Step 17: Machine Machine14, Duration 124\\n  Step 18: Machine Machine17, Duration 196\\n  Step 19: Machine Machine3, Duration 18\\n  Step 20: Machine Machine4, Duration 110\\nJob6:\\n  Step 1: Machine Machine9, Duration 59\\n  Step 2: Machine Machine17, Duration 116\\n  Step 3: Machine Machine16, Duration 68\\n  Step 4: Machine Machine13, Duration 35\\n  Step 5: Machine Machine0, Duration 169\\n  Step 6: Machine Machine14, Duration 70\\n  Step 7: Machine Machine1, Duration 129\\n  Step 8: Machine Machine12, Duration 34\\n  Step 9: Machine Machine10, Duration 73\\n  Step 10: Machine Machine18, Duration 77\\n  Step 11: Machine Machine11, Duration 177\\n  Step 12: Machine Machine4, Duration 63\\n  Step 13: Machine Machine3, Duration 13\\n  Step 14: Machine Machine2, Duration 58\\n  Step 15: Machine Machine15, Duration 137\\n  Step 16: Machine Machine5, Duration 84\\n  Step 17: Machine Machine8, Duration 67\\n  Step 18: Machine Machine19, Duration 121\\n  Step 19: Machine Machine7, Duration 187\\n  Step 20: Machine Machine6, Duration 105\\nJob7:\\n  Step 1: Machine Machine16, Duration 57\\n  Step 2: Machine Machine1, Duration 173\\n  Step 3: Machine Machine7, Duration 6\\n  Step 4: Machine Machine5, Duration 19\\n  Step 5: Machine Machine12, Duration 91\\n  Step 6: Machine Machine11, Duration 114\\n  Step 7: Machine Machine14, Duration 94\\n  Step 8: Machine Machine17, Duration 156\\n  Step 9: Machine Machine9, Duration 72\\n  Step 10: Machine Machine19, Duration 112\\n  Step 11: Machine Machine18, Duration 1\\n  Step 12: Machine Machine13, Duration 111\\n  Step 13: Machine Machine2, Duration 168\\n  Step 14: Machine Machine3, Duration 44\\n  Step 15: Machine Machine6, Duration 15\\n  Step 16: Machine Machine4, Duration 194\\n  Step 17: Machine Machine0, Duration 119\\n  Step 18: Machine Machine15, Duration 57\\n  Step 19: Machine Machine10, Duration 101\\n  Step 20: Machine Machine8, Duration 164\\nJob8:\\n  Step 1: Machine Machine9, Duration 126\\n  Step 2: Machine Machine11, Duration 29\\n  Step 3: Machine Machine15, Duration 17\\n  Step 4: Machine Machine8, Duration 62\\n  Step 5: Machine Machine0, Duration 171\\n  Step 6: Machine Machine14, Duration 181\\n  Step 7: Machine Machine13, Duration 184\\n  Step 8: Machine Machine12, Duration 35\\n  Step 9: Machine Machine5, Duration 30\\n  Step 10: Machine Machine4, Duration 115\\n  Step 11: Machine Machine6, Duration 2\\n  Step 12: Machine Machine3, Duration 151\\n  Step 13: Machine Machine16, Duration 65\\n  Step 14: Machine Machine19, Duration 91\\n  Step 15: Machine Machine1, Duration 77\\n  Step 16: Machine Machine17, Duration 166\\n  Step 17: Machine Machine2, Duration 74\\n  Step 18: Machine Machine10, Duration 183\\n  Step 19: Machine Machine18, Duration 177\\n  Step 20: Machine Machine7, Duration 187\\nJob9:\\n  Step 1: Machine Machine8, Duration 99\\n  Step 2: Machine Machine18, Duration 122\\n  Step 3: Machine Machine11, Duration 49\\n  Step 4: Machine Machine7, Duration 44\\n  Step 5: Machine Machine10, Duration 126\\n  Step 6: Machine Machine17, Duration 168\\n  Step 7: Machine Machine3, Duration 20\\n  Step 8: Machine Machine6, Duration 46\\n  Step 9: Machine Machine14, Duration 190\\n  Step 10: Machine Machine4, Duration 162\\n  Step 11: Machine Machine1, Duration 184\\n  Step 12: Machine Machine0, Duration 96\\n  Step 13: Machine Machine5, Duration 170\\n  Step 14: Machine Machine16, Duration 147\\n  Step 15: Machine Machine19, Duration 10\\n  Step 16: Machine Machine13, Duration 142\\n  Step 17: Machine Machine9, Duration 111\\n  Step 18: Machine Machine12, Duration 12\\n  Step 19: Machine Machine2, Duration 86\\n  Step 20: Machine Machine15, Duration 196\\nJob10:\\n  Step 1: Machine Machine12, Duration 114\\n  Step 2: Machine Machine16, Duration 75\\n  Step 3: Machine Machine15, Duration 66\\n  Step 4: Machine Machine9, Duration 170\\n  Step 5: Machine Machine6, Duration 70\\n  Step 6: Machine Machine2, Duration 50\\n  Step 7: Machine Machine10, Duration 131\\n  Step 8: Machine Machine11, Duration 57\\n  Step 9: Machine Machine5, Duration 61\\n  Step 10: Machine Machine0, Duration 188\\n  Step 11: Machine Machine8, Duration 74\\n  Step 12: Machine Machine1, Duration 107\\n  Step 13: Machine Machine13, Duration 152\\n  Step 14: Machine Machine4, Duration 152\\n  Step 15: Machine Machine18, Duration 60\\n  Step 16: Machine Machine17, Duration 97\\n  Step 17: Machine Machine19, Duration 19\\n  Step 18: Machine Machine3, Duration 15\\n  Step 19: Machine Machine7, Duration 147\\n  Step 20: Machine Machine14, Duration 156\\nJob11:\\n  Step 1: Machine Machine0, Duration 29\\n  Step 2: Machine Machine1, Duration 179\\n  Step 3: Machine Machine7, Duration 109\\n  Step 4: Machine Machine4, Duration 30\\n  Step 5: Machine Machine18, Duration 92\\n  Step 6: Machine Machine10, Duration 71\\n  Step 7: Machine Machine9, Duration 111\\n  Step 8: Machine Machine15, Duration 146\\n  Step 9: Machine Machine5, Duration 77\\n  Step 10: Machine Machine19, Duration 59\\n  Step 11: Machine Machine2, Duration 146\\n  Step 12: Machine Machine17, Duration 16\\n  Step 13: Machine Machine16, Duration 49\\n  Step 14: Machine Machine13, Duration 12\\n  Step 15: Machine Machine12, Duration 144\\n  Step 16: Machine Machine3, Duration 95\\n  Step 17: Machine Machine14, Duration 163\\n  Step 18: Machine Machine6, Duration 199\\n  Step 19: Machine Machine11, Duration 157\\n  Step 20: Machine Machine8, Duration 131\\nJob12:\\n  Step 1: Machine Machine17, Duration 174\\n  Step 2: Machine Machine13, Duration 22\\n  Step 3: Machine Machine11, Duration 142\\n  Step 4: Machine Machine8, Duration 32\\n  Step 5: Machine Machine14, Duration 49\\n  Step 6: Machine Machine10, Duration 97\\n  Step 7: Machine Machine5, Duration 47\\n  Step 8: Machine Machine4, Duration 140\\n  Step 9: Machine Machine12, Duration 49\\n  Step 10: Machine Machine18, Duration 41\\n  Step 11: Machine Machine9, Duration 157\\n  Step 12: Machine Machine2, Duration 3\\n  Step 13: Machine Machine7, Duration 198\\n  Step 14: Machine Machine19, Duration 92\\n  Step 15: Machine Machine0, Duration 2\\n  Step 16: Machine Machine3, Duration 142\\n  Step 17: Machine Machine1, Duration 114\\n  Step 18: Machine Machine16, Duration 4\\n  Step 19: Machine Machine6, Duration 98\\n  Step 20: Machine Machine15, Duration 100\\nJob13:\\n  Step 1: Machine Machine17, Duration 47\\n  Step 2: Machine Machine8, Duration 55\\n  Step 3: Machine Machine7, Duration 136\\n  Step 4: Machine Machine9, Duration 51\\n  Step 5: Machine Machine1, Duration 79\\n  Step 6: Machine Machine4, Duration 37\\n  Step 7: Machine Machine15, Duration 100\\n  Step 8: Machine Machine14, Duration 139\\n  Step 9: Machine Machine0, Duration 45\\n  Step 10: Machine Machine10, Duration 39\\n  Step 11: Machine Machine16, Duration 160\\n  Step 12: Machine Machine19, Duration 90\\n  Step 13: Machine Machine5, Duration 114\\n  Step 14: Machine Machine13, Duration 13\\n  Step 15: Machine Machine2, Duration 66\\n  Step 16: Machine Machine11, Duration 90\\n  Step 17: Machine Machine12, Duration 187\\n  Step 18: Machine Machine6, Duration 47\\n  Step 19: Machine Machine18, Duration 75\\n  Step 20: Machine Machine3, Duration 151\\nJob14:\\n  Step 1: Machine Machine18, Duration 139\\n  Step 2: Machine Machine5, Duration 102\\n  Step 3: Machine Machine4, Duration 181\\n  Step 4: Machine Machine7, Duration 24\\n  Step 5: Machine Machine13, Duration 142\\n  Step 6: Machine Machine8, Duration 23\\n  Step 7: Machine Machine16, Duration 100\\n  Step 8: Machine Machine11, Duration 95\\n  Step 9: Machine Machine3, Duration 89\\n  Step 10: Machine Machine14, Duration 144\\n  Step 11: Machine Machine15, Duration 159\\n  Step 12: Machine Machine10, Duration 176\\n  Step 13: Machine Machine9, Duration 153\\n  Step 14: Machine Machine2, Duration 112\\n  Step 15: Machine Machine12, Duration 136\\n  Step 16: Machine Machine6, Duration 97\\n  Step 17: Machine Machine19, Duration 176\\n  Step 18: Machine Machine17, Duration 20\\n  Step 19: Machine Machine1, Duration 154\\n  Step 20: Machine Machine0, Duration 15\\nJob15:\\n  Step 1: Machine Machine16, Duration 183\\n  Step 2: Machine Machine12, Duration 53\\n  Step 3: Machine Machine2, Duration 2\\n  Step 4: Machine Machine15, Duration 26\\n  Step 5: Machine Machine1, Duration 196\\n  Step 6: Machine Machine9, Duration 15\\n  Step 7: Machine Machine18, Duration 5\\n  Step 8: Machine Machine7, Duration 103\\n  Step 9: Machine Machine3, Duration 40\\n  Step 10: Machine Machine5, Duration 86\\n  Step 11: Machine Machine4, Duration 130\\n  Step 12: Machine Machine6, Duration 118\\n  Step 13: Machine Machine0, Duration 111\\n  Step 14: Machine Machine8, Duration 94\\n  Step 15: Machine Machine13, Duration 118\\n  Step 16: Machine Machine11, Duration 119\\n  Step 17: Machine Machine19, Duration 188\\n  Step 18: Machine Machine17, Duration 119\\n  Step 19: Machine Machine14, Duration 55\\n  Step 20: Machine Machine10, Duration 146\\nJob16:\\n  Step 1: Machine Machine0, Duration 97\\n  Step 2: Machine Machine9, Duration 197\\n  Step 3: Machine Machine1, Duration 127\\n  Step 4: Machine Machine8, Duration 39\\n  Step 5: Machine Machine11, Duration 80\\n  Step 6: Machine Machine5, Duration 138\\n  Step 7: Machine Machine13, Duration 77\\n  Step 8: Machine Machine2, Duration 3\\n  Step 9: Machine Machine17, Duration 116\\n  Step 10: Machine Machine4, Duration 115\\n  Step 11: Machine Machine6, Duration 127\\n  Step 12: Machine Machine18, Duration 61\\n  Step 13: Machine Machine7, Duration 124\\n  Step 14: Machine Machine15, Duration 7\\n  Step 15: Machine Machine12, Duration 111\\n  Step 16: Machine Machine14, Duration 40\\n  Step 17: Machine Machine16, Duration 96\\n  Step 18: Machine Machine10, Duration 34\\n  Step 19: Machine Machine19, Duration 159\\n  Step 20: Machine Machine3, Duration 29\\nJob17:\\n  Step 1: Machine Machine18, Duration 123\\n  Step 2: Machine Machine5, Duration 22\\n  Step 3: Machine Machine1, Duration 135\\n  Step 4: Machine Machine19, Duration 99\\n  Step 5: Machine Machine8, Duration 105\\n  Step 6: Machine Machine11, Duration 14\\n  Step 7: Machine Machine13, Duration 159\\n  Step 8: Machine Machine9, Duration 21\\n  Step 9: Machine Machine14, Duration 86\\n  Step 10: Machine Machine17, Duration 12\\n  Step 11: Machine Machine7, Duration 49\\n  Step 12: Machine Machine6, Duration 160\\n  Step 13: Machine Machine4, Duration 66\\n  Step 14: Machine Machine12, Duration 9\\n  Step 15: Machine Machine3, Duration 31\\n  Step 16: Machine Machine16, Duration 134\\n  Step 17: Machine Machine15, Duration 12\\n  Step 18: Machine Machine10, Duration 38\\n  Step 19: Machine Machine2, Duration 131\\n  Step 20: Machine Machine0, Duration 55\\nJob18:\\n  Step 1: Machine Machine12, Duration 18\\n  Step 2: Machine Machine11, Duration 93\\n  Step 3: Machine Machine7, Duration 128\\n  Step 4: Machine Machine17, Duration 41\\n  Step 5: Machine Machine8, Duration 174\\n  Step 6: Machine Machine4, Duration 75\\n  Step 7: Machine Machine15, Duration 44\\n  Step 8: Machine Machine5, Duration 15\\n  Step 9: Machine Machine9, Duration 100\\n  Step 10: Machine Machine14, Duration 58\\n  Step 11: Machine Machine10, Duration 166\\n  Step 12: Machine Machine13, Duration 89\\n  Step 13: Machine Machine16, Duration 174\\n  Step 14: Machine Machine19, Duration 91\\n  Step 15: Machine Machine3, Duration 33\\n  Step 16: Machine Machine0, Duration 28\\n  Step 17: Machine Machine6, Duration 195\\n  Step 18: Machine Machine1, Duration 163\\n  Step 19: Machine Machine18, Duration 95\\n  Step 20: Machine Machine2, Duration 40\\nJob19:\\n  Step 1: Machine Machine18, Duration 185\\n  Step 2: Machine Machine9, Duration 88\\n  Step 3: Machine Machine13, Duration 135\\n  Step 4: Machine Machine1, Duration 98\\n  Step 5: Machine Machine15, Duration 196\\n  Step 6: Machine Machine0, Duration 119\\n  Step 7: Machine Machine8, Duration 52\\n  Step 8: Machine Machine10, Duration 21\\n  Step 9: Machine Machine6, Duration 130\\n  Step 10: Machine Machine4, Duration 141\\n  Step 11: Machine Machine17, Duration 52\\n  Step 12: Machine Machine14, Duration 96\\n  Step 13: Machine Machine2, Duration 34\\n  Step 14: Machine Machine3, Duration 115\\n  Step 15: Machine Machine12, Duration 5\\n  Step 16: Machine Machine5, Duration 74\\n  Step 17: Machine Machine11, Duration 104\\n  Step 18: Machine Machine19, Duration 88\\n  Step 19: Machine Machine7, Duration 162\\n  Step 20: Machine Machine16, Duration 113\\nJob20:\\n  Step 1: Machine Machine6, Duration 63\\n  Step 2: Machine Machine2, Duration 140\\n  Step 3: Machine Machine4, Duration 8\\n  Step 4: Machine Machine0, Duration 73\\n  Step 5: Machine Machine15, Duration 115\\n  Step 6: Machine Machine3, Duration 178\\n  Step 7: Machine Machine1, Duration 101\\n  Step 8: Machine Machine17, Duration 149\\n  Step 9: Machine Machine19, Duration 137\\n  Step 10: Machine Machine18, Duration 170\\n  Step 11: Machine Machine16, Duration 92\\n  Step 12: Machine Machine8, Duration 149\\n  Step 13: Machine Machine9, Duration 180\\n  Step 14: Machine Machine11, Duration 103\\n  Step 15: Machine Machine7, Duration 179\\n  Step 16: Machine Machine13, Duration 106\\n  Step 17: Machine Machine5, Duration 57\\n  Step 18: Machine Machine12, Duration 171\\n  Step 19: Machine Machine14, Duration 112\\n  Step 20: Machine Machine10, Duration 104\\nJob21:\\n  Step 1: Machine Machine8, Duration 125\\n  Step 2: Machine Machine5, Duration 82\\n  Step 3: Machine Machine2, Duration 151\\n  Step 4: Machine Machine9, Duration 10\\n  Step 5: Machine Machine4, Duration 162\\n  Step 6: Machine Machine10, Duration 144\\n  Step 7: Machine Machine1, Duration 9\\n  Step 8: Machine Machine13, Duration 193\\n  Step 9: Machine Machine0, Duration 165\\n  Step 10: Machine Machine3, Duration 98\\n  Step 11: Machine Machine14, Duration 134\\n  Step 12: Machine Machine11, Duration 198\\n  Step 13: Machine Machine15, Duration 129\\n  Step 14: Machine Machine6, Duration 34\\n  Step 15: Machine Machine16, Duration 139\\n  Step 16: Machine Machine12, Duration 89\\n  Step 17: Machine Machine7, Duration 108\\n  Step 18: Machine Machine17, Duration 87\\n  Step 19: Machine Machine19, Duration 86\\n  Step 20: Machine Machine18, Duration 51\\nJob22:\\n  Step 1: Machine Machine0, Duration 107\\n  Step 2: Machine Machine8, Duration 84\\n  Step 3: Machine Machine2, Duration 70\\n  Step 4: Machine Machine12, Duration 31\\n  Step 5: Machine Machine19, Duration 163\\n  Step 6: Machine Machine11, Duration 104\\n  Step 7: Machine Machine1, Duration 54\\n  Step 8: Machine Machine4, Duration 19\\n  Step 9: Machine Machine6, Duration 85\\n  Step 10: Machine Machine15, Duration 194\\n  Step 11: Machine Machine10, Duration 157\\n  Step 12: Machine Machine13, Duration 124\\n  Step 13: Machine Machine5, Duration 193\\n  Step 14: Machine Machine16, Duration 140\\n  Step 15: Machine Machine9, Duration 187\\n  Step 16: Machine Machine7, Duration 162\\n  Step 17: Machine Machine14, Duration 23\\n  Step 18: Machine Machine18, Duration 59\\n  Step 19: Machine Machine17, Duration 26\\n  Step 20: Machine Machine3, Duration 182\\nJob23:\\n  Step 1: Machine Machine3, Duration 86\\n  Step 2: Machine Machine17, Duration 25\\n  Step 3: Machine Machine19, Duration 109\\n  Step 4: Machine Machine18, Duration 95\\n  Step 5: Machine Machine12, Duration 85\\n  Step 6: Machine Machine0, Duration 179\\n  Step 7: Machine Machine9, Duration 76\\n  Step 8: Machine Machine6, Duration 68\\n  Step 9: Machine Machine15, Duration 104\\n  Step 10: Machine Machine2, Duration 25\\n  Step 11: Machine Machine4, Duration 24\\n  Step 12: Machine Machine7, Duration 113\\n  Step 13: Machine Machine5, Duration 37\\n  Step 14: Machine Machine10, Duration 155\\n  Step 15: Machine Machine8, Duration 113\\n  Step 16: Machine Machine1, Duration 134\\n  Step 17: Machine Machine13, Duration 190\\n  Step 18: Machine Machine14, Duration 67\\n  Step 19: Machine Machine11, Duration 192\\n  Step 20: Machine Machine16, Duration 172\\nJob24:\\n  Step 1: Machine Machine19, Duration 28\\n  Step 2: Machine Machine10, Duration 4\\n  Step 3: Machine Machine16, Duration 91\\n  Step 4: Machine Machine3, Duration 104\\n  Step 5: Machine Machine13, Duration 37\\n  Step 6: Machine Machine0, Duration 198\\n  Step 7: Machine Machine15, Duration 53\\n  Step 8: Machine Machine18, Duration 165\\n  Step 9: Machine Machine1, Duration 72\\n  Step 10: Machine Machine4, Duration 8\\n  Step 11: Machine Machine2, Duration 93\\n  Step 12: Machine Machine5, Duration 161\\n  Step 13: Machine Machine6, Duration 148\\n  Step 14: Machine Machine9, Duration 181\\n  Step 15: Machine Machine11, Duration 109\\n  Step 16: Machine Machine12, Duration 49\\n  Step 17: Machine Machine14, Duration 110\\n  Step 18: Machine Machine8, Duration 76\\n  Step 19: Machine Machine7, Duration 130\\n  Step 20: Machine Machine17, Duration 7\\nJob25:\\n  Step 1: Machine Machine5, Duration 36\\n  Step 2: Machine Machine1, Duration 139\\n  Step 3: Machine Machine17, Duration 66\\n  Step 4: Machine Machine19, Duration 88\\n  Step 5: Machine Machine8, Duration 41\\n  Step 6: Machine Machine9, Duration 148\\n  Step 7: Machine Machine7, Duration 162\\n  Step 8: Machine Machine16, Duration 69\\n  Step 9: Machine Machine12, Duration 189\\n  Step 10: Machine Machine3, Duration 57\\n  Step 11: Machine Machine0, Duration 157\\n  Step 12: Machine Machine4, Duration 43\\n  Step 13: Machine Machine10, Duration 198\\n  Step 14: Machine Machine6, Duration 149\\n  Step 15: Machine Machine2, Duration 192\\n  Step 16: Machine Machine13, Duration 57\\n  Step 17: Machine Machine14, Duration 95\\n  Step 18: Machine Machine18, Duration 95\\n  Step 19: Machine Machine11, Duration 11\\n  Step 20: Machine Machine15, Duration 158\\nJob26:\\n  Step 1: Machine Machine5, Duration 8\\n  Step 2: Machine Machine1, Duration 149\\n  Step 3: Machine Machine8, Duration 168\\n  Step 4: Machine Machine9, Duration 159\\n  Step 5: Machine Machine12, Duration 65\\n  Step 6: Machine Machine4, Duration 194\\n  Step 7: Machine Machine17, Duration 48\\n  Step 8: Machine Machine6, Duration 4\\n  Step 9: Machine Machine2, Duration 197\\n  Step 10: Machine Machine16, Duration 91\\n  Step 11: Machine Machine18, Duration 122\\n  Step 12: Machine Machine0, Duration 123\\n  Step 13: Machine Machine15, Duration 27\\n  Step 14: Machine Machine19, Duration 76\\n  Step 15: Machine Machine7, Duration 147\\n  Step 16: Machine Machine13, Duration 120\\n  Step 17: Machine Machine14, Duration 20\\n  Step 18: Machine Machine11, Duration 24\\n  Step 19: Machine Machine3, Duration 133\\n  Step 20: Machine Machine10, Duration 182\\nJob27:\\n  Step 1: Machine Machine11, Duration 29\\n  Step 2: Machine Machine9, Duration 46\\n  Step 3: Machine Machine7, Duration 164\\n  Step 4: Machine Machine13, Duration 152\\n  Step 5: Machine Machine1, Duration 4\\n  Step 6: Machine Machine18, Duration 129\\n  Step 7: Machine Machine14, Duration 148\\n  Step 8: Machine Machine2, Duration 46\\n  Step 9: Machine Machine19, Duration 98\\n  Step 10: Machine Machine16, Duration 84\\n  Step 11: Machine Machine10, Duration 133\\n  Step 12: Machine Machine15, Duration 137\\n  Step 13: Machine Machine4, Duration 192\\n  Step 14: Machine Machine5, Duration 166\\n  Step 15: Machine Machine3, Duration 14\\n  Step 16: Machine Machine6, Duration 173\\n  Step 17: Machine Machine17, Duration 44\\n  Step 18: Machine Machine0, Duration 144\\n  Step 19: Machine Machine8, Duration 99\\n  Step 20: Machine Machine12, Duration 85\\nJob28:\\n  Step 1: Machine Machine9, Duration 64\\n  Step 2: Machine Machine19, Duration 62\\n  Step 3: Machine Machine1, Duration 3\\n  Step 4: Machine Machine14, Duration 109\\n  Step 5: Machine Machine12, Duration 133\\n  Step 6: Machine Machine7, Duration 33\\n  Step 7: Machine Machine11, Duration 19\\n  Step 8: Machine Machine16, Duration 46\\n  Step 9: Machine Machine0, Duration 89\\n  Step 10: Machine Machine6, Duration 27\\n  Step 11: Machine Machine2, Duration 108\\n  Step 12: Machine Machine15, Duration 49\\n  Step 13: Machine Machine10, Duration 137\\n  Step 14: Machine Machine4, Duration 138\\n  Step 15: Machine Machine5, Duration 27\\n  Step 16: Machine Machine3, Duration 65\\n  Step 17: Machine Machine17, Duration 1\\n  Step 18: Machine Machine13, Duration 182\\n  Step 19: Machine Machine18, Duration 35\\n  Step 20: Machine Machine8, Duration 51\\nJob29:\\n  Step 1: Machine Machine17, Duration 165\\n  Step 2: Machine Machine2, Duration 31\\n  Step 3: Machine Machine7, Duration 16\\n  Step 4: Machine Machine5, Duration 28\\n  Step 5: Machine Machine3, Duration 81\\n  Step 6: Machine Machine19, Duration 112\\n  Step 7: Machine Machine11, Duration 17\\n  Step 8: Machine Machine8, Duration 168\\n  Step 9: Machine Machine1, Duration 139\\n  Step 10: Machine Machine0, Duration 80\\n  Step 11: Machine Machine9, Duration 141\\n  Step 12: Machine Machine10, Duration 46\\n  Step 13: Machine Machine14, Duration 26\\n  Step 14: Machine Machine13, Duration 173\\n  Step 15: Machine Machine4, Duration 173\\n  Step 16: Machine Machine18, Duration 189\\n  Step 17: Machine Machine15, Duration 193\\n  Step 18: Machine Machine12, Duration 107\\n  Step 19: Machine Machine16, Duration 177\\n  Step 20: Machine Machine6, Duration 77\\nJob30:\\n  Step 1: Machine Machine3, Duration 19\\n  Step 2: Machine Machine6, Duration 33\\n  Step 3: Machine Machine13, Duration 161\\n  Step 4: Machine Machine2, Duration 9\\n  Step 5: Machine Machine9, Duration 112\\n  Step 6: Machine Machine1, Duration 185\\n  Step 7: Machine Machine4, Duration 134\\n  Step 8: Machine Machine8, Duration 77\\n  Step 9: Machine Machine5, Duration 190\\n  Step 10: Machine Machine14, Duration 109\\n  Step 11: Machine Machine16, Duration 149\\n  Step 12: Machine Machine0, Duration 60\\n  Step 13: Machine Machine19, Duration 82\\n  Step 14: Machine Machine11, Duration 89\\n  Step 15: Machine Machine10, Duration 193\\n  Step 16: Machine Machine12, Duration 182\\n  Step 17: Machine Machine17, Duration 73\\n  Step 18: Machine Machine18, Duration 103\\n  Step 19: Machine Machine7, Duration 153\\n  Step 20: Machine Machine15, Duration 18\\nJob31:\\n  Step 1: Machine Machine14, Duration 34\\n  Step 2: Machine Machine6, Duration 112\\n  Step 3: Machine Machine7, Duration 154\\n  Step 4: Machine Machine3, Duration 66\\n  Step 5: Machine Machine0, Duration 147\\n  Step 6: Machine Machine13, Duration 165\\n  Step 7: Machine Machine19, Duration 177\\n  Step 8: Machine Machine15, Duration 192\\n  Step 9: Machine Machine5, Duration 160\\n  Step 10: Machine Machine4, Duration 180\\n  Step 11: Machine Machine18, Duration 177\\n  Step 12: Machine Machine8, Duration 51\\n  Step 13: Machine Machine10, Duration 82\\n  Step 14: Machine Machine11, Duration 169\\n  Step 15: Machine Machine9, Duration 6\\n  Step 16: Machine Machine17, Duration 195\\n  Step 17: Machine Machine16, Duration 149\\n  Step 18: Machine Machine1, Duration 54\\n  Step 19: Machine Machine2, Duration 10\\n  Step 20: Machine Machine12, Duration 156\\nJob32:\\n  Step 1: Machine Machine1, Duration 17\\n  Step 2: Machine Machine8, Duration 18\\n  Step 3: Machine Machine3, Duration 165\\n  Step 4: Machine Machine2, Duration 135\\n  Step 5: Machine Machine15, Duration 183\\n  Step 6: Machine Machine0, Duration 93\\n  Step 7: Machine Machine4, Duration 87\\n  Step 8: Machine Machine9, Duration 104\\n  Step 9: Machine Machine14, Duration 121\\n  Step 10: Machine Machine5, Duration 88\\n  Step 11: Machine Machine19, Duration 87\\n  Step 12: Machine Machine17, Duration 50\\n  Step 13: Machine Machine18, Duration 1\\n  Step 14: Machine Machine6, Duration 192\\n  Step 15: Machine Machine12, Duration 65\\n  Step 16: Machine Machine10, Duration 80\\n  Step 17: Machine Machine7, Duration 6\\n  Step 18: Machine Machine11, Duration 79\\n  Step 19: Machine Machine13, Duration 8\\n  Step 20: Machine Machine16, Duration 153\\nJob33:\\n  Step 1: Machine Machine10, Duration 197\\n  Step 2: Machine Machine0, Duration 79\\n  Step 3: Machine Machine17, Duration 164\\n  Step 4: Machine Machine11, Duration 16\\n  Step 5: Machine Machine16, Duration 65\\n  Step 6: Machine Machine12, Duration 32\\n  Step 7: Machine Machine15, Duration 76\\n  Step 8: Machine Machine1, Duration 191\\n  Step 9: Machine Machine2, Duration 101\\n  Step 10: Machine Machine14, Duration 23\\n  Step 11: Machine Machine6, Duration 200\\n  Step 12: Machine Machine7, Duration 96\\n  Step 13: Machine Machine18, Duration 151\\n  Step 14: Machine Machine5, Duration 24\\n  Step 15: Machine Machine3, Duration 96\\n  Step 16: Machine Machine4, Duration 106\\n  Step 17: Machine Machine13, Duration 2\\n  Step 18: Machine Machine9, Duration 132\\n  Step 19: Machine Machine8, Duration 106\\n  Step 20: Machine Machine19, Duration 132\\nJob34:\\n  Step 1: Machine Machine16, Duration 75\\n  Step 2: Machine Machine3, Duration 149\\n  Step 3: Machine Machine8, Duration 40\\n  Step 4: Machine Machine9, Duration 29\\n  Step 5: Machine Machine13, Duration 115\\n  Step 6: Machine Machine15, Duration 169\\n  Step 7: Machine Machine1, Duration 139\\n  Step 8: Machine Machine17, Duration 27\\n  Step 9: Machine Machine14, Duration 54\\n  Step 10: Machine Machine2, Duration 84\\n  Step 11: Machine Machine5, Duration 30\\n  Step 12: Machine Machine7, Duration 8\\n  Step 13: Machine Machine11, Duration 8\\n  Step 14: Machine Machine10, Duration 95\\n  Step 15: Machine Machine12, Duration 113\\n  Step 16: Machine Machine6, Duration 88\\n  Step 17: Machine Machine0, Duration 154\\n  Step 18: Machine Machine4, Duration 55\\n  Step 19: Machine Machine18, Duration 158\\n  Step 20: Machine Machine19, Duration 32\\nJob35:\\n  Step 1: Machine Machine14, Duration 133\\n  Step 2: Machine Machine9, Duration 142\\n  Step 3: Machine Machine4, Duration 115\\n  Step 4: Machine Machine17, Duration 154\\n  Step 5: Machine Machine2, Duration 178\\n  Step 6: Machine Machine5, Duration 99\\n  Step 7: Machine Machine15, Duration 173\\n  Step 8: Machine Machine13, Duration 53\\n  Step 9: Machine Machine10, Duration 77\\n  Step 10: Machine Machine12, Duration 186\\n  Step 11: Machine Machine19, Duration 144\\n  Step 12: Machine Machine3, Duration 116\\n  Step 13: Machine Machine7, Duration 113\\n  Step 14: Machine Machine8, Duration 154\\n  Step 15: Machine Machine18, Duration 22\\n  Step 16: Machine Machine11, Duration 127\\n  Step 17: Machine Machine0, Duration 28\\n  Step 18: Machine Machine1, Duration 61\\n  Step 19: Machine Machine16, Duration 90\\n  Step 20: Machine Machine6, Duration 52\\nJob36:\\n  Step 1: Machine Machine7, Duration 130\\n  Step 2: Machine Machine9, Duration 95\\n  Step 3: Machine Machine3, Duration 38\\n  Step 4: Machine Machine17, Duration 87\\n  Step 5: Machine Machine11, Duration 96\\n  Step 6: Machine Machine2, Duration 16\\n  Step 7: Machine Machine15, Duration 79\\n  Step 8: Machine Machine13, Duration 150\\n  Step 9: Machine Machine4, Duration 36\\n  Step 10: Machine Machine0, Duration 40\\n  Step 11: Machine Machine5, Duration 5\\n  Step 12: Machine Machine18, Duration 114\\n  Step 13: Machine Machine10, Duration 109\\n  Step 14: Machine Machine14, Duration 78\\n  Step 15: Machine Machine12, Duration 14\\n  Step 16: Machine Machine16, Duration 103\\n  Step 17: Machine Machine6, Duration 54\\n  Step 18: Machine Machine8, Duration 86\\n  Step 19: Machine Machine1, Duration 154\\n  Step 20: Machine Machine19, Duration 137\\nJob37:\\n  Step 1: Machine Machine1, Duration 30\\n  Step 2: Machine Machine17, Duration 128\\n  Step 3: Machine Machine12, Duration 192\\n  Step 4: Machine Machine2, Duration 12\\n  Step 5: Machine Machine7, Duration 48\\n  Step 6: Machine Machine11, Duration 117\\n  Step 7: Machine Machine15, Duration 96\\n  Step 8: Machine Machine4, Duration 99\\n  Step 9: Machine Machine18, Duration 30\\n  Step 10: Machine Machine3, Duration 24\\n  Step 11: Machine Machine14, Duration 96\\n  Step 12: Machine Machine16, Duration 69\\n  Step 13: Machine Machine5, Duration 49\\n  Step 14: Machine Machine19, Duration 134\\n  Step 15: Machine Machine10, Duration 124\\n  Step 16: Machine Machine6, Duration 54\\n  Step 17: Machine Machine13, Duration 16\\n  Step 18: Machine Machine0, Duration 171\\n  Step 19: Machine Machine9, Duration 127\\n  Step 20: Machine Machine8, Duration 17\\nJob38:\\n  Step 1: Machine Machine10, Duration 139\\n  Step 2: Machine Machine1, Duration 196\\n  Step 3: Machine Machine6, Duration 135\\n  Step 4: Machine Machine4, Duration 134\\n  Step 5: Machine Machine12, Duration 98\\n  Step 6: Machine Machine16, Duration 37\\n  Step 7: Machine Machine0, Duration 12\\n  Step 8: Machine Machine5, Duration 109\\n  Step 9: Machine Machine18, Duration 88\\n  Step 10: Machine Machine3, Duration 118\\n  Step 11: Machine Machine7, Duration 48\\n  Step 12: Machine Machine19, Duration 192\\n  Step 13: Machine Machine14, Duration 84\\n  Step 14: Machine Machine9, Duration 142\\n  Step 15: Machine Machine13, Duration 147\\n  Step 16: Machine Machine11, Duration 17\\n  Step 17: Machine Machine2, Duration 107\\n  Step 18: Machine Machine17, Duration 194\\n  Step 19: Machine Machine8, Duration 122\\n  Step 20: Machine Machine15, Duration 68\\nJob39:\\n  Step 1: Machine Machine9, Duration 106\\n  Step 2: Machine Machine10, Duration 154\\n  Step 3: Machine Machine1, Duration 111\\n  Step 4: Machine Machine3, Duration 148\\n  Step 5: Machine Machine11, Duration 128\\n  Step 6: Machine Machine2, Duration 153\\n  Step 7: Machine Machine15, Duration 88\\n  Step 8: Machine Machine4, Duration 45\\n  Step 9: Machine Machine16, Duration 191\\n  Step 10: Machine Machine18, Duration 164\\n  Step 11: Machine Machine17, Duration 116\\n  Step 12: Machine Machine5, Duration 1\\n  Step 13: Machine Machine0, Duration 31\\n  Step 14: Machine Machine19, Duration 95\\n  Step 15: Machine Machine7, Duration 51\\n  Step 16: Machine Machine14, Duration 46\\n  Step 17: Machine Machine6, Duration 123\\n  Step 18: Machine Machine12, Duration 16\\n  Step 19: Machine Machine8, Duration 187\\n  Step 20: Machine Machine13, Duration 189\\nJob40:\\n  Step 1: Machine Machine12, Duration 101\\n  Step 2: Machine Machine8, Duration 113\\n  Step 3: Machine Machine9, Duration 38\\n  Step 4: Machine Machine1, Duration 119\\n  Step 5: Machine Machine2, Duration 184\\n  Step 6: Machine Machine3, Duration 148\\n  Step 7: Machine Machine16, Duration 148\\n  Step 8: Machine Machine10, Duration 43\\n  Step 9: Machine Machine15, Duration 20\\n  Step 10: Machine Machine14, Duration 178\\n  Step 11: Machine Machine11, Duration 83\\n  Step 12: Machine Machine5, Duration 92\\n  Step 13: Machine Machine0, Duration 35\\n  Step 14: Machine Machine17, Duration 165\\n  Step 15: Machine Machine13, Duration 38\\n  Step 16: Machine Machine6, Duration 131\\n  Step 17: Machine Machine19, Duration 144\\n  Step 18: Machine Machine7, Duration 179\\n  Step 19: Machine Machine4, Duration 30\\n  Step 20: Machine Machine18, Duration 89\\nJob41:\\n  Step 1: Machine Machine9, Duration 164\\n  Step 2: Machine Machine19, Duration 55\\n  Step 3: Machine Machine8, Duration 176\\n  Step 4: Machine Machine18, Duration 82\\n  Step 5: Machine Machine14, Duration 61\\n  Step 6: Machine Machine0, Duration 183\\n  Step 7: Machine Machine15, Duration 14\\n  Step 8: Machine Machine16, Duration 27\\n  Step 9: Machine Machine11, Duration 66\\n  Step 10: Machine Machine12, Duration 91\\n  Step 11: Machine Machine13, Duration 22\\n  Step 12: Machine Machine6, Duration 158\\n  Step 13: Machine Machine4, Duration 165\\n  Step 14: Machine Machine1, Duration 182\\n  Step 15: Machine Machine17, Duration 86\\n  Step 16: Machine Machine3, Duration 197\\n  Step 17: Machine Machine10, Duration 139\\n  Step 18: Machine Machine7, Duration 157\\n  Step 19: Machine Machine5, Duration 119\\n  Step 20: Machine Machine2, Duration 114\\nJob42:\\n  Step 1: Machine Machine15, Duration 33\\n  Step 2: Machine Machine5, Duration 65\\n  Step 3: Machine Machine19, Duration 109\\n  Step 4: Machine Machine11, Duration 84\\n  Step 5: Machine Machine2, Duration 164\\n  Step 6: Machine Machine12, Duration 141\\n  Step 7: Machine Machine17, Duration 132\\n  Step 8: Machine Machine1, Duration 164\\n  Step 9: Machine Machine4, Duration 97\\n  Step 10: Machine Machine9, Duration 85\\n  Step 11: Machine Machine14, Duration 125\\n  Step 12: Machine Machine10, Duration 104\\n  Step 13: Machine Machine8, Duration 22\\n  Step 14: Machine Machine6, Duration 171\\n  Step 15: Machine Machine7, Duration 115\\n  Step 16: Machine Machine18, Duration 77\\n  Step 17: Machine Machine0, Duration 69\\n  Step 18: Machine Machine16, Duration 181\\n  Step 19: Machine Machine13, Duration 121\\n  Step 20: Machine Machine3, Duration 98\\nJob43:\\n  Step 1: Machine Machine4, Duration 44\\n  Step 2: Machine Machine5, Duration 99\\n  Step 3: Machine Machine19, Duration 20\\n  Step 4: Machine Machine18, Duration 171\\n  Step 5: Machine Machine17, Duration 174\\n  Step 6: Machine Machine6, Duration 87\\n  Step 7: Machine Machine13, Duration 33\\n  Step 8: Machine Machine3, Duration 18\\n  Step 9: Machine Machine11, Duration 153\\n  Step 10: Machine Machine2, Duration 153\\n  Step 11: Machine Machine16, Duration 113\\n  Step 12: Machine Machine15, Duration 149\\n  Step 13: Machine Machine7, Duration 103\\n  Step 14: Machine Machine8, Duration 103\\n  Step 15: Machine Machine10, Duration 138\\n  Step 16: Machine Machine14, Duration 67\\n  Step 17: Machine Machine9, Duration 56\\n  Step 18: Machine Machine1, Duration 92\\n  Step 19: Machine Machine0, Duration 137\\n  Step 20: Machine Machine12, Duration 105\\nJob44:\\n  Step 1: Machine Machine13, Duration 69\\n  Step 2: Machine Machine2, Duration 145\\n  Step 3: Machine Machine4, Duration 4\\n  Step 4: Machine Machine10, Duration 11\\n  Step 5: Machine Machine16, Duration 54\\n  Step 6: Machine Machine14, Duration 150\\n  Step 7: Machine Machine17, Duration 31\\n  Step 8: Machine Machine3, Duration 168\\n  Step 9: Machine Machine18, Duration 142\\n  Step 10: Machine Machine12, Duration 86\\n  Step 11: Machine Machine5, Duration 19\\n  Step 12: Machine Machine9, Duration 111\\n  Step 13: Machine Machine11, Duration 89\\n  Step 14: Machine Machine19, Duration 53\\n  Step 15: Machine Machine15, Duration 96\\n  Step 16: Machine Machine1, Duration 179\\n  Step 17: Machine Machine8, Duration 148\\n  Step 18: Machine Machine0, Duration 195\\n  Step 19: Machine Machine7, Duration 23\\n  Step 20: Machine Machine6, Duration 161\\nJob45:\\n  Step 1: Machine Machine15, Duration 95\\n  Step 2: Machine Machine7, Duration 75\\n  Step 3: Machine Machine13, Duration 65\\n  Step 4: Machine Machine17, Duration 83\\n  Step 5: Machine Machine18, Duration 169\\n  Step 6: Machine Machine8, Duration 170\\n  Step 7: Machine Machine16, Duration 195\\n  Step 8: Machine Machine0, Duration 193\\n  Step 9: Machine Machine11, Duration 144\\n  Step 10: Machine Machine10, Duration 53\\n  Step 11: Machine Machine12, Duration 102\\n  Step 12: Machine Machine4, Duration 27\\n  Step 13: Machine Machine3, Duration 122\\n  Step 14: Machine Machine2, Duration 199\\n  Step 15: Machine Machine19, Duration 198\\n  Step 16: Machine Machine6, Duration 184\\n  Step 17: Machine Machine9, Duration 6\\n  Step 18: Machine Machine5, Duration 9\\n  Step 19: Machine Machine14, Duration 124\\n  Step 20: Machine Machine1, Duration 17\\nJob46:\\n  Step 1: Machine Machine2, Duration 175\\n  Step 2: Machine Machine11, Duration 137\\n  Step 3: Machine Machine3, Duration 74\\n  Step 4: Machine Machine9, Duration 3\\n  Step 5: Machine Machine4, Duration 94\\n  Step 6: Machine Machine5, Duration 2\\n  Step 7: Machine Machine13, Duration 175\\n  Step 8: Machine Machine17, Duration 134\\n  Step 9: Machine Machine7, Duration 46\\n  Step 10: Machine Machine12, Duration 120\\n  Step 11: Machine Machine18, Duration 184\\n  Step 12: Machine Machine15, Duration 123\\n  Step 13: Machine Machine10, Duration 118\\n  Step 14: Machine Machine0, Duration 76\\n  Step 15: Machine Machine14, Duration 195\\n  Step 16: Machine Machine6, Duration 37\\n  Step 17: Machine Machine16, Duration 38\\n  Step 18: Machine Machine8, Duration 92\\n  Step 19: Machine Machine19, Duration 146\\n  Step 20: Machine Machine1, Duration 43\\nJob47:\\n  Step 1: Machine Machine17, Duration 105\\n  Step 2: Machine Machine16, Duration 68\\n  Step 3: Machine Machine2, Duration 195\\n  Step 4: Machine Machine4, Duration 131\\n  Step 5: Machine Machine15, Duration 9\\n  Step 6: Machine Machine18, Duration 61\\n  Step 7: Machine Machine12, Duration 170\\n  Step 8: Machine Machine19, Duration 186\\n  Step 9: Machine Machine13, Duration 152\\n  Step 10: Machine Machine6, Duration 166\\n  Step 11: Machine Machine9, Duration 69\\n  Step 12: Machine Machine14, Duration 46\\n  Step 13: Machine Machine10, Duration 164\\n  Step 14: Machine Machine11, Duration 46\\n  Step 15: Machine Machine5, Duration 84\\n  Step 16: Machine Machine1, Duration 133\\n  Step 17: Machine Machine0, Duration 19\\n  Step 18: Machine Machine3, Duration 199\\n  Step 19: Machine Machine7, Duration 175\\n  Step 20: Machine Machine8, Duration 59\\nJob48:\\n  Step 1: Machine Machine10, Duration 127\\n  Step 2: Machine Machine6, Duration 163\\n  Step 3: Machine Machine19, Duration 152\\n  Step 4: Machine Machine14, Duration 149\\n  Step 5: Machine Machine17, Duration 12\\n  Step 6: Machine Machine13, Duration 11\\n  Step 7: Machine Machine3, Duration 89\\n  Step 8: Machine Machine5, Duration 97\\n  Step 9: Machine Machine16, Duration 87\\n  Step 10: Machine Machine18, Duration 120\\n  Step 11: Machine Machine2, Duration 135\\n  Step 12: Machine Machine0, Duration 123\\n  Step 13: Machine Machine12, Duration 161\\n  Step 14: Machine Machine15, Duration 58\\n  Step 15: Machine Machine8, Duration 139\\n  Step 16: Machine Machine7, Duration 82\\n  Step 17: Machine Machine4, Duration 1\\n  Step 18: Machine Machine11, Duration 93\\n  Step 19: Machine Machine9, Duration 185\\n  Step 20: Machine Machine1, Duration 167\\nJob49:\\n  Step 1: Machine Machine19, Duration 154\\n  Step 2: Machine Machine3, Duration 124\\n  Step 3: Machine Machine5, Duration 198\\n  Step 4: Machine Machine15, Duration 49\\n  Step 5: Machine Machine0, Duration 100\\n  Step 6: Machine Machine8, Duration 145\\n  Step 7: Machine Machine4, Duration 17\\n  Step 8: Machine Machine12, Duration 103\\n  Step 9: Machine Machine13, Duration 130\\n  Step 10: Machine Machine18, Duration 170\\n  Step 11: Machine Machine1, Duration 130\\n  Step 12: Machine Machine17, Duration 122\\n  Step 13: Machine Machine11, Duration 137\\n  Step 14: Machine Machine14, Duration 33\\n  Step 15: Machine Machine6, Duration 109\\n  Step 16: Machine Machine2, Duration 26\\n  Step 17: Machine Machine9, Duration 120\\n  Step 18: Machine Machine7, Duration 33\\n  Step 19: Machine Machine10, Duration 140\\n  Step 20: Machine Machine16, Duration 126\\nJob50:\\n  Step 1: Machine Machine18, Duration 57\\n  Step 2: Machine Machine17, Duration 133\\n  Step 3: Machine Machine10, Duration 124\\n  Step 4: Machine Machine16, Duration 188\\n  Step 5: Machine Machine4, Duration 53\\n  Step 6: Machine Machine15, Duration 24\\n  Step 7: Machine Machine11, Duration 81\\n  Step 8: Machine Machine1, Duration 93\\n  Step 9: Machine Machine7, Duration 89\\n  Step 10: Machine Machine19, Duration 12\\n  Step 11: Machine Machine6, Duration 110\\n  Step 12: Machine Machine8, Duration 111\\n  Step 13: Machine Machine0, Duration 72\\n  Step 14: Machine Machine13, Duration 163\\n  Step 15: Machine Machine12, Duration 155\\n  Step 16: Machine Machine5, Duration 151\\n  Step 17: Machine Machine3, Duration 121\\n  Step 18: Machine Machine2, Duration 98\\n  Step 19: Machine Machine9, Duration 95\\n  Step 20: Machine Machine14, Duration 164\\n        \\n        REQUIRED OUTPUT FORMAT:\\n        You must provide your solution in the following exact format:\\n        \\n        1. FINAL MAKESPAN: [integer value]\\n        2. STRUCTURED SCHEDULE:\\n           For each operation, provide:\\n           - Job: [job_name]\\n           - Step: [step_number]\\n           - Machine: [machine_name]\\n           - Start Time: [start_time]\\n           - End Time: [end_time]\\n           - Duration: [duration]\\n        \\n        Example format:\\n        FINAL MAKESPAN: 25\\n        STRUCTURED SCHEDULE:\\n        - Job: Job1, Step: 1, Machine: Machine0, Start Time: 0, End Time: 3, Duration: 3\\n        - Job: Job1, Step: 2, Machine: Machine1, Start Time: 3, End Time: 7, Duration: 4\\n        - Job: Job2, Step: 1, Machine: Machine1, Start Time: 7, End Time: 10, Duration: 3\\n        \\n        Please solve this Job Shop Scheduling Problem and provide:\\n        1. A valid schedule with start and end times for each operation\\n        2. The minimum makespan (total completion time)\\n        3. Ensure all constraints are satisfied:\\n           - Job precedence: operations within a job must be sequential\\n           - Machine constraints: no overlapping operations on the same machine\\n        "
      },
      "execution_time": 23.795324087142944
    }
  }
}